"gene_symbol","hgnc_id","gene_url","disease_label","mondo_id","disease_url","mode_of_inheritance","dosage_haploinsufficiency_assertion","dosage_triplosensitivity_assertion","dosage_report","dosage_group","gene_disease_validity_assertion_classifications","gene_disease_validity_assertion_reports","gene_disease_validity_gceps","actionability_assertion_classifications","actionability_assertion_reports","actionability_groups"
"A2ML1","HGNC:23336","https://search.clinicalgenome.org/kb/genes/HGNC:23336","Noonan syndrome","MONDO:0018997","https://search.clinicalgenome.org/kb/conditions/MONDO:0018997","Autosomal dominant inheritance","","","","","disputing (06/07/2018)","https://search.clinicalgenome.org/kb/gene-validity/CGGV:assertion_d910a9d8-516e-443d-acba-8d61f7574792-2018-06-07T160000.000Z","RASopathy","","",""
"A4GALT","HGNC:18149","https://search.clinicalgenome.org/kb/genes/HGNC:18149","A4GALT-congenital disorder of glycosylation","MONDO:0100587","https://search.clinicalgenome.org/kb/conditions/MONDO:0100587","Autosomal recessive inheritance","30 - Gene Associated with Autosomal Recessive Phenotype (12/11/2014)","0 - No Evidence for Triplosensitivity (12/11/2014)","https://search.clinicalgenome.org/kb/gene-dosage/HGNC:18149","Dosage Working Group","definitive evidence (05/30/2025)","https://search.clinicalgenome.org/kb/gene-validity/CGGV:assertion_7e3a8df0-77f1-4395-b501-63a96016e515-2025-05-30T170000.000Z","Congenital Disorders of Glycosylation","","",""
"AAGAB","HGNC:25662","https://search.clinicalgenome.org/kb/genes/HGNC:25662","palmoplantar keratoderma, punctate type 1A","MONDO:0007858","https://search.clinicalgenome.org/kb/conditions/MONDO:0007858","N/A","3 - Sufficient Evidence for Haploinsufficiency (02/28/2013)","0 - No Evidence for Triplosensitivity (02/28/2013)","https://search.clinicalgenome.org/kb/gene-dosage/HGNC:25662","Dosage Working Group","","","","","",""
"AARS1","HGNC:20","https://search.clinicalgenome.org/kb/genes/HGNC:20","Charcot-Marie-Tooth disease axonal type 2N","MONDO:0013212","https://search.clinicalgenome.org/kb/conditions/MONDO:0013212","Autosomal dominant inheritance","0 - No Evidence for Haploinsufficiency (01/11/2018)","0 - No Evidence for Triplosensitivity (01/11/2018)","https://search.clinicalgenome.org/kb/gene-dosage/HGNC:20","Dosage Working Group","definitive evidence (03/14/2024)","https://search.clinicalgenome.org/kb/gene-validity/CGGV:assertion_92de3832-c272-4993-8586-288c6331dec2-2024-03-14T160000.000Z","Charcot-Marie-Tooth","","",""
"AARS1","HGNC:20","https://search.clinicalgenome.org/kb/genes/HGNC:20","AARS1-related leukoencephalopathy","MONDO:1010132","https://search.clinicalgenome.org/kb/conditions/MONDO:1010132","Autosomal dominant inheritance","0 - No Evidence for Haploinsufficiency (01/11/2018)","0 - No Evidence for Triplosensitivity (01/11/2018)","https://search.clinicalgenome.org/kb/gene-dosage/HGNC:20","Dosage Working Group","limited evidence (08/27/2025)","https://search.clinicalgenome.org/kb/gene-validity/CGGV:assertion_3cfbfccc-95a9-4271-b8a2-8b6d2bcc1b27-2025-08-27T170000.000Z","Leukodystrophy and Leukoencephalopathy","","",""
"AARS2","HGNC:21022","https://search.clinicalgenome.org/kb/genes/HGNC:21022","mitochondrial disease","MONDO:0044970","https://search.clinicalgenome.org/kb/conditions/MONDO:0044970","Autosomal recessive inheritance","30 - Gene Associated with Autosomal Recessive Phenotype (06/27/2025)","","https://search.clinicalgenome.org/kb/gene-dosage/HGNC:21022","Dosage Working Group","definitive evidence (04/18/2022)","https://search.clinicalgenome.org/kb/gene-validity/CGGV:assertion_583e237c-18f6-4427-a04f-82ea0f020daf-2022-04-18T160000.000Z","Mitochondrial Diseases","","",""
"AARS2","HGNC:21022","https://search.clinicalgenome.org/kb/genes/HGNC:21022","leukoencephalopathy, progressive, with ovarian failure","MONDO:0014387","https://search.clinicalgenome.org/kb/conditions/MONDO:0014387","N/A","30 - Gene Associated with Autosomal Recessive Phenotype (06/27/2025)","","https://search.clinicalgenome.org/kb/gene-dosage/HGNC:21022","Dosage Working Group","","","","","",""
"AASS","HGNC:17366","https://search.clinicalgenome.org/kb/genes/HGNC:17366","hyperlysinemia","MONDO:0009388","https://search.clinicalgenome.org/kb/conditions/MONDO:0009388","Autosomal recessive inheritance","30 - Gene Associated with Autosomal Recessive Phenotype (10/08/2025)","0 - No Evidence for Triplosensitivity (10/08/2025)","https://search.clinicalgenome.org/kb/gene-dosage/HGNC:17366","Dosage Working Group","definitive evidence (10/14/2022)","https://search.clinicalgenome.org/kb/gene-validity/CGGV:assertion_92e04f9e-f03e-4295-baac-e9fb6b48a258-2022-10-14T160000.000Z","Aminoacidopathy","","",""
"ABAT","HGNC:23","https://search.clinicalgenome.org/kb/genes/HGNC:23","genetic developmental and epileptic encephalopathy","MONDO:0100062","https://search.clinicalgenome.org/kb/conditions/MONDO:0100062","Autosomal recessive inheritance","30 - Gene Associated with Autosomal Recessive Phenotype (08/22/2016)","","https://search.clinicalgenome.org/kb/gene-dosage/HGNC:23","Dosage Working Group","moderate evidence (04/19/2022)","https://search.clinicalgenome.org/kb/gene-validity/CGGV:assertion_3a5138ad-d4b8-4ea1-aa78-b5d1f07b2b82-2022-04-19T160000.000Z","Epilepsy","","",""
"ABAT","HGNC:23","https://search.clinicalgenome.org/kb/genes/HGNC:23","GABA aminotransaminase deficiency","MONDO:0013166","https://search.clinicalgenome.org/kb/conditions/MONDO:0013166","N/A","30 - Gene Associated with Autosomal Recessive Phenotype (08/22/2016)","","https://search.clinicalgenome.org/kb/gene-dosage/HGNC:23","Dosage Working Group","","","","","",""
"ABCA3","HGNC:33","https://search.clinicalgenome.org/kb/genes/HGNC:33","interstitial lung disease due to ABCA3 deficiency","MONDO:0012582","https://search.clinicalgenome.org/kb/conditions/MONDO:0012582","Autosomal recessive inheritance","","","","","definitive evidence (09/17/2024)","https://search.clinicalgenome.org/kb/gene-validity/CGGV:assertion_f3e2d402-69a2-496f-af67-ba3aae132eab-2024-09-17T160000.000Z","Interstitial Lung Disease","","",""
"ABCA4","HGNC:34","https://search.clinicalgenome.org/kb/genes/HGNC:34","age related macular degeneration 2","MONDO:0007932","https://search.clinicalgenome.org/kb/conditions/MONDO:0007932","Autosomal dominant inheritance","","","","","disputing (03/06/2025)","https://search.clinicalgenome.org/kb/gene-validity/CGGV:assertion_3f249e6f-9a1c-4c82-893b-dfaa327cc06b-2025-03-06T170000.000Z","Retina","","",""
"ABCA4","HGNC:34","https://search.clinicalgenome.org/kb/genes/HGNC:34","ABCA4-related retinopathy","MONDO:0800406","https://search.clinicalgenome.org/kb/conditions/MONDO:0800406","Autosomal recessive inheritance","","","","","definitive evidence (10/06/2022)","https://search.clinicalgenome.org/kb/gene-validity/CGGV:assertion_38729563-bf36-48ae-929e-fa69a225de39-2022-10-06T160000.000Z","Retina","","",""
"ABCB11","HGNC:42","https://search.clinicalgenome.org/kb/genes/HGNC:42","progressive familial intrahepatic cholestasis type 2","MONDO:0011156","https://search.clinicalgenome.org/kb/conditions/MONDO:0011156","N/A","30 - Gene Associated with Autosomal Recessive Phenotype (07/08/2020)","0 - No Evidence for Triplosensitivity (07/08/2020)","https://search.clinicalgenome.org/kb/gene-dosage/HGNC:42","Dosage Working Group","","","","","",""
"ABCB4","HGNC:45","https://search.clinicalgenome.org/kb/genes/HGNC:45","progressive familial intrahepatic cholestasis type 3","MONDO:0011214","https://search.clinicalgenome.org/kb/conditions/MONDO:0011214","Autosomal recessive inheritance","3 - Sufficient Evidence for Haploinsufficiency (04/16/2024)","0 - No Evidence for Triplosensitivity (04/16/2024)","https://search.clinicalgenome.org/kb/gene-dosage/HGNC:45","Dosage Working Group","definitive evidence (11/23/2022)","https://search.clinicalgenome.org/kb/gene-validity/CGGV:assertion_009134d7-b79c-4a90-9bae-c1f302439258-2022-11-23T170000.000Z","General Gene Curation","","",""
"ABCB4","HGNC:45","https://search.clinicalgenome.org/kb/genes/HGNC:45","gallbladder disease 1","MONDO:0010939","https://search.clinicalgenome.org/kb/conditions/MONDO:0010939","N/A","3 - Sufficient Evidence for Haploinsufficiency (04/16/2024)","0 - No Evidence for Triplosensitivity (04/16/2024)","https://search.clinicalgenome.org/kb/gene-dosage/HGNC:45","Dosage Working Group","","","","","",""
"ABCB6","HGNC:47","https://search.clinicalgenome.org/kb/genes/HGNC:47","dyschromatosis universalis hereditaria 3","MONDO:0014169","https://search.clinicalgenome.org/kb/conditions/MONDO:0014169","Autosomal dominant inheritance","","","","","moderate evidence (04/26/2024)","https://search.clinicalgenome.org/kb/gene-validity/CGGV:assertion_93bbbc0a-5f6f-4d80-b560-3265d7b89ed3-2024-04-26T180000.000Z","General Inborn Errors of Metabolism","","",""
"ABCB6","HGNC:47","https://search.clinicalgenome.org/kb/genes/HGNC:47","microphthalmia, isolated, with coloboma 7","MONDO:0013783","https://search.clinicalgenome.org/kb/conditions/MONDO:0013783","Autosomal dominant inheritance","","","","","limited evidence (04/26/2024)","https://search.clinicalgenome.org/kb/gene-validity/CGGV:assertion_45ec3fba-48fd-4bf4-b865-2c2d7216e8eb-2024-04-26T180000.000Z","General Inborn Errors of Metabolism","","",""
"ABCB7","HGNC:48","https://search.clinicalgenome.org/kb/genes/HGNC:48","mitochondrial disease","MONDO:0044970","https://search.clinicalgenome.org/kb/conditions/MONDO:0044970","X-linked inheritance","","","","","moderate evidence (09/28/2023)","https://search.clinicalgenome.org/kb/gene-validity/CGGV:assertion_f3ff096d-abfb-47df-8ac1-c942a98828b0-2023-09-28T160000.000Z","Mitochondrial Diseases","","",""
"ABCC4","HGNC:55","https://search.clinicalgenome.org/kb/genes/HGNC:55","qualitative platelet defect","MONDO:0001197","https://search.clinicalgenome.org/kb/conditions/MONDO:0001197","Autosomal recessive inheritance","","","","","moderate evidence (06/03/2024)","https://search.clinicalgenome.org/kb/gene-validity/CGGV:assertion_2828abac-5b4a-4dad-a703-10c0daf35dbd-2024-06-03T160000.000Z","Hemostasis Thrombosis","","",""
"ABCC8","HGNC:59","https://search.clinicalgenome.org/kb/genes/HGNC:59","monogenic diabetes","MONDO:0015967","https://search.clinicalgenome.org/kb/conditions/MONDO:0015967","Semidominant inheritance","30 - Gene Associated with Autosomal Recessive Phenotype (02/24/2012)","0 - No Evidence for Triplosensitivity (02/24/2012)","https://search.clinicalgenome.org/kb/gene-dosage/HGNC:59","Dosage Working Group","definitive evidence (07/24/2022)","https://search.clinicalgenome.org/kb/gene-validity/CGGV:assertion_33c0dfa5-c6ea-42fd-8118-be6ff97beb3e-2022-07-24T160000.000Z","Monogenic Diabetes","","",""
"ABCC8","HGNC:59","https://search.clinicalgenome.org/kb/genes/HGNC:59","pulmonary arterial hypertension","MONDO:0015924","https://search.clinicalgenome.org/kb/conditions/MONDO:0015924","Autosomal dominant inheritance","30 - Gene Associated with Autosomal Recessive Phenotype (02/24/2012)","0 - No Evidence for Triplosensitivity (02/24/2012)","https://search.clinicalgenome.org/kb/gene-dosage/HGNC:59","Dosage Working Group","moderate evidence (03/12/2025)","https://search.clinicalgenome.org/kb/gene-validity/CGGV:assertion_14b1739d-8890-4927-8efb-e909f48bad5a-2025-03-12T160000.000Z","Pulmonary Hypertension","","",""
"ABCC8","HGNC:59","https://search.clinicalgenome.org/kb/genes/HGNC:59","hyperinsulinemic hypoglycemia, familial, 1","MONDO:0009734","https://search.clinicalgenome.org/kb/conditions/MONDO:0009734","N/A","30 - Gene Associated with Autosomal Recessive Phenotype (02/24/2012)","0 - No Evidence for Triplosensitivity (02/24/2012)","https://search.clinicalgenome.org/kb/gene-dosage/HGNC:59","Dosage Working Group","","","","","",""
"ABCC9","HGNC:60","https://search.clinicalgenome.org/kb/genes/HGNC:60","dilated cardiomyopathy","MONDO:0005021","https://search.clinicalgenome.org/kb/conditions/MONDO:0005021","Autosomal dominant inheritance","","","","","limited evidence (11/15/2024)","https://search.clinicalgenome.org/kb/gene-validity/CGGV:assertion_8be22ebc-f0f5-4de5-9c2a-382ebd02c533-2024-11-15T170000.000Z","Dilated Cardiomyopathy","","",""
"ABCC9","HGNC:60","https://search.clinicalgenome.org/kb/genes/HGNC:60","hypertrichotic osteochondrodysplasia Cantu type","MONDO:0009406","https://search.clinicalgenome.org/kb/conditions/MONDO:0009406","Autosomal dominant inheritance","","","","","definitive evidence (02/21/2025)","https://search.clinicalgenome.org/kb/gene-validity/CGGV:assertion_53f8043c-d672-4dfd-a1b7-c5fd6e1cdcae-2025-02-21T170000.000Z","Syndromic Disorders","","",""
"ABCD1","HGNC:61","https://search.clinicalgenome.org/kb/genes/HGNC:61","adrenoleukodystrophy","MONDO:0018544","https://search.clinicalgenome.org/kb/conditions/MONDO:0018544","X-linked inheritance","3 - Sufficient Evidence for Haploinsufficiency (12/02/2020)","0 - No Evidence for Triplosensitivity (12/02/2020)","https://search.clinicalgenome.org/kb/gene-dosage/HGNC:61","Dosage Working Group","definitive evidence (12/18/2020)","https://search.clinicalgenome.org/kb/gene-validity/CGGV:assertion_815e0f84-b530-4fd2-81a9-02e02bf352ee-2020-12-18T050000.000Z","Peroxisomal Disorders","Strong Actionability (12/01/2023) | Strong Actionability (12/01/2023)","https://actionability.clinicalgenome.org/ac/Adult/ui/stg2SummaryRpt?doc=AC117 | https://actionability.clinicalgenome.org/ac/Pediatric/ui/stg2SummaryRpt?doc=AC117","Adult Actionability Working Group | Pediatric Actionability Working Group"
"ABCD1","HGNC:61","https://search.clinicalgenome.org/kb/genes/HGNC:61","X-linked cerebral adrenoleukodystrophy","MONDO:0010247","https://search.clinicalgenome.org/kb/conditions/MONDO:0010247","N/A","3 - Sufficient Evidence for Haploinsufficiency (12/02/2020)","0 - No Evidence for Triplosensitivity (12/02/2020)","https://search.clinicalgenome.org/kb/gene-dosage/HGNC:61","Dosage Working Group","","","","Strong Actionability (12/01/2023) | Strong Actionability (12/01/2023)","https://actionability.clinicalgenome.org/ac/Adult/ui/stg2SummaryRpt?doc=AC117 | https://actionability.clinicalgenome.org/ac/Pediatric/ui/stg2SummaryRpt?doc=AC117","Adult Actionability Working Group | Pediatric Actionability Working Group"
"ABCD1","HGNC:61","https://search.clinicalgenome.org/kb/genes/HGNC:61","adrenomyeloneuropathy","MONDO:0015339","https://search.clinicalgenome.org/kb/conditions/MONDO:0015339","N/A","3 - Sufficient Evidence for Haploinsufficiency (12/02/2020)","0 - No Evidence for Triplosensitivity (12/02/2020)","https://search.clinicalgenome.org/kb/gene-dosage/HGNC:61","Dosage Working Group","","","","Strong Actionability (12/01/2023)","https://actionability.clinicalgenome.org/ac/Pediatric/ui/stg2SummaryRpt?doc=AC117","Pediatric Actionability Working Group"
"ABCD1","HGNC:61","https://search.clinicalgenome.org/kb/genes/HGNC:61","isolated adrenal insufficiency","MONDO:0100315","https://search.clinicalgenome.org/kb/conditions/MONDO:0100315","N/A","3 - Sufficient Evidence for Haploinsufficiency (12/02/2020)","0 - No Evidence for Triplosensitivity (12/02/2020)","https://search.clinicalgenome.org/kb/gene-dosage/HGNC:61","Dosage Working Group","","","","Strong Actionability (12/01/2023)","https://actionability.clinicalgenome.org/ac/Pediatric/ui/stg2SummaryRpt?doc=AC117","Pediatric Actionability Working Group"
"ABCD3","HGNC:67","https://search.clinicalgenome.org/kb/genes/HGNC:67","congenital bile acid synthesis defect 5","MONDO:0014564","https://search.clinicalgenome.org/kb/conditions/MONDO:0014564","Autosomal recessive inheritance","","","","","limited evidence (07/08/2025)","https://search.clinicalgenome.org/kb/gene-validity/CGGV:assertion_f8d82e6f-8ee8-4944-898b-165916c13cac-2025-07-08T160000.000Z","Peroxisomal Disorders","","",""
"ABCD4","HGNC:68","https://search.clinicalgenome.org/kb/genes/HGNC:68","methylmalonic acidemia with homocystinuria, type cblJ","MONDO:0013925","https://search.clinicalgenome.org/kb/conditions/MONDO:0013925","Autosomal recessive inheritance","","","","","moderate evidence (12/22/2023)","https://search.clinicalgenome.org/kb/gene-validity/CGGV:assertion_902c9288-f6bd-4068-9a5f-652b49583d93-2023-12-22T190000.000Z","General Inborn Errors of Metabolism","","",""
"ABCG5","HGNC:13886","https://search.clinicalgenome.org/kb/genes/HGNC:13886","sitosterolemia","MONDO:0008863","https://search.clinicalgenome.org/kb/conditions/MONDO:0008863","Autosomal recessive inheritance","30 - Gene Associated with Autosomal Recessive Phenotype (09/29/2025)","0 - No Evidence for Triplosensitivity (09/29/2025)","https://search.clinicalgenome.org/kb/gene-dosage/HGNC:13886","Dosage Working Group","definitive evidence (07/10/2020)","https://search.clinicalgenome.org/kb/gene-validity/CGGV:assertion_c52c7403-8975-4a3f-8796-a966e977f708-2020-07-10T160000.000Z","Hemostasis Thrombosis","","",""
"ABCG5","HGNC:13886","https://search.clinicalgenome.org/kb/genes/HGNC:13886","sitosterolemia 1","MONDO:0020747","https://search.clinicalgenome.org/kb/conditions/MONDO:0020747","N/A","30 - Gene Associated with Autosomal Recessive Phenotype (09/29/2025)","0 - No Evidence for Triplosensitivity (09/29/2025)","https://search.clinicalgenome.org/kb/gene-dosage/HGNC:13886","Dosage Working Group","","","","","",""
"ABCG8","HGNC:13887","https://search.clinicalgenome.org/kb/genes/HGNC:13887","sitosterolemia","MONDO:0008863","https://search.clinicalgenome.org/kb/conditions/MONDO:0008863","Autosomal recessive inheritance","30 - Gene Associated with Autosomal Recessive Phenotype (02/03/2025)","0 - No Evidence for Triplosensitivity (02/03/2025)","https://search.clinicalgenome.org/kb/gene-dosage/HGNC:13887","Dosage Working Group","definitive evidence (07/14/2020)","https://search.clinicalgenome.org/kb/gene-validity/CGGV:assertion_af59edc2-1148-4dca-b804-192639017b65-2020-07-14T202806.911Z","Hemostasis Thrombosis","","",""
"ABHD12","HGNC:15868","https://search.clinicalgenome.org/kb/genes/HGNC:15868","PHARC syndrome","MONDO:0012984","https://search.clinicalgenome.org/kb/conditions/MONDO:0012984","Autosomal recessive inheritance","30 - Gene Associated with Autosomal Recessive Phenotype (07/18/2025)","","https://search.clinicalgenome.org/kb/gene-dosage/HGNC:15868","Dosage Working Group","definitive evidence (06/26/2018)","https://search.clinicalgenome.org/kb/gene-validity/CGGV:assertion_ccd68c20-2024-4239-be51-26697e19a6b4-2018-06-26T160000.000Z","Hearing Loss","","",""
"ABHD5","HGNC:21396","https://search.clinicalgenome.org/kb/genes/HGNC:21396","Dorfman-Chanarin disease","MONDO:0010155","https://search.clinicalgenome.org/kb/conditions/MONDO:0010155","Autosomal recessive inheritance","","","","","definitive evidence (08/02/2022)","https://search.clinicalgenome.org/kb/gene-validity/CGGV:assertion_19bf65b3-0c75-46e2-8796-5664ce6dd371-2022-08-02T160000.000Z","Lysosomal Diseases GCEP","","",""
"ACAD8","HGNC:87","https://search.clinicalgenome.org/kb/genes/HGNC:87","isobutyryl-CoA dehydrogenase deficiency","MONDO:0012648","https://search.clinicalgenome.org/kb/conditions/MONDO:0012648","Autosomal recessive inheritance","30 - Gene Associated with Autosomal Recessive Phenotype (12/11/2014)","0 - No Evidence for Triplosensitivity (12/11/2014)","https://search.clinicalgenome.org/kb/gene-dosage/HGNC:87","Dosage Working Group","definitive evidence (04/26/2019)","https://search.clinicalgenome.org/kb/gene-validity/CGGV:assertion_0d260f0e-df71-420a-9281-92e4bddcddbb-2019-04-26T160000.000Z","Aminoacidopathy","","",""
"ACAD9","HGNC:21497","https://search.clinicalgenome.org/kb/genes/HGNC:21497","acyl-CoA dehydrogenase 9 deficiency","MONDO:0012624","https://search.clinicalgenome.org/kb/conditions/MONDO:0012624","Autosomal recessive inheritance","","","","","definitive evidence (03/27/2018)","https://search.clinicalgenome.org/kb/gene-validity/CGGV:assertion_5fad1866-75ce-470f-984c-e64bb7e11168-2018-03-27T160000.000Z","Fatty Acid Oxidation Disorders","","",""
"ACADL","HGNC:88","https://search.clinicalgenome.org/kb/genes/HGNC:88","long chain acyl-CoA dehydrogenase deficiency","MONDO:0020531","https://search.clinicalgenome.org/kb/conditions/MONDO:0020531","Autosomal recessive inheritance","","","","","disputing (04/25/2024)","https://search.clinicalgenome.org/kb/gene-validity/CGGV:assertion_d95637bf-c628-4d23-a0d5-656db55a09a4-2024-04-25T160000.000Z","Fatty Acid Oxidation Disorders","","",""
"ACADM","HGNC:89","https://search.clinicalgenome.org/kb/genes/HGNC:89","medium chain acyl-CoA dehydrogenase deficiency","MONDO:0008721","https://search.clinicalgenome.org/kb/conditions/MONDO:0008721","Autosomal recessive inheritance","30 - Gene Associated with Autosomal Recessive Phenotype (08/22/2016)","0 - No Evidence for Triplosensitivity (08/22/2016)","https://search.clinicalgenome.org/kb/gene-dosage/HGNC:89","Dosage Working Group","definitive evidence (01/23/2018)","https://search.clinicalgenome.org/kb/gene-validity/CGGV:assertion_fb987774-0e5b-4466-924f-6f19fccc6599-2018-01-23T170000.000Z","Fatty Acid Oxidation Disorders","Strong Actionability (08/03/2020) | Strong Actionability (08/03/2020)","https://actionability.clinicalgenome.org/ac/Pediatric/ui/stg2SummaryRpt?doc=AC1016 | https://actionability.clinicalgenome.org/ac/Adult/ui/stg2SummaryRpt?doc=AC1016","Pediatric Actionability Working Group | Adult Actionability Working Group"
"ACADS","HGNC:90","https://search.clinicalgenome.org/kb/genes/HGNC:90","short chain acyl-CoA dehydrogenase deficiency","MONDO:0008722","https://search.clinicalgenome.org/kb/conditions/MONDO:0008722","Autosomal recessive inheritance","","","","","definitive evidence (01/23/2018)","https://search.clinicalgenome.org/kb/gene-validity/CGGV:assertion_c6bc94e9-cdf2-4efb-b654-004541efc344-2018-01-23T170000.000Z","Fatty Acid Oxidation Disorders","","",""
"ACADSB","HGNC:91","https://search.clinicalgenome.org/kb/genes/HGNC:91","2-methylbutyryl-CoA dehydrogenase deficiency","MONDO:0012392","https://search.clinicalgenome.org/kb/conditions/MONDO:0012392","Autosomal recessive inheritance","30 - Gene Associated with Autosomal Recessive Phenotype (08/22/2016)","","https://search.clinicalgenome.org/kb/gene-dosage/HGNC:91","Dosage Working Group","definitive evidence (03/22/2019)","https://search.clinicalgenome.org/kb/gene-validity/CGGV:assertion_8bfa3857-c96c-40ac-b4c1-2cf04fd4eb4f-2019-03-22T160000.000Z","Aminoacidopathy","","",""
"ACADVL","HGNC:92","https://search.clinicalgenome.org/kb/genes/HGNC:92","very long chain acyl-CoA dehydrogenase deficiency","MONDO:0008723","https://search.clinicalgenome.org/kb/conditions/MONDO:0008723","Autosomal recessive inheritance","30 - Gene Associated with Autosomal Recessive Phenotype (09/26/2025)","0 - No Evidence for Triplosensitivity (09/26/2025)","https://search.clinicalgenome.org/kb/gene-dosage/HGNC:92","Dosage Working Group","definitive evidence (02/20/2018)","https://search.clinicalgenome.org/kb/gene-validity/CGGV:assertion_130ca053-9f40-4fd5-b89c-b9b374694fda-2018-02-20T170000.000Z","Fatty Acid Oxidation Disorders","Limited Actionability (03/08/2025) | Moderate Actionability (03/08/2025)","https://actionability.clinicalgenome.org/ac/Adult/ui/stg2SummaryRpt?doc=AC126 | https://actionability.clinicalgenome.org/ac/Pediatric/ui/stg2SummaryRpt?doc=AC126","Adult Actionability Working Group | Pediatric Actionability Working Group"
"ACAN","HGNC:319","https://search.clinicalgenome.org/kb/genes/HGNC:319","ACAN-related short stature spectrum","MONDO:1060149","https://search.clinicalgenome.org/kb/conditions/MONDO:1060149","Autosomal dominant inheritance","","","","","definitive evidence (05/07/2025)","https://search.clinicalgenome.org/kb/gene-validity/CGGV:assertion_fbf745d3-628c-4b90-aaa6-a0e28dd7bae1-2025-05-07T160000.000Z","Skeletal Disorders","","",""
"ACAT1","HGNC:93","https://search.clinicalgenome.org/kb/genes/HGNC:93","beta-ketothiolase deficiency","MONDO:0008760","https://search.clinicalgenome.org/kb/conditions/MONDO:0008760","Autosomal recessive inheritance","","","","","definitive evidence (05/22/2018)","https://search.clinicalgenome.org/kb/gene-validity/CGGV:assertion_99bcab0a-de59-479d-8fe6-8b76cbce90ee-2018-05-22T160000.000Z","Fatty Acid Oxidation Disorders","","",""
"ACAT2","HGNC:94","https://search.clinicalgenome.org/kb/genes/HGNC:94","acetyl-CoA acetyltransferase-2 deficiency","MONDO:0013548","https://search.clinicalgenome.org/kb/conditions/MONDO:0013548","Mode of inheritance","","","","","no known disease relationship (01/25/2021)","https://search.clinicalgenome.org/kb/gene-validity/CGGV:assertion_7cb46678-6e33-4d34-86ba-fdf59e59fb80-2021-01-25T194853.212Z","Fatty Acid Oxidation Disorders","","",""
"ACBD5","HGNC:23338","https://search.clinicalgenome.org/kb/genes/HGNC:23338","acyl-CoA binding domain containing protein 5 deficiency","MONDO:0100112","https://search.clinicalgenome.org/kb/conditions/MONDO:0100112","Autosomal recessive inheritance","","","","","definitive evidence (06/21/2024)","https://search.clinicalgenome.org/kb/gene-validity/CGGV:assertion_8ac052f6-de8d-4c14-adf2-bbecb624defd-2024-06-21T160000.000Z","Peroxisomal Disorders","","",""
"ACD","HGNC:25070","https://search.clinicalgenome.org/kb/genes/HGNC:25070","ACD-related short telomere syndrome","MONDO:0100569","https://search.clinicalgenome.org/kb/conditions/MONDO:0100569","Semidominant inheritance","0 - No Evidence for Haploinsufficiency (04/24/2025)","0 - No Evidence for Triplosensitivity (04/24/2025)","https://search.clinicalgenome.org/kb/gene-dosage/HGNC:25070","Dosage Working Group","definitive evidence (02/20/2024)","https://search.clinicalgenome.org/kb/gene-validity/CGGV:assertion_c29b6517-54ab-414e-a3ab-e5aa006e0d54-2024-02-20T170000.000Z","Interstitial Lung Disease","","",""
"ACE","HGNC:2707","https://search.clinicalgenome.org/kb/genes/HGNC:2707","renal tubular dysgenesis - ACE","MONDO:0700337","https://search.clinicalgenome.org/kb/conditions/MONDO:0700337","Autosomal recessive inheritance","","","","","definitive evidence (12/11/2024)","https://search.clinicalgenome.org/kb/gene-validity/CGGV:assertion_14a5efd4-d71f-40b1-91ff-90f7f8d63ec7-2024-12-11T170000.000Z","Prenatal","","",""
"ACO2","HGNC:118","https://search.clinicalgenome.org/kb/genes/HGNC:118","mitochondrial disease","MONDO:0044970","https://search.clinicalgenome.org/kb/conditions/MONDO:0044970","Autosomal recessive inheritance | Autosomal dominant inheritance","","","","","definitive evidence (10/19/2023) | strong evidence (10/19/2023)","https://search.clinicalgenome.org/kb/gene-validity/CGGV:assertion_5892fec8-dc8b-467b-abba-fb6be142bb7a-2023-10-19T040000.000Z | https://search.clinicalgenome.org/kb/gene-validity/CGGV:assertion_2bca6e9c-e167-4862-bf45-3ec787b92f49-2023-10-19T040000.000Z","Mitochondrial Diseases | Mitochondrial Diseases","","",""
"ACO2","HGNC:118","https://search.clinicalgenome.org/kb/genes/HGNC:118","optic atrophy 9","MONDO:0014571","https://search.clinicalgenome.org/kb/conditions/MONDO:0014571","Semidominant inheritance","","","","","definitive evidence (04/05/2024)","https://search.clinicalgenome.org/kb/gene-validity/CGGV:assertion_236ff728-58f0-4f71-8575-8dd8546c8fba-2024-04-05T190000.000Z","Glaucoma and Neuro-Ophthalmology","","",""
"ACOX1","HGNC:119","https://search.clinicalgenome.org/kb/genes/HGNC:119","peroxisomal acyl-CoA oxidase deficiency","MONDO:0009919","https://search.clinicalgenome.org/kb/conditions/MONDO:0009919","Autosomal recessive inheritance","30 - Gene Associated with Autosomal Recessive Phenotype (11/20/2014)","0 - No Evidence for Triplosensitivity (11/20/2014)","https://search.clinicalgenome.org/kb/gene-dosage/HGNC:119","Dosage Working Group","definitive evidence (11/04/2022)","https://search.clinicalgenome.org/kb/gene-validity/CGGV:assertion_96026ae4-050d-4eb5-849c-178c703a556e-2022-11-04T160000.000Z","Peroxisomal Disorders","","",""
"ACOX1","HGNC:119","https://search.clinicalgenome.org/kb/genes/HGNC:119","Mitchell syndrome","MONDO:0030073","https://search.clinicalgenome.org/kb/conditions/MONDO:0030073","Autosomal dominant inheritance","30 - Gene Associated with Autosomal Recessive Phenotype (11/20/2014)","0 - No Evidence for Triplosensitivity (11/20/2014)","https://search.clinicalgenome.org/kb/gene-dosage/HGNC:119","Dosage Working Group","strong evidence (12/29/2022)","https://search.clinicalgenome.org/kb/gene-validity/CGGV:assertion_2efeef00-0803-472b-8e25-080e4728c018-2022-12-29T170000.000Z","Peroxisomal Disorders","","",""
"ACOX2","HGNC:120","https://search.clinicalgenome.org/kb/genes/HGNC:120","congenital bile acid synthesis defect 6","MONDO:0015015","https://search.clinicalgenome.org/kb/conditions/MONDO:0015015","Autosomal recessive inheritance","","","","","definitive evidence (07/25/2024)","https://search.clinicalgenome.org/kb/gene-validity/CGGV:assertion_5627eadb-12f9-4768-915c-3da73c425650-2024-07-25T180000.000Z","General Inborn Errors of Metabolism","","",""
"ACP5","HGNC:124","https://search.clinicalgenome.org/kb/genes/HGNC:124","Spondyloenchondrodysplasia with immune dysregulation","MONDO:0011939","https://search.clinicalgenome.org/kb/conditions/MONDO:0011939","N/A","30 - Gene Associated with Autosomal Recessive Phenotype (08/22/2016)","0 - No Evidence for Triplosensitivity (08/22/2016)","https://search.clinicalgenome.org/kb/gene-dosage/HGNC:124","Dosage Working Group","","","","","",""
"ACSF3","HGNC:27288","https://search.clinicalgenome.org/kb/genes/HGNC:27288","combined malonic and methylmalonic acidemia","MONDO:0013661","https://search.clinicalgenome.org/kb/conditions/MONDO:0013661","Autosomal recessive inheritance","30 - Gene Associated with Autosomal Recessive Phenotype (08/22/2016)","0 - No Evidence for Triplosensitivity (08/22/2016)","https://search.clinicalgenome.org/kb/gene-dosage/HGNC:27288","Dosage Working Group","definitive evidence (10/09/2020)","https://search.clinicalgenome.org/kb/gene-validity/CGGV:assertion_b215e20c-7781-49a0-b473-9219cb07e0b9-2020-10-09T160000.000Z","Aminoacidopathy","","",""
"ACSL4","HGNC:3571","https://search.clinicalgenome.org/kb/genes/HGNC:3571","non-syndromic X-linked intellectual disability","MONDO:0019181","https://search.clinicalgenome.org/kb/conditions/MONDO:0019181","X-linked inheritance","1 - Little Evidence for Haploinsufficiency (06/10/2025)","0 - No Evidence for Triplosensitivity (06/10/2025)","https://search.clinicalgenome.org/kb/gene-dosage/HGNC:3571","Dosage Working Group","definitive evidence (01/10/2023)","https://search.clinicalgenome.org/kb/gene-validity/CGGV:assertion_b4da722c-f7fc-4dc4-ad19-1d1b023d488f-2023-01-10T190000.000Z","Intellectual Disability and Autism","","",""
"ACSL4","HGNC:3571","https://search.clinicalgenome.org/kb/genes/HGNC:3571","intellectual disability, X-linked 63","MONDO:0010313","https://search.clinicalgenome.org/kb/conditions/MONDO:0010313","N/A","1 - Little Evidence for Haploinsufficiency (06/10/2025)","0 - No Evidence for Triplosensitivity (06/10/2025)","https://search.clinicalgenome.org/kb/gene-dosage/HGNC:3571","Dosage Working Group","","","","","",""
"ACTA1","HGNC:129","https://search.clinicalgenome.org/kb/genes/HGNC:129","alpha-actinopathy","MONDO:0100084","https://search.clinicalgenome.org/kb/conditions/MONDO:0100084","Autosomal dominant inheritance | Autosomal recessive inheritance","","","","","definitive evidence (02/26/2024) | definitive evidence (02/26/2024)","https://search.clinicalgenome.org/kb/gene-validity/CGGV:assertion_ba47597e-07a0-45e3-a971-f15807e8a1a4-2024-02-26T170000.000Z | https://search.clinicalgenome.org/kb/gene-validity/CGGV:assertion_098a7b3a-26ab-4915-8187-f6db682cef4f-2024-02-26T170000.000Z","Congenital Myopathies | Congenital Myopathies","","",""
"ACTA2","HGNC:130","https://search.clinicalgenome.org/kb/genes/HGNC:130","multisystemic smooth muscle dysfunction syndrome","MONDO:0013452","https://search.clinicalgenome.org/kb/conditions/MONDO:0013452","Autosomal dominant inheritance","1 - Little Evidence for Haploinsufficiency (09/28/2022)","0 - No Evidence for Triplosensitivity (09/28/2022)","https://search.clinicalgenome.org/kb/gene-dosage/HGNC:130","Dosage Working Group","definitive evidence (01/24/2025)","https://search.clinicalgenome.org/kb/gene-validity/CGGV:assertion_2f4fb1fe-4b82-481d-a81d-398eea46acc5-2025-01-24T170000.000Z","Hereditary Cardiovascular Disease","","",""
"ACTA2","HGNC:130","https://search.clinicalgenome.org/kb/genes/HGNC:130","familial thoracic aortic aneurysm and aortic dissection","MONDO:0019625","https://search.clinicalgenome.org/kb/conditions/MONDO:0019625","N/A","1 - Little Evidence for Haploinsufficiency (09/28/2022)","0 - No Evidence for Triplosensitivity (09/28/2022)","https://search.clinicalgenome.org/kb/gene-dosage/HGNC:130","Dosage Working Group","","","","Strong Actionability (03/01/2019) | Strong Actionability (03/01/2019)","https://actionability.clinicalgenome.org/ac/Adult/ui/stg2SummaryRpt?doc=AC134 | https://actionability.clinicalgenome.org/ac/Pediatric/ui/stg2SummaryRpt?doc=AC134","Adult Actionability Working Group | Pediatric Actionability Working Group"
"ACTB","HGNC:132","https://search.clinicalgenome.org/kb/genes/HGNC:132","Baraitser-Winter cerebrofrontofacial syndrome","MONDO:0017579","https://search.clinicalgenome.org/kb/conditions/MONDO:0017579","Autosomal dominant inheritance","0 - No Evidence for Haploinsufficiency (02/08/2022)","0 - No Evidence for Triplosensitivity (02/08/2022)","https://search.clinicalgenome.org/kb/gene-dosage/HGNC:132","Dosage Working Group","definitive evidence (10/26/2021)","https://search.clinicalgenome.org/kb/gene-validity/CGGV:assertion_fa13dfad-ab93-4521-874a-5ede8f608fe4-2021-10-26T165835.977Z","Brain Malformations","","",""
"ACTB","HGNC:132","https://search.clinicalgenome.org/kb/genes/HGNC:132","ACTB-associated syndromic thrombocytopenia","MONDO:0100433","https://search.clinicalgenome.org/kb/conditions/MONDO:0100433","Autosomal dominant inheritance","0 - No Evidence for Haploinsufficiency (02/08/2022)","0 - No Evidence for Triplosensitivity (02/08/2022)","https://search.clinicalgenome.org/kb/gene-dosage/HGNC:132","Dosage Working Group","moderate evidence (06/03/2024)","https://search.clinicalgenome.org/kb/gene-validity/CGGV:assertion_9cee7fd2-09f7-41dc-9742-542917d856b0-2024-06-03T160000.000Z","Hemostasis Thrombosis","","",""
"ACTB","HGNC:132","https://search.clinicalgenome.org/kb/genes/HGNC:132","syndromic intellectual disability","MONDO:0000508","https://search.clinicalgenome.org/kb/conditions/MONDO:0000508","N/A","0 - No Evidence for Haploinsufficiency (02/08/2022)","0 - No Evidence for Triplosensitivity (02/08/2022)","https://search.clinicalgenome.org/kb/gene-dosage/HGNC:132","Dosage Working Group","","","","","",""
"ACTC1","HGNC:143","https://search.clinicalgenome.org/kb/genes/HGNC:143","hypertrophic cardiomyopathy","MONDO:0005045","https://search.clinicalgenome.org/kb/conditions/MONDO:0005045","Autosomal dominant inheritance","1 - Little Evidence for Haploinsufficiency (09/10/2024)","0 - No Evidence for Triplosensitivity (09/10/2024)","https://search.clinicalgenome.org/kb/gene-dosage/HGNC:143","Dosage Working Group","definitive evidence (06/23/2021)","https://search.clinicalgenome.org/kb/gene-validity/CGGV:assertion_2f62793b-0015-46eb-bb51-bddbae25ba0d-2021-06-23T201616.296Z","Hypertrophic Cardiomyopathy","Assertion Pending (08/14/2017)","https://actionability.clinicalgenome.org/ac/Adult/ui/stg2SummaryRpt?doc=AC056","Adult Actionability Working Group"
"ACTC1","HGNC:143","https://search.clinicalgenome.org/kb/genes/HGNC:143","arrhythmogenic right ventricular cardiomyopathy","MONDO:0016587","https://search.clinicalgenome.org/kb/conditions/MONDO:0016587","Autosomal dominant inheritance","1 - Little Evidence for Haploinsufficiency (09/10/2024)","0 - No Evidence for Triplosensitivity (09/10/2024)","https://search.clinicalgenome.org/kb/gene-dosage/HGNC:143","Dosage Working Group","no known disease relationship (03/15/2019)","https://search.clinicalgenome.org/kb/gene-validity/CGGV:assertion_748d4255-ef43-4b42-b9f1-1cdbc50de763-2019-03-15T160000.000Z","Arrhythmogenic Right Ventricular Cardiomyopathy","","",""
"ACTC1","HGNC:143","https://search.clinicalgenome.org/kb/genes/HGNC:143","dilated cardiomyopathy","MONDO:0005021","https://search.clinicalgenome.org/kb/conditions/MONDO:0005021","Autosomal dominant inheritance","1 - Little Evidence for Haploinsufficiency (09/10/2024)","0 - No Evidence for Triplosensitivity (09/10/2024)","https://search.clinicalgenome.org/kb/gene-dosage/HGNC:143","Dosage Working Group","moderate evidence (04/25/2025)","https://search.clinicalgenome.org/kb/gene-validity/CGGV:assertion_3e9b4048-3003-4180-b891-fcf10d25a814-2025-04-25T040000.000Z","Dilated Cardiomyopathy","","",""
"ACTC1","HGNC:143","https://search.clinicalgenome.org/kb/genes/HGNC:143","hypertrophic cardiomyopathy 11","MONDO:0012799","https://search.clinicalgenome.org/kb/conditions/MONDO:0012799","N/A","1 - Little Evidence for Haploinsufficiency (09/10/2024)","0 - No Evidence for Triplosensitivity (09/10/2024)","https://search.clinicalgenome.org/kb/gene-dosage/HGNC:143","Dosage Working Group","","","","Assertion Pending (08/14/2017)","https://actionability.clinicalgenome.org/ac/Adult/ui/stg2SummaryRpt?doc=AC056","Adult Actionability Working Group"
"ACTC1","HGNC:143","https://search.clinicalgenome.org/kb/genes/HGNC:143","familial hypertrophic cardiomyopathy","MONDO:0024573","https://search.clinicalgenome.org/kb/conditions/MONDO:0024573","N/A","1 - Little Evidence for Haploinsufficiency (09/10/2024)","0 - No Evidence for Triplosensitivity (09/10/2024)","https://search.clinicalgenome.org/kb/gene-dosage/HGNC:143","Dosage Working Group","","","","Assertion Pending (08/14/2017)","https://actionability.clinicalgenome.org/ac/Adult/ui/stg2SummaryRpt?doc=AC056","Adult Actionability Working Group"
"ACTC1","HGNC:143","https://search.clinicalgenome.org/kb/genes/HGNC:143","cardiogenetic disease","MONDO:0100547","https://search.clinicalgenome.org/kb/conditions/MONDO:0100547","N/A","1 - Little Evidence for Haploinsufficiency (09/10/2024)","0 - No Evidence for Triplosensitivity (09/10/2024)","https://search.clinicalgenome.org/kb/gene-dosage/HGNC:143","Dosage Working Group","","","","","",""
"ACTG1","HGNC:144","https://search.clinicalgenome.org/kb/genes/HGNC:144","nonsyndromic genetic hearing loss","MONDO:0019497","https://search.clinicalgenome.org/kb/conditions/MONDO:0019497","Autosomal dominant inheritance","","","","","definitive evidence (01/07/2019)","https://search.clinicalgenome.org/kb/gene-validity/CGGV:assertion_db9f5d19-5ebc-4a1a-a4c3-79ff27f69a0e-2019-01-07T170000.000Z","Hearing Loss","","",""
"ACTG1","HGNC:144","https://search.clinicalgenome.org/kb/genes/HGNC:144","Baraitser-winter syndrome 2","MONDO:0013812","https://search.clinicalgenome.org/kb/conditions/MONDO:0013812","Autosomal dominant inheritance","","","","","definitive evidence (01/07/2019)","https://search.clinicalgenome.org/kb/gene-validity/CGGV:assertion_9969a221-1ce9-44c6-8ab7-2ad5f7ccd5ab-2019-01-07T170000.000Z","Hearing Loss","","",""
"ACTG1","HGNC:144","https://search.clinicalgenome.org/kb/genes/HGNC:144","","CGGV:FREETEXT_5710bf1a-49db-4189-b02a-9c51a46e50f1","https://search.clinicalgenome.org/kb/conditions/CGGV:FREETEXT_5710bf1a-49db-4189-b02a-9c51a46e50f1","N/A","","","","","","","","","",""
"ACTL6A","HGNC:24124","https://search.clinicalgenome.org/kb/genes/HGNC:24124","ACTL6A-related BAFopathy","MONDO:0700121","https://search.clinicalgenome.org/kb/conditions/MONDO:0700121","Autosomal dominant inheritance","","","","","moderate evidence (07/21/2023)","https://search.clinicalgenome.org/kb/gene-validity/CGGV:assertion_9278e3c0-9174-4aed-8c13-b34618e88825-2023-07-21T160000.000Z","Syndromic Disorders","","",""
"ACTL6B","HGNC:160","https://search.clinicalgenome.org/kb/genes/HGNC:160","genetic developmental and epileptic encephalopathy","MONDO:0100062","https://search.clinicalgenome.org/kb/conditions/MONDO:0100062","N/A","30 - Gene Associated with Autosomal Recessive Phenotype (11/23/2022)","","https://search.clinicalgenome.org/kb/gene-dosage/HGNC:160","Dosage Working Group","","","","","",""
"ACTN1","HGNC:163","https://search.clinicalgenome.org/kb/genes/HGNC:163","platelet-type bleeding disorder 15","MONDO:0014078","https://search.clinicalgenome.org/kb/conditions/MONDO:0014078","Autosomal dominant inheritance","","","","","definitive evidence (11/25/2020)","https://search.clinicalgenome.org/kb/gene-validity/CGGV:assertion_215f3113-cfb6-44cc-a68b-1eb6539c9fa0-2020-11-25T170000.000Z","Hemostasis Thrombosis","","",""
"ACTN2","HGNC:164","https://search.clinicalgenome.org/kb/genes/HGNC:164","ACTN2-related cardiac and skeletal myopathy","MONDO:0700349","https://search.clinicalgenome.org/kb/conditions/MONDO:0700349","Autosomal dominant inheritance","","","","","definitive evidence (07/23/2025)","https://search.clinicalgenome.org/kb/gene-validity/CGGV:assertion_6710e329-d391-4355-85a5-02d03f8791a3-2025-07-23T040000.000Z","Hereditary Cardiovascular Disease","","",""
"ACVR1","HGNC:171","https://search.clinicalgenome.org/kb/genes/HGNC:171","congenital heart disease","MONDO:0005453","https://search.clinicalgenome.org/kb/conditions/MONDO:0005453","Autosomal dominant inheritance","","","","","limited evidence (08/14/2023)","https://search.clinicalgenome.org/kb/gene-validity/CGGV:assertion_a34f19aa-a12e-483c-ae09-a0fce770647b-2023-08-14T160000.000Z","Congenital Heart Disease","","",""
"ACVR1","HGNC:171","https://search.clinicalgenome.org/kb/genes/HGNC:171","fibrodysplasia ossificans progressiva","MONDO:0007606","https://search.clinicalgenome.org/kb/conditions/MONDO:0007606","Autosomal dominant inheritance","","","","","definitive evidence (03/01/2023)","https://search.clinicalgenome.org/kb/gene-validity/CGGV:assertion_0439e75f-fc1b-4841-8c9a-17f3568ce8a4-2023-03-01T170000.000Z","Skeletal Disorders","","",""
"ACVRL1","HGNC:175","https://search.clinicalgenome.org/kb/genes/HGNC:175","telangiectasia, hereditary hemorrhagic, type 2","MONDO:0010880","https://search.clinicalgenome.org/kb/conditions/MONDO:0010880","Autosomal dominant inheritance","3 - Sufficient Evidence for Haploinsufficiency (02/11/2025)","0 - No Evidence for Triplosensitivity (02/11/2025)","https://search.clinicalgenome.org/kb/gene-dosage/HGNC:175","Dosage Working Group","definitive evidence (12/05/2022)","https://search.clinicalgenome.org/kb/gene-validity/CGGV:assertion_fbbb72c5-84a0-4096-8d49-6df506cfee0e-2022-12-05T170000.000Z","Hemostasis Thrombosis","Moderate Actionability (08/26/2022) | Strong Actionability (08/26/2022)","https://actionability.clinicalgenome.org/ac/Adult/ui/stg2SummaryRpt?doc=AC107 | https://actionability.clinicalgenome.org/ac/Pediatric/ui/stg2SummaryRpt?doc=AC107","Adult Actionability Working Group | Pediatric Actionability Working Group"
"ACVRL1","HGNC:175","https://search.clinicalgenome.org/kb/genes/HGNC:175","hereditary hemorrhagic telangiectasia","MONDO:0019180","https://search.clinicalgenome.org/kb/conditions/MONDO:0019180","N/A","3 - Sufficient Evidence for Haploinsufficiency (02/11/2025)","0 - No Evidence for Triplosensitivity (02/11/2025)","https://search.clinicalgenome.org/kb/gene-dosage/HGNC:175","Dosage Working Group","","","","Moderate Actionability (08/26/2022) | Strong Actionability (08/26/2022)","https://actionability.clinicalgenome.org/ac/Adult/ui/stg2SummaryRpt?doc=AC107 | https://actionability.clinicalgenome.org/ac/Pediatric/ui/stg2SummaryRpt?doc=AC107","Adult Actionability Working Group | Pediatric Actionability Working Group"
"ACY1","HGNC:177","https://search.clinicalgenome.org/kb/genes/HGNC:177","aminoacylase 1 deficiency","MONDO:0012368","https://search.clinicalgenome.org/kb/conditions/MONDO:0012368","Autosomal recessive inheritance","","","","","definitive evidence (09/25/2020)","https://search.clinicalgenome.org/kb/gene-validity/CGGV:assertion_67196825-d32f-4070-9c15-debaa2287b73-2020-09-25T160000.000Z","Aminoacidopathy","","",""
"ADA","HGNC:186","https://search.clinicalgenome.org/kb/genes/HGNC:186","severe combined immunodeficiency, autosomal recessive, T cell-negative, B cell-negative, NK cell-negative, due to adenosine deaminase deficiency","MONDO:0007064","https://search.clinicalgenome.org/kb/conditions/MONDO:0007064","Autosomal recessive inheritance","","","","","definitive evidence (11/19/2020)","https://search.clinicalgenome.org/kb/gene-validity/CGGV:assertion_664ba77c-3db6-47da-941e-316ac819432a-2020-11-19T170000.000Z","SCID-CID","","",""
"ADA2","HGNC:1839","https://search.clinicalgenome.org/kb/genes/HGNC:1839","deficiency of adenosine deaminase 2","MONDO:0100317","https://search.clinicalgenome.org/kb/conditions/MONDO:0100317","Autosomal recessive inheritance","30 - Gene Associated with Autosomal Recessive Phenotype (08/22/2016)","","https://search.clinicalgenome.org/kb/gene-dosage/HGNC:1839","Dosage Working Group","definitive evidence (05/30/2023)","https://search.clinicalgenome.org/kb/gene-validity/CGGV:assertion_e05f1338-6a58-4991-af3b-6433bd165a9f-2023-05-30T170000.000Z","Antibody Deficiencies GCEP","","",""
"ADA2","HGNC:1839","https://search.clinicalgenome.org/kb/genes/HGNC:1839","vasculitis due to ADA2 deficiency","MONDO:0014306","https://search.clinicalgenome.org/kb/conditions/MONDO:0014306","N/A","30 - Gene Associated with Autosomal Recessive Phenotype (08/22/2016)","","https://search.clinicalgenome.org/kb/gene-dosage/HGNC:1839","Dosage Working Group","","","","","",""
"ADAM17","HGNC:195","https://search.clinicalgenome.org/kb/genes/HGNC:195","congenital heart disease","MONDO:0005453","https://search.clinicalgenome.org/kb/conditions/MONDO:0005453","Autosomal dominant inheritance","","","","","limited evidence (08/14/2023)","https://search.clinicalgenome.org/kb/gene-validity/CGGV:assertion_8ad3a100-7a22-4065-aaa2-87c64a843486-2023-08-14T160000.000Z","Congenital Heart Disease","","",""
"ADAM9","HGNC:216","https://search.clinicalgenome.org/kb/genes/HGNC:216","ADAM9-related retinopathy","MONDO:0800398","https://search.clinicalgenome.org/kb/conditions/MONDO:0800398","Autosomal recessive inheritance","30 - Gene Associated with Autosomal Recessive Phenotype (12/11/2014)","0 - No Evidence for Triplosensitivity (12/11/2014)","https://search.clinicalgenome.org/kb/gene-dosage/HGNC:216","Dosage Working Group","definitive evidence (09/01/2022)","https://search.clinicalgenome.org/kb/gene-validity/CGGV:assertion_c648ec73-186d-4680-93ea-29f5fdf91812-2022-09-01T160000.000Z","Retina","","",""
"ADAM9","HGNC:216","https://search.clinicalgenome.org/kb/genes/HGNC:216","cone-rod dystrophy 9","MONDO:0013002","https://search.clinicalgenome.org/kb/conditions/MONDO:0013002","N/A","30 - Gene Associated with Autosomal Recessive Phenotype (12/11/2014)","0 - No Evidence for Triplosensitivity (12/11/2014)","https://search.clinicalgenome.org/kb/gene-dosage/HGNC:216","Dosage Working Group","","","","","",""
"ADAMTS13","HGNC:1366","https://search.clinicalgenome.org/kb/genes/HGNC:1366","congenital thrombotic thrombocytopenic purpura","MONDO:0010122","https://search.clinicalgenome.org/kb/conditions/MONDO:0010122","Autosomal recessive inheritance","30 - Gene Associated with Autosomal Recessive Phenotype (08/22/2016)","","https://search.clinicalgenome.org/kb/gene-dosage/HGNC:1366","Dosage Working Group","definitive evidence (03/25/2020)","https://search.clinicalgenome.org/kb/gene-validity/CGGV:assertion_6442c328-21be-482d-9ea9-ce694c1a5dd9-2020-03-25T160000.000Z","Hemostasis Thrombosis","","",""
"ADAMTS17","HGNC:17109","https://search.clinicalgenome.org/kb/genes/HGNC:17109","Weill-Marchesani 4 syndrome, recessive","MONDO:0013176","https://search.clinicalgenome.org/kb/conditions/MONDO:0013176","N/A","30 - Gene Associated with Autosomal Recessive Phenotype (08/22/2016)","0 - No Evidence for Triplosensitivity (08/22/2016)","https://search.clinicalgenome.org/kb/gene-dosage/HGNC:17109","Dosage Working Group","","","","","",""
"ADAMTS18","HGNC:17110","https://search.clinicalgenome.org/kb/genes/HGNC:17110","microcornea-myopic chorioretinal atrophy","MONDO:0014195","https://search.clinicalgenome.org/kb/conditions/MONDO:0014195","Autosomal recessive inheritance","30 - Gene Associated with Autosomal Recessive Phenotype (08/22/2016)","0 - No Evidence for Triplosensitivity (08/22/2016)","https://search.clinicalgenome.org/kb/gene-dosage/HGNC:17110","Dosage Working Group","definitive evidence (03/02/2022)","https://search.clinicalgenome.org/kb/gene-validity/CGGV:assertion_95caeabe-f92c-4884-87b4-ed97f15769f3-2022-03-02T212447.170Z","Retina","","",""
"ADAMTS19","HGNC:17111","https://search.clinicalgenome.org/kb/genes/HGNC:17111","congenital heart disease","MONDO:0005453","https://search.clinicalgenome.org/kb/conditions/MONDO:0005453","Autosomal recessive inheritance","","","","","limited evidence (07/08/2024)","https://search.clinicalgenome.org/kb/gene-validity/CGGV:assertion_b850ff44-cec0-4afd-a3d8-0779b336f972-2024-07-08T160000.000Z","Congenital Heart Disease","","",""
"ADAMTS2","HGNC:218","https://search.clinicalgenome.org/kb/genes/HGNC:218","Ehlers-Danlos syndrome, dermatosparaxis type","MONDO:0009161","https://search.clinicalgenome.org/kb/conditions/MONDO:0009161","N/A","30 - Gene Associated with Autosomal Recessive Phenotype (08/22/2016)","0 - No Evidence for Triplosensitivity (08/22/2016)","https://search.clinicalgenome.org/kb/gene-dosage/HGNC:218","Dosage Working Group","","","","","",""
"ADAMTS9","HGNC:13202","https://search.clinicalgenome.org/kb/genes/HGNC:13202","ciliopathy","MONDO:0005308","https://search.clinicalgenome.org/kb/conditions/MONDO:0005308","Autosomal recessive inheritance","","","","","limited evidence (05/11/2022)","https://search.clinicalgenome.org/kb/gene-validity/CGGV:assertion_a31b47e0-c9a5-4bdd-99d7-2d7f0d2a3bc8-2022-05-11T160000.000Z","Kidney Cystic and Ciliopathy Disorders","","",""
"ADAMTSL2","HGNC:14631","https://search.clinicalgenome.org/kb/genes/HGNC:14631","geleophysic dysplasia 1","MONDO:0009269","https://search.clinicalgenome.org/kb/conditions/MONDO:0009269","N/A","30 - Gene Associated with Autosomal Recessive Phenotype (08/22/2016)","0 - No Evidence for Triplosensitivity (08/22/2016)","https://search.clinicalgenome.org/kb/gene-dosage/HGNC:14631","Dosage Working Group","","","","","",""
"ADAR","HGNC:225","https://search.clinicalgenome.org/kb/genes/HGNC:225","Leigh syndrome","MONDO:0009723","https://search.clinicalgenome.org/kb/conditions/MONDO:0009723","Autosomal recessive inheritance","","","","","limited evidence (08/27/2020)","https://search.clinicalgenome.org/kb/gene-validity/CGGV:assertion_03f538b5-43af-4699-9ddb-264077de21c9-2020-08-27T164642.352Z","Mitochondrial Diseases","","",""
"ADAR","HGNC:225","https://search.clinicalgenome.org/kb/genes/HGNC:225","ADAR-related type 1 interferonopathy","MONDO:0700261","https://search.clinicalgenome.org/kb/conditions/MONDO:0700261","Autosomal dominant inheritance | Autosomal recessive inheritance","","","","","definitive evidence (10/21/2024) | definitive evidence (10/31/2024)","https://search.clinicalgenome.org/kb/gene-validity/CGGV:assertion_c6e83262-29db-4535-a41b-8cb8549009bf-2024-10-21T160000.000Z | https://search.clinicalgenome.org/kb/gene-validity/CGGV:assertion_9cf90ec8-f2fd-4b93-89ca-d20e628a6109-2024-10-31T160000.000Z","Leukodystrophy and Leukoencephalopathy | Leukodystrophy and Leukoencephalopathy","","",""
"ADAT3","HGNC:25151","https://search.clinicalgenome.org/kb/genes/HGNC:25151","intellectual disability-strabismus syndrome","MONDO:0014119","https://search.clinicalgenome.org/kb/conditions/MONDO:0014119","Autosomal recessive inheritance","","","","","moderate evidence (09/15/2025)","https://search.clinicalgenome.org/kb/gene-validity/CGGV:assertion_7a9357c4-670e-498d-8e50-e58b08cff6cc-2025-09-16T160000.000Z","Intellectual Disability and Autism","","",""
"ADCY1","HGNC:232","https://search.clinicalgenome.org/kb/genes/HGNC:232","nonsyndromic genetic hearing loss","MONDO:0019497","https://search.clinicalgenome.org/kb/conditions/MONDO:0019497","Autosomal recessive inheritance","","","","","limited evidence (10/31/2024)","https://search.clinicalgenome.org/kb/gene-validity/CGGV:assertion_8dc7be09-eeed-4bd3-8a00-ab4e89af3bae-2024-10-31T160000.000Z","Hearing Loss","","",""
"ADCY5","HGNC:236","https://search.clinicalgenome.org/kb/genes/HGNC:236","dyskinesia with orofacial involvement","MONDO:0031115","https://search.clinicalgenome.org/kb/conditions/MONDO:0031115","Semidominant inheritance","","","","","definitive evidence (09/05/2024)","https://search.clinicalgenome.org/kb/gene-validity/CGGV:assertion_ec58d44e-b258-4ca1-b678-102a9a90678b-2024-09-05T160000.000Z","Cerebral Palsy","","",""
"ADD3","HGNC:245","https://search.clinicalgenome.org/kb/genes/HGNC:245","complex neurodevelopmental disorder with motor features","MONDO:0100516","https://search.clinicalgenome.org/kb/conditions/MONDO:0100516","Autosomal recessive inheritance","","","","","moderate evidence (08/15/2022)","https://search.clinicalgenome.org/kb/gene-validity/CGGV:assertion_8a858435-3e50-406f-8ec3-9f4e40b1c392-2022-08-15T180000.000Z","Cerebral Palsy","","",""
"ADGRG1","HGNC:4512","https://search.clinicalgenome.org/kb/genes/HGNC:4512","bilateral frontoparietal polymicrogyria","MONDO:0011738","https://search.clinicalgenome.org/kb/conditions/MONDO:0011738","Autosomal recessive inheritance","30 - Gene Associated with Autosomal Recessive Phenotype (05/17/2012)","0 - No Evidence for Triplosensitivity (05/17/2012)","https://search.clinicalgenome.org/kb/gene-dosage/HGNC:4512","Dosage Working Group","definitive evidence (10/24/2023)","https://search.clinicalgenome.org/kb/gene-validity/CGGV:assertion_00a967bf-7f3a-4305-8210-7787f257a836-2023-10-24T170000.000Z","Brain Malformations","","",""
"ADGRV1","HGNC:17416","https://search.clinicalgenome.org/kb/genes/HGNC:17416","nonsyndromic genetic hearing loss","MONDO:0019497","https://search.clinicalgenome.org/kb/conditions/MONDO:0019497","Autosomal recessive inheritance","30 - Gene Associated with Autosomal Recessive Phenotype (08/23/2021)","0 - No Evidence for Triplosensitivity (08/23/2021)","https://search.clinicalgenome.org/kb/gene-dosage/HGNC:17416","Dosage Working Group","disputing (03/19/2019)","https://search.clinicalgenome.org/kb/gene-validity/CGGV:assertion_1f3dc96a-8fd3-4d30-98fd-1b1cf264e818-2019-03-19T160000.000Z","Hearing Loss","","",""
"ADGRV1","HGNC:17416","https://search.clinicalgenome.org/kb/genes/HGNC:17416","Usher syndrome type 2","MONDO:0016484","https://search.clinicalgenome.org/kb/conditions/MONDO:0016484","Autosomal recessive inheritance","30 - Gene Associated with Autosomal Recessive Phenotype (08/23/2021)","0 - No Evidence for Triplosensitivity (08/23/2021)","https://search.clinicalgenome.org/kb/gene-dosage/HGNC:17416","Dosage Working Group","definitive evidence (02/15/2017)","https://search.clinicalgenome.org/kb/gene-validity/CGGV:assertion_992d2cd7-5305-4278-9601-3e59ac1a8770-2017-02-15T170000.000Z","Hearing Loss","","",""
"ADK","HGNC:257","https://search.clinicalgenome.org/kb/genes/HGNC:257","adenosine kinase deficiency","MONDO:0100255","https://search.clinicalgenome.org/kb/conditions/MONDO:0100255","Autosomal recessive inheritance","","","","","definitive evidence (04/08/2021)","https://search.clinicalgenome.org/kb/gene-validity/CGGV:assertion_c2319ca2-652d-411e-ab6d-5b7fb7e185ea-2021-04-08T160000.000Z","Aminoacidopathy","","",""
"ADNP","HGNC:15766","https://search.clinicalgenome.org/kb/genes/HGNC:15766","ADNP-related multiple congenital anomalies - intellectual disability - autism spectrum disorder","MONDO:0014379","https://search.clinicalgenome.org/kb/conditions/MONDO:0014379","Autosomal dominant inheritance","3 - Sufficient Evidence for Haploinsufficiency (11/22/2017)","0 - No Evidence for Triplosensitivity (11/22/2017)","https://search.clinicalgenome.org/kb/gene-dosage/HGNC:15766","Dosage Working Group","definitive evidence (01/14/2020)","https://search.clinicalgenome.org/kb/gene-validity/CGGV:assertion_837200e1-ed55-415b-bd9e-6649e4abab1d-2020-01-15T170000.000Z","Intellectual Disability and Autism","","",""
"ADRA2B","HGNC:282","https://search.clinicalgenome.org/kb/genes/HGNC:282","epilepsy","MONDO:0005027","https://search.clinicalgenome.org/kb/conditions/MONDO:0005027","Autosomal dominant inheritance","","","","","refuting evidence (06/18/2024)","https://search.clinicalgenome.org/kb/gene-validity/CGGV:assertion_ef3edc91-d4fd-4704-895e-c08f45f88fe7-2024-06-18T160000.000Z","Epilepsy","","",""
"ADSL","HGNC:291","https://search.clinicalgenome.org/kb/genes/HGNC:291","adenylosuccinate lyase deficiency","MONDO:0007068","https://search.clinicalgenome.org/kb/conditions/MONDO:0007068","Autosomal recessive inheritance","30 - Gene Associated with Autosomal Recessive Phenotype (11/06/2015)","0 - No Evidence for Triplosensitivity (11/06/2015)","https://search.clinicalgenome.org/kb/gene-dosage/HGNC:291","Dosage Working Group","definitive evidence (09/06/2020)","https://search.clinicalgenome.org/kb/gene-validity/CGGV:assertion_d282f565-84e4-4a47-9acc-77ee31bbe9f6-2020-09-07T160000.000Z","Intellectual Disability and Autism","","",""
"AFF2","HGNC:3776","https://search.clinicalgenome.org/kb/genes/HGNC:3776","non-syndromic X-linked intellectual disability","MONDO:0019181","https://search.clinicalgenome.org/kb/conditions/MONDO:0019181","X-linked inheritance","3 - Sufficient Evidence for Haploinsufficiency (12/08/2020)","0 - No Evidence for Triplosensitivity (12/08/2020)","https://search.clinicalgenome.org/kb/gene-dosage/HGNC:3776","Dosage Working Group","definitive evidence (08/11/2025)","https://search.clinicalgenome.org/kb/gene-validity/CGGV:assertion_ab4216e3-61b7-4542-ad3a-8788a7ef8b63-2025-08-10T220000.000Z","Intellectual Disability and Autism","","",""
"AFF2","HGNC:3776","https://search.clinicalgenome.org/kb/genes/HGNC:3776","FRAXE intellectual disability","MONDO:0010659","https://search.clinicalgenome.org/kb/conditions/MONDO:0010659","N/A","3 - Sufficient Evidence for Haploinsufficiency (12/08/2020)","0 - No Evidence for Triplosensitivity (12/08/2020)","https://search.clinicalgenome.org/kb/gene-dosage/HGNC:3776","Dosage Working Group","","","","","",""
"AFG2A","HGNC:18119","https://search.clinicalgenome.org/kb/genes/HGNC:18119","syndromic complex neurodevelopmental disorder","MONDO:0800439","https://search.clinicalgenome.org/kb/conditions/MONDO:0800439","Autosomal recessive inheritance","","","","","definitive evidence (07/23/2024)","https://search.clinicalgenome.org/kb/gene-validity/CGGV:assertion_c3ae4261-8438-496b-8295-a9fdb5785436-2024-07-23T160000.000Z","Syndromic Disorders","","",""
"AFG2B","HGNC:28762","https://search.clinicalgenome.org/kb/genes/HGNC:28762","hearing loss, autosomal recessive 119","MONDO:0030480","https://search.clinicalgenome.org/kb/conditions/MONDO:0030480","Autosomal recessive inheritance","","","","","limited evidence (02/21/2024)","https://search.clinicalgenome.org/kb/gene-validity/CGGV:assertion_e11de007-664f-4359-830e-fcb94ca09474-2024-02-21T170000.000Z","Hearing Loss","","",""
"AFG3L2","HGNC:315","https://search.clinicalgenome.org/kb/genes/HGNC:315","optic atrophy 12","MONDO:0033549","https://search.clinicalgenome.org/kb/conditions/MONDO:0033549","Semidominant inheritance","","","","","definitive evidence (05/16/2024)","https://search.clinicalgenome.org/kb/gene-validity/CGGV:assertion_837efbf5-6fac-4b1c-9f72-59527b5dd6fd-2024-05-16T160000.000Z","Glaucoma and Neuro-Ophthalmology","","",""
"AGA","HGNC:318","https://search.clinicalgenome.org/kb/genes/HGNC:318","aspartylglucosaminuria","MONDO:0008830","https://search.clinicalgenome.org/kb/conditions/MONDO:0008830","Autosomal recessive inheritance","30 - Gene Associated with Autosomal Recessive Phenotype (08/22/2016)","","https://search.clinicalgenome.org/kb/gene-dosage/HGNC:318","Dosage Working Group","definitive evidence (09/02/2022)","https://search.clinicalgenome.org/kb/gene-validity/CGGV:assertion_1f315b4a-1a3b-4deb-90fd-2b73f732a4ba-2022-09-02T160000.000Z","Lysosomal Diseases GCEP","","",""
"AGBL5","HGNC:26147","https://search.clinicalgenome.org/kb/genes/HGNC:26147","inherited retinal dystrophy","MONDO:0019118","https://search.clinicalgenome.org/kb/conditions/MONDO:0019118","Autosomal recessive inheritance","","","","","definitive evidence (05/01/2025)","https://search.clinicalgenome.org/kb/gene-validity/CGGV:assertion_cb9b01dc-10a2-4307-8b51-e956f71c4b65-2025-05-01T160000.000Z","Retina","","",""
"AGK","HGNC:21869","https://search.clinicalgenome.org/kb/genes/HGNC:21869","mitochondrial disease","MONDO:0044970","https://search.clinicalgenome.org/kb/conditions/MONDO:0044970","Autosomal recessive inheritance","30 - Gene Associated with Autosomal Recessive Phenotype (09/26/2025)","0 - No Evidence for Triplosensitivity (09/26/2025)","https://search.clinicalgenome.org/kb/gene-dosage/HGNC:21869","Dosage Working Group","definitive evidence (02/06/2023)","https://search.clinicalgenome.org/kb/gene-validity/CGGV:assertion_9f2f03ad-0f05-4e7d-b76e-f73b6e72251a-2023-02-06T050000.000Z","Mitochondrial Diseases","","",""
"AGL","HGNC:321","https://search.clinicalgenome.org/kb/genes/HGNC:321","glycogen storage disease III","MONDO:0009291","https://search.clinicalgenome.org/kb/conditions/MONDO:0009291","Autosomal recessive inheritance","","","","","definitive evidence (02/24/2023)","https://search.clinicalgenome.org/kb/gene-validity/CGGV:assertion_a7b762bc-a12f-4194-91b9-764784248cc7-2023-02-24T170000.000Z","General Inborn Errors of Metabolism","","",""
"AGO2","HGNC:3263","https://search.clinicalgenome.org/kb/genes/HGNC:3263","Lessel-Kreienkamp syndrome","MONDO:0030897","https://search.clinicalgenome.org/kb/conditions/MONDO:0030897","Autosomal dominant inheritance","","","","","definitive evidence (09/15/2023)","https://search.clinicalgenome.org/kb/gene-validity/CGGV:assertion_ec86c06a-f5a3-448d-be53-277bc91d12de-2023-09-15T160000.000Z","Syndromic Disorders","","",""
"AGPAT2","HGNC:325","https://search.clinicalgenome.org/kb/genes/HGNC:325","lipodystrophy","MONDO:0006573","https://search.clinicalgenome.org/kb/conditions/MONDO:0006573","Autosomal recessive inheritance","30 - Gene Associated with Autosomal Recessive Phenotype (08/22/2016)","0 - No Evidence for Triplosensitivity (08/22/2016)","https://search.clinicalgenome.org/kb/gene-dosage/HGNC:325","Dosage Working Group","definitive evidence (11/13/2024)","https://search.clinicalgenome.org/kb/gene-validity/CGGV:assertion_dfa30e7e-e750-4b65-bcd5-9421cc34fc43-2024-11-13T170000.000Z","Monogenic Diabetes","","",""
"AGPAT2","HGNC:325","https://search.clinicalgenome.org/kb/genes/HGNC:325","congenital generalized lipodystrophy type 1","MONDO:0012071","https://search.clinicalgenome.org/kb/conditions/MONDO:0012071","N/A","30 - Gene Associated with Autosomal Recessive Phenotype (08/22/2016)","0 - No Evidence for Triplosensitivity (08/22/2016)","https://search.clinicalgenome.org/kb/gene-dosage/HGNC:325","Dosage Working Group","","","","","",""
"AGPS","HGNC:327","https://search.clinicalgenome.org/kb/genes/HGNC:327","alkylglycerone-phosphate synthase deficiency","MONDO:0100274","https://search.clinicalgenome.org/kb/conditions/MONDO:0100274","Autosomal recessive inheritance","","","","","definitive evidence (04/22/2022)","https://search.clinicalgenome.org/kb/gene-validity/CGGV:assertion_aba640e2-c95d-414b-8c72-d22769e4366a-2022-04-22T160000.000Z","Peroxisomal Disorders","","",""
"AGRN","HGNC:329","https://search.clinicalgenome.org/kb/genes/HGNC:329","congenital myasthenic syndrome 8","MONDO:0014052","https://search.clinicalgenome.org/kb/conditions/MONDO:0014052","Autosomal recessive inheritance","30 - Gene Associated with Autosomal Recessive Phenotype (08/22/2016)","0 - No Evidence for Triplosensitivity (08/22/2016)","https://search.clinicalgenome.org/kb/gene-dosage/HGNC:329","Dosage Working Group","definitive evidence (08/25/2025)","https://search.clinicalgenome.org/kb/gene-validity/CGGV:assertion_70c80ce8-1780-4c6e-a8ff-c33b5cbf5d6a-2025-08-25T160000.000Z","Congenital Myopathies","","",""
"AGT","HGNC:333","https://search.clinicalgenome.org/kb/genes/HGNC:333","renal tubular dysgenesis of genetic origin","MONDO:0009970","https://search.clinicalgenome.org/kb/conditions/MONDO:0009970","N/A","30 - Gene Associated with Autosomal Recessive Phenotype (11/13/2014)","0 - No Evidence for Triplosensitivity (11/13/2014)","https://search.clinicalgenome.org/kb/gene-dosage/HGNC:333","Dosage Working Group","","","","","",""
"AGTPBP1","HGNC:17258","https://search.clinicalgenome.org/kb/genes/HGNC:17258","neurodegeneration, childhood-onset, with cerebellar atrophy","MONDO:0032650","https://search.clinicalgenome.org/kb/conditions/MONDO:0032650","Autosomal recessive inheritance","","","","","definitive evidence (07/21/2025)","https://search.clinicalgenome.org/kb/gene-validity/CGGV:assertion_9e11a817-7b96-4205-a9d8-6aab86a735bc-2025-07-21T160000.000Z","Cerebral Palsy","","",""
"AGTR2","HGNC:338","https://search.clinicalgenome.org/kb/genes/HGNC:338","X-linked complex neurodevelopmental disorder","MONDO:0100148","https://search.clinicalgenome.org/kb/conditions/MONDO:0100148","X-linked inheritance","0 - No Evidence for Haploinsufficiency (05/10/2012)","0 - No Evidence for Triplosensitivity (05/10/2012)","https://search.clinicalgenome.org/kb/gene-dosage/HGNC:338","Dosage Working Group","disputing (06/02/2020)","https://search.clinicalgenome.org/kb/gene-validity/CGGV:assertion_d7cfa2a0-e6a7-49b8-a773-b32a1dfbcd57-2020-06-02T160000.000Z","Intellectual Disability and Autism","","",""
"AGTR2","HGNC:338","https://search.clinicalgenome.org/kb/genes/HGNC:338","intellectual disability, X-linked 88","MONDO:0010454","https://search.clinicalgenome.org/kb/conditions/MONDO:0010454","N/A","0 - No Evidence for Haploinsufficiency (05/10/2012)","0 - No Evidence for Triplosensitivity (05/10/2012)","https://search.clinicalgenome.org/kb/gene-dosage/HGNC:338","Dosage Working Group","","","","","",""
"AGXT","HGNC:341","https://search.clinicalgenome.org/kb/genes/HGNC:341","alanine glyoxylate aminotransferase deficiency","MONDO:0100278","https://search.clinicalgenome.org/kb/conditions/MONDO:0100278","Autosomal recessive inheritance","30 - Gene Associated with Autosomal Recessive Phenotype (08/22/2016)","","https://search.clinicalgenome.org/kb/gene-dosage/HGNC:341","Dosage Working Group","definitive evidence (02/07/2020)","https://search.clinicalgenome.org/kb/gene-validity/CGGV:assertion_8460f17d-4d94-4a0c-ac46-41c86ce32e83-2020-02-07T170000.000Z","Peroxisomal Disorders","","",""
"AGXT","HGNC:341","https://search.clinicalgenome.org/kb/genes/HGNC:341","primary hyperoxaluria type 1","MONDO:0009823","https://search.clinicalgenome.org/kb/conditions/MONDO:0009823","N/A","30 - Gene Associated with Autosomal Recessive Phenotype (08/22/2016)","","https://search.clinicalgenome.org/kb/gene-dosage/HGNC:341","Dosage Working Group","","","","","",""
"AHCY","HGNC:343","https://search.clinicalgenome.org/kb/genes/HGNC:343","hypermethioninemia with deficiency of S-adenosylhomocysteine hydrolase","MONDO:0013404","https://search.clinicalgenome.org/kb/conditions/MONDO:0013404","Autosomal recessive inheritance","30 - Gene Associated with Autosomal Recessive Phenotype (06/08/2016)","0 - No Evidence for Triplosensitivity (06/08/2016)","https://search.clinicalgenome.org/kb/gene-dosage/HGNC:343","Dosage Working Group","definitive evidence (12/13/2024)","https://search.clinicalgenome.org/kb/gene-validity/CGGV:assertion_d9b3a56b-b188-44d1-9983-a059895c0ba1-2024-12-13T170000.000Z","Aminoacidopathy","","",""
"AHDC1","HGNC:25230","https://search.clinicalgenome.org/kb/genes/HGNC:25230","AHDC1-related intellectual disability - obstructive sleep apnea - mild dysmorphism syndrome","MONDO:0014358","https://search.clinicalgenome.org/kb/conditions/MONDO:0014358","Autosomal dominant inheritance","3 - Sufficient Evidence for Haploinsufficiency (02/28/2018)","0 - No Evidence for Triplosensitivity (02/28/2018)","https://search.clinicalgenome.org/kb/gene-dosage/HGNC:25230","Dosage Working Group","definitive evidence (11/16/2021)","https://search.clinicalgenome.org/kb/gene-validity/CGGV:assertion_59a6c010-95ac-4813-9cf4-5ff60fa5c7e9-2021-11-16T170000.000Z","Intellectual Disability and Autism","","",""
"AHI1","HGNC:21575","https://search.clinicalgenome.org/kb/genes/HGNC:21575","Joubert syndrome 3","MONDO:0012078","https://search.clinicalgenome.org/kb/conditions/MONDO:0012078","Autosomal recessive inheritance","30 - Gene Associated with Autosomal Recessive Phenotype (09/26/2025)","0 - No Evidence for Triplosensitivity (09/26/2025)","https://search.clinicalgenome.org/kb/gene-dosage/HGNC:21575","Dosage Working Group","definitive evidence (10/26/2021)","https://search.clinicalgenome.org/kb/gene-validity/CGGV:assertion_d0d8d22f-cea6-4f4f-bc71-e85303dccac1-2021-10-26T143345.589Z","Brain Malformations","","",""
"AICDA","HGNC:13203","https://search.clinicalgenome.org/kb/genes/HGNC:13203","hyper-IgM syndrome type 2","MONDO:0011528","https://search.clinicalgenome.org/kb/conditions/MONDO:0011528","Autosomal recessive inheritance | Autosomal dominant inheritance","30 - Gene Associated with Autosomal Recessive Phenotype (08/22/2016)","","https://search.clinicalgenome.org/kb/gene-dosage/HGNC:13203","Dosage Working Group","definitive evidence (08/28/2024) | definitive evidence (08/28/2024)","https://search.clinicalgenome.org/kb/gene-validity/CGGV:assertion_b34c451d-03a1-42dd-a439-599428b0eb38-2024-08-28T170000.000Z | https://search.clinicalgenome.org/kb/gene-validity/CGGV:assertion_dc16b40a-e78d-432a-88e8-f1ee6c0735f3-2024-08-28T170000.000Z","Antibody Deficiencies GCEP | Antibody Deficiencies GCEP","","",""
"AIFM1","HGNC:8768","https://search.clinicalgenome.org/kb/genes/HGNC:8768","Leigh syndrome","MONDO:0009723","https://search.clinicalgenome.org/kb/conditions/MONDO:0009723","X-linked inheritance","0 - No Evidence for Haploinsufficiency (04/23/2025)","0 - No Evidence for Triplosensitivity (04/23/2025)","https://search.clinicalgenome.org/kb/gene-dosage/HGNC:8768","Dosage Working Group","moderate evidence (06/14/2021)","https://search.clinicalgenome.org/kb/gene-validity/CGGV:assertion_e917f93b-01ef-42e3-bf8d-b50a91f83f9c-2021-06-14T135732.582Z","Mitochondrial Diseases","","",""
"AIFM1","HGNC:8768","https://search.clinicalgenome.org/kb/genes/HGNC:8768","X-linked hereditary sensory and autonomic neuropathy with hearing loss","MONDO:0010378","https://search.clinicalgenome.org/kb/conditions/MONDO:0010378","N/A","0 - No Evidence for Haploinsufficiency (04/23/2025)","0 - No Evidence for Triplosensitivity (04/23/2025)","https://search.clinicalgenome.org/kb/gene-dosage/HGNC:8768","Dosage Working Group","","","","","",""
"AIMP1","HGNC:10648","https://search.clinicalgenome.org/kb/genes/HGNC:10648","hypomyelinating leukodystrophy 3","MONDO:0009843","https://search.clinicalgenome.org/kb/conditions/MONDO:0009843","Autosomal recessive inheritance","30 - Gene Associated with Autosomal Recessive Phenotype (08/22/2016)","0 - No Evidence for Triplosensitivity (08/22/2016)","https://search.clinicalgenome.org/kb/gene-dosage/HGNC:10648","Dosage Working Group","definitive evidence (12/18/2024)","https://search.clinicalgenome.org/kb/gene-validity/CGGV:assertion_52296001-edce-4ae5-be19-d30319179f7d-2024-12-18T170000.000Z","Leukodystrophy and Leukoencephalopathy","","",""
"AIMP2","HGNC:20609","https://search.clinicalgenome.org/kb/genes/HGNC:20609","leukodystrophy, hypomyelinating, 17","MONDO:0054817","https://search.clinicalgenome.org/kb/conditions/MONDO:0054817","Autosomal recessive inheritance","","","","","definitive evidence (09/03/2025)","https://search.clinicalgenome.org/kb/gene-validity/CGGV:assertion_ba6f8aa3-9aa9-4755-8dec-bb5c69005bbe-2025-09-03T160000.000Z","Leukodystrophy and Leukoencephalopathy","","",""
"AIPL1","HGNC:359","https://search.clinicalgenome.org/kb/genes/HGNC:359","AIPL1-related retinopathy","MONDO:0100438","https://search.clinicalgenome.org/kb/conditions/MONDO:0100438","Autosomal recessive inheritance","","","","","definitive evidence (02/02/2023)","https://search.clinicalgenome.org/kb/gene-validity/CGGV:assertion_594ca712-dbb5-408b-8aba-68dbfaf7f778-2023-02-02T170000.000Z","Retina","","",""
"AIRE","HGNC:360","https://search.clinicalgenome.org/kb/genes/HGNC:360","autoimmune polyendocrine syndrome type 1","MONDO:0009411","https://search.clinicalgenome.org/kb/conditions/MONDO:0009411","Autosomal recessive inheritance","","","","","definitive evidence (11/07/2024)","https://search.clinicalgenome.org/kb/gene-validity/CGGV:assertion_c8a4a9cc-050b-46dc-b24a-af6a53517274-2024-11-07T170000.000Z","Monogenic Diabetes","","",""
"AK2","HGNC:362","https://search.clinicalgenome.org/kb/genes/HGNC:362","reticular dysgenesis","MONDO:0009973","https://search.clinicalgenome.org/kb/conditions/MONDO:0009973","Autosomal recessive inheritance","","","","","definitive evidence (05/20/2021)","https://search.clinicalgenome.org/kb/gene-validity/CGGV:assertion_aba98528-8032-4dd4-bd1d-5381b102323c-2021-05-20T150257.066Z","SCID-CID","","",""
"AK7","HGNC:20091","https://search.clinicalgenome.org/kb/genes/HGNC:20091","primary ciliary dyskinesia","MONDO:0016575","https://search.clinicalgenome.org/kb/conditions/MONDO:0016575","Autosomal recessive inheritance","","","","","disputing (03/09/2023)","https://search.clinicalgenome.org/kb/gene-validity/CGGV:assertion_8d34669e-fef4-49fb-97af-be7b5c6bea2d-2023-03-09T170000.000Z","Motile Ciliopathy","","",""
"AK7","HGNC:20091","https://search.clinicalgenome.org/kb/genes/HGNC:20091","spermatogenic failure 27","MONDO:0054731","https://search.clinicalgenome.org/kb/conditions/MONDO:0054731","Autosomal recessive inheritance","","","","","limited evidence (03/09/2023)","https://search.clinicalgenome.org/kb/gene-validity/CGGV:assertion_54a1d538-0afb-47b9-a7b2-e1f8b0afbcc8-2023-03-09T170000.000Z","Motile Ciliopathy","","",""
"AKAP9","HGNC:379","https://search.clinicalgenome.org/kb/genes/HGNC:379","long QT syndrome","MONDO:0002442","https://search.clinicalgenome.org/kb/conditions/MONDO:0002442","Autosomal dominant inheritance","","","","","disputing (12/15/2020)","https://search.clinicalgenome.org/kb/gene-validity/CGGV:assertion_786eac72-8014-4fdf-b279-10a5faaa09b8-2020-12-15T002607.349Z","Long QT Syndrome","","",""
"AKR1D1","HGNC:388","https://search.clinicalgenome.org/kb/genes/HGNC:388","congenital bile acid synthesis defect 2","MONDO:0009339","https://search.clinicalgenome.org/kb/conditions/MONDO:0009339","Autosomal recessive inheritance","","","","","definitive evidence (09/27/2024)","https://search.clinicalgenome.org/kb/gene-validity/CGGV:assertion_236a7baf-2425-4882-a6de-130dfb5117ac-2024-09-27T160000.000Z","General Inborn Errors of Metabolism","","",""
"AKT1","HGNC:391","https://search.clinicalgenome.org/kb/genes/HGNC:391","Cowden syndrome 6","MONDO:0014048","https://search.clinicalgenome.org/kb/conditions/MONDO:0014048","Autosomal dominant inheritance","0 - No Evidence for Haploinsufficiency (01/25/2022)","0 - No Evidence for Triplosensitivity (01/25/2022)","https://search.clinicalgenome.org/kb/gene-dosage/HGNC:391","Dosage Working Group","limited evidence (12/09/2024)","https://search.clinicalgenome.org/kb/gene-validity/CGGV:assertion_1333bd6d-332b-4c75-8811-cde8efce2001-2024-11-12T170000.000Z","Childhood, Adolescent and Young Adult Cancer Predisposition","","",""
"AKT3","HGNC:393","https://search.clinicalgenome.org/kb/genes/HGNC:393","overgrowth syndrome and/or cerebral malformations due to abnormalities in MTOR pathway genes","MONDO:0100283","https://search.clinicalgenome.org/kb/conditions/MONDO:0100283","Autosomal dominant inheritance","1 - Little Evidence for Haploinsufficiency (05/09/2023)","0 - No Evidence for Triplosensitivity (05/09/2023)","https://search.clinicalgenome.org/kb/gene-dosage/HGNC:393","Dosage Working Group","definitive evidence (07/29/2021)","https://search.clinicalgenome.org/kb/gene-validity/CGGV:assertion_52b1df18-387f-4c38-a655-682e4d2eb378-2021-07-29T213439.431Z","Brain Malformations","","",""
"AKT3","HGNC:393","https://search.clinicalgenome.org/kb/genes/HGNC:393","microcephaly","MONDO:0001149","https://search.clinicalgenome.org/kb/conditions/MONDO:0001149","Autosomal dominant inheritance","1 - Little Evidence for Haploinsufficiency (05/09/2023)","0 - No Evidence for Triplosensitivity (05/09/2023)","https://search.clinicalgenome.org/kb/gene-dosage/HGNC:393","Dosage Working Group","limited evidence (10/26/2021)","https://search.clinicalgenome.org/kb/gene-validity/CGGV:assertion_6e3b524c-5d27-43d6-a0db-4f8f7cf1f872-2021-10-26T150030.155Z","Brain Malformations","","",""
"ALAD","HGNC:395","https://search.clinicalgenome.org/kb/genes/HGNC:395","porphyria due to ALA dehydratase deficiency","MONDO:0013000","https://search.clinicalgenome.org/kb/conditions/MONDO:0013000","Autosomal recessive inheritance","30 - Gene Associated with Autosomal Recessive Phenotype (08/22/2016)","","https://search.clinicalgenome.org/kb/gene-dosage/HGNC:395","Dosage Working Group","moderate evidence (01/14/2025)","https://search.clinicalgenome.org/kb/gene-validity/CGGV:assertion_0ac683af-ca8d-46ab-8641-66ab9b537d16-2025-01-14T200000.000Z","General Inborn Errors of Metabolism","","",""
"ALAS2","HGNC:397","https://search.clinicalgenome.org/kb/genes/HGNC:397","X-linked erythropoietic protoporphyria","MONDO:0010420","https://search.clinicalgenome.org/kb/conditions/MONDO:0010420","X-linked inheritance","","","","","definitive evidence (03/27/2022)","https://search.clinicalgenome.org/kb/gene-validity/CGGV:assertion_61e658f9-fdc9-4b3c-8788-80eb1ad83b0b-2022-03-27T181700.091Z","General Inborn Errors of Metabolism","","",""
"ALB","HGNC:399","https://search.clinicalgenome.org/kb/genes/HGNC:399","hyperthyroxinemia, familial dysalbuminemic","MONDO:0014448","https://search.clinicalgenome.org/kb/conditions/MONDO:0014448","Autosomal dominant inheritance","","","","","moderate evidence (05/09/2025)","https://search.clinicalgenome.org/kb/gene-validity/CGGV:assertion_01c39e59-0831-4bc0-a3bb-603d92d81059-2025-05-09T040000.000Z","General Inborn Errors of Metabolism","","",""
"ALB","HGNC:399","https://search.clinicalgenome.org/kb/genes/HGNC:399","congenital analbuminemia","MONDO:0014449","https://search.clinicalgenome.org/kb/conditions/MONDO:0014449","Autosomal recessive inheritance","","","","","definitive evidence (05/09/2025)","https://search.clinicalgenome.org/kb/gene-validity/CGGV:assertion_a5c453ff-8474-463a-916e-45ccb14e2b39-2025-05-09T040000.000Z","General Inborn Errors of Metabolism","","",""
"ALDH18A1","HGNC:9722","https://search.clinicalgenome.org/kb/genes/HGNC:9722","P5CS deficiency","MONDO:0100126","https://search.clinicalgenome.org/kb/conditions/MONDO:0100126","Semidominant inheritance","","","","","definitive evidence (05/18/2021)","https://search.clinicalgenome.org/kb/gene-validity/CGGV:assertion_7bfbe962-beb3-4553-9909-a83a3aac2d55-2021-05-18T211134.377Z","Aminoacidopathy","","",""
"ALDH1A3","HGNC:409","https://search.clinicalgenome.org/kb/genes/HGNC:409","isolated microphthalmia 8","MONDO:0014050","https://search.clinicalgenome.org/kb/conditions/MONDO:0014050","N/A","30 - Gene Associated with Autosomal Recessive Phenotype (08/22/2016)","0 - No Evidence for Triplosensitivity (08/22/2016)","https://search.clinicalgenome.org/kb/gene-dosage/HGNC:409","Dosage Working Group","","","","","",""
"ALDH3A2","HGNC:403","https://search.clinicalgenome.org/kb/genes/HGNC:403","Sjogren-Larsson syndrome","MONDO:0010031","https://search.clinicalgenome.org/kb/conditions/MONDO:0010031","N/A","30 - Gene Associated with Autosomal Recessive Phenotype (08/22/2016)","","https://search.clinicalgenome.org/kb/gene-dosage/HGNC:403","Dosage Working Group","","","","","",""
"ALDH4A1","HGNC:406","https://search.clinicalgenome.org/kb/genes/HGNC:406","hyperprolinemia type 2","MONDO:0009401","https://search.clinicalgenome.org/kb/conditions/MONDO:0009401","Autosomal recessive inheritance","30 - Gene Associated with Autosomal Recessive Phenotype (04/09/2015)","0 - No Evidence for Triplosensitivity (04/09/2015)","https://search.clinicalgenome.org/kb/gene-dosage/HGNC:406","Dosage Working Group","definitive evidence (10/23/2020)","https://search.clinicalgenome.org/kb/gene-validity/CGGV:assertion_5edc3f72-31e0-47f8-bcec-e3e5b81c97ae-2020-10-23T171643.432Z","Aminoacidopathy","","",""
"ALDH5A1","HGNC:408","https://search.clinicalgenome.org/kb/genes/HGNC:408","succinic semialdehyde dehydrogenase deficiency","MONDO:0010083","https://search.clinicalgenome.org/kb/conditions/MONDO:0010083","Autosomal recessive inheritance","30 - Gene Associated with Autosomal Recessive Phenotype (08/22/2016)","0 - No Evidence for Triplosensitivity (08/22/2016)","https://search.clinicalgenome.org/kb/gene-dosage/HGNC:408","Dosage Working Group","definitive evidence (04/27/2021)","https://search.clinicalgenome.org/kb/gene-validity/CGGV:assertion_c3e57466-df2f-4045-b374-010dbd334bfc-2021-04-27T160000.000Z","Intellectual Disability and Autism","","",""
"ALDH6A1","HGNC:7179","https://search.clinicalgenome.org/kb/genes/HGNC:7179","methylmalonate semialdehyde dehydrogenase deficiency","MONDO:0013579","https://search.clinicalgenome.org/kb/conditions/MONDO:0013579","Autosomal recessive inheritance","","","","","limited evidence (12/12/2022)","https://search.clinicalgenome.org/kb/gene-validity/CGGV:assertion_57ca1521-9336-4769-bc55-240089dab917-2022-12-12T170000.000Z","Aminoacidopathy","","",""
"ALDH7A1","HGNC:877","https://search.clinicalgenome.org/kb/genes/HGNC:877","pyridoxine-dependent epilepsy","MONDO:0009945","https://search.clinicalgenome.org/kb/conditions/MONDO:0009945","Autosomal recessive inheritance","","","","","definitive evidence (07/26/2019)","https://search.clinicalgenome.org/kb/gene-validity/CGGV:assertion_7a982307-d8bd-43d1-b356-ef7ee6f32045-2019-07-26T160000.000Z","Aminoacidopathy","","",""
"ALDH7A1","HGNC:877","https://search.clinicalgenome.org/kb/genes/HGNC:877","pyridoxine-dependent epilepsy caused by ALDH7A1 mutant","MONDO:0020741","https://search.clinicalgenome.org/kb/conditions/MONDO:0020741","N/A","","","","","","","","Has Insufficient Evidence for Actionability Based on Early Rule-out (12/17/2018) | Strong Actionability (05/29/2019)","https://actionability.clinicalgenome.org/ac/Adult/ui/stg2SummaryRpt?doc=AC1002 | https://actionability.clinicalgenome.org/ac/Pediatric/ui/stg2SummaryRpt?doc=AC1002","Adult Actionability Working Group | Pediatric Actionability Working Group"
"ALDOA","HGNC:414","https://search.clinicalgenome.org/kb/genes/HGNC:414","glycogen storage disease due to aldolase A deficiency","MONDO:0012747","https://search.clinicalgenome.org/kb/conditions/MONDO:0012747","N/A","30 - Gene Associated with Autosomal Recessive Phenotype (08/22/2016)","","https://search.clinicalgenome.org/kb/gene-dosage/HGNC:414","Dosage Working Group","","","","","",""
"ALDOB","HGNC:417","https://search.clinicalgenome.org/kb/genes/HGNC:417","hereditary fructose intolerance","MONDO:0009249","https://search.clinicalgenome.org/kb/conditions/MONDO:0009249","Autosomal recessive inheritance","","","","","definitive evidence (09/04/2025)","https://search.clinicalgenome.org/kb/gene-validity/CGGV:assertion_9997dba9-812f-4480-98d8-d0b3a050dbc7-2025-09-04T170000.000Z","Congenital Disorders of Glycosylation","Strong Actionability (04/13/2023) | Limited Actionability (04/13/2023)","https://actionability.clinicalgenome.org/ac/Pediatric/ui/stg2SummaryRpt?doc=AC008 | https://actionability.clinicalgenome.org/ac/Adult/ui/stg2SummaryRpt?doc=AC008","Pediatric Actionability Working Group | Adult Actionability Working Group"
"ALG1","HGNC:18294","https://search.clinicalgenome.org/kb/genes/HGNC:18294","ALG1-congenital disorder of glycosylation","MONDO:0012052","https://search.clinicalgenome.org/kb/conditions/MONDO:0012052","Autosomal recessive inheritance","30 - Gene Associated with Autosomal Recessive Phenotype (08/22/2016)","","https://search.clinicalgenome.org/kb/gene-dosage/HGNC:18294","Dosage Working Group","definitive evidence (08/07/2024)","https://search.clinicalgenome.org/kb/gene-validity/CGGV:assertion_98d42afb-c5ce-4518-83ce-aab777f202e6-2024-08-07T190000.000Z","Intellectual Disability and Autism","","",""
"ALG10","HGNC:23162","https://search.clinicalgenome.org/kb/genes/HGNC:23162","congenital disorder of glycosylation","MONDO:0015286","https://search.clinicalgenome.org/kb/conditions/MONDO:0015286","Autosomal recessive inheritance","","","","","limited evidence (04/03/2025)","https://search.clinicalgenome.org/kb/gene-validity/CGGV:assertion_477a729b-ac93-4873-8c3e-ba95d1080381-2025-04-03T170000.000Z","Congenital Disorders of Glycosylation","","",""
"ALG11","HGNC:32456","https://search.clinicalgenome.org/kb/genes/HGNC:32456","ALG11-congenital disorder of glycosylation","MONDO:0013349","https://search.clinicalgenome.org/kb/conditions/MONDO:0013349","Autosomal recessive inheritance","","","","","moderate evidence (06/21/2023)","https://search.clinicalgenome.org/kb/gene-validity/CGGV:assertion_3a818528-da84-4204-baf0-88bb0ae5696e-2023-06-21T160000.000Z","Congenital Disorders of Glycosylation","","",""
"ALG12","HGNC:19358","https://search.clinicalgenome.org/kb/genes/HGNC:19358","ALG12-congenital disorder of glycosylation","MONDO:0011783","https://search.clinicalgenome.org/kb/conditions/MONDO:0011783","Autosomal recessive inheritance","30 - Gene Associated with Autosomal Recessive Phenotype (08/22/2016)","0 - No Evidence for Triplosensitivity (08/22/2016)","https://search.clinicalgenome.org/kb/gene-dosage/HGNC:19358","Dosage Working Group","definitive evidence (02/15/2023)","https://search.clinicalgenome.org/kb/gene-validity/CGGV:assertion_21631e85-8133-4703-a77c-c046effb6e56-2023-02-15T200000.000Z","Intellectual Disability and Autism","","",""
"ALG13","HGNC:30881","https://search.clinicalgenome.org/kb/genes/HGNC:30881","genetic developmental and epileptic encephalopathy","MONDO:0100062","https://search.clinicalgenome.org/kb/conditions/MONDO:0100062","X-linked inheritance","1 - Little Evidence for Haploinsufficiency (04/23/2025)","0 - No Evidence for Triplosensitivity (04/23/2025)","https://search.clinicalgenome.org/kb/gene-dosage/HGNC:30881","Dosage Working Group","definitive evidence (04/19/2018)","https://search.clinicalgenome.org/kb/gene-validity/CGGV:assertion_f14dd634-ec5c-48cc-a375-e3cfd0c6e832-2018-04-19T160000.000Z","Epilepsy","","",""
"ALG14","HGNC:28287","https://search.clinicalgenome.org/kb/genes/HGNC:28287","congenital disorder of glycosylation","MONDO:0015286","https://search.clinicalgenome.org/kb/conditions/MONDO:0015286","Autosomal recessive inheritance","","","","","limited evidence (02/21/2024)","https://search.clinicalgenome.org/kb/gene-validity/CGGV:assertion_809c40c4-1800-42ef-b56f-95a2c61f44ce-2024-02-21T170000.000Z","Congenital Disorders of Glycosylation","","",""
"ALG2","HGNC:23159","https://search.clinicalgenome.org/kb/genes/HGNC:23159","ALG2-congenital disorder of glycosylation","MONDO:0011933","https://search.clinicalgenome.org/kb/conditions/MONDO:0011933","Autosomal recessive inheritance","30 - Gene Associated with Autosomal Recessive Phenotype (08/22/2016)","","https://search.clinicalgenome.org/kb/gene-dosage/HGNC:23159","Dosage Working Group","strong evidence (11/15/2023)","https://search.clinicalgenome.org/kb/gene-validity/CGGV:assertion_f7cb8bd0-58b2-4644-a041-76f42f564fbc-2023-11-15T170000.000Z","Congenital Disorders of Glycosylation","","",""
"ALG2","HGNC:23159","https://search.clinicalgenome.org/kb/genes/HGNC:23159","congenital myasthenic syndrome 14","MONDO:0014543","https://search.clinicalgenome.org/kb/conditions/MONDO:0014543","N/A","30 - Gene Associated with Autosomal Recessive Phenotype (08/22/2016)","","https://search.clinicalgenome.org/kb/gene-dosage/HGNC:23159","Dosage Working Group","","","","","",""
"ALG3","HGNC:23056","https://search.clinicalgenome.org/kb/genes/HGNC:23056","ALG3-congenital disorder of glycosylation","MONDO:0010998","https://search.clinicalgenome.org/kb/conditions/MONDO:0010998","Autosomal recessive inheritance","","","","","definitive evidence (12/06/2022)","https://search.clinicalgenome.org/kb/gene-validity/CGGV:assertion_1512f6a2-f64c-49d6-ab26-44cdaeef97ee-2022-12-06T070000.000Z","Intellectual Disability and Autism","","",""
"ALG5","HGNC:20266","https://search.clinicalgenome.org/kb/genes/HGNC:20266","autosomal dominant polycystic kidney disease","MONDO:0004691","https://search.clinicalgenome.org/kb/conditions/MONDO:0004691","Autosomal dominant inheritance","","","","","moderate evidence (03/22/2023)","https://search.clinicalgenome.org/kb/gene-validity/CGGV:assertion_1883b1e7-0fb2-4ad5-8ed3-515bf65dc11e-2023-03-22T160000.000Z","Kidney Cystic and Ciliopathy Disorders","","",""
"ALG6","HGNC:23157","https://search.clinicalgenome.org/kb/genes/HGNC:23157","cystic kidney disease","MONDO:0002473","https://search.clinicalgenome.org/kb/conditions/MONDO:0002473","Autosomal dominant inheritance","30 - Gene Associated with Autosomal Recessive Phenotype (08/22/2016)","","https://search.clinicalgenome.org/kb/gene-dosage/HGNC:23157","Dosage Working Group","limited evidence (04/29/2024)","https://search.clinicalgenome.org/kb/gene-validity/CGGV:assertion_b4d62da9-8878-494e-b36b-7025fc31a428-2024-04-29T160000.000Z","Kidney Cystic and Ciliopathy Disorders","","",""
"ALG6","HGNC:23157","https://search.clinicalgenome.org/kb/genes/HGNC:23157","ALG6-congenital disorder of glycosylation 1C","MONDO:0011291","https://search.clinicalgenome.org/kb/conditions/MONDO:0011291","Autosomal recessive inheritance","30 - Gene Associated with Autosomal Recessive Phenotype (08/22/2016)","","https://search.clinicalgenome.org/kb/gene-dosage/HGNC:23157","Dosage Working Group","definitive evidence (11/11/2022)","https://search.clinicalgenome.org/kb/gene-validity/CGGV:assertion_8a243ba1-c323-4fde-a7d2-74892c6ab367-2022-11-11T190000.000Z","Intellectual Disability and Autism","","",""
"ALG8","HGNC:23161","https://search.clinicalgenome.org/kb/genes/HGNC:23161","autosomal dominant polycystic kidney disease","MONDO:0004691","https://search.clinicalgenome.org/kb/conditions/MONDO:0004691","Autosomal dominant inheritance","","","","","definitive evidence (03/10/2025)","https://search.clinicalgenome.org/kb/gene-validity/CGGV:assertion_13259bf6-e954-4159-b247-c9685638e537-2025-03-10T160000.000Z","Kidney Cystic and Ciliopathy Disorders","","",""
"ALG9","HGNC:15672","https://search.clinicalgenome.org/kb/genes/HGNC:15672","ALG9-associated autosomal dominant polycystic kidney disease","MONDO:0700000","https://search.clinicalgenome.org/kb/conditions/MONDO:0700000","Autosomal dominant inheritance","","","","","definitive evidence (09/11/2023)","https://search.clinicalgenome.org/kb/gene-validity/CGGV:assertion_38d817af-0a28-4453-a00f-ffccadbd9936-2023-09-11T160000.000Z","Kidney Cystic and Ciliopathy Disorders","","",""
"ALK","HGNC:427","https://search.clinicalgenome.org/kb/genes/HGNC:427","neuroblastoma, susceptibility to, 3","MONDO:0013083","https://search.clinicalgenome.org/kb/conditions/MONDO:0013083","Autosomal dominant inheritance","0 - No Evidence for Haploinsufficiency (06/23/2025)","0 - No Evidence for Triplosensitivity (06/23/2025)","https://search.clinicalgenome.org/kb/gene-dosage/HGNC:427","Dosage Working Group","definitive evidence (12/30/2022)","https://search.clinicalgenome.org/kb/gene-validity/CGGV:assertion_ba9f692d-9b6d-4d46-8bfa-009ec20ae538-2022-12-30T180000.000Z","Hereditary Cancer","Has Insufficient Evidence for Actionability Based on Early Rule-out (09/19/2022) | Limited Actionability (08/13/2024)","https://actionability.clinicalgenome.org/ac/Adult/ui/stg2SummaryRpt?doc=AC1057 | https://actionability.clinicalgenome.org/ac/Pediatric/ui/stg2SummaryRpt?doc=AC1057","Adult Actionability Working Group | Pediatric Actionability Working Group"
"ALMS1","HGNC:428","https://search.clinicalgenome.org/kb/genes/HGNC:428","Alstrom syndrome","MONDO:0008763","https://search.clinicalgenome.org/kb/conditions/MONDO:0008763","Autosomal recessive inheritance","30 - Gene Associated with Autosomal Recessive Phenotype (08/22/2016)","0 - No Evidence for Triplosensitivity (08/22/2016)","https://search.clinicalgenome.org/kb/gene-dosage/HGNC:428","Dosage Working Group","definitive evidence (02/10/2017)","https://search.clinicalgenome.org/kb/gene-validity/CGGCIEX:assertion_6238","Hearing Loss","","",""
"ALPK3","HGNC:17574","https://search.clinicalgenome.org/kb/genes/HGNC:17574","hypertrophic cardiomyopathy","MONDO:0005045","https://search.clinicalgenome.org/kb/conditions/MONDO:0005045","Autosomal recessive inheritance | Autosomal dominant inheritance","","","","","definitive evidence (02/09/2022) | strong evidence (01/16/2025)","https://search.clinicalgenome.org/kb/gene-validity/CGGV:assertion_6312d79f-df12-4ec6-8ce6-0f38f19e617d-2022-02-09T170000.000Z | https://search.clinicalgenome.org/kb/gene-validity/CGGV:assertion_ace85164-0b70-46a2-ac6b-253088f4514d-2025-01-16T010000.000Z","Hereditary Cardiovascular Disease | Hereditary Cardiovascular Disease","","",""
"ALPL","HGNC:438","https://search.clinicalgenome.org/kb/genes/HGNC:438","ALPL-related autosomal dominant hypophosphatasia","MONDO:0100608","https://search.clinicalgenome.org/kb/conditions/MONDO:0100608","Autosomal dominant inheritance","","","","","definitive evidence (05/19/2021)","https://search.clinicalgenome.org/kb/gene-validity/CGGV:assertion_417cf2e3-52ab-4a2f-baf0-eb1baae622f8-2021-05-19T160000.000Z","Skeletal Disorders","","",""
"ALPL","HGNC:438","https://search.clinicalgenome.org/kb/genes/HGNC:438","ALPL-related autosomal recessive hypophosphatasia","MONDO:0100609","https://search.clinicalgenome.org/kb/conditions/MONDO:0100609","Autosomal recessive inheritance","","","","","definitive evidence (01/19/2021)","https://search.clinicalgenome.org/kb/gene-validity/CGGV:assertion_897ed4ed-89b5-4e4d-8580-db5721ed6696-2021-01-19T050000.000Z","Skeletal Disorders","","",""
"ALPL","HGNC:438","https://search.clinicalgenome.org/kb/genes/HGNC:438","odontohypophosphatasia","MONDO:0016607","https://search.clinicalgenome.org/kb/conditions/MONDO:0016607","N/A","","","","","","","","Moderate Actionability (01/09/2025) | Moderate Actionability (01/09/2025)","https://actionability.clinicalgenome.org/ac/Pediatric/ui/stg2SummaryRpt?doc=AC004 | https://actionability.clinicalgenome.org/ac/Adult/ui/stg2SummaryRpt?doc=AC004","Pediatric Actionability Working Group | Adult Actionability Working Group"
"ALPL","HGNC:438","https://search.clinicalgenome.org/kb/genes/HGNC:438","hypophosphatasia","MONDO:0018570","https://search.clinicalgenome.org/kb/conditions/MONDO:0018570","N/A","","","","","","","","Moderate Actionability (01/09/2025) | Moderate Actionability (01/09/2025)","https://actionability.clinicalgenome.org/ac/Pediatric/ui/stg2SummaryRpt?doc=AC004 | https://actionability.clinicalgenome.org/ac/Adult/ui/stg2SummaryRpt?doc=AC004","Pediatric Actionability Working Group | Adult Actionability Working Group"
"ALPL","HGNC:438","https://search.clinicalgenome.org/kb/genes/HGNC:438","moderate hypophosphatasia","MONDO:0600010","https://search.clinicalgenome.org/kb/conditions/MONDO:0600010","N/A","","","","","","","","Moderate Actionability (01/09/2025) | Moderate Actionability (01/09/2025)","https://actionability.clinicalgenome.org/ac/Pediatric/ui/stg2SummaryRpt?doc=AC004 | https://actionability.clinicalgenome.org/ac/Adult/ui/stg2SummaryRpt?doc=AC004","Pediatric Actionability Working Group | Adult Actionability Working Group"
"ALPL","HGNC:438","https://search.clinicalgenome.org/kb/genes/HGNC:438","severe hypophosphatasia","MONDO:0600009","https://search.clinicalgenome.org/kb/conditions/MONDO:0600009","N/A","","","","","","","","Moderate Actionability (01/09/2025) | Moderate Actionability (01/09/2025)","https://actionability.clinicalgenome.org/ac/Pediatric/ui/stg2SummaryRpt?doc=AC004 | https://actionability.clinicalgenome.org/ac/Adult/ui/stg2SummaryRpt?doc=AC004","Pediatric Actionability Working Group | Adult Actionability Working Group"
"ALPL","HGNC:438","https://search.clinicalgenome.org/kb/genes/HGNC:438","mild hypophosphatasia","MONDO:0600011","https://search.clinicalgenome.org/kb/conditions/MONDO:0600011","N/A","","","","","","","","Moderate Actionability (01/09/2025) | Moderate Actionability (01/09/2025)","https://actionability.clinicalgenome.org/ac/Pediatric/ui/stg2SummaryRpt?doc=AC004 | https://actionability.clinicalgenome.org/ac/Adult/ui/stg2SummaryRpt?doc=AC004","Pediatric Actionability Working Group | Adult Actionability Working Group"
"ALPL","HGNC:438","https://search.clinicalgenome.org/kb/genes/HGNC:438","perinatal lethal hypophosphatasia","MONDO:0016605","https://search.clinicalgenome.org/kb/conditions/MONDO:0016605","N/A","","","","","","","","Moderate Actionability (01/09/2025) | Moderate Actionability (01/09/2025)","https://actionability.clinicalgenome.org/ac/Pediatric/ui/stg2SummaryRpt?doc=AC004 | https://actionability.clinicalgenome.org/ac/Adult/ui/stg2SummaryRpt?doc=AC004","Pediatric Actionability Working Group | Adult Actionability Working Group"
"ALS2","HGNC:443","https://search.clinicalgenome.org/kb/genes/HGNC:443","ALS2-related motor neuron disease","MONDO:0100227","https://search.clinicalgenome.org/kb/conditions/MONDO:0100227","Autosomal recessive inheritance","30 - Gene Associated with Autosomal Recessive Phenotype (08/22/2016)","0 - No Evidence for Triplosensitivity (08/22/2016)","https://search.clinicalgenome.org/kb/gene-dosage/HGNC:443","Dosage Working Group","definitive evidence (02/14/2023)","https://search.clinicalgenome.org/kb/gene-validity/CGGV:assertion_b31dd10c-0b38-4edf-8e23-fb2652c6e939-2023-02-14T170000.000Z","Amyotrophic Lateral Sclerosis Spectrum Disorders","","",""
"ALS2","HGNC:443","https://search.clinicalgenome.org/kb/genes/HGNC:443","Alstrom syndrome","MONDO:0008763","https://search.clinicalgenome.org/kb/conditions/MONDO:0008763","N/A","30 - Gene Associated with Autosomal Recessive Phenotype (08/22/2016)","0 - No Evidence for Triplosensitivity (08/22/2016)","https://search.clinicalgenome.org/kb/gene-dosage/HGNC:443","Dosage Working Group","","","","","",""
"ALX1","HGNC:1494","https://search.clinicalgenome.org/kb/genes/HGNC:1494","frontonasal dysplasia - severe microphthalmia - severe facial clefting syndrome","MONDO:0013271","https://search.clinicalgenome.org/kb/conditions/MONDO:0013271","Autosomal recessive inheritance","","","","","definitive evidence (10/13/2022)","https://search.clinicalgenome.org/kb/gene-validity/CGGV:assertion_ade0e1d8-3f68-4276-bc1d-173ca2d4936f-2022-10-13T160000.000Z","Craniofacial Malformations","","",""
"ALX3","HGNC:449","https://search.clinicalgenome.org/kb/genes/HGNC:449","frontorhiny","MONDO:0007636","https://search.clinicalgenome.org/kb/conditions/MONDO:0007636","Autosomal recessive inheritance","","","","","definitive evidence (10/13/2022)","https://search.clinicalgenome.org/kb/gene-validity/CGGV:assertion_1b460912-d5fd-4b7b-99da-ccd477fd8139-2022-10-13T160000.000Z","Craniofacial Malformations","","",""
"ALX4","HGNC:450","https://search.clinicalgenome.org/kb/genes/HGNC:450","parietal foramina 2","MONDO:0012309","https://search.clinicalgenome.org/kb/conditions/MONDO:0012309","N/A","3 - Sufficient Evidence for Haploinsufficiency (07/22/2020)","0 - No Evidence for Triplosensitivity (07/22/2020)","https://search.clinicalgenome.org/kb/gene-dosage/HGNC:450","Dosage Working Group","","","","","",""
"AMACR","HGNC:451","https://search.clinicalgenome.org/kb/genes/HGNC:451","alpha-methylacyl-CoA racemase deficiency","MONDO:0013681","https://search.clinicalgenome.org/kb/conditions/MONDO:0013681","Autosomal recessive inheritance","","","","","moderate evidence (03/31/2022)","https://search.clinicalgenome.org/kb/gene-validity/CGGV:assertion_3fb8a3ea-cf06-4788-841f-e787f3780a49-2022-03-31T040000.000Z","Peroxisomal Disorders","","",""
"AMER1","HGNC:26837","https://search.clinicalgenome.org/kb/genes/HGNC:26837","osteopathia striata with cranial sclerosis","MONDO:0010310","https://search.clinicalgenome.org/kb/conditions/MONDO:0010310","X-linked inheritance","","","","","definitive evidence (02/16/2024)","https://search.clinicalgenome.org/kb/gene-validity/CGGV:assertion_a0c6c307-2d6c-4893-8f52-5fc6a2e2d440-2024-02-16T170000.000Z","Prenatal","","",""
"AMH","HGNC:464","https://search.clinicalgenome.org/kb/genes/HGNC:464","persistent Mullerian duct syndrome","MONDO:0009857","https://search.clinicalgenome.org/kb/conditions/MONDO:0009857","N/A","30 - Gene Associated with Autosomal Recessive Phenotype (08/22/2016)","","https://search.clinicalgenome.org/kb/gene-dosage/HGNC:464","Dosage Working Group","","","","","",""
"AMN","HGNC:14604","https://search.clinicalgenome.org/kb/genes/HGNC:14604","Imerslund-Grasbeck syndrome type 1","MONDO:0100156","https://search.clinicalgenome.org/kb/conditions/MONDO:0100156","N/A","30 - Gene Associated with Autosomal Recessive Phenotype (08/22/2016)","0 - No Evidence for Triplosensitivity (08/22/2016)","https://search.clinicalgenome.org/kb/gene-dosage/HGNC:14604","Dosage Working Group","","","","","",""
"AMT","HGNC:473","https://search.clinicalgenome.org/kb/genes/HGNC:473","glycine encephalopathy","MONDO:0011612","https://search.clinicalgenome.org/kb/conditions/MONDO:0011612","Autosomal recessive inheritance","","","","","definitive evidence (05/24/2019)","https://search.clinicalgenome.org/kb/gene-validity/CGGV:assertion_a85e1b07-b975-4c92-b592-7b3e8d35805a-2019-05-24T160000.000Z","Aminoacidopathy","Limited Actionability (11/18/2024)","https://actionability.clinicalgenome.org/ac/Pediatric/ui/stg2SummaryRpt?doc=AC1029","Pediatric Actionability Working Group"
"ANAPC1","HGNC:19988","https://search.clinicalgenome.org/kb/genes/HGNC:19988","Rothmund-Thomson syndrome type 1","MONDO:0016368","https://search.clinicalgenome.org/kb/conditions/MONDO:0016368","Autosomal recessive inheritance","","","","","moderate evidence (09/20/2024)","https://search.clinicalgenome.org/kb/gene-validity/CGGV:assertion_a9160a17-6833-4930-a99f-0804a1207e49-2024-09-20T160000.000Z","Syndromic Disorders","","",""
"ANG","HGNC:483","https://search.clinicalgenome.org/kb/genes/HGNC:483","amyotrophic lateral sclerosis type 9","MONDO:0012753","https://search.clinicalgenome.org/kb/conditions/MONDO:0012753","Autosomal dominant inheritance","","","","","limited evidence (02/08/2022)","https://search.clinicalgenome.org/kb/gene-validity/CGGV:assertion_4ee17299-56dd-40a7-8cec-9a316f3e46f2-2022-02-08T000000.000Z","Amyotrophic Lateral Sclerosis Spectrum Disorders","","",""
"ANGPT1","HGNC:484","https://search.clinicalgenome.org/kb/genes/HGNC:484","primary congenital glaucoma","MONDO:0000365","https://search.clinicalgenome.org/kb/conditions/MONDO:0000365","Autosomal dominant inheritance","","","","","limited evidence (02/15/2024)","https://search.clinicalgenome.org/kb/gene-validity/CGGV:assertion_62aef3ff-a230-4b1e-88d8-8097c9975031-2024-02-15T200000.000Z","Glaucoma and Neuro-Ophthalmology","","",""
"ANGPTL3","HGNC:491","https://search.clinicalgenome.org/kb/genes/HGNC:491","familial hypobetalipoproteinemia 2","MONDO:0011505","https://search.clinicalgenome.org/kb/conditions/MONDO:0011505","Autosomal recessive inheritance","30 - Gene Associated with Autosomal Recessive Phenotype (08/22/2016)","","https://search.clinicalgenome.org/kb/gene-dosage/HGNC:491","Dosage Working Group","definitive evidence (09/22/2022)","https://search.clinicalgenome.org/kb/gene-validity/CGGV:assertion_df7eb35c-09a3-4df2-bf05-22aee7de3855-2022-09-22T160000.000Z","General Gene Curation","","",""
"ANK1","HGNC:492","https://search.clinicalgenome.org/kb/genes/HGNC:492","hereditary spherocytosis","MONDO:0019350","https://search.clinicalgenome.org/kb/conditions/MONDO:0019350","Autosomal dominant inheritance | Autosomal recessive inheritance","","","","","definitive evidence (03/24/2021) | limited evidence (06/23/2021)","https://search.clinicalgenome.org/kb/gene-validity/CGGV:assertion_82460b48-c4a5-4496-92ce-6fbad632d6d7-2021-03-24T160000.000Z | https://search.clinicalgenome.org/kb/gene-validity/CGGV:assertion_55457b0b-370e-466d-b2da-1cb8d67aecc8-2021-06-23T160000.000Z","General Gene Curation | General Gene Curation","","",""
"ANK2","HGNC:493","https://search.clinicalgenome.org/kb/genes/HGNC:493","complex neurodevelopmental disorder","MONDO:0100038","https://search.clinicalgenome.org/kb/conditions/MONDO:0100038","Autosomal dominant inheritance","3 - Sufficient Evidence for Haploinsufficiency (01/14/2025)","0 - No Evidence for Triplosensitivity (01/14/2025)","https://search.clinicalgenome.org/kb/gene-dosage/HGNC:493","Dosage Working Group","definitive evidence (10/21/2020)","https://search.clinicalgenome.org/kb/gene-validity/CGGV:assertion_097e646b-467f-4c08-95d6-958ed324562b-2020-10-21T100000.000Z","Intellectual Disability and Autism","","",""
"ANK2","HGNC:493","https://search.clinicalgenome.org/kb/genes/HGNC:493","long QT syndrome","MONDO:0002442","https://search.clinicalgenome.org/kb/conditions/MONDO:0002442","Autosomal dominant inheritance","3 - Sufficient Evidence for Haploinsufficiency (01/14/2025)","0 - No Evidence for Triplosensitivity (01/14/2025)","https://search.clinicalgenome.org/kb/gene-dosage/HGNC:493","Dosage Working Group","disputing (12/15/2020)","https://search.clinicalgenome.org/kb/gene-validity/CGGV:assertion_dd577817-d668-413c-95f9-d3e08a8cf5d3-2020-12-15T002719.834Z","Long QT Syndrome","","",""
"ANK2","HGNC:493","https://search.clinicalgenome.org/kb/genes/HGNC:493","catecholaminergic polymorphic ventricular tachycardia","MONDO:0017990","https://search.clinicalgenome.org/kb/conditions/MONDO:0017990","Autosomal dominant inheritance","3 - Sufficient Evidence for Haploinsufficiency (01/14/2025)","0 - No Evidence for Triplosensitivity (01/14/2025)","https://search.clinicalgenome.org/kb/gene-dosage/HGNC:493","Dosage Working Group","disputing (01/20/2021)","https://search.clinicalgenome.org/kb/gene-validity/CGGV:assertion_c7e5e43e-1596-4c15-bf14-e9388b204e88-2021-01-20T170000.000Z","Catecholaminergic Polymorphic Ventricular Tachycardia","","",""
"ANK2","HGNC:493","https://search.clinicalgenome.org/kb/genes/HGNC:493","Brugada syndrome","MONDO:0015263","https://search.clinicalgenome.org/kb/conditions/MONDO:0015263","Autosomal dominant inheritance","3 - Sufficient Evidence for Haploinsufficiency (01/14/2025)","0 - No Evidence for Triplosensitivity (01/14/2025)","https://search.clinicalgenome.org/kb/gene-dosage/HGNC:493","Dosage Working Group","disputing (11/21/2017)","https://search.clinicalgenome.org/kb/gene-validity/CGGCIEX:assertion_10145","Brugada Syndrome","","",""
"ANK3","HGNC:494","https://search.clinicalgenome.org/kb/genes/HGNC:494","intellectual disability","MONDO:0001071","https://search.clinicalgenome.org/kb/conditions/MONDO:0001071","Autosomal recessive inheritance","","","","","moderate evidence (10/02/2024)","https://search.clinicalgenome.org/kb/gene-validity/CGGV:assertion_668a89e3-477d-434c-8ab4-0bc9ec3504de-2024-10-02T100000.000Z","Intellectual Disability and Autism","","",""
"ANKRD1","HGNC:15819","https://search.clinicalgenome.org/kb/genes/HGNC:15819","hypertrophic cardiomyopathy","MONDO:0005045","https://search.clinicalgenome.org/kb/conditions/MONDO:0005045","Autosomal dominant inheritance","","","","","disputing (02/08/2023)","https://search.clinicalgenome.org/kb/gene-validity/CGGV:assertion_8f241e6c-2fc8-4f23-b976-3b79d90fad3e-2023-02-08T170000.000Z","Hereditary Cardiovascular Disease","","",""
"ANKRD1","HGNC:15819","https://search.clinicalgenome.org/kb/genes/HGNC:15819","dilated cardiomyopathy","MONDO:0005021","https://search.clinicalgenome.org/kb/conditions/MONDO:0005021","Autosomal dominant inheritance","","","","","limited evidence (02/07/2025)","https://search.clinicalgenome.org/kb/gene-validity/CGGV:assertion_3dcc6918-d7e7-4385-b343-bc8b8678b3a4-2025-02-07T170000.000Z","Dilated Cardiomyopathy","","",""
"ANKRD1","HGNC:15819","https://search.clinicalgenome.org/kb/genes/HGNC:15819","congenital heart disease","MONDO:0005453","https://search.clinicalgenome.org/kb/conditions/MONDO:0005453","Autosomal dominant inheritance","","","","","limited evidence (08/12/2024)","https://search.clinicalgenome.org/kb/gene-validity/CGGV:assertion_fcf5126d-f39b-45e6-82c6-6f92c1d2435d-2024-08-12T160000.000Z","Congenital Heart Disease","","",""
"ANKRD11","HGNC:21316","https://search.clinicalgenome.org/kb/genes/HGNC:21316","KBG syndrome","MONDO:0007846","https://search.clinicalgenome.org/kb/conditions/MONDO:0007846","Autosomal dominant inheritance","3 - Sufficient Evidence for Haploinsufficiency (06/14/2022)","0 - No Evidence for Triplosensitivity (06/14/2022)","https://search.clinicalgenome.org/kb/gene-dosage/HGNC:21316","Dosage Working Group","definitive evidence (11/26/2019)","https://search.clinicalgenome.org/kb/gene-validity/CGGV:assertion_cf3e887e-8da4-45ea-bec8-9565f8246bc9-2019-11-26T170000.000Z","Intellectual Disability and Autism","","",""
"ANKRD17","HGNC:23575","https://search.clinicalgenome.org/kb/genes/HGNC:23575","syndromic complex neurodevelopmental disorder","MONDO:0800439","https://search.clinicalgenome.org/kb/conditions/MONDO:0800439","Autosomal dominant inheritance","3 - Sufficient Evidence for Haploinsufficiency (04/11/2023)","0 - No Evidence for Triplosensitivity (04/11/2023)","https://search.clinicalgenome.org/kb/gene-dosage/HGNC:23575","Dosage Working Group","definitive evidence (12/12/2024)","https://search.clinicalgenome.org/kb/gene-validity/CGGV:assertion_48a9765c-f7ae-46f4-aa6f-7fa95f81404f-2024-12-12T170000.000Z","Intellectual Disability and Autism","","",""
"ANKRD17","HGNC:23575","https://search.clinicalgenome.org/kb/genes/HGNC:23575","syndromic intellectual disability","MONDO:0000508","https://search.clinicalgenome.org/kb/conditions/MONDO:0000508","N/A","3 - Sufficient Evidence for Haploinsufficiency (04/11/2023)","0 - No Evidence for Triplosensitivity (04/11/2023)","https://search.clinicalgenome.org/kb/gene-dosage/HGNC:23575","Dosage Working Group","","","","","",""
"ANKRD26","HGNC:29186","https://search.clinicalgenome.org/kb/genes/HGNC:29186","thrombocytopenia 2","MONDO:0008555","https://search.clinicalgenome.org/kb/conditions/MONDO:0008555","Autosomal dominant inheritance","0 - No Evidence for Haploinsufficiency (10/10/2023)","0 - No Evidence for Triplosensitivity (10/10/2023)","https://search.clinicalgenome.org/kb/gene-dosage/HGNC:29186","Dosage Working Group","definitive evidence (09/25/2019)","https://search.clinicalgenome.org/kb/gene-validity/CGGV:assertion_e86bee2b-8353-48c2-8ea3-a6b2b26cdb2f-2019-09-25T160000.000Z","Hemostasis Thrombosis","","",""
"ANKS6","HGNC:26724","https://search.clinicalgenome.org/kb/genes/HGNC:26724","nephronophthisis 16","MONDO:0014158","https://search.clinicalgenome.org/kb/conditions/MONDO:0014158","Autosomal recessive inheritance","30 - Gene Associated with Autosomal Recessive Phenotype (08/22/2016)","","https://search.clinicalgenome.org/kb/gene-dosage/HGNC:26724","Dosage Working Group","definitive evidence (08/25/2021)","https://search.clinicalgenome.org/kb/gene-validity/CGGV:assertion_62df8a40-0b65-46a4-89c8-51f26424c523-2021-08-25T160000.000Z","Kidney Cystic and Ciliopathy Disorders","","",""
"ANKZF1","HGNC:25527","https://search.clinicalgenome.org/kb/genes/HGNC:25527","inflammatory bowel disease","MONDO:0005265","https://search.clinicalgenome.org/kb/conditions/MONDO:0005265","Mode of inheritance","","","","","no known disease relationship (04/15/2025)","https://search.clinicalgenome.org/kb/gene-validity/CGGV:assertion_c576dc9d-3feb-4707-9fe4-b58622f4495d-2025-04-15T160000.000Z","Primary Immune Regulatory Disorders","","",""
"ANO10","HGNC:25519","https://search.clinicalgenome.org/kb/genes/HGNC:25519","autosomal recessive spinocerebellar ataxia 10","MONDO:0013392","https://search.clinicalgenome.org/kb/conditions/MONDO:0013392","Autosomal recessive inheritance","","","","","definitive evidence (12/11/2024)","https://search.clinicalgenome.org/kb/gene-validity/CGGV:assertion_5ae3de38-041c-4440-8302-7a33de494755-2024-12-11T170000.000Z","Cerebellar Ataxia","","",""
"ANO5","HGNC:27337","https://search.clinicalgenome.org/kb/genes/HGNC:27337","autosomal recessive limb-girdle muscular dystrophy","MONDO:0015152","https://search.clinicalgenome.org/kb/conditions/MONDO:0015152","Autosomal recessive inheritance","","","","","definitive evidence (11/14/2024)","https://search.clinicalgenome.org/kb/gene-validity/CGGV:assertion_cecfa828-c192-44ae-9f3f-9dd5a99a5e5a-2024-11-14T170000.000Z","Muscular Dystrophies and Myopathies","","",""
"ANO5","HGNC:27337","https://search.clinicalgenome.org/kb/genes/HGNC:27337","gnathodiaphyseal dysplasia","MONDO:0008151","https://search.clinicalgenome.org/kb/conditions/MONDO:0008151","Autosomal dominant inheritance","","","","","definitive evidence (02/03/2025)","https://search.clinicalgenome.org/kb/gene-validity/CGGV:assertion_ef25799d-71a4-414c-8826-6d90c5b24d4b-2025-02-03T170000.000Z","Skeletal Disorders","","",""
"ANO6","HGNC:25240","https://search.clinicalgenome.org/kb/genes/HGNC:25240","Scott syndrome","MONDO:0009885","https://search.clinicalgenome.org/kb/conditions/MONDO:0009885","Autosomal recessive inheritance","","","","","moderate evidence (06/04/2025)","https://search.clinicalgenome.org/kb/gene-validity/CGGV:assertion_c2d3c125-1938-4295-82bb-b2851a3b2c8d-2025-06-04T160000.000Z","Hemostasis Thrombosis","","",""
"ANOS1","HGNC:6211","https://search.clinicalgenome.org/kb/genes/HGNC:6211","hypogonadotropic hypogonadism 1 with or without anosmia","MONDO:0010635","https://search.clinicalgenome.org/kb/conditions/MONDO:0010635","X-linked inheritance","3 - Sufficient Evidence for Haploinsufficiency (05/26/2021)","0 - No Evidence for Triplosensitivity (05/26/2021)","https://search.clinicalgenome.org/kb/gene-dosage/HGNC:6211","Dosage Working Group","definitive evidence (05/17/2022)","https://search.clinicalgenome.org/kb/gene-validity/CGGV:assertion_2b7650b6-f2b6-4ac3-a967-3e631c98d7b1-2022-05-17T223152.758Z","Syndromic Disorders","","",""
"ANTXR2","HGNC:21732","https://search.clinicalgenome.org/kb/genes/HGNC:21732","hyaline fibromatosis syndrome","MONDO:0009229","https://search.clinicalgenome.org/kb/conditions/MONDO:0009229","Autosomal recessive inheritance","30 - Gene Associated with Autosomal Recessive Phenotype (08/22/2016)","0 - No Evidence for Triplosensitivity (08/22/2016)","https://search.clinicalgenome.org/kb/gene-dosage/HGNC:21732","Dosage Working Group","definitive evidence (11/22/2022)","https://search.clinicalgenome.org/kb/gene-validity/CGGV:assertion_0368b332-6765-451e-867b-71dd93e05ae4-2022-11-22T170000.000Z","Syndromic Disorders","","",""
"ANXA11","HGNC:535","https://search.clinicalgenome.org/kb/genes/HGNC:535","amyotrophic lateral sclerosis type 23","MONDO:0027694","https://search.clinicalgenome.org/kb/conditions/MONDO:0027694","Autosomal dominant inheritance","","","","","definitive evidence (11/12/2021)","https://search.clinicalgenome.org/kb/gene-validity/CGGV:assertion_4dca2f56-87c6-4ac7-97bf-0889883b8e63-2021-11-12T215939.032Z","Amyotrophic Lateral Sclerosis Spectrum Disorders","","",""
"AP1B1","HGNC:554","https://search.clinicalgenome.org/kb/genes/HGNC:554","ichthyosiform erythroderma, corneal involvement, and hearing loss","MONDO:0009440","https://search.clinicalgenome.org/kb/conditions/MONDO:0009440","Autosomal recessive inheritance","","","","","definitive evidence (08/29/2024)","https://search.clinicalgenome.org/kb/gene-validity/CGGV:assertion_670db330-6dc2-44b1-9e65-c7758b1aecb2-2024-08-29T160000.000Z","General Inborn Errors of Metabolism","","",""
"AP1G1","HGNC:555","https://search.clinicalgenome.org/kb/genes/HGNC:555","complex neurodevelopmental disorder","MONDO:0100038","https://search.clinicalgenome.org/kb/conditions/MONDO:0100038","Autosomal recessive inheritance | Autosomal dominant inheritance","","","","","limited evidence (11/02/2022) | strong evidence (11/02/2022)","https://search.clinicalgenome.org/kb/gene-validity/CGGV:assertion_d636cccc-aa9c-4927-ae40-538bf34d0620-2022-11-02T190000.000Z | https://search.clinicalgenome.org/kb/gene-validity/CGGV:assertion_b3519527-9a80-4f0e-9ea6-c4244eb2ee33-2022-11-02T190000.000Z","Intellectual Disability and Autism | Intellectual Disability and Autism","","",""
"AP1S1","HGNC:559","https://search.clinicalgenome.org/kb/genes/HGNC:559","MEDNIK syndrome","MONDO:0012251","https://search.clinicalgenome.org/kb/conditions/MONDO:0012251","Autosomal recessive inheritance","","","","","definitive evidence (06/10/2022)","https://search.clinicalgenome.org/kb/gene-validity/CGGV:assertion_b9559de4-1945-47fa-bea5-336d376eec0e-2022-06-10T160000.000Z","General Inborn Errors of Metabolism","","",""
"AP1S2","HGNC:560","https://search.clinicalgenome.org/kb/genes/HGNC:560","X-linked syndromic intellectual disability","MONDO:0020119","https://search.clinicalgenome.org/kb/conditions/MONDO:0020119","X-linked inheritance","3 - Sufficient Evidence for Haploinsufficiency (04/28/2021)","0 - No Evidence for Triplosensitivity (04/28/2021)","https://search.clinicalgenome.org/kb/gene-dosage/HGNC:560","Dosage Working Group","definitive evidence (10/20/2017)","https://search.clinicalgenome.org/kb/gene-validity/CGGV:assertion_9caaaacd-e262-421c-826b-8433848721ff-2017-10-20T160000.000Z","Intellectual Disability and Autism","","",""
"AP1S2","HGNC:560","https://search.clinicalgenome.org/kb/genes/HGNC:560","syndromic X-linked intellectual disability 5","MONDO:0010574","https://search.clinicalgenome.org/kb/conditions/MONDO:0010574","N/A","3 - Sufficient Evidence for Haploinsufficiency (04/28/2021)","0 - No Evidence for Triplosensitivity (04/28/2021)","https://search.clinicalgenome.org/kb/gene-dosage/HGNC:560","Dosage Working Group","","","","","",""
"AP2M1","HGNC:564","https://search.clinicalgenome.org/kb/genes/HGNC:564","complex neurodevelopmental disorder","MONDO:0100038","https://search.clinicalgenome.org/kb/conditions/MONDO:0100038","Autosomal dominant inheritance","","","","","definitive evidence (10/01/2024)","https://search.clinicalgenome.org/kb/gene-validity/CGGV:assertion_800ffff6-7cf0-4131-aa96-e3bb4f0bde76-2024-10-01T170000.000Z","Epilepsy","","",""
"AP3B1","HGNC:566","https://search.clinicalgenome.org/kb/genes/HGNC:566","Hermansky-Pudlak syndrome 2","MONDO:0011997","https://search.clinicalgenome.org/kb/conditions/MONDO:0011997","Autosomal recessive inheritance","","","","","definitive evidence (02/26/2020)","https://search.clinicalgenome.org/kb/gene-validity/CGGV:assertion_00ce813c-9493-48f9-9351-b70defb71d75-2020-02-26T170000.000Z","Hemostasis Thrombosis","","",""
"AP3D1","HGNC:568","https://search.clinicalgenome.org/kb/genes/HGNC:568","Hermansky-Pudlak syndrome 10","MONDO:0014885","https://search.clinicalgenome.org/kb/conditions/MONDO:0014885","Autosomal recessive inheritance","","","","","moderate evidence (06/07/2023)","https://search.clinicalgenome.org/kb/gene-validity/CGGV:assertion_3ec9ffa2-efda-446d-a848-e6d4d5b92fb6-2023-06-07T160000.000Z","Hemostasis Thrombosis","","",""
"AP4B1","HGNC:572","https://search.clinicalgenome.org/kb/genes/HGNC:572","AP-4 deficiency syndrome","MONDO:0100176","https://search.clinicalgenome.org/kb/conditions/MONDO:0100176","Autosomal recessive inheritance","30 - Gene Associated with Autosomal Recessive Phenotype (08/22/2016)","0 - No Evidence for Triplosensitivity (08/22/2016)","https://search.clinicalgenome.org/kb/gene-dosage/HGNC:572","Dosage Working Group","definitive evidence (07/26/2021)","https://search.clinicalgenome.org/kb/gene-validity/CGGV:assertion_4436344a-e0da-4c42-b06a-cdf8a2581ce5-2021-07-26T160000.000Z","Intellectual Disability and Autism","","",""
"AP4B1","HGNC:572","https://search.clinicalgenome.org/kb/genes/HGNC:572","hereditary spastic paraplegia 47","MONDO:0013551","https://search.clinicalgenome.org/kb/conditions/MONDO:0013551","N/A","30 - Gene Associated with Autosomal Recessive Phenotype (08/22/2016)","0 - No Evidence for Triplosensitivity (08/22/2016)","https://search.clinicalgenome.org/kb/gene-dosage/HGNC:572","Dosage Working Group","","","","","",""
"AP4E1","HGNC:573","https://search.clinicalgenome.org/kb/genes/HGNC:573","AP-4 deficiency syndrome","MONDO:0100176","https://search.clinicalgenome.org/kb/conditions/MONDO:0100176","Autosomal recessive inheritance","","","","","definitive evidence (12/16/2020)","https://search.clinicalgenome.org/kb/gene-validity/CGGV:assertion_be93d2e7-f302-41a7-9675-032510e46ad2-2020-12-16T170000.000Z","Intellectual Disability and Autism","","",""
"AP4M1","HGNC:574","https://search.clinicalgenome.org/kb/genes/HGNC:574","AP-4 deficiency syndrome","MONDO:0100176","https://search.clinicalgenome.org/kb/conditions/MONDO:0100176","Autosomal recessive inheritance","","","","","definitive evidence (04/06/2021)","https://search.clinicalgenome.org/kb/gene-validity/CGGV:assertion_f49be3e4-4e1f-478b-b4e0-f41623e5b548-2021-04-07T160000.000Z","Intellectual Disability and Autism","","",""
"AP4S1","HGNC:575","https://search.clinicalgenome.org/kb/genes/HGNC:575","AP-4 deficiency syndrome","MONDO:0100176","https://search.clinicalgenome.org/kb/conditions/MONDO:0100176","Autosomal recessive inheritance","30 - Gene Associated with Autosomal Recessive Phenotype (08/22/2016)","0 - No Evidence for Triplosensitivity (08/22/2016)","https://search.clinicalgenome.org/kb/gene-dosage/HGNC:575","Dosage Working Group","definitive evidence (04/25/2023)","https://search.clinicalgenome.org/kb/gene-validity/CGGV:assertion_652e2cbe-22aa-4cd4-ba41-5bacca69af13-2023-04-25T160000.000Z","Intellectual Disability and Autism","","",""
"AP4S1","HGNC:575","https://search.clinicalgenome.org/kb/genes/HGNC:575","hereditary spastic paraplegia 52","MONDO:0013552","https://search.clinicalgenome.org/kb/conditions/MONDO:0013552","N/A","30 - Gene Associated with Autosomal Recessive Phenotype (08/22/2016)","0 - No Evidence for Triplosensitivity (08/22/2016)","https://search.clinicalgenome.org/kb/gene-dosage/HGNC:575","Dosage Working Group","","","","","",""
"AP5Z1","HGNC:22197","https://search.clinicalgenome.org/kb/genes/HGNC:22197","hereditary spastic paraplegia","MONDO:0019064","https://search.clinicalgenome.org/kb/conditions/MONDO:0019064","Autosomal recessive inheritance","","","","","definitive evidence (09/19/2022)","https://search.clinicalgenome.org/kb/gene-validity/CGGV:assertion_020a234e-180c-4d9f-8f04-bd79eac6046e-2022-09-19T160000.000Z","Cerebral Palsy","","",""
"APC","HGNC:583","https://search.clinicalgenome.org/kb/genes/HGNC:583","classic or attenuated familial adenomatous polyposis","MONDO:0021057","https://search.clinicalgenome.org/kb/conditions/MONDO:0021057","Autosomal dominant inheritance","3 - Sufficient Evidence for Haploinsufficiency (07/19/2021)","0 - No Evidence for Triplosensitivity (07/19/2021)","https://search.clinicalgenome.org/kb/gene-dosage/HGNC:583","Dosage Working Group","definitive evidence (06/20/2022)","https://search.clinicalgenome.org/kb/gene-validity/CGGV:assertion_cdf062b6-6abf-49f6-a2dc-43b0e535f1b6-2022-06-20T170000.000Z","Hereditary Cancer","Definitive Actionability (10/01/2019) | Strong Actionability (10/01/2019)","https://actionability.clinicalgenome.org/ac/Pediatric/ui/stg2SummaryRpt?doc=AC048 | https://actionability.clinicalgenome.org/ac/Adult/ui/stg2SummaryRpt?doc=AC048","Pediatric Actionability Working Group | Adult Actionability Working Group"
"APC","HGNC:583","https://search.clinicalgenome.org/kb/genes/HGNC:583","gastric adenocarcinoma and proximal polyposis of the stomach","MONDO:0017790","https://search.clinicalgenome.org/kb/conditions/MONDO:0017790","Autosomal dominant inheritance","3 - Sufficient Evidence for Haploinsufficiency (07/19/2021)","0 - No Evidence for Triplosensitivity (07/19/2021)","https://search.clinicalgenome.org/kb/gene-dosage/HGNC:583","Dosage Working Group","definitive evidence (06/20/2022)","https://search.clinicalgenome.org/kb/gene-validity/CGGV:assertion_22036d0d-71a8-4824-894b-0de40c412e15-2022-06-20T170000.000Z","Hereditary Cancer","","",""
"APC","HGNC:583","https://search.clinicalgenome.org/kb/genes/HGNC:583","attenuated familial adenomatous polyposis","MONDO:0016362","https://search.clinicalgenome.org/kb/conditions/MONDO:0016362","N/A","3 - Sufficient Evidence for Haploinsufficiency (07/19/2021)","0 - No Evidence for Triplosensitivity (07/19/2021)","https://search.clinicalgenome.org/kb/gene-dosage/HGNC:583","Dosage Working Group","","","","Definitive Actionability (10/01/2019) | Strong Actionability (10/01/2019)","https://actionability.clinicalgenome.org/ac/Pediatric/ui/stg2SummaryRpt?doc=AC048 | https://actionability.clinicalgenome.org/ac/Adult/ui/stg2SummaryRpt?doc=AC048","Pediatric Actionability Working Group | Adult Actionability Working Group"
"APC","HGNC:583","https://search.clinicalgenome.org/kb/genes/HGNC:583","APC-related attenuated familial adenomatous polyposis","MONDO:0016613","https://search.clinicalgenome.org/kb/conditions/MONDO:0016613","N/A","3 - Sufficient Evidence for Haploinsufficiency (07/19/2021)","0 - No Evidence for Triplosensitivity (07/19/2021)","https://search.clinicalgenome.org/kb/gene-dosage/HGNC:583","Dosage Working Group","","","","Definitive Actionability (10/01/2019) | Strong Actionability (10/01/2019)","https://actionability.clinicalgenome.org/ac/Pediatric/ui/stg2SummaryRpt?doc=AC048 | https://actionability.clinicalgenome.org/ac/Adult/ui/stg2SummaryRpt?doc=AC048","Pediatric Actionability Working Group | Adult Actionability Working Group"
"APC","HGNC:583","https://search.clinicalgenome.org/kb/genes/HGNC:583","classic familial adenomatous polyposis","MONDO:0021055","https://search.clinicalgenome.org/kb/conditions/MONDO:0021055","N/A","3 - Sufficient Evidence for Haploinsufficiency (07/19/2021)","0 - No Evidence for Triplosensitivity (07/19/2021)","https://search.clinicalgenome.org/kb/gene-dosage/HGNC:583","Dosage Working Group","","","","Definitive Actionability (10/01/2019) | Strong Actionability (10/01/2019)","https://actionability.clinicalgenome.org/ac/Pediatric/ui/stg2SummaryRpt?doc=AC048 | https://actionability.clinicalgenome.org/ac/Adult/ui/stg2SummaryRpt?doc=AC048","Pediatric Actionability Working Group | Adult Actionability Working Group"
"APC2","HGNC:24036","https://search.clinicalgenome.org/kb/genes/HGNC:24036","lissencephaly spectrum disorders","MONDO:0018838","https://search.clinicalgenome.org/kb/conditions/MONDO:0018838","Autosomal recessive inheritance","","","","","strong evidence (10/11/2022)","https://search.clinicalgenome.org/kb/gene-validity/CGGV:assertion_4fd2851a-bba3-47eb-a97c-e8bf51ec6766-2022-10-11T160000.000Z","Brain Malformations","","",""
"APOA4","HGNC:602","https://search.clinicalgenome.org/kb/genes/HGNC:602","autosomal dominant medullary cystic kidney disease with or without hyperuricemia","MONDO:0008264","https://search.clinicalgenome.org/kb/conditions/MONDO:0008264","Autosomal dominant inheritance","","","","","limited evidence (02/28/2024)","https://search.clinicalgenome.org/kb/gene-validity/CGGV:assertion_433a4c49-838e-4601-92af-caece99d62eb-2024-02-28T170000.000Z","Kidney Cystic and Ciliopathy Disorders","","",""
"APOB","HGNC:603","https://search.clinicalgenome.org/kb/genes/HGNC:603","familial hypobetalipoproteinemia 1","MONDO:0014252","https://search.clinicalgenome.org/kb/conditions/MONDO:0014252","Semidominant inheritance","3 - Sufficient Evidence for Haploinsufficiency (04/09/2020)","0 - No Evidence for Triplosensitivity (04/09/2020)","https://search.clinicalgenome.org/kb/gene-dosage/HGNC:603","Dosage Working Group","definitive evidence (02/26/2020)","https://search.clinicalgenome.org/kb/gene-validity/CGGV:assertion_e7382aae-83d5-4a23-b1fe-e3d6acea8584-2020-02-26T170000.000Z","General Gene Curation","","",""
"APOB","HGNC:603","https://search.clinicalgenome.org/kb/genes/HGNC:603","hypercholesterolemia, autosomal dominant, type B","MONDO:0007751","https://search.clinicalgenome.org/kb/conditions/MONDO:0007751","Autosomal dominant inheritance","3 - Sufficient Evidence for Haploinsufficiency (04/09/2020)","0 - No Evidence for Triplosensitivity (04/09/2020)","https://search.clinicalgenome.org/kb/gene-dosage/HGNC:603","Dosage Working Group","definitive evidence (11/14/2018)","https://search.clinicalgenome.org/kb/gene-validity/CGGV:assertion_1c26b83b-409e-47c7-9c53-6ca79472d6fc-2018-11-14T180000.000Z","General Gene Curation","Strong Actionability (08/03/2020) | Strong Actionability (08/03/2020) | Strong Actionability (08/03/2020) | Definitive Actionability (08/03/2020)","https://actionability.clinicalgenome.org/ac/Adult/ui/stg2SummaryRpt?doc=AC065 | https://actionability.clinicalgenome.org/ac/Pediatric/ui/stg2SummaryRpt?doc=AC057 | https://actionability.clinicalgenome.org/ac/Pediatric/ui/stg2SummaryRpt?doc=AC065 | https://actionability.clinicalgenome.org/ac/Adult/ui/stg2SummaryRpt?doc=AC057","Adult Actionability Working Group | Pediatric Actionability Working Group | Pediatric Actionability Working Group | Adult Actionability Working Group"
"APOB","HGNC:603","https://search.clinicalgenome.org/kb/genes/HGNC:603","homozygous familial hypercholesterolemia","MONDO:0018328","https://search.clinicalgenome.org/kb/conditions/MONDO:0018328","N/A","3 - Sufficient Evidence for Haploinsufficiency (04/09/2020)","0 - No Evidence for Triplosensitivity (04/09/2020)","https://search.clinicalgenome.org/kb/gene-dosage/HGNC:603","Dosage Working Group","","","","Strong Actionability (08/03/2020) | Strong Actionability (08/03/2020)","https://actionability.clinicalgenome.org/ac/Adult/ui/stg2SummaryRpt?doc=AC065 | https://actionability.clinicalgenome.org/ac/Pediatric/ui/stg2SummaryRpt?doc=AC065","Adult Actionability Working Group | Pediatric Actionability Working Group"
"APOC2","HGNC:609","https://search.clinicalgenome.org/kb/genes/HGNC:609","familial apolipoprotein C-II deficiency","MONDO:0008810","https://search.clinicalgenome.org/kb/conditions/MONDO:0008810","N/A","30 - Gene Associated with Autosomal Recessive Phenotype (08/22/2016)","","https://search.clinicalgenome.org/kb/gene-dosage/HGNC:609","Dosage Working Group","","","","","",""
"APOL1","HGNC:618","https://search.clinicalgenome.org/kb/genes/HGNC:618","focal segmental glomerulosclerosis 4, susceptibility to","MONDO:0012931","https://search.clinicalgenome.org/kb/conditions/MONDO:0012931","Autosomal recessive inheritance","","","","","definitive evidence (09/28/2021)","https://search.clinicalgenome.org/kb/gene-validity/CGGV:assertion_47d0f13d-5122-4762-82c9-08db3ba104d1-2021-09-28T023000.000Z","Glomerulopathy","","",""
"APOLD1","HGNC:25268","https://search.clinicalgenome.org/kb/genes/HGNC:25268","inherited blood coagulation disorder","MONDO:0021181","https://search.clinicalgenome.org/kb/conditions/MONDO:0021181","Autosomal dominant inheritance","","","","","limited evidence (02/05/2024)","https://search.clinicalgenome.org/kb/gene-validity/CGGV:assertion_3b8a1833-03a5-4e71-9f31-974fcd6443f6-2024-02-05T170000.000Z","Hemostasis Thrombosis","","",""
"APP","HGNC:620","https://search.clinicalgenome.org/kb/genes/HGNC:620","early-onset autosomal dominant Alzheimer disease","MONDO:0015140","https://search.clinicalgenome.org/kb/conditions/MONDO:0015140","N/A","0 - No Evidence for Haploinsufficiency (06/03/2024)","3 - Sufficient Evidence for Triplosensitivity (06/03/2024)","https://search.clinicalgenome.org/kb/gene-dosage/HGNC:620","Dosage Working Group","","","","","",""
"APPL1","HGNC:24035","https://search.clinicalgenome.org/kb/genes/HGNC:24035","monogenic diabetes","MONDO:0015967","https://search.clinicalgenome.org/kb/conditions/MONDO:0015967","Autosomal dominant inheritance","","","","","limited evidence (12/15/2021)","https://search.clinicalgenome.org/kb/gene-validity/CGGV:assertion_5e2bc680-f1d4-4b65-baaa-22b4ff22b56e-2021-12-15T170000.000Z","Monogenic Diabetes","","",""
"AQP1","HGNC:633","https://search.clinicalgenome.org/kb/genes/HGNC:633","pulmonary arterial hypertension","MONDO:0015924","https://search.clinicalgenome.org/kb/conditions/MONDO:0015924","Autosomal dominant inheritance","","","","","limited evidence (01/11/2021)","https://search.clinicalgenome.org/kb/gene-validity/CGGV:assertion_29eda804-13df-4fe9-bbb3-9494b11edc92-2021-01-11T145519.495Z","Pulmonary Hypertension","","",""
"AR","HGNC:644","https://search.clinicalgenome.org/kb/genes/HGNC:644","Kennedy disease","MONDO:0010735","https://search.clinicalgenome.org/kb/conditions/MONDO:0010735","X-linked inheritance","3 - Sufficient Evidence for Haploinsufficiency (12/08/2020)","0 - No Evidence for Triplosensitivity (12/08/2020)","https://search.clinicalgenome.org/kb/gene-dosage/HGNC:644","Dosage Working Group","definitive evidence (08/08/2023)","https://search.clinicalgenome.org/kb/gene-validity/CGGV:assertion_a05eab29-c7e9-4b2a-9378-ac384962b69c-2023-08-08T190000.000Z","Amyotrophic Lateral Sclerosis Spectrum Disorders","","",""
"AR","HGNC:644","https://search.clinicalgenome.org/kb/genes/HGNC:644","androgen insensitivity syndrome","MONDO:0019154","https://search.clinicalgenome.org/kb/conditions/MONDO:0019154","N/A","3 - Sufficient Evidence for Haploinsufficiency (12/08/2020)","0 - No Evidence for Triplosensitivity (12/08/2020)","https://search.clinicalgenome.org/kb/gene-dosage/HGNC:644","Dosage Working Group","","","","","",""
"ARCN1","HGNC:649","https://search.clinicalgenome.org/kb/genes/HGNC:649","short stature, rhizomelic, with microcephaly, micrognathia, and developmental delay","MONDO:0014948","https://search.clinicalgenome.org/kb/conditions/MONDO:0014948","N/A","3 - Sufficient Evidence for Haploinsufficiency (05/10/2022)","0 - No Evidence for Triplosensitivity (05/10/2022)","https://search.clinicalgenome.org/kb/gene-dosage/HGNC:649","Dosage Working Group","","","","","",""
"ARF1","HGNC:652","https://search.clinicalgenome.org/kb/genes/HGNC:652","periventricular nodular heterotopia","MONDO:0020341","https://search.clinicalgenome.org/kb/conditions/MONDO:0020341","Autosomal dominant inheritance","","","","","definitive evidence (06/28/2024)","https://search.clinicalgenome.org/kb/gene-validity/CGGV:assertion_5b42038d-6fb1-40be-96c3-1e97eacd9092-2024-06-28T160000.000Z","Brain Malformations","","",""
"ARFGEF2","HGNC:15853","https://search.clinicalgenome.org/kb/genes/HGNC:15853","periventricular heterotopia with microcephaly, autosomal recessive","MONDO:0011966","https://search.clinicalgenome.org/kb/conditions/MONDO:0011966","Autosomal recessive inheritance","30 - Gene Associated with Autosomal Recessive Phenotype (08/22/2016)","0 - No Evidence for Triplosensitivity (08/22/2016)","https://search.clinicalgenome.org/kb/gene-dosage/HGNC:15853","Dosage Working Group","definitive evidence (09/12/2023)","https://search.clinicalgenome.org/kb/gene-validity/CGGV:assertion_814507e0-e6cd-4bce-a4c6-4d1caa61cfc3-2023-09-12T170000.000Z","Brain Malformations","","",""
"ARG1","HGNC:663","https://search.clinicalgenome.org/kb/genes/HGNC:663","arginase deficiency","MONDO:0008814","https://search.clinicalgenome.org/kb/conditions/MONDO:0008814","Autosomal recessive inheritance","30 - Gene Associated with Autosomal Recessive Phenotype (08/22/2016)","0 - No Evidence for Triplosensitivity (08/22/2016)","https://search.clinicalgenome.org/kb/gene-dosage/HGNC:663","Dosage Working Group","definitive evidence (06/29/2020)","https://search.clinicalgenome.org/kb/gene-validity/CGGV:assertion_0157f793-9232-4700-bbf0-dfb16270f688-2020-06-29T174101.533Z","Aminoacidopathy","Has Insufficient Evidence for Actionability Based on Early Rule-out (05/15/2023) | Limited Actionability (12/17/2024)","https://actionability.clinicalgenome.org/ac/Adult/ui/stg2SummaryRpt?doc=AC1051 | https://actionability.clinicalgenome.org/ac/Pediatric/ui/stg2SummaryRpt?doc=AC1051","Adult Actionability Working Group | Pediatric Actionability Working Group"
"ARHGAP29","HGNC:30207","https://search.clinicalgenome.org/kb/genes/HGNC:30207","orofacial cleft","MONDO:0000358","https://search.clinicalgenome.org/kb/conditions/MONDO:0000358","Autosomal dominant inheritance","","","","","definitive evidence (08/15/2024)","https://search.clinicalgenome.org/kb/gene-validity/CGGV:assertion_48ab3875-5bae-4b9c-8744-8ff16e4903ee-2024-08-15T160000.000Z","Craniofacial Malformations","","",""
"ARHGDIA","HGNC:678","https://search.clinicalgenome.org/kb/genes/HGNC:678","nephrotic syndrome, type 8","MONDO:0014099","https://search.clinicalgenome.org/kb/conditions/MONDO:0014099","Autosomal recessive inheritance","","","","","moderate evidence (05/24/2022)","https://search.clinicalgenome.org/kb/gene-validity/CGGV:assertion_0e529f2b-21ac-44b2-981e-048e92e377a1-2022-05-24T180000.000Z","Glomerulopathy","","",""
"ARHGEF1","HGNC:681","https://search.clinicalgenome.org/kb/genes/HGNC:681","immunodeficiency 62","MONDO:0032763","https://search.clinicalgenome.org/kb/conditions/MONDO:0032763","Autosomal recessive inheritance","","","","","limited evidence (01/19/2021)","https://search.clinicalgenome.org/kb/gene-validity/CGGV:assertion_9547c192-135d-48b3-a1c0-2eca5e2608c5-2021-01-19T214711.722Z","Antibody Deficiencies GCEP","","",""
"ARHGEF10","HGNC:14103","https://search.clinicalgenome.org/kb/genes/HGNC:14103","autosomal dominant slowed nerve conduction velocity","MONDO:0011998","https://search.clinicalgenome.org/kb/conditions/MONDO:0011998","Autosomal dominant inheritance","","","","","limited evidence (10/05/2020)","https://search.clinicalgenome.org/kb/gene-validity/CGGV:assertion_b23121f9-57e1-48ac-a2bc-d5a293829530-2020-10-05T160423.090Z","Charcot-Marie-Tooth","","",""
"ARHGEF18","HGNC:17090","https://search.clinicalgenome.org/kb/genes/HGNC:17090","inherited retinal dystrophy","MONDO:0019118","https://search.clinicalgenome.org/kb/conditions/MONDO:0019118","Autosomal recessive inheritance","","","","","moderate evidence (11/07/2024)","https://search.clinicalgenome.org/kb/gene-validity/CGGV:assertion_96382044-7790-49d1-848c-01d699df9550-2024-11-07T170000.000Z","Retina","","",""
"ARHGEF28","HGNC:30322","https://search.clinicalgenome.org/kb/genes/HGNC:30322","amyotrophic lateral sclerosis","MONDO:0004976","https://search.clinicalgenome.org/kb/conditions/MONDO:0004976","Semidominant inheritance","","","","","limited evidence (03/28/2024)","https://search.clinicalgenome.org/kb/gene-validity/CGGV:assertion_ac27cecc-9749-4c69-88fa-fe83b2d49568-2024-03-28T190000.000Z","Amyotrophic Lateral Sclerosis Spectrum Disorders","","",""
"ARHGEF6","HGNC:685","https://search.clinicalgenome.org/kb/genes/HGNC:685","non-syndromic X-linked intellectual disability","MONDO:0019181","https://search.clinicalgenome.org/kb/conditions/MONDO:0019181","X-linked inheritance","0 - No Evidence for Haploinsufficiency (04/25/2012)","0 - No Evidence for Triplosensitivity (04/25/2012)","https://search.clinicalgenome.org/kb/gene-dosage/HGNC:685","Dosage Working Group","disputing (10/20/2020)","https://search.clinicalgenome.org/kb/gene-validity/CGGV:assertion_d248ef99-6ff8-43d8-a24e-dfce6b2db1c8-2020-10-19T220000.000Z","Intellectual Disability and Autism","","",""
"ARHGEF9","HGNC:14561","https://search.clinicalgenome.org/kb/genes/HGNC:14561","X-linked complex neurodevelopmental disorder","MONDO:0100148","https://search.clinicalgenome.org/kb/conditions/MONDO:0100148","X-linked inheritance","3 - Sufficient Evidence for Haploinsufficiency (11/25/2021)","0 - No Evidence for Triplosensitivity (11/25/2021)","https://search.clinicalgenome.org/kb/gene-dosage/HGNC:14561","Dosage Working Group","definitive evidence (05/23/2024)","https://search.clinicalgenome.org/kb/gene-validity/CGGV:assertion_9305fb2c-6cdf-492d-9dd0-8b03dd4fab1c-2024-05-23T160000.000Z","Intellectual Disability and Autism","","",""
"ARID1A","HGNC:11110","https://search.clinicalgenome.org/kb/genes/HGNC:11110","Coffin-Siris syndrome","MONDO:0015452","https://search.clinicalgenome.org/kb/conditions/MONDO:0015452","Autosomal dominant inheritance","3 - Sufficient Evidence for Haploinsufficiency (05/27/2020)","0 - No Evidence for Triplosensitivity (05/27/2020)","https://search.clinicalgenome.org/kb/gene-dosage/HGNC:11110","Dosage Working Group","definitive evidence (07/07/2021)","https://search.clinicalgenome.org/kb/gene-validity/CGGV:assertion_aaf6d47a-656a-49ca-ba9e-169f25bf03e7-2021-07-07T160000.000Z","Intellectual Disability and Autism","","",""
"ARID1A","HGNC:11110","https://search.clinicalgenome.org/kb/genes/HGNC:11110","intellectual disability, autosomal dominant 14","MONDO:0013819","https://search.clinicalgenome.org/kb/conditions/MONDO:0013819","N/A","3 - Sufficient Evidence for Haploinsufficiency (05/27/2020)","0 - No Evidence for Triplosensitivity (05/27/2020)","https://search.clinicalgenome.org/kb/gene-dosage/HGNC:11110","Dosage Working Group","","","","","",""
"ARID1B","HGNC:18040","https://search.clinicalgenome.org/kb/genes/HGNC:18040","Coffin-Siris syndrome","MONDO:0015452","https://search.clinicalgenome.org/kb/conditions/MONDO:0015452","Autosomal dominant inheritance","3 - Sufficient Evidence for Haploinsufficiency (05/26/2021)","0 - No Evidence for Triplosensitivity (05/26/2021)","https://search.clinicalgenome.org/kb/gene-dosage/HGNC:18040","Dosage Working Group","definitive evidence (12/04/2019)","https://search.clinicalgenome.org/kb/gene-validity/CGGV:assertion_d487e6c4-9727-4315-90a2-11338128a8e5-2019-12-04T200734.569Z","Intellectual Disability and Autism","","",""
"ARID1B","HGNC:18040","https://search.clinicalgenome.org/kb/genes/HGNC:18040","Coffin-Siris syndrome 1","MONDO:0007617","https://search.clinicalgenome.org/kb/conditions/MONDO:0007617","N/A","3 - Sufficient Evidence for Haploinsufficiency (05/26/2021)","0 - No Evidence for Triplosensitivity (05/26/2021)","https://search.clinicalgenome.org/kb/gene-dosage/HGNC:18040","Dosage Working Group","","","","","",""
"ARID2","HGNC:18037","https://search.clinicalgenome.org/kb/genes/HGNC:18037","Coffin-Siris syndrome","MONDO:0015452","https://search.clinicalgenome.org/kb/conditions/MONDO:0015452","Autosomal dominant inheritance","3 - Sufficient Evidence for Haploinsufficiency (06/26/2019)","0 - No Evidence for Triplosensitivity (06/26/2019)","https://search.clinicalgenome.org/kb/gene-dosage/HGNC:18037","Dosage Working Group","definitive evidence (12/07/2022)","https://search.clinicalgenome.org/kb/gene-validity/CGGV:assertion_ae1a697f-8dcd-4edf-a25b-e5e0593e7e61-2022-12-06T230000.000Z","Intellectual Disability and Autism","","",""
"ARID2","HGNC:18037","https://search.clinicalgenome.org/kb/genes/HGNC:18037","Coffin-Siris syndrome 6","MONDO:0033492","https://search.clinicalgenome.org/kb/conditions/MONDO:0033492","N/A","3 - Sufficient Evidence for Haploinsufficiency (06/26/2019)","0 - No Evidence for Triplosensitivity (06/26/2019)","https://search.clinicalgenome.org/kb/gene-dosage/HGNC:18037","Dosage Working Group","","","","","",""
"ARL13B","HGNC:25419","https://search.clinicalgenome.org/kb/genes/HGNC:25419","Joubert syndrome","MONDO:0018772","https://search.clinicalgenome.org/kb/conditions/MONDO:0018772","Autosomal recessive inheritance","","","","","definitive evidence (06/03/2020)","https://search.clinicalgenome.org/kb/gene-validity/CGGV:assertion_f6c474c9-4035-498c-a902-03be50d36205-2020-06-03T210114.719Z","Syndromic Disorders","","",""
"ARL2BP","HGNC:17146","https://search.clinicalgenome.org/kb/genes/HGNC:17146","ciliopathy","MONDO:0005308","https://search.clinicalgenome.org/kb/conditions/MONDO:0005308","Autosomal recessive inheritance","","","","","definitive evidence (01/02/2025)","https://search.clinicalgenome.org/kb/gene-validity/CGGV:assertion_afe2baae-73d8-4f77-a106-a9163dbde4ce-2025-01-02T170000.000Z","Retina","","",""
"ARL6","HGNC:13210","https://search.clinicalgenome.org/kb/genes/HGNC:13210","ciliopathy","MONDO:0005308","https://search.clinicalgenome.org/kb/conditions/MONDO:0005308","Autosomal recessive inheritance","30 - Gene Associated with Autosomal Recessive Phenotype (08/22/2016)","0 - No Evidence for Triplosensitivity (08/22/2016)","https://search.clinicalgenome.org/kb/gene-dosage/HGNC:13210","Dosage Working Group","definitive evidence (07/14/2025)","https://search.clinicalgenome.org/kb/gene-validity/CGGV:assertion_9289028a-10d0-4d9a-aa17-13d13d91c732-2025-07-14T160000.000Z","Kidney Cystic and Ciliopathy Disorders","","",""
"ARL6","HGNC:13210","https://search.clinicalgenome.org/kb/genes/HGNC:13210","Bardet-Biedl syndrome 3","MONDO:0010832","https://search.clinicalgenome.org/kb/conditions/MONDO:0010832","N/A","30 - Gene Associated with Autosomal Recessive Phenotype (08/22/2016)","0 - No Evidence for Triplosensitivity (08/22/2016)","https://search.clinicalgenome.org/kb/gene-dosage/HGNC:13210","Dosage Working Group","","","","","",""
"ARL6IP1","HGNC:697","https://search.clinicalgenome.org/kb/genes/HGNC:697","hereditary spastic paraplegia","MONDO:0019064","https://search.clinicalgenome.org/kb/conditions/MONDO:0019064","Autosomal recessive inheritance","30 - Gene Associated with Autosomal Recessive Phenotype (08/22/2016)","","https://search.clinicalgenome.org/kb/gene-dosage/HGNC:697","Dosage Working Group","definitive evidence (10/17/2022)","https://search.clinicalgenome.org/kb/gene-validity/CGGV:assertion_58275699-f116-4243-83da-72f751753837-2022-10-17T180000.000Z","Cerebral Palsy","","",""
"ARL6IP1","HGNC:697","https://search.clinicalgenome.org/kb/genes/HGNC:697","hereditary spastic paraplegia 61","MONDO:0014304","https://search.clinicalgenome.org/kb/conditions/MONDO:0014304","N/A","30 - Gene Associated with Autosomal Recessive Phenotype (08/22/2016)","","https://search.clinicalgenome.org/kb/gene-dosage/HGNC:697","Dosage Working Group","","","","","",""
"ARMC2","HGNC:23045","https://search.clinicalgenome.org/kb/genes/HGNC:23045","spermatogenic failure 38","MONDO:0032748","https://search.clinicalgenome.org/kb/conditions/MONDO:0032748","Autosomal recessive inheritance","","","","","definitive evidence (05/10/2023)","https://search.clinicalgenome.org/kb/gene-validity/CGGV:assertion_aef0ad23-4568-4ef7-94e9-557981bfbe6c-2023-05-10T160000.000Z","Motile Ciliopathy","","",""
"ARMC9","HGNC:20730","https://search.clinicalgenome.org/kb/genes/HGNC:20730","Joubert syndrome 30","MONDO:0033308","https://search.clinicalgenome.org/kb/conditions/MONDO:0033308","Autosomal recessive inheritance","","","","","definitive evidence (06/28/2023)","https://search.clinicalgenome.org/kb/gene-validity/CGGV:assertion_77d8b454-195d-463c-b043-fc068392a23b-2023-06-28T160000.000Z","Kidney Cystic and Ciliopathy Disorders","","",""
"ARPC1B","HGNC:704","https://search.clinicalgenome.org/kb/genes/HGNC:704","platelet abnormalities with eosinophilia and immune-mediated inflammatory disease","MONDO:0060583","https://search.clinicalgenome.org/kb/conditions/MONDO:0060583","Autosomal recessive inheritance","","","","","definitive evidence (07/22/2020)","https://search.clinicalgenome.org/kb/gene-validity/CGGV:assertion_13909f11-a592-41cc-ade9-c77a5b49b253-2020-07-22T160000.000Z","Hemostasis Thrombosis","","",""
"ARPP21","HGNC:16968","https://search.clinicalgenome.org/kb/genes/HGNC:16968","amyotrophic lateral sclerosis","MONDO:0004976","https://search.clinicalgenome.org/kb/conditions/MONDO:0004976","Autosomal dominant inheritance","","","","","limited evidence (01/14/2025)","https://search.clinicalgenome.org/kb/gene-validity/CGGV:assertion_02d4089a-94dd-42b6-ab09-dc258db00ae9-2025-01-14T200000.000Z","Amyotrophic Lateral Sclerosis Spectrum Disorders","","",""
"ARSA","HGNC:713","https://search.clinicalgenome.org/kb/genes/HGNC:713","metachromatic leukodystrophy","MONDO:0018868","https://search.clinicalgenome.org/kb/conditions/MONDO:0018868","Autosomal recessive inheritance","30 - Gene Associated with Autosomal Recessive Phenotype (09/05/2012)","0 - No Evidence for Triplosensitivity (09/05/2012)","https://search.clinicalgenome.org/kb/gene-dosage/HGNC:713","Dosage Working Group","definitive evidence (06/15/2023)","https://search.clinicalgenome.org/kb/gene-validity/CGGV:assertion_a8d351d5-5158-4cc2-b4dd-d3179b53e2a4-2023-06-15T160000.000Z","Lysosomal Diseases GCEP","","",""
"ARSA","HGNC:713","https://search.clinicalgenome.org/kb/genes/HGNC:713","metachromatic leukodystrophy, juvenile form","MONDO:0009591","https://search.clinicalgenome.org/kb/conditions/MONDO:0009591","N/A","30 - Gene Associated with Autosomal Recessive Phenotype (09/05/2012)","0 - No Evidence for Triplosensitivity (09/05/2012)","https://search.clinicalgenome.org/kb/gene-dosage/HGNC:713","Dosage Working Group","","","","","",""
"ARSB","HGNC:714","https://search.clinicalgenome.org/kb/genes/HGNC:714","mucopolysaccharidosis type 6","MONDO:0009661","https://search.clinicalgenome.org/kb/conditions/MONDO:0009661","Autosomal recessive inheritance","","","","","definitive evidence (04/17/2022)","https://search.clinicalgenome.org/kb/gene-validity/CGGV:assertion_2a850717-e21b-495d-8542-de4fdb142647-2022-04-17T160000.000Z","Lysosomal Diseases GCEP","","",""
"ARSL","HGNC:719","https://search.clinicalgenome.org/kb/genes/HGNC:719","X-linked chondrodysplasia punctata 1","MONDO:0010555","https://search.clinicalgenome.org/kb/conditions/MONDO:0010555","X-linked inheritance","3 - Sufficient Evidence for Haploinsufficiency (07/12/2012)","0 - No Evidence for Triplosensitivity (07/12/2012)","https://search.clinicalgenome.org/kb/gene-dosage/HGNC:719","Dosage Working Group","definitive evidence (08/29/2023)","https://search.clinicalgenome.org/kb/gene-validity/CGGV:assertion_2c48d88b-d100-4203-8abf-03f3199bf3e0-2023-08-29T160000.000Z","Syndromic Disorders","","",""
"ARX","HGNC:18060","https://search.clinicalgenome.org/kb/genes/HGNC:18060","genetic developmental and epileptic encephalopathy","MONDO:0100062","https://search.clinicalgenome.org/kb/conditions/MONDO:0100062","X-linked inheritance","3 - Sufficient Evidence for Haploinsufficiency (12/05/2019)","0 - No Evidence for Triplosensitivity (12/05/2019)","https://search.clinicalgenome.org/kb/gene-dosage/HGNC:18060","Dosage Working Group","definitive evidence (06/04/2019)","https://search.clinicalgenome.org/kb/gene-validity/CGGV:assertion_3a5357ce-2161-4a7f-a8e1-a1dba4550e57-2019-06-04T160000.000Z","Epilepsy","","",""
"ARX","HGNC:18060","https://search.clinicalgenome.org/kb/genes/HGNC:18060","X-linked complex neurodevelopmental disorder","MONDO:0100148","https://search.clinicalgenome.org/kb/conditions/MONDO:0100148","X-linked inheritance","3 - Sufficient Evidence for Haploinsufficiency (12/05/2019)","0 - No Evidence for Triplosensitivity (12/05/2019)","https://search.clinicalgenome.org/kb/gene-dosage/HGNC:18060","Dosage Working Group","definitive evidence (12/01/2020)","https://search.clinicalgenome.org/kb/gene-validity/CGGV:assertion_ccf3ab49-ee8f-4980-aa04-ca13c21c124a-2020-12-01T170000.000Z","Intellectual Disability and Autism","","",""
"ARX","HGNC:18060","https://search.clinicalgenome.org/kb/genes/HGNC:18060","X-linked lissencephaly with abnormal genitalia","MONDO:0010268","https://search.clinicalgenome.org/kb/conditions/MONDO:0010268","N/A","3 - Sufficient Evidence for Haploinsufficiency (12/05/2019)","0 - No Evidence for Triplosensitivity (12/05/2019)","https://search.clinicalgenome.org/kb/gene-dosage/HGNC:18060","Dosage Working Group","","","","","",""
"ASAH1","HGNC:735","https://search.clinicalgenome.org/kb/genes/HGNC:735","ASAH1-related sphingolipidosis","MONDO:0100524","https://search.clinicalgenome.org/kb/conditions/MONDO:0100524","Autosomal recessive inheritance","30 - Gene Associated with Autosomal Recessive Phenotype (09/12/2017)","0 - No Evidence for Triplosensitivity (09/12/2017)","https://search.clinicalgenome.org/kb/gene-dosage/HGNC:735","Dosage Working Group","definitive evidence (10/04/2023)","https://search.clinicalgenome.org/kb/gene-validity/CGGV:assertion_d7d25555-4d27-4fd4-8619-cdf78b50701a-2023-10-04T160000.000Z","Lysosomal Diseases GCEP","","",""
"ASAH1","HGNC:735","https://search.clinicalgenome.org/kb/genes/HGNC:735","Farber lipogranulomatosis","MONDO:0009218","https://search.clinicalgenome.org/kb/conditions/MONDO:0009218","N/A","30 - Gene Associated with Autosomal Recessive Phenotype (09/12/2017)","0 - No Evidence for Triplosensitivity (09/12/2017)","https://search.clinicalgenome.org/kb/gene-dosage/HGNC:735","Dosage Working Group","","","","","",""
"ASB10","HGNC:17185","https://search.clinicalgenome.org/kb/genes/HGNC:17185","obsolete glaucoma 1, open angle, F","MONDO:0011311","https://search.clinicalgenome.org/kb/conditions/MONDO:0011311","Autosomal dominant inheritance","","","","","limited evidence (03/16/2023)","https://search.clinicalgenome.org/kb/gene-validity/CGGV:assertion_ac9aa333-15d1-404d-85e1-a3d6e759dc0b-2023-03-16T160000.000Z","Glaucoma and Neuro-Ophthalmology","","",""
"ASH1L","HGNC:19088","https://search.clinicalgenome.org/kb/genes/HGNC:19088","syndromic complex neurodevelopmental disorder","MONDO:0800439","https://search.clinicalgenome.org/kb/conditions/MONDO:0800439","Autosomal dominant inheritance","3 - Sufficient Evidence for Haploinsufficiency (12/27/2017)","0 - No Evidence for Triplosensitivity (12/27/2017)","https://search.clinicalgenome.org/kb/gene-dosage/HGNC:19088","Dosage Working Group","definitive evidence (02/23/2023)","https://search.clinicalgenome.org/kb/gene-validity/CGGV:assertion_41052ba5-878d-4e64-8ef2-ed65887a1345-2023-02-23T070000.000Z","Intellectual Disability and Autism","","",""
"ASH1L","HGNC:19088","https://search.clinicalgenome.org/kb/genes/HGNC:19088","complex neurodevelopmental disorder","MONDO:0100038","https://search.clinicalgenome.org/kb/conditions/MONDO:0100038","N/A","3 - Sufficient Evidence for Haploinsufficiency (12/27/2017)","0 - No Evidence for Triplosensitivity (12/27/2017)","https://search.clinicalgenome.org/kb/gene-dosage/HGNC:19088","Dosage Working Group","","","","","",""
"ASL","HGNC:746","https://search.clinicalgenome.org/kb/genes/HGNC:746","argininosuccinic aciduria","MONDO:0008815","https://search.clinicalgenome.org/kb/conditions/MONDO:0008815","Autosomal recessive inheritance","30 - Gene Associated with Autosomal Recessive Phenotype (08/22/2016)","","https://search.clinicalgenome.org/kb/gene-dosage/HGNC:746","Dosage Working Group","definitive evidence (09/15/2018)","https://search.clinicalgenome.org/kb/gene-validity/CGGV:assertion_c16021b9-f6db-4e41-90f3-4786d63a1fa3-2018-09-15T160000.000Z","Aminoacidopathy","Moderate Actionability (05/04/2021) | Has Insufficient Evidence for Actionability Based on Early Rule-out (05/04/2021)","https://actionability.clinicalgenome.org/ac/Pediatric/ui/stg2SummaryRpt?doc=AC1028 | https://actionability.clinicalgenome.org/ac/Adult/ui/stg2SummaryRpt?doc=AC1028","Pediatric Actionability Working Group | Adult Actionability Working Group"
"ASNS","HGNC:753","https://search.clinicalgenome.org/kb/genes/HGNC:753","congenital microcephaly - severe encephalopathy - progressive cerebral atrophy syndrome","MONDO:0014258","https://search.clinicalgenome.org/kb/conditions/MONDO:0014258","Autosomal recessive inheritance","","","","","definitive evidence (06/29/2020)","https://search.clinicalgenome.org/kb/gene-validity/CGGV:assertion_e1cea57d-fe02-469e-8c52-a383c3f5a0c6-2020-06-29T174449.301Z","Aminoacidopathy","","",""
"ASPA","HGNC:756","https://search.clinicalgenome.org/kb/genes/HGNC:756","Canavan disease","MONDO:0010079","https://search.clinicalgenome.org/kb/conditions/MONDO:0010079","Autosomal recessive inheritance","30 - Gene Associated with Autosomal Recessive Phenotype (08/22/2016)","0 - No Evidence for Triplosensitivity (08/22/2016)","https://search.clinicalgenome.org/kb/gene-dosage/HGNC:756","Dosage Working Group","definitive evidence (10/08/2020)","https://search.clinicalgenome.org/kb/gene-validity/CGGV:assertion_66306eff-659f-4508-a41b-1820e47e0e1d-2020-10-08T161701.633Z","Aminoacidopathy","","",""
"ASPH","HGNC:757","https://search.clinicalgenome.org/kb/genes/HGNC:757","facial dysmorphism-lens dislocation-anterior segment abnormalities-spontaneous filtering blebs syndrome","MONDO:0011106","https://search.clinicalgenome.org/kb/conditions/MONDO:0011106","N/A","30 - Gene Associated with Autosomal Recessive Phenotype (08/22/2016)","","https://search.clinicalgenome.org/kb/gene-dosage/HGNC:757","Dosage Working Group","","","","","",""
"ASPM","HGNC:19048","https://search.clinicalgenome.org/kb/genes/HGNC:19048","autosomal recessive primary microcephaly","MONDO:0016660","https://search.clinicalgenome.org/kb/conditions/MONDO:0016660","Autosomal recessive inheritance","30 - Gene Associated with Autosomal Recessive Phenotype (08/22/2016)","0 - No Evidence for Triplosensitivity (08/22/2016)","https://search.clinicalgenome.org/kb/gene-dosage/HGNC:19048","Dosage Working Group","definitive evidence (03/14/2024)","https://search.clinicalgenome.org/kb/gene-validity/CGGV:assertion_41e82e1a-528f-48ee-9e07-22865077f61d-2024-03-14T170000.000Z","Brain Malformations","","",""
"ASS1","HGNC:758","https://search.clinicalgenome.org/kb/genes/HGNC:758","citrullinemia type I","MONDO:0008988","https://search.clinicalgenome.org/kb/conditions/MONDO:0008988","Autosomal recessive inheritance","","","","","definitive evidence (12/27/2018)","https://search.clinicalgenome.org/kb/gene-validity/CGGV:assertion_5dc5ef32-81ca-478e-be42-436da3416e4d-2018-12-27T170000.000Z","Aminoacidopathy","Strong Actionability (10/26/2020) | Strong Actionability (10/26/2020)","https://actionability.clinicalgenome.org/ac/Pediatric/ui/stg2SummaryRpt?doc=AC1017 | https://actionability.clinicalgenome.org/ac/Adult/ui/stg2SummaryRpt?doc=AC1017","Pediatric Actionability Working Group | Adult Actionability Working Group"
"ASTN2","HGNC:17021","https://search.clinicalgenome.org/kb/genes/HGNC:17021","complex neurodevelopmental disorder","MONDO:0100038","https://search.clinicalgenome.org/kb/conditions/MONDO:0100038","N/A","1 - Little Evidence for Haploinsufficiency (03/09/2021)","0 - No Evidence for Triplosensitivity (03/09/2021)","https://search.clinicalgenome.org/kb/gene-dosage/HGNC:17021","Dosage Working Group","","","","","",""
"ASXL1","HGNC:18318","https://search.clinicalgenome.org/kb/genes/HGNC:18318","Bohring-Opitz syndrome","MONDO:0011510","https://search.clinicalgenome.org/kb/conditions/MONDO:0011510","Autosomal dominant inheritance","3 - Sufficient Evidence for Haploinsufficiency (03/14/2013)","0 - No Evidence for Triplosensitivity (03/14/2013)","https://search.clinicalgenome.org/kb/gene-dosage/HGNC:18318","Dosage Working Group","definitive evidence (07/30/2021)","https://search.clinicalgenome.org/kb/gene-validity/CGGV:assertion_31e0ce4d-aeb7-4983-9ec2-85178d7f40f0-2021-07-30T160000.000Z","Intellectual Disability and Autism","","",""
"ASXL2","HGNC:23805","https://search.clinicalgenome.org/kb/genes/HGNC:23805","syndromic intellectual disability","MONDO:0000508","https://search.clinicalgenome.org/kb/conditions/MONDO:0000508","Autosomal dominant inheritance","0 - No Evidence for Haploinsufficiency (06/28/2018)","0 - No Evidence for Triplosensitivity (06/28/2018)","https://search.clinicalgenome.org/kb/gene-dosage/HGNC:23805","Dosage Working Group","definitive evidence (09/28/2021)","https://search.clinicalgenome.org/kb/gene-validity/CGGV:assertion_cedd313e-b43b-4212-840b-7d4172258b16-2021-09-28T115443.696Z","Intellectual Disability and Autism","","",""
"ASXL3","HGNC:29357","https://search.clinicalgenome.org/kb/genes/HGNC:29357","syndromic intellectual disability","MONDO:0000508","https://search.clinicalgenome.org/kb/conditions/MONDO:0000508","Autosomal dominant inheritance","3 - Sufficient Evidence for Haploinsufficiency (11/22/2017)","0 - No Evidence for Triplosensitivity (11/22/2017)","https://search.clinicalgenome.org/kb/gene-dosage/HGNC:29357","Dosage Working Group","definitive evidence (10/06/2021)","https://search.clinicalgenome.org/kb/gene-validity/CGGV:assertion_947933aa-f0f8-4909-abd8-2984dd11dcb8-2021-10-06T040000.000Z","Intellectual Disability and Autism","","",""
"ASXL3","HGNC:29357","https://search.clinicalgenome.org/kb/genes/HGNC:29357","severe feeding difficulties-failure to thrive-microcephaly due to ASXL3 deficiency syndrome","MONDO:0014205","https://search.clinicalgenome.org/kb/conditions/MONDO:0014205","N/A","3 - Sufficient Evidence for Haploinsufficiency (11/22/2017)","0 - No Evidence for Triplosensitivity (11/22/2017)","https://search.clinicalgenome.org/kb/gene-dosage/HGNC:29357","Dosage Working Group","","","","","",""
"ATCAY","HGNC:779","https://search.clinicalgenome.org/kb/genes/HGNC:779","Cayman type cerebellar ataxia","MONDO:0011025","https://search.clinicalgenome.org/kb/conditions/MONDO:0011025","N/A","30 - Gene Associated with Autosomal Recessive Phenotype (08/22/2016)","","https://search.clinicalgenome.org/kb/gene-dosage/HGNC:779","Dosage Working Group","","","","","",""
"ATE1","HGNC:782","https://search.clinicalgenome.org/kb/genes/HGNC:782","congenital heart disease","MONDO:0005453","https://search.clinicalgenome.org/kb/conditions/MONDO:0005453","Autosomal recessive inheritance","","","","","disputing (08/14/2023)","https://search.clinicalgenome.org/kb/gene-validity/CGGV:assertion_091bbd85-831a-4628-92f4-b2487d837eb6-2023-08-14T160000.000Z","Congenital Heart Disease","","",""
"ATF6","HGNC:791","https://search.clinicalgenome.org/kb/genes/HGNC:791","ATF6-related retinopathy","MONDO:0100447","https://search.clinicalgenome.org/kb/conditions/MONDO:0100447","Autosomal recessive inheritance","30 - Gene Associated with Autosomal Recessive Phenotype (01/12/2017)","0 - No Evidence for Triplosensitivity (01/12/2017)","https://search.clinicalgenome.org/kb/gene-dosage/HGNC:791","Dosage Working Group","definitive evidence (10/07/2021)","https://search.clinicalgenome.org/kb/gene-validity/CGGV:assertion_649d690a-8457-4c95-8d27-978daf4ac877-2021-10-07T160000.000Z","Retina","","",""
"ATF6","HGNC:791","https://search.clinicalgenome.org/kb/genes/HGNC:791","achromatopsia","MONDO:0018852","https://search.clinicalgenome.org/kb/conditions/MONDO:0018852","Autosomal recessive inheritance","30 - Gene Associated with Autosomal Recessive Phenotype (01/12/2017)","0 - No Evidence for Triplosensitivity (01/12/2017)","https://search.clinicalgenome.org/kb/gene-dosage/HGNC:791","Dosage Working Group","strong evidence (11/16/2016)","https://search.clinicalgenome.org/kb/gene-validity/CGGCIEX:assertion_4842","General Gene Curation","","",""
"ATF6","HGNC:791","https://search.clinicalgenome.org/kb/genes/HGNC:791","achromatopsia 7","MONDO:0014677","https://search.clinicalgenome.org/kb/conditions/MONDO:0014677","N/A","30 - Gene Associated with Autosomal Recessive Phenotype (01/12/2017)","0 - No Evidence for Triplosensitivity (01/12/2017)","https://search.clinicalgenome.org/kb/gene-dosage/HGNC:791","Dosage Working Group","","","","","",""
"ATG5","HGNC:589","https://search.clinicalgenome.org/kb/genes/HGNC:589","spinocerebellar ataxia, autosomal recessive 25","MONDO:0033115","https://search.clinicalgenome.org/kb/conditions/MONDO:0033115","Autosomal recessive inheritance","","","","","limited evidence (07/21/2022)","https://search.clinicalgenome.org/kb/gene-validity/CGGV:assertion_b47796b8-3811-4411-b0f0-5b703755f08b-2022-07-21T160000.000Z","Lysosomal Diseases GCEP","","",""
"ATG7","HGNC:16935","https://search.clinicalgenome.org/kb/genes/HGNC:16935","spinocerebellar ataxia, autosomal recessive 31","MONDO:0030323","https://search.clinicalgenome.org/kb/conditions/MONDO:0030323","Autosomal recessive inheritance","","","","","strong evidence (09/02/2022)","https://search.clinicalgenome.org/kb/gene-validity/CGGV:assertion_bfee65a8-cbc9-4f1a-a4f7-5973ecff593d-2022-09-02T160000.000Z","Lysosomal Diseases GCEP","","",""
"ATL1","HGNC:11231","https://search.clinicalgenome.org/kb/genes/HGNC:11231","neuropathy, hereditary sensory, type 1D","MONDO:0013381","https://search.clinicalgenome.org/kb/conditions/MONDO:0013381","Autosomal dominant inheritance","","","","","definitive evidence (02/10/2022)","https://search.clinicalgenome.org/kb/gene-validity/CGGV:assertion_0c0282d1-5ab4-4a86-b1f6-165a3dbd515a-2022-02-10T020857.711Z","Charcot-Marie-Tooth","","",""
"ATL3","HGNC:24526","https://search.clinicalgenome.org/kb/genes/HGNC:24526","neuropathy, hereditary sensory, type 1F","MONDO:0014286","https://search.clinicalgenome.org/kb/conditions/MONDO:0014286","Autosomal dominant inheritance","","","","","moderate evidence (07/13/2021)","https://search.clinicalgenome.org/kb/gene-validity/CGGV:assertion_132d0be7-2003-43ed-a934-1cf60cf45773-2021-07-13T160000.000Z","Charcot-Marie-Tooth","","",""
"ATM","HGNC:795","https://search.clinicalgenome.org/kb/genes/HGNC:795","ATM-related cancer predisposition","MONDO:0700270","https://search.clinicalgenome.org/kb/conditions/MONDO:0700270","Autosomal dominant inheritance","3 - Sufficient Evidence for Haploinsufficiency (04/08/2020)","0 - No Evidence for Triplosensitivity (04/08/2020)","https://search.clinicalgenome.org/kb/gene-dosage/HGNC:795","Dosage Working Group","definitive evidence (11/22/2024)","https://search.clinicalgenome.org/kb/gene-validity/CGGV:assertion_5acbaa2d-bdd3-40dd-b7e4-df0b0204468e-2024-11-22T180000.000Z","Hereditary Cancer","","",""
"ATM","HGNC:795","https://search.clinicalgenome.org/kb/genes/HGNC:795","ataxia telangiectasia","MONDO:0008840","https://search.clinicalgenome.org/kb/conditions/MONDO:0008840","Autosomal recessive inheritance","3 - Sufficient Evidence for Haploinsufficiency (04/08/2020)","0 - No Evidence for Triplosensitivity (04/08/2020)","https://search.clinicalgenome.org/kb/gene-dosage/HGNC:795","Dosage Working Group","definitive evidence (07/27/2021)","https://search.clinicalgenome.org/kb/gene-validity/CGGV:assertion_02a69e27-77dc-41bd-83d2-dda9c224ee43-2021-07-27T205239.729Z","Hereditary Cancer","","",""
"ATM","HGNC:795","https://search.clinicalgenome.org/kb/genes/HGNC:795","hereditary breast carcinoma","MONDO:0016419","https://search.clinicalgenome.org/kb/conditions/MONDO:0016419","N/A","3 - Sufficient Evidence for Haploinsufficiency (04/08/2020)","0 - No Evidence for Triplosensitivity (04/08/2020)","https://search.clinicalgenome.org/kb/gene-dosage/HGNC:795","Dosage Working Group","","","","Moderate Actionability (09/19/2017) | Has Insufficient Evidence for Actionability Based on Early Rule-out (06/04/2025)","https://actionability.clinicalgenome.org/ac/Adult/ui/stg2SummaryRpt?doc=AC127 | https://actionability.clinicalgenome.org/ac/Pediatric/ui/stg2SummaryRpt?doc=AC127","Adult Actionability Working Group | Pediatric Actionability Working Group"
"ATP11A","HGNC:13552","https://search.clinicalgenome.org/kb/genes/HGNC:13552","autosomal dominant nonsyndromic hearing loss","MONDO:0019587","https://search.clinicalgenome.org/kb/conditions/MONDO:0019587","Autosomal dominant inheritance","","","","","moderate evidence (05/21/2025)","https://search.clinicalgenome.org/kb/gene-validity/CGGV:assertion_d997f862-6a13-4da1-93cb-8fab590f87a8-2025-05-21T160000.000Z","Hearing Loss","","",""
"ATP13A2","HGNC:30213","https://search.clinicalgenome.org/kb/genes/HGNC:30213","Kufor-Rakeb syndrome","MONDO:0011706","https://search.clinicalgenome.org/kb/conditions/MONDO:0011706","Autosomal recessive inheritance","30 - Gene Associated with Autosomal Recessive Phenotype (08/22/2016)","","https://search.clinicalgenome.org/kb/gene-dosage/HGNC:30213","Dosage Working Group","definitive evidence (04/14/2022)","https://search.clinicalgenome.org/kb/gene-validity/CGGV:assertion_0ba5cb4f-3f7f-44dc-b2a5-0a2d62e510d4-2022-04-14T160000.000Z","Intellectual Disability and Autism","","",""
"ATP13A3","HGNC:24113","https://search.clinicalgenome.org/kb/genes/HGNC:24113","pulmonary arterial hypertension","MONDO:0015924","https://search.clinicalgenome.org/kb/conditions/MONDO:0015924","Semidominant inheritance","","","","","definitive evidence (11/09/2021)","https://search.clinicalgenome.org/kb/gene-validity/CGGV:assertion_5024e74a-fe6e-4eb2-89df-d07ff18e439c-2021-11-09T173936.225Z","Pulmonary Hypertension","","",""
"ATP1A1","HGNC:799","https://search.clinicalgenome.org/kb/genes/HGNC:799","Charcot-Marie-tooth disease, axonal, type 2DD","MONDO:0054833","https://search.clinicalgenome.org/kb/conditions/MONDO:0054833","Autosomal dominant inheritance","","","","","moderate evidence (10/10/2022)","https://search.clinicalgenome.org/kb/gene-validity/CGGV:assertion_65182954-6603-4880-85fa-352700bd784b-2022-10-10T160000.000Z","Charcot-Marie-Tooth","","",""
"ATP1A2","HGNC:800","https://search.clinicalgenome.org/kb/genes/HGNC:800","hemiplegic migraine-developmental and epileptic encephalopathy spectrum","MONDO:0100539","https://search.clinicalgenome.org/kb/conditions/MONDO:0100539","Autosomal dominant inheritance","","","","","definitive evidence (01/16/2024)","https://search.clinicalgenome.org/kb/gene-validity/CGGV:assertion_fe788a45-b8da-4377-acdb-5dd55fcc3130-2024-01-16T200000.000Z","Epilepsy","","",""
"ATP1A2","HGNC:800","https://search.clinicalgenome.org/kb/genes/HGNC:800","fetal akinesia, respiratory insufficiency, microcephaly, polymicrogyria, and dysmorphic facies","MONDO:0859204","https://search.clinicalgenome.org/kb/conditions/MONDO:0859204","Autosomal recessive inheritance","","","","","definitive evidence (07/01/2025)","https://search.clinicalgenome.org/kb/gene-validity/CGGV:assertion_fb2e7696-8d5d-48a2-892f-c8fad53c65f8-2025-07-01T160000.000Z","Prenatal","","",""
"ATP1A3","HGNC:801","https://search.clinicalgenome.org/kb/genes/HGNC:801","ATP1A3-associated neurological disorder","MONDO:0700002","https://search.clinicalgenome.org/kb/conditions/MONDO:0700002","Autosomal dominant inheritance","","","","","definitive evidence (05/22/2022)","https://search.clinicalgenome.org/kb/gene-validity/CGGV:assertion_2a572fef-35c5-46dd-8a69-af436b3ecdcc-2022-05-22T063513.942Z","Syndromic Disorders","","",""
"ATP2A1","HGNC:811","https://search.clinicalgenome.org/kb/genes/HGNC:811","Brody myopathy","MONDO:0010977","https://search.clinicalgenome.org/kb/conditions/MONDO:0010977","N/A","30 - Gene Associated with Autosomal Recessive Phenotype (08/22/2016)","0 - No Evidence for Triplosensitivity (08/22/2016)","https://search.clinicalgenome.org/kb/gene-dosage/HGNC:811","Dosage Working Group","","","","","",""
"ATP2B2","HGNC:815","https://search.clinicalgenome.org/kb/genes/HGNC:815","autosomal dominant nonsyndromic hearing loss","MONDO:0019587","https://search.clinicalgenome.org/kb/conditions/MONDO:0019587","Autosomal dominant inheritance","","","","","definitive evidence (07/22/2025)","https://search.clinicalgenome.org/kb/gene-validity/CGGV:assertion_193d07d0-5e1a-4ea1-84d6-377eb8fb5e7f-2025-07-22T160000.000Z","Hearing Loss","","",""
"ATP5MK","HGNC:30889","https://search.clinicalgenome.org/kb/genes/HGNC:30889","Leigh syndrome","MONDO:0009723","https://search.clinicalgenome.org/kb/conditions/MONDO:0009723","Autosomal recessive inheritance","","","","","moderate evidence (08/27/2020)","https://search.clinicalgenome.org/kb/gene-validity/CGGV:assertion_ff19a86d-404a-464e-8da6-8824ce45ed20-2020-08-27T164252.070Z","Mitochondrial Diseases","","",""
"ATP5MK","HGNC:30889","https://search.clinicalgenome.org/kb/genes/HGNC:30889","mitochondrial disease","MONDO:0044970","https://search.clinicalgenome.org/kb/conditions/MONDO:0044970","Autosomal recessive inheritance","","","","","moderate evidence (04/15/2024)","https://search.clinicalgenome.org/kb/gene-validity/CGGV:assertion_1b48db69-0e48-47b6-bbd3-4c09ade82a73-2024-04-15T040000.000Z","Mitochondrial Diseases","","",""
"ATP6AP1","HGNC:868","https://search.clinicalgenome.org/kb/genes/HGNC:868","congenital disorder of glycosylation type II","MONDO:0005501","https://search.clinicalgenome.org/kb/conditions/MONDO:0005501","X-linked inheritance","","","","","definitive evidence (05/15/2024)","https://search.clinicalgenome.org/kb/gene-validity/CGGV:assertion_c6bfce2b-c20c-40f9-b2f5-d81f76a328f7-2024-05-15T160000.000Z","Congenital Disorders of Glycosylation","","",""
"ATP6AP2","HGNC:18305","https://search.clinicalgenome.org/kb/genes/HGNC:18305","ATP6AP2-related disorder","MONDO:0100146","https://search.clinicalgenome.org/kb/conditions/MONDO:0100146","X-linked inheritance","0 - No Evidence for Haploinsufficiency (10/31/2012)","0 - No Evidence for Triplosensitivity (10/31/2012)","https://search.clinicalgenome.org/kb/gene-dosage/HGNC:18305","Dosage Working Group","definitive evidence (09/14/2020)","https://search.clinicalgenome.org/kb/gene-validity/CGGV:assertion_ac33652a-dd98-46f4-ba4e-d3d5a482a22e-2020-09-14T160000.000Z","Intellectual Disability and Autism","","",""
"ATP6V0A2","HGNC:18481","https://search.clinicalgenome.org/kb/genes/HGNC:18481","autosomal recessive cutis laxa type 2A","MONDO:0018163","https://search.clinicalgenome.org/kb/conditions/MONDO:0018163","Autosomal recessive inheritance","30 - Gene Associated with Autosomal Recessive Phenotype (08/22/2016)","0 - No Evidence for Triplosensitivity (08/22/2016)","https://search.clinicalgenome.org/kb/gene-dosage/HGNC:18481","Dosage Working Group","definitive evidence (04/03/2024)","https://search.clinicalgenome.org/kb/gene-validity/CGGV:assertion_67eb6244-012c-48c0-a409-874636825d85-2024-04-03T160000.000Z","Congenital Disorders of Glycosylation","","",""
"ATP6V0A4","HGNC:866","https://search.clinicalgenome.org/kb/genes/HGNC:866","renal tubular acidosis, distal, 3, with or without sensorineural hearing loss","MONDO:0011268","https://search.clinicalgenome.org/kb/conditions/MONDO:0011268","N/A","30 - Gene Associated with Autosomal Recessive Phenotype (08/22/2016)","","https://search.clinicalgenome.org/kb/gene-dosage/HGNC:866","Dosage Working Group","","","","","",""
"ATP6V1A","HGNC:851","https://search.clinicalgenome.org/kb/genes/HGNC:851","autosomal recessive cutis laxa type 2D","MONDO:0027451","https://search.clinicalgenome.org/kb/conditions/MONDO:0027451","Autosomal recessive inheritance","","","","","limited evidence (04/03/2024)","https://search.clinicalgenome.org/kb/gene-validity/CGGV:assertion_f9b7d66a-3d77-4515-aa6b-9f33e59f2f09-2024-04-03T160000.000Z","Congenital Disorders of Glycosylation","","",""
"ATP6V1B1","HGNC:853","https://search.clinicalgenome.org/kb/genes/HGNC:853","renal tubular acidosis, distal, 2, with progressive sensorineural hearing loss","MONDO:0009968","https://search.clinicalgenome.org/kb/conditions/MONDO:0009968","Autosomal recessive inheritance","","","","","definitive evidence (12/19/2017)","https://search.clinicalgenome.org/kb/gene-validity/CGGV:assertion_c74d3789-9cfc-4be3-b23d-baf610620e6c-2017-12-19T050000.000Z","Hearing Loss","","",""
"ATP6V1E1","HGNC:857","https://search.clinicalgenome.org/kb/genes/HGNC:857","autosomal recessive cutis laxa type 2C","MONDO:0027462","https://search.clinicalgenome.org/kb/conditions/MONDO:0027462","Autosomal recessive inheritance","0 - No Evidence for Haploinsufficiency (04/26/2012)","0 - No Evidence for Triplosensitivity (04/26/2012)","https://search.clinicalgenome.org/kb/gene-dosage/HGNC:857","Dosage Working Group","limited evidence (05/01/2024)","https://search.clinicalgenome.org/kb/gene-validity/CGGV:assertion_d86dbf9e-ebed-446b-8291-e5838e37fd06-2024-05-01T160000.000Z","Congenital Disorders of Glycosylation","","",""
"ATP7A","HGNC:869","https://search.clinicalgenome.org/kb/genes/HGNC:869","Menkes disease","MONDO:0010651","https://search.clinicalgenome.org/kb/conditions/MONDO:0010651","X-linked inheritance","3 - Sufficient Evidence for Haploinsufficiency (03/24/2021)","0 - No Evidence for Triplosensitivity (03/24/2021)","https://search.clinicalgenome.org/kb/gene-dosage/HGNC:869","Dosage Working Group","definitive evidence (02/07/2018)","https://search.clinicalgenome.org/kb/gene-validity/CGGV:assertion_9bc50734-316b-47db-ba10-61f3fde46cca-2018-02-07T170000.000Z","Intellectual Disability and Autism","Moderate Actionability (01/17/2019)","https://actionability.clinicalgenome.org/ac/Pediatric/ui/stg2SummaryRpt?doc=AC013","Pediatric Actionability Working Group"
"ATP7A","HGNC:869","https://search.clinicalgenome.org/kb/genes/HGNC:869","X-linked distal spinal muscular atrophy type 3","MONDO:0010338","https://search.clinicalgenome.org/kb/conditions/MONDO:0010338","X-linked inheritance","3 - Sufficient Evidence for Haploinsufficiency (03/24/2021)","0 - No Evidence for Triplosensitivity (03/24/2021)","https://search.clinicalgenome.org/kb/gene-dosage/HGNC:869","Dosage Working Group","moderate evidence (01/10/2023)","https://search.clinicalgenome.org/kb/gene-validity/CGGV:assertion_ec7c42f3-3cad-4020-aa75-cf103c5381ba-2023-01-10T170000.000Z","Charcot-Marie-Tooth","","",""
"ATP7B","HGNC:870","https://search.clinicalgenome.org/kb/genes/HGNC:870","Wilson disease","MONDO:0010200","https://search.clinicalgenome.org/kb/conditions/MONDO:0010200","Autosomal recessive inheritance","30 - Gene Associated with Autosomal Recessive Phenotype (01/12/2017)","0 - No Evidence for Triplosensitivity (01/12/2017)","https://search.clinicalgenome.org/kb/gene-dosage/HGNC:870","Dosage Working Group","definitive evidence (03/27/2019)","https://search.clinicalgenome.org/kb/gene-validity/CGGV:assertion_f0ac0a41-d7d5-4377-a622-1ee9bc4ed9f3-2019-03-27T160000.000Z","General Gene Curation","Strong Actionability (02/14/2022) | Definitive Actionability (02/14/2022)","https://actionability.clinicalgenome.org/ac/Adult/ui/stg2SummaryRpt?doc=AC028 | https://actionability.clinicalgenome.org/ac/Pediatric/ui/stg2SummaryRpt?doc=AC028","Adult Actionability Working Group | Pediatric Actionability Working Group"
"ATP8A2","HGNC:13533","https://search.clinicalgenome.org/kb/genes/HGNC:13533","cerebellar ataxia, intellectual disability, and dysequilibrium","MONDO:0009133","https://search.clinicalgenome.org/kb/conditions/MONDO:0009133","Autosomal recessive inheritance","30 - Gene Associated with Autosomal Recessive Phenotype (03/28/2023)","0 - No Evidence for Triplosensitivity (03/28/2023)","https://search.clinicalgenome.org/kb/gene-dosage/HGNC:13533","Dosage Working Group","definitive evidence (04/03/2025)","https://search.clinicalgenome.org/kb/gene-validity/CGGV:assertion_e6919cb8-703a-4f80-932b-2238f7bc08d6-2025-04-03T160000.000Z","Cerebral Palsy","","",""
"ATP8A2","HGNC:13533","https://search.clinicalgenome.org/kb/genes/HGNC:13533","cerebellar ataxia, intellectual disability, and dysequilibrium syndrome 4","MONDO:0014104","https://search.clinicalgenome.org/kb/conditions/MONDO:0014104","N/A","30 - Gene Associated with Autosomal Recessive Phenotype (03/28/2023)","0 - No Evidence for Triplosensitivity (03/28/2023)","https://search.clinicalgenome.org/kb/gene-dosage/HGNC:13533","Dosage Working Group","","","","","",""
"ATPAF2","HGNC:18802","https://search.clinicalgenome.org/kb/genes/HGNC:18802","mitochondrial disease","MONDO:0044970","https://search.clinicalgenome.org/kb/conditions/MONDO:0044970","Autosomal recessive inheritance","30 - Gene Associated with Autosomal Recessive Phenotype (08/22/2016)","0 - No Evidence for Triplosensitivity (08/22/2016)","https://search.clinicalgenome.org/kb/gene-dosage/HGNC:18802","Dosage Working Group","limited evidence (04/04/2022)","https://search.clinicalgenome.org/kb/gene-validity/CGGV:assertion_cfb2ce05-0eb4-4b98-95e5-e01cac3131ac-2022-04-04T040000.000Z","Mitochondrial Diseases","","",""
"ATPAF2","HGNC:18802","https://search.clinicalgenome.org/kb/genes/HGNC:18802","mitochondrial complex V (ATP synthase) deficiency, nuclear type 1","MONDO:0011421","https://search.clinicalgenome.org/kb/conditions/MONDO:0011421","N/A","30 - Gene Associated with Autosomal Recessive Phenotype (08/22/2016)","0 - No Evidence for Triplosensitivity (08/22/2016)","https://search.clinicalgenome.org/kb/gene-dosage/HGNC:18802","Dosage Working Group","","","","","",""
"ATR","HGNC:882","https://search.clinicalgenome.org/kb/genes/HGNC:882","familial cutaneous telangiectasia and oropharyngeal predisposition cancer syndrome","MONDO:0013806","https://search.clinicalgenome.org/kb/conditions/MONDO:0013806","N/A","1 - Little Evidence for Haploinsufficiency (06/05/2020)","0 - No Evidence for Triplosensitivity (06/05/2020)","https://search.clinicalgenome.org/kb/gene-dosage/HGNC:882","Dosage Working Group","","","","","",""
"ATRIP","HGNC:33499","https://search.clinicalgenome.org/kb/genes/HGNC:33499","hereditary breast carcinoma","MONDO:0016419","https://search.clinicalgenome.org/kb/conditions/MONDO:0016419","Autosomal dominant inheritance","","","","","limited evidence (08/29/2024)","https://search.clinicalgenome.org/kb/gene-validity/CGGV:assertion_7d3d3117-9df2-4dbf-a925-e6a77945c8b7-2024-08-29T170000.000Z","Hereditary Cancer","","",""
"ATRX","HGNC:886","https://search.clinicalgenome.org/kb/genes/HGNC:886","ATR-X-related syndrome","MONDO:0016980","https://search.clinicalgenome.org/kb/conditions/MONDO:0016980","X-linked inheritance","3 - Sufficient Evidence for Haploinsufficiency (07/31/2012)","0 - No Evidence for Triplosensitivity (07/31/2012)","https://search.clinicalgenome.org/kb/gene-dosage/HGNC:886","Dosage Working Group","definitive evidence (09/29/2021)","https://search.clinicalgenome.org/kb/gene-validity/CGGV:assertion_5296ecdf-b709-47bd-9032-daec8b91e300-2021-09-28T220000.000Z","Intellectual Disability and Autism","","",""
"ATRX","HGNC:886","https://search.clinicalgenome.org/kb/genes/HGNC:886","alpha thalassemia-X-linked intellectual disability syndrome","MONDO:0010519","https://search.clinicalgenome.org/kb/conditions/MONDO:0010519","N/A","3 - Sufficient Evidence for Haploinsufficiency (07/31/2012)","0 - No Evidence for Triplosensitivity (07/31/2012)","https://search.clinicalgenome.org/kb/gene-dosage/HGNC:886","Dosage Working Group","","","","","",""
"ATXN2","HGNC:10555","https://search.clinicalgenome.org/kb/genes/HGNC:10555","spinocerebellar ataxia type 2","MONDO:0008458","https://search.clinicalgenome.org/kb/conditions/MONDO:0008458","Autosomal dominant inheritance","","","","","definitive evidence (02/13/2024)","https://search.clinicalgenome.org/kb/gene-validity/CGGV:assertion_a5f9701f-a9a7-4689-9aec-27b3cbb06129-2024-02-13T170000.000Z","Amyotrophic Lateral Sclerosis Spectrum Disorders","","",""
"AUH","HGNC:890","https://search.clinicalgenome.org/kb/genes/HGNC:890","3-methylglutaconic aciduria type 1","MONDO:0009610","https://search.clinicalgenome.org/kb/conditions/MONDO:0009610","Autosomal recessive inheritance","","","","","definitive evidence (06/29/2020)","https://search.clinicalgenome.org/kb/gene-validity/CGGV:assertion_681f6747-37ce-498e-8bb1-eddd55a90e2c-2020-06-29T174231.569Z","Aminoacidopathy","","",""
"AUTS2","HGNC:14262","https://search.clinicalgenome.org/kb/genes/HGNC:14262","syndromic intellectual disability","MONDO:0000508","https://search.clinicalgenome.org/kb/conditions/MONDO:0000508","Autosomal dominant inheritance","3 - Sufficient Evidence for Haploinsufficiency (06/24/2020)","0 - No Evidence for Triplosensitivity (06/24/2020)","https://search.clinicalgenome.org/kb/gene-dosage/HGNC:14262","Dosage Working Group","definitive evidence (09/01/2020)","https://search.clinicalgenome.org/kb/gene-validity/CGGV:assertion_582999f6-b3b4-46de-90a0-8f44e22df469-2020-09-01T160000.000Z","Intellectual Disability and Autism","","",""
"AUTS2","HGNC:14262","https://search.clinicalgenome.org/kb/genes/HGNC:14262","autism spectrum disorder due to AUTS2 deficiency","MONDO:0014361","https://search.clinicalgenome.org/kb/conditions/MONDO:0014361","N/A","3 - Sufficient Evidence for Haploinsufficiency (06/24/2020)","0 - No Evidence for Triplosensitivity (06/24/2020)","https://search.clinicalgenome.org/kb/gene-dosage/HGNC:14262","Dosage Working Group","","","","","",""
"AVIL","HGNC:14188","https://search.clinicalgenome.org/kb/genes/HGNC:14188","nephrotic syndrome, type 21","MONDO:0032826","https://search.clinicalgenome.org/kb/conditions/MONDO:0032826","Autosomal recessive inheritance","","","","","limited evidence (08/27/2024)","https://search.clinicalgenome.org/kb/gene-validity/CGGV:assertion_04806c21-071c-4a74-96c2-ab89ef5ba0e0-2024-08-27T180000.000Z","Glomerulopathy","","",""
"AVPR1A","HGNC:895","https://search.clinicalgenome.org/kb/genes/HGNC:895","autism spectrum disorder","MONDO:0005258","https://search.clinicalgenome.org/kb/conditions/MONDO:0005258","Mode of inheritance","","","","","disputing (03/01/2022)","https://search.clinicalgenome.org/kb/gene-validity/CGGV:assertion_8ea232de-063f-489a-b00a-8c5d11dbe43a-2022-03-01T050000.000Z","Intellectual Disability and Autism","","",""
"AVPR2","HGNC:897","https://search.clinicalgenome.org/kb/genes/HGNC:897","diabetes insipidus, nephrogenic, X-linked","MONDO:0010581","https://search.clinicalgenome.org/kb/conditions/MONDO:0010581","N/A","3 - Sufficient Evidence for Haploinsufficiency (02/01/2021)","0 - No Evidence for Triplosensitivity (02/01/2021)","https://search.clinicalgenome.org/kb/gene-dosage/HGNC:897","Dosage Working Group","","","","","",""
"AXIN2","HGNC:904","https://search.clinicalgenome.org/kb/genes/HGNC:904","oligodontia-cancer predisposition syndrome","MONDO:0012075","https://search.clinicalgenome.org/kb/conditions/MONDO:0012075","Autosomal dominant inheritance","3 - Sufficient Evidence for Haploinsufficiency (12/08/2021)","0 - No Evidence for Triplosensitivity (12/08/2021)","https://search.clinicalgenome.org/kb/gene-dosage/HGNC:904","Dosage Working Group","definitive evidence (12/20/2023)","https://search.clinicalgenome.org/kb/gene-validity/CGGV:assertion_cb1ae839-6186-44f7-85fe-8642b6c180ba-2023-12-20T180000.000Z","Hereditary Cancer","","",""
"B2M","HGNC:914","https://search.clinicalgenome.org/kb/genes/HGNC:914","hypoproteinemia, hypercatabolic","MONDO:0009434","https://search.clinicalgenome.org/kb/conditions/MONDO:0009434","Autosomal recessive inheritance","","","","","limited evidence (04/18/2024)","https://search.clinicalgenome.org/kb/gene-validity/CGGV:assertion_56366640-5981-436e-bfa1-8d1edf14ac3f-2024-04-18T160000.000Z","SCID-CID","","",""
"B3GALNT2","HGNC:28596","https://search.clinicalgenome.org/kb/genes/HGNC:28596","muscular dystrophy-dystroglycanopathy (congenital with brain and eye anomalies), type a, 11","MONDO:0014071","https://search.clinicalgenome.org/kb/conditions/MONDO:0014071","N/A","30 - Gene Associated with Autosomal Recessive Phenotype (08/22/2016)","","https://search.clinicalgenome.org/kb/gene-dosage/HGNC:28596","Dosage Working Group","","","","","",""
"B3GALT6","HGNC:17978","https://search.clinicalgenome.org/kb/genes/HGNC:17978","B3GALT6-congenital disorder of glycosylation","MONDO:0100586","https://search.clinicalgenome.org/kb/conditions/MONDO:0100586","Autosomal recessive inheritance","30 - Gene Associated with Autosomal Recessive Phenotype (08/22/2016)","0 - No Evidence for Triplosensitivity (08/22/2016)","https://search.clinicalgenome.org/kb/gene-dosage/HGNC:17978","Dosage Working Group","definitive evidence (04/04/2025)","https://search.clinicalgenome.org/kb/gene-validity/CGGV:assertion_4e67a52c-3e93-4bc2-bbc6-05f8dc9be657-2025-04-04T170000.000Z","Congenital Disorders of Glycosylation","","",""
"B3GALT6","HGNC:17978","https://search.clinicalgenome.org/kb/genes/HGNC:17978","spondyloepimetaphyseal dysplasia with joint laxity, type 1, with or without fractures","MONDO:0010075","https://search.clinicalgenome.org/kb/conditions/MONDO:0010075","N/A","30 - Gene Associated with Autosomal Recessive Phenotype (08/22/2016)","0 - No Evidence for Triplosensitivity (08/22/2016)","https://search.clinicalgenome.org/kb/gene-dosage/HGNC:17978","Dosage Working Group","","","","","",""
"B4GALNT1","HGNC:4117","https://search.clinicalgenome.org/kb/genes/HGNC:4117","complex hereditary spastic paraplegia","MONDO:0015150","https://search.clinicalgenome.org/kb/conditions/MONDO:0015150","Autosomal recessive inheritance","","","","","definitive evidence (06/01/2023)","https://search.clinicalgenome.org/kb/gene-validity/CGGV:assertion_4cabf677-8fa5-4455-831c-1d06dd48c780-2023-06-01T060000.000Z","Cerebral Palsy","","",""
"B4GALT1","HGNC:924","https://search.clinicalgenome.org/kb/genes/HGNC:924","B4GALT1-congenital disorder of glycosylation","MONDO:0011772","https://search.clinicalgenome.org/kb/conditions/MONDO:0011772","N/A","30 - Gene Associated with Autosomal Recessive Phenotype (08/22/2016)","0 - No Evidence for Triplosensitivity (08/22/2016)","https://search.clinicalgenome.org/kb/gene-dosage/HGNC:924","Dosage Working Group","","","","","",""
"B4GALT7","HGNC:930","https://search.clinicalgenome.org/kb/genes/HGNC:930","Ehlers-Danlos syndrome, spondylodysplastic type, 1","MONDO:0020682","https://search.clinicalgenome.org/kb/conditions/MONDO:0020682","Autosomal recessive inheritance","30 - Gene Associated with Autosomal Recessive Phenotype (08/22/2016)","0 - No Evidence for Triplosensitivity (08/22/2016)","https://search.clinicalgenome.org/kb/gene-dosage/HGNC:930","Dosage Working Group","definitive evidence (08/05/2024)","https://search.clinicalgenome.org/kb/gene-validity/CGGV:assertion_19ab23bf-37ed-46bc-af9e-d3fc39adaf15-2024-08-05T160000.000Z","Skeletal Disorders","","",""
"B4GAT1","HGNC:15685","https://search.clinicalgenome.org/kb/genes/HGNC:15685","muscular dystrophy-dystroglycanopathy (congenital with brain and eye anomalies), type A13","MONDO:0014120","https://search.clinicalgenome.org/kb/conditions/MONDO:0014120","Autosomal recessive inheritance","","","","","moderate evidence (07/08/2025)","https://search.clinicalgenome.org/kb/gene-validity/CGGV:assertion_5fdad7b1-d881-4d7c-a9ab-34812a92ae24-2025-07-08T190000.000Z","Brain Malformations","","",""
"B9D1","HGNC:24123","https://search.clinicalgenome.org/kb/genes/HGNC:24123","ciliopathy","MONDO:0005308","https://search.clinicalgenome.org/kb/conditions/MONDO:0005308","Autosomal recessive inheritance","30 - Gene Associated with Autosomal Recessive Phenotype (08/22/2016)","0 - No Evidence for Triplosensitivity (08/22/2016)","https://search.clinicalgenome.org/kb/gene-dosage/HGNC:24123","Dosage Working Group","definitive evidence (05/08/2023)","https://search.clinicalgenome.org/kb/gene-validity/CGGV:assertion_8d682069-b65a-46d5-973a-6b43ba1a80e1-2023-05-08T160000.000Z","Kidney Cystic and Ciliopathy Disorders","","",""
"B9D1","HGNC:24123","https://search.clinicalgenome.org/kb/genes/HGNC:24123","Joubert syndrome 27","MONDO:0014927","https://search.clinicalgenome.org/kb/conditions/MONDO:0014927","N/A","30 - Gene Associated with Autosomal Recessive Phenotype (08/22/2016)","0 - No Evidence for Triplosensitivity (08/22/2016)","https://search.clinicalgenome.org/kb/gene-dosage/HGNC:24123","Dosage Working Group","","","","","",""
"B9D2","HGNC:28636","https://search.clinicalgenome.org/kb/genes/HGNC:28636","ciliopathy","MONDO:0005308","https://search.clinicalgenome.org/kb/conditions/MONDO:0005308","Autosomal recessive inheritance","","","","","moderate evidence (06/12/2023)","https://search.clinicalgenome.org/kb/gene-validity/CGGV:assertion_ebe1140c-09cc-4d05-8886-5a78267afe65-2023-06-12T160000.000Z","Kidney Cystic and Ciliopathy Disorders","","",""
"BAAT","HGNC:932","https://search.clinicalgenome.org/kb/genes/HGNC:932","bile acid CoA:amino acid N-acyltransferase deficiency","MONDO:0100305","https://search.clinicalgenome.org/kb/conditions/MONDO:0100305","Autosomal recessive inheritance","","","","","moderate evidence (06/21/2024)","https://search.clinicalgenome.org/kb/gene-validity/CGGV:assertion_9b732497-a853-45af-bf8e-b3ad663159f1-2024-06-21T160000.000Z","Peroxisomal Disorders","","",""
"BACH2","HGNC:14078","https://search.clinicalgenome.org/kb/genes/HGNC:14078","immunodeficiency 60","MONDO:0032723","https://search.clinicalgenome.org/kb/conditions/MONDO:0032723","Autosomal dominant inheritance","","","","","moderate evidence (02/21/2023)","https://search.clinicalgenome.org/kb/gene-validity/CGGV:assertion_2473560a-6e5c-4342-a6e2-c89e37f4cc71-2023-02-21T180000.000Z","Antibody Deficiencies GCEP","","",""
"BAG3","HGNC:939","https://search.clinicalgenome.org/kb/genes/HGNC:939","dilated cardiomyopathy","MONDO:0005021","https://search.clinicalgenome.org/kb/conditions/MONDO:0005021","Autosomal dominant inheritance","3 - Sufficient Evidence for Haploinsufficiency (02/12/2015)","0 - No Evidence for Triplosensitivity (02/12/2015)","https://search.clinicalgenome.org/kb/gene-dosage/HGNC:939","Dosage Working Group","definitive evidence (05/30/2025)","https://search.clinicalgenome.org/kb/gene-validity/CGGV:assertion_1bec07e1-0186-4f45-bd8e-7d8a0f2547a9-2025-05-30T160000.000Z","Dilated Cardiomyopathy","","",""
"BAG3","HGNC:939","https://search.clinicalgenome.org/kb/genes/HGNC:939","myofibrillar myopathy","MONDO:0018943","https://search.clinicalgenome.org/kb/conditions/MONDO:0018943","Autosomal dominant inheritance","3 - Sufficient Evidence for Haploinsufficiency (02/12/2015)","0 - No Evidence for Triplosensitivity (02/12/2015)","https://search.clinicalgenome.org/kb/gene-dosage/HGNC:939","Dosage Working Group","definitive evidence (12/18/2016)","https://search.clinicalgenome.org/kb/gene-validity/CGGCIEX:assertion_5466","General Gene Curation","Has Insufficient Evidence for Actionability Based on Expert Review (09/06/2018)","https://actionability.clinicalgenome.org/ac/Adult/ui/stg2SummaryRpt?doc=AC155","Adult Actionability Working Group"
"BAG3","HGNC:939","https://search.clinicalgenome.org/kb/genes/HGNC:939","myofibrillar myopathy 6","MONDO:0013061","https://search.clinicalgenome.org/kb/conditions/MONDO:0013061","N/A","3 - Sufficient Evidence for Haploinsufficiency (02/12/2015)","0 - No Evidence for Triplosensitivity (02/12/2015)","https://search.clinicalgenome.org/kb/gene-dosage/HGNC:939","Dosage Working Group","","","","Has Insufficient Evidence for Actionability Based on Expert Review (09/06/2018)","https://actionability.clinicalgenome.org/ac/Adult/ui/stg2SummaryRpt?doc=AC155","Adult Actionability Working Group"
"BAG5","HGNC:941","https://search.clinicalgenome.org/kb/genes/HGNC:941","dilated cardiomyopathy","MONDO:0005021","https://search.clinicalgenome.org/kb/conditions/MONDO:0005021","Autosomal recessive inheritance","","","","","moderate evidence (06/14/2024)","https://search.clinicalgenome.org/kb/gene-validity/CGGV:assertion_97fe83b7-fe12-4014-9706-6847446fa9bd-2024-06-14T160000.000Z","Dilated Cardiomyopathy","","",""
"BANF1","HGNC:17397","https://search.clinicalgenome.org/kb/genes/HGNC:17397","Nestor-Guillermo progeria syndrome","MONDO:0013523","https://search.clinicalgenome.org/kb/conditions/MONDO:0013523","Autosomal recessive inheritance","","","","","limited evidence (04/03/2024)","https://search.clinicalgenome.org/kb/gene-validity/CGGV:assertion_2e2059e5-b7a5-42fe-93b7-182982608431-2024-04-03T160000.000Z","Syndromic Disorders","","",""
"BAP1","HGNC:950","https://search.clinicalgenome.org/kb/genes/HGNC:950","BAP1-related tumor predisposition syndrome","MONDO:0013692","https://search.clinicalgenome.org/kb/conditions/MONDO:0013692","Autosomal dominant inheritance","3 - Sufficient Evidence for Haploinsufficiency (01/30/2025)","0 - No Evidence for Triplosensitivity (01/30/2025)","https://search.clinicalgenome.org/kb/gene-dosage/HGNC:950","Dosage Working Group","definitive evidence (03/21/2019)","https://search.clinicalgenome.org/kb/gene-validity/CGGV:assertion_d70c33af-2e4f-4489-9c29-797655015b1d-2019-03-21T175713.803Z","Hereditary Cancer","Assertion Pending (07/06/2017)","https://actionability.clinicalgenome.org/ac/Adult/ui/stg2SummaryRpt?doc=AC139","Adult Actionability Working Group"
"BARD1","HGNC:952","https://search.clinicalgenome.org/kb/genes/HGNC:952","familial ovarian cancer","MONDO:0016248","https://search.clinicalgenome.org/kb/conditions/MONDO:0016248","Autosomal dominant inheritance","3 - Sufficient Evidence for Haploinsufficiency (05/01/2020)","0 - No Evidence for Triplosensitivity (05/01/2020)","https://search.clinicalgenome.org/kb/gene-dosage/HGNC:952","Dosage Working Group","disputing (08/29/2024)","https://search.clinicalgenome.org/kb/gene-validity/CGGV:assertion_02af8326-360e-4f42-a378-fefff7387d97-2024-08-29T170000.000Z","Hereditary Cancer","","",""
"BARD1","HGNC:952","https://search.clinicalgenome.org/kb/genes/HGNC:952","BARD1-related cancer predisposition","MONDO:0700267","https://search.clinicalgenome.org/kb/conditions/MONDO:0700267","Autosomal dominant inheritance","3 - Sufficient Evidence for Haploinsufficiency (05/01/2020)","0 - No Evidence for Triplosensitivity (05/01/2020)","https://search.clinicalgenome.org/kb/gene-dosage/HGNC:952","Dosage Working Group","definitive evidence (09/03/2024)","https://search.clinicalgenome.org/kb/gene-validity/CGGV:assertion_09113d8c-ba63-40f1-9c8f-08b67c6c867c-2024-09-03T170000.000Z","Hereditary Cancer","Has Insufficient Evidence for Actionability Based on Early Rule-out (09/12/2022) | Moderate Actionability (05/14/2024)","https://actionability.clinicalgenome.org/ac/Pediatric/ui/stg2SummaryRpt?doc=AC1054 | https://actionability.clinicalgenome.org/ac/Adult/ui/stg2SummaryRpt?doc=AC1054","Pediatric Actionability Working Group | Adult Actionability Working Group"
"BARD1","HGNC:952","https://search.clinicalgenome.org/kb/genes/HGNC:952","hereditary breast carcinoma","MONDO:0016419","https://search.clinicalgenome.org/kb/conditions/MONDO:0016419","N/A","3 - Sufficient Evidence for Haploinsufficiency (05/01/2020)","0 - No Evidence for Triplosensitivity (05/01/2020)","https://search.clinicalgenome.org/kb/gene-dosage/HGNC:952","Dosage Working Group","","","","","",""
"BAZ2B","HGNC:963","https://search.clinicalgenome.org/kb/genes/HGNC:963","complex neurodevelopmental disorder","MONDO:0100038","https://search.clinicalgenome.org/kb/conditions/MONDO:0100038","Autosomal dominant inheritance","","","","","limited evidence (10/19/2022)","https://search.clinicalgenome.org/kb/gene-validity/CGGV:assertion_be8c5c40-5fe7-4247-b1d2-b11ca339b365-2022-10-19T040000.000Z","Intellectual Disability and Autism","","",""
"BBS1","HGNC:966","https://search.clinicalgenome.org/kb/genes/HGNC:966","BBS1-related ciliopathy","MONDO:1040043","https://search.clinicalgenome.org/kb/conditions/MONDO:1040043","Autosomal recessive inheritance","","","","","definitive evidence (12/07/2023)","https://search.clinicalgenome.org/kb/gene-validity/CGGV:assertion_ee6e7562-927a-459b-a0f1-ccd849c7e783-2023-12-07T170000.000Z","Retina","","",""
"BBS10","HGNC:26291","https://search.clinicalgenome.org/kb/genes/HGNC:26291","BBS10-related ciliopathy","MONDO:0700237","https://search.clinicalgenome.org/kb/conditions/MONDO:0700237","Autosomal recessive inheritance","","","","","definitive evidence (08/03/2023)","https://search.clinicalgenome.org/kb/gene-validity/CGGV:assertion_f9eb490e-1977-426e-ac7a-c507bbc38490-2023-08-03T160000.000Z","Retina","","",""
"BBS12","HGNC:26648","https://search.clinicalgenome.org/kb/genes/HGNC:26648","BBS12-related ciliopathy","MONDO:1040045","https://search.clinicalgenome.org/kb/conditions/MONDO:1040045","Autosomal recessive inheritance","30 - Gene Associated with Autosomal Recessive Phenotype (08/22/2016)","0 - No Evidence for Triplosensitivity (08/22/2016)","https://search.clinicalgenome.org/kb/gene-dosage/HGNC:26648","Dosage Working Group","definitive evidence (01/04/2024)","https://search.clinicalgenome.org/kb/gene-validity/CGGV:assertion_3aefcbae-bf06-45da-b3be-a550e997257a-2024-01-04T170000.000Z","Retina","","",""
"BBS12","HGNC:26648","https://search.clinicalgenome.org/kb/genes/HGNC:26648","Bardet-Biedl syndrome 12","MONDO:0014440","https://search.clinicalgenome.org/kb/conditions/MONDO:0014440","N/A","30 - Gene Associated with Autosomal Recessive Phenotype (08/22/2016)","0 - No Evidence for Triplosensitivity (08/22/2016)","https://search.clinicalgenome.org/kb/gene-dosage/HGNC:26648","Dosage Working Group","","","","","",""
"BBS2","HGNC:967","https://search.clinicalgenome.org/kb/genes/HGNC:967","BBS2-related ciliopathy","MONDO:1040048","https://search.clinicalgenome.org/kb/conditions/MONDO:1040048","Autosomal recessive inheritance","","","","","definitive evidence (03/07/2024)","https://search.clinicalgenome.org/kb/gene-validity/CGGV:assertion_be74a060-cfb3-4180-a107-cfaf0e81bfa3-2024-03-07T170000.000Z","Retina","","",""
"BBS4","HGNC:969","https://search.clinicalgenome.org/kb/genes/HGNC:969","BBS4-related ciliopathy","MONDO:1040044","https://search.clinicalgenome.org/kb/conditions/MONDO:1040044","Autosomal recessive inheritance","","","","","definitive evidence (12/07/2023)","https://search.clinicalgenome.org/kb/gene-validity/CGGV:assertion_988d537d-5595-4b8f-bbc4-8e3aefc025fa-2023-12-07T170000.000Z","Retina","","",""
"BBS5","HGNC:970","https://search.clinicalgenome.org/kb/genes/HGNC:970","BBS5-related ciliopathy","MONDO:1040047","https://search.clinicalgenome.org/kb/conditions/MONDO:1040047","Autosomal recessive inheritance","30 - Gene Associated with Autosomal Recessive Phenotype (10/12/2015)","0 - No Evidence for Triplosensitivity (10/12/2015)","https://search.clinicalgenome.org/kb/gene-dosage/HGNC:970","Dosage Working Group","definitive evidence (12/07/2023)","https://search.clinicalgenome.org/kb/gene-validity/CGGV:assertion_bdb1249e-ab95-4d34-a43f-1dbb09eb3d94-2023-12-07T170000.000Z","Retina","","",""
"BBS5","HGNC:970","https://search.clinicalgenome.org/kb/genes/HGNC:970","Bardet-Biedl syndrome 5","MONDO:0014434","https://search.clinicalgenome.org/kb/conditions/MONDO:0014434","N/A","30 - Gene Associated with Autosomal Recessive Phenotype (10/12/2015)","0 - No Evidence for Triplosensitivity (10/12/2015)","https://search.clinicalgenome.org/kb/gene-dosage/HGNC:970","Dosage Working Group","","","","","",""
"BBS7","HGNC:18758","https://search.clinicalgenome.org/kb/genes/HGNC:18758","BBS7-related ciliopathy","MONDO:1040042","https://search.clinicalgenome.org/kb/conditions/MONDO:1040042","Autosomal recessive inheritance","30 - Gene Associated with Autosomal Recessive Phenotype (08/22/2016)","","https://search.clinicalgenome.org/kb/gene-dosage/HGNC:18758","Dosage Working Group","definitive evidence (09/07/2023)","https://search.clinicalgenome.org/kb/gene-validity/CGGV:assertion_a09e1836-927c-424d-b10c-fd93f3e6dc6b-2023-09-07T160000.000Z","Retina","","",""
"BBS7","HGNC:18758","https://search.clinicalgenome.org/kb/genes/HGNC:18758","Bardet-Biedl syndrome 7","MONDO:0014435","https://search.clinicalgenome.org/kb/conditions/MONDO:0014435","N/A","30 - Gene Associated with Autosomal Recessive Phenotype (08/22/2016)","","https://search.clinicalgenome.org/kb/gene-dosage/HGNC:18758","Dosage Working Group","","","","","",""
"BBS9","HGNC:30000","https://search.clinicalgenome.org/kb/genes/HGNC:30000","BBS9-related ciliopathy","MONDO:0700236","https://search.clinicalgenome.org/kb/conditions/MONDO:0700236","Autosomal recessive inheritance","","","","","definitive evidence (08/03/2023)","https://search.clinicalgenome.org/kb/gene-validity/CGGV:assertion_3fc68f9f-ed7c-453e-8c41-179a9ccad0ca-2023-08-03T160000.000Z","Retina","","",""
"BCAP31","HGNC:16695","https://search.clinicalgenome.org/kb/genes/HGNC:16695","severe motor and intellectual disabilities-sensorineural deafness-dystonia syndrome","MONDO:0010334","https://search.clinicalgenome.org/kb/conditions/MONDO:0010334","X-linked inheritance","3 - Sufficient Evidence for Haploinsufficiency (08/08/2023)","0 - No Evidence for Triplosensitivity (08/08/2023)","https://search.clinicalgenome.org/kb/gene-dosage/HGNC:16695","Dosage Working Group","definitive evidence (08/02/2023)","https://search.clinicalgenome.org/kb/gene-validity/CGGV:assertion_d31d5251-bedd-49e9-b0bb-5ff6923edcf7-2023-08-02T160000.000Z","Intellectual Disability and Autism","","",""
"BCAT2","HGNC:977","https://search.clinicalgenome.org/kb/genes/HGNC:977","hypervalinemia and hyperleucine-isoleucinemia","MONDO:0100058","https://search.clinicalgenome.org/kb/conditions/MONDO:0100058","Autosomal recessive inheritance","","","","","definitive evidence (07/24/2020)","https://search.clinicalgenome.org/kb/gene-validity/CGGV:assertion_b5e16ee6-88c9-4872-8681-dd7fd0156b0f-2020-07-24T172325.905Z","Aminoacidopathy","","",""
"BCHE","HGNC:983","https://search.clinicalgenome.org/kb/genes/HGNC:983","butyrylcholinesterase deficiency","MONDO:0015270","https://search.clinicalgenome.org/kb/conditions/MONDO:0015270","N/A","30 - Gene Associated with Autosomal Recessive Phenotype (08/22/2016)","","https://search.clinicalgenome.org/kb/gene-dosage/HGNC:983","Dosage Working Group","","","","","",""
"BCKDHA","HGNC:986","https://search.clinicalgenome.org/kb/genes/HGNC:986","maple syrup urine disease type 1A","MONDO:0023691","https://search.clinicalgenome.org/kb/conditions/MONDO:0023691","Autosomal recessive inheritance","","","","","definitive evidence (09/14/2018)","https://search.clinicalgenome.org/kb/gene-validity/CGGV:assertion_5c89a6c7-751a-4a99-8a32-97cc33c5df7c-2018-09-14T160000.000Z","Aminoacidopathy","Has Insufficient Evidence for Actionability Based on Early Rule-out (06/28/2021) | Strong Actionability (06/28/2021)","https://actionability.clinicalgenome.org/ac/Adult/ui/stg2SummaryRpt?doc=AC1041 | https://actionability.clinicalgenome.org/ac/Pediatric/ui/stg2SummaryRpt?doc=AC1041","Adult Actionability Working Group | Pediatric Actionability Working Group"
"BCKDHA","HGNC:986","https://search.clinicalgenome.org/kb/genes/HGNC:986","maple syrup urine disease","MONDO:0009563","https://search.clinicalgenome.org/kb/conditions/MONDO:0009563","N/A","","","","","","","","Has Insufficient Evidence for Actionability Based on Early Rule-out (06/28/2021) | Strong Actionability (06/28/2021)","https://actionability.clinicalgenome.org/ac/Adult/ui/stg2SummaryRpt?doc=AC1041 | https://actionability.clinicalgenome.org/ac/Pediatric/ui/stg2SummaryRpt?doc=AC1041","Adult Actionability Working Group | Pediatric Actionability Working Group"
"BCKDHA","HGNC:986","https://search.clinicalgenome.org/kb/genes/HGNC:986","intermittent maple syrup urine disease","MONDO:0017053","https://search.clinicalgenome.org/kb/conditions/MONDO:0017053","N/A","","","","","","","","Has Insufficient Evidence for Actionability Based on Early Rule-out (06/28/2021) | Strong Actionability (06/28/2021)","https://actionability.clinicalgenome.org/ac/Adult/ui/stg2SummaryRpt?doc=AC1041 | https://actionability.clinicalgenome.org/ac/Pediatric/ui/stg2SummaryRpt?doc=AC1041","Adult Actionability Working Group | Pediatric Actionability Working Group"
"BCKDHA","HGNC:986","https://search.clinicalgenome.org/kb/genes/HGNC:986","maple syrup urine disease, mild variant","MONDO:0014057","https://search.clinicalgenome.org/kb/conditions/MONDO:0014057","N/A","","","","","","","","Has Insufficient Evidence for Actionability Based on Early Rule-out (06/28/2021) | Strong Actionability (06/28/2021)","https://actionability.clinicalgenome.org/ac/Adult/ui/stg2SummaryRpt?doc=AC1041 | https://actionability.clinicalgenome.org/ac/Pediatric/ui/stg2SummaryRpt?doc=AC1041","Adult Actionability Working Group | Pediatric Actionability Working Group"
"BCKDHA","HGNC:986","https://search.clinicalgenome.org/kb/genes/HGNC:986","thiamine-responsive maple syrup urine disease","MONDO:0017054","https://search.clinicalgenome.org/kb/conditions/MONDO:0017054","N/A","","","","","","","","Has Insufficient Evidence for Actionability Based on Early Rule-out (06/28/2021) | Strong Actionability (06/28/2021)","https://actionability.clinicalgenome.org/ac/Adult/ui/stg2SummaryRpt?doc=AC1041 | https://actionability.clinicalgenome.org/ac/Pediatric/ui/stg2SummaryRpt?doc=AC1041","Adult Actionability Working Group | Pediatric Actionability Working Group"
"BCKDHA","HGNC:986","https://search.clinicalgenome.org/kb/genes/HGNC:986","intermediate maple syrup urine disease","MONDO:0017052","https://search.clinicalgenome.org/kb/conditions/MONDO:0017052","N/A","","","","","","","","Has Insufficient Evidence for Actionability Based on Early Rule-out (06/28/2021) | Strong Actionability (06/28/2021)","https://actionability.clinicalgenome.org/ac/Adult/ui/stg2SummaryRpt?doc=AC1041 | https://actionability.clinicalgenome.org/ac/Pediatric/ui/stg2SummaryRpt?doc=AC1041","Adult Actionability Working Group | Pediatric Actionability Working Group"
"BCKDHA","HGNC:986","https://search.clinicalgenome.org/kb/genes/HGNC:986","classic maple syrup urine disease","MONDO:0017051","https://search.clinicalgenome.org/kb/conditions/MONDO:0017051","N/A","","","","","","","","Has Insufficient Evidence for Actionability Based on Early Rule-out (06/28/2021) | Strong Actionability (06/28/2021)","https://actionability.clinicalgenome.org/ac/Adult/ui/stg2SummaryRpt?doc=AC1041 | https://actionability.clinicalgenome.org/ac/Pediatric/ui/stg2SummaryRpt?doc=AC1041","Adult Actionability Working Group | Pediatric Actionability Working Group"
"BCKDHB","HGNC:987","https://search.clinicalgenome.org/kb/genes/HGNC:987","maple syrup urine disease type 1B","MONDO:0023692","https://search.clinicalgenome.org/kb/conditions/MONDO:0023692","Autosomal recessive inheritance","30 - Gene Associated with Autosomal Recessive Phenotype (08/22/2016)","","https://search.clinicalgenome.org/kb/gene-dosage/HGNC:987","Dosage Working Group","definitive evidence (02/08/2019)","https://search.clinicalgenome.org/kb/gene-validity/CGGV:assertion_0b0d314c-7355-441c-a357-72ba3e566c57-2019-02-08T170000.000Z","Aminoacidopathy","Has Insufficient Evidence for Actionability Based on Early Rule-out (06/28/2021) | Strong Actionability (06/28/2021)","https://actionability.clinicalgenome.org/ac/Adult/ui/stg2SummaryRpt?doc=AC1041 | https://actionability.clinicalgenome.org/ac/Pediatric/ui/stg2SummaryRpt?doc=AC1041","Adult Actionability Working Group | Pediatric Actionability Working Group"
"BCKDHB","HGNC:987","https://search.clinicalgenome.org/kb/genes/HGNC:987","maple syrup urine disease","MONDO:0009563","https://search.clinicalgenome.org/kb/conditions/MONDO:0009563","N/A","30 - Gene Associated with Autosomal Recessive Phenotype (08/22/2016)","","https://search.clinicalgenome.org/kb/gene-dosage/HGNC:987","Dosage Working Group","","","","Has Insufficient Evidence for Actionability Based on Early Rule-out (06/28/2021) | Strong Actionability (06/28/2021)","https://actionability.clinicalgenome.org/ac/Adult/ui/stg2SummaryRpt?doc=AC1041 | https://actionability.clinicalgenome.org/ac/Pediatric/ui/stg2SummaryRpt?doc=AC1041","Adult Actionability Working Group | Pediatric Actionability Working Group"
"BCKDHB","HGNC:987","https://search.clinicalgenome.org/kb/genes/HGNC:987","intermittent maple syrup urine disease","MONDO:0017053","https://search.clinicalgenome.org/kb/conditions/MONDO:0017053","N/A","30 - Gene Associated with Autosomal Recessive Phenotype (08/22/2016)","","https://search.clinicalgenome.org/kb/gene-dosage/HGNC:987","Dosage Working Group","","","","Has Insufficient Evidence for Actionability Based on Early Rule-out (06/28/2021) | Strong Actionability (06/28/2021)","https://actionability.clinicalgenome.org/ac/Adult/ui/stg2SummaryRpt?doc=AC1041 | https://actionability.clinicalgenome.org/ac/Pediatric/ui/stg2SummaryRpt?doc=AC1041","Adult Actionability Working Group | Pediatric Actionability Working Group"
"BCKDHB","HGNC:987","https://search.clinicalgenome.org/kb/genes/HGNC:987","maple syrup urine disease, mild variant","MONDO:0014057","https://search.clinicalgenome.org/kb/conditions/MONDO:0014057","N/A","30 - Gene Associated with Autosomal Recessive Phenotype (08/22/2016)","","https://search.clinicalgenome.org/kb/gene-dosage/HGNC:987","Dosage Working Group","","","","Has Insufficient Evidence for Actionability Based on Early Rule-out (06/28/2021) | Strong Actionability (06/28/2021)","https://actionability.clinicalgenome.org/ac/Adult/ui/stg2SummaryRpt?doc=AC1041 | https://actionability.clinicalgenome.org/ac/Pediatric/ui/stg2SummaryRpt?doc=AC1041","Adult Actionability Working Group | Pediatric Actionability Working Group"
"BCKDHB","HGNC:987","https://search.clinicalgenome.org/kb/genes/HGNC:987","classic maple syrup urine disease","MONDO:0017051","https://search.clinicalgenome.org/kb/conditions/MONDO:0017051","N/A","30 - Gene Associated with Autosomal Recessive Phenotype (08/22/2016)","","https://search.clinicalgenome.org/kb/gene-dosage/HGNC:987","Dosage Working Group","","","","Has Insufficient Evidence for Actionability Based on Early Rule-out (06/28/2021) | Strong Actionability (06/28/2021)","https://actionability.clinicalgenome.org/ac/Adult/ui/stg2SummaryRpt?doc=AC1041 | https://actionability.clinicalgenome.org/ac/Pediatric/ui/stg2SummaryRpt?doc=AC1041","Adult Actionability Working Group | Pediatric Actionability Working Group"
"BCKDHB","HGNC:987","https://search.clinicalgenome.org/kb/genes/HGNC:987","intermediate maple syrup urine disease","MONDO:0017052","https://search.clinicalgenome.org/kb/conditions/MONDO:0017052","N/A","30 - Gene Associated with Autosomal Recessive Phenotype (08/22/2016)","","https://search.clinicalgenome.org/kb/gene-dosage/HGNC:987","Dosage Working Group","","","","Has Insufficient Evidence for Actionability Based on Early Rule-out (06/28/2021) | Strong Actionability (06/28/2021)","https://actionability.clinicalgenome.org/ac/Adult/ui/stg2SummaryRpt?doc=AC1041 | https://actionability.clinicalgenome.org/ac/Pediatric/ui/stg2SummaryRpt?doc=AC1041","Adult Actionability Working Group | Pediatric Actionability Working Group"
"BCKDHB","HGNC:987","https://search.clinicalgenome.org/kb/genes/HGNC:987","thiamine-responsive maple syrup urine disease","MONDO:0017054","https://search.clinicalgenome.org/kb/conditions/MONDO:0017054","N/A","30 - Gene Associated with Autosomal Recessive Phenotype (08/22/2016)","","https://search.clinicalgenome.org/kb/gene-dosage/HGNC:987","Dosage Working Group","","","","Has Insufficient Evidence for Actionability Based on Early Rule-out (06/28/2021) | Strong Actionability (06/28/2021)","https://actionability.clinicalgenome.org/ac/Adult/ui/stg2SummaryRpt?doc=AC1041 | https://actionability.clinicalgenome.org/ac/Pediatric/ui/stg2SummaryRpt?doc=AC1041","Adult Actionability Working Group | Pediatric Actionability Working Group"
"BCKDK","HGNC:16902","https://search.clinicalgenome.org/kb/genes/HGNC:16902","branched-chain keto acid dehydrogenase kinase deficiency","MONDO:0013970","https://search.clinicalgenome.org/kb/conditions/MONDO:0013970","Autosomal recessive inheritance","30 - Gene Associated with Autosomal Recessive Phenotype (08/22/2016)","","https://search.clinicalgenome.org/kb/gene-dosage/HGNC:16902","Dosage Working Group","definitive evidence (01/18/2019)","https://search.clinicalgenome.org/kb/gene-validity/CGGV:assertion_f90aaad0-b56a-41dc-8d1f-9d12fc66113f-2019-01-18T170000.000Z","Aminoacidopathy","","",""
"BCL10","HGNC:989","https://search.clinicalgenome.org/kb/genes/HGNC:989","immunodeficiency 37","MONDO:0014491","https://search.clinicalgenome.org/kb/conditions/MONDO:0014491","Autosomal recessive inheritance","","","","","definitive evidence (12/29/2022)","https://search.clinicalgenome.org/kb/gene-validity/CGGV:assertion_2826b3a9-d32b-4d91-8c5d-1a20c408d08d-2022-12-29T180000.000Z","SCID-CID","","",""
"BCL11A","HGNC:13221","https://search.clinicalgenome.org/kb/genes/HGNC:13221","Dias-Logan syndrome","MONDO:0014914","https://search.clinicalgenome.org/kb/conditions/MONDO:0014914","Autosomal dominant inheritance","3 - Sufficient Evidence for Haploinsufficiency (04/13/2017)","0 - No Evidence for Triplosensitivity (04/13/2017)","https://search.clinicalgenome.org/kb/gene-dosage/HGNC:13221","Dosage Working Group","definitive evidence (09/13/2020)","https://search.clinicalgenome.org/kb/gene-validity/CGGV:assertion_9630f9a3-3f90-49c6-ae8b-6313c950b1b2-2020-09-13T171807.228Z","Intellectual Disability and Autism","","",""
"BCL11B","HGNC:13222","https://search.clinicalgenome.org/kb/genes/HGNC:13222","intellectual developmental disorder with speech delay, dysmorphic facies, and t-cell abnormalities","MONDO:0060763","https://search.clinicalgenome.org/kb/conditions/MONDO:0060763","Autosomal dominant inheritance","","","","","definitive evidence (01/18/2025)","https://search.clinicalgenome.org/kb/gene-validity/CGGV:assertion_8ca4f24f-78dd-4dda-a50d-07dd3d1cef07-2024-12-19T170000.000Z","SCID-CID","","",""
"BCL9","HGNC:1008","https://search.clinicalgenome.org/kb/genes/HGNC:1008","congenital heart disease","MONDO:0005453","https://search.clinicalgenome.org/kb/conditions/MONDO:0005453","Autosomal dominant inheritance","","","","","limited evidence (09/11/2023)","https://search.clinicalgenome.org/kb/gene-validity/CGGV:assertion_7f45b6e5-4286-40d2-aadf-9b15a62c26df-2023-09-11T160000.000Z","Congenital Heart Disease","","",""
"BCOR","HGNC:20893","https://search.clinicalgenome.org/kb/genes/HGNC:20893","microphthalmia, syndromic 2","MONDO:0010261","https://search.clinicalgenome.org/kb/conditions/MONDO:0010261","X-linked inheritance","3 - Sufficient Evidence for Haploinsufficiency (10/04/2012)","0 - No Evidence for Triplosensitivity (10/04/2012)","https://search.clinicalgenome.org/kb/gene-dosage/HGNC:20893","Dosage Working Group","definitive evidence (12/17/2020)","https://search.clinicalgenome.org/kb/gene-validity/CGGV:assertion_3da06b77-1ed0-4197-948c-a9bbf80b6ed4-2020-12-17T171347.861Z","Syndromic Disorders","","",""
"BCORL1","HGNC:25657","https://search.clinicalgenome.org/kb/genes/HGNC:25657","Shukla-Vernon syndrome","MONDO:0026727","https://search.clinicalgenome.org/kb/conditions/MONDO:0026727","X-linked inheritance","","","","","limited evidence (03/05/2024)","https://search.clinicalgenome.org/kb/gene-validity/CGGV:assertion_7cc118e0-37b5-408c-9c91-ed0828997a1d-2024-03-05T070000.000Z","Intellectual Disability and Autism","","",""
"BCS1L","HGNC:1020","https://search.clinicalgenome.org/kb/genes/HGNC:1020","Bjornstad syndrome","MONDO:0009872","https://search.clinicalgenome.org/kb/conditions/MONDO:0009872","Autosomal recessive inheritance","30 - Gene Associated with Autosomal Recessive Phenotype (08/22/2016)","0 - No Evidence for Triplosensitivity (08/22/2016)","https://search.clinicalgenome.org/kb/gene-dosage/HGNC:1020","Dosage Working Group","definitive evidence (07/09/2018)","https://search.clinicalgenome.org/kb/gene-validity/CGGV:assertion_7a26b6b5-e703-43fc-bcd0-eaff67ef8107-2018-07-09T160000.000Z","Hearing Loss","","",""
"BCS1L","HGNC:1020","https://search.clinicalgenome.org/kb/genes/HGNC:1020","Leigh syndrome","MONDO:0009723","https://search.clinicalgenome.org/kb/conditions/MONDO:0009723","Autosomal recessive inheritance","30 - Gene Associated with Autosomal Recessive Phenotype (08/22/2016)","0 - No Evidence for Triplosensitivity (08/22/2016)","https://search.clinicalgenome.org/kb/gene-dosage/HGNC:1020","Dosage Working Group","limited evidence (09/19/2019)","https://search.clinicalgenome.org/kb/gene-validity/CGGV:assertion_3b50d7db-1144-4187-a60c-72b45adb80bd-2019-09-19T155315.896Z","Mitochondrial Diseases","","",""
"BDP1","HGNC:13652","https://search.clinicalgenome.org/kb/genes/HGNC:13652","nonsyndromic genetic hearing loss","MONDO:0019497","https://search.clinicalgenome.org/kb/conditions/MONDO:0019497","Autosomal recessive inheritance","","","","","limited evidence (03/26/2021)","https://search.clinicalgenome.org/kb/gene-validity/CGGV:assertion_d300a54b-171c-4445-a138-a24409e99aae-2021-03-26T160000.000Z","Hearing Loss","","",""
"BEST1","HGNC:12703","https://search.clinicalgenome.org/kb/genes/HGNC:12703","BEST1-related dominant retinopathy","MONDO:0700238","https://search.clinicalgenome.org/kb/conditions/MONDO:0700238","Autosomal dominant inheritance","","","","","definitive evidence (08/03/2023)","https://search.clinicalgenome.org/kb/gene-validity/CGGV:assertion_487a42cc-7dd0-4991-ac9d-1346f59073c0-2023-08-03T160000.000Z","Retina","","",""
"BGN","HGNC:1044","https://search.clinicalgenome.org/kb/genes/HGNC:1044","familial thoracic aortic aneurysm and aortic dissection","MONDO:0019625","https://search.clinicalgenome.org/kb/conditions/MONDO:0019625","Autosomal dominant inheritance","","","","","limited evidence (12/22/2016)","https://search.clinicalgenome.org/kb/gene-validity/CGGCIEX:assertion_8260","Heritable Thoracic Aortic Aneurysm and Dissection","","",""
"BICRA","HGNC:4332","https://search.clinicalgenome.org/kb/genes/HGNC:4332","Coffin-Siris syndrome","MONDO:0015452","https://search.clinicalgenome.org/kb/conditions/MONDO:0015452","Autosomal dominant inheritance","","","","","definitive evidence (06/17/2025)","https://search.clinicalgenome.org/kb/gene-validity/CGGV:assertion_2dcc8864-4487-4c5c-b541-cfd972767269-2024-11-20T170000.000Z","Intellectual Disability and Autism","","",""
"BIN1","HGNC:1052","https://search.clinicalgenome.org/kb/genes/HGNC:1052","centronuclear myopathy","MONDO:0018947","https://search.clinicalgenome.org/kb/conditions/MONDO:0018947","Autosomal recessive inheritance | Autosomal dominant inheritance","30 - Gene Associated with Autosomal Recessive Phenotype (08/22/2016)","","https://search.clinicalgenome.org/kb/gene-dosage/HGNC:1052","Dosage Working Group","definitive evidence (06/10/2024) | limited evidence (06/10/2024)","https://search.clinicalgenome.org/kb/gene-validity/CGGV:assertion_6d04cc64-0994-4579-99d5-bd2b89710173-2024-06-10T160000.000Z | https://search.clinicalgenome.org/kb/gene-validity/CGGV:assertion_8bb963a9-ec8a-4966-93bb-4f8ef6f8f8a1-2024-06-10T160000.000Z","Congenital Myopathies | Congenital Myopathies","","",""
"BIN1","HGNC:1052","https://search.clinicalgenome.org/kb/genes/HGNC:1052","myopathy, centronuclear, 2","MONDO:0009709","https://search.clinicalgenome.org/kb/conditions/MONDO:0009709","N/A","30 - Gene Associated with Autosomal Recessive Phenotype (08/22/2016)","","https://search.clinicalgenome.org/kb/gene-dosage/HGNC:1052","Dosage Working Group","","","","","",""
"BLK","HGNC:1057","https://search.clinicalgenome.org/kb/genes/HGNC:1057","monogenic diabetes","MONDO:0015967","https://search.clinicalgenome.org/kb/conditions/MONDO:0015967","Autosomal dominant inheritance","","","","","refuting evidence (01/17/2023)","https://search.clinicalgenome.org/kb/gene-validity/CGGV:assertion_072e29f7-db97-40d9-9280-819706203c24-2023-01-17T170000.000Z","Monogenic Diabetes","","",""
"BLM","HGNC:1058","https://search.clinicalgenome.org/kb/genes/HGNC:1058","Bloom syndrome","MONDO:0008876","https://search.clinicalgenome.org/kb/conditions/MONDO:0008876","Autosomal recessive inheritance","30 - Gene Associated with Autosomal Recessive Phenotype (02/09/2022)","0 - No Evidence for Triplosensitivity (02/09/2022)","https://search.clinicalgenome.org/kb/gene-dosage/HGNC:1058","Dosage Working Group","definitive evidence (04/19/2019)","https://search.clinicalgenome.org/kb/gene-validity/CGGV:assertion_e0a20b67-5a62-462c-894b-76b60a66e979-2019-04-19T160000.000Z","Hereditary Cancer","","",""
"BLM","HGNC:1058","https://search.clinicalgenome.org/kb/genes/HGNC:1058","colorectal cancer","MONDO:0005575","https://search.clinicalgenome.org/kb/conditions/MONDO:0005575","Autosomal dominant inheritance","30 - Gene Associated with Autosomal Recessive Phenotype (02/09/2022)","0 - No Evidence for Triplosensitivity (02/09/2022)","https://search.clinicalgenome.org/kb/gene-dosage/HGNC:1058","Dosage Working Group","limited evidence (11/22/2024)","https://search.clinicalgenome.org/kb/gene-validity/CGGV:assertion_37bc882f-34c6-4aea-afea-7b6f037ed9a7-2024-11-22T180000.000Z","Hereditary Cancer","","",""
"BLNK","HGNC:14211","https://search.clinicalgenome.org/kb/genes/HGNC:14211","agammaglobulinemia 4, autosomal recessive","MONDO:0013289","https://search.clinicalgenome.org/kb/conditions/MONDO:0013289","Autosomal recessive inheritance","30 - Gene Associated with Autosomal Recessive Phenotype (08/22/2016)","0 - No Evidence for Triplosensitivity (08/22/2016)","https://search.clinicalgenome.org/kb/gene-dosage/HGNC:14211","Dosage Working Group","definitive evidence (03/16/2021)","https://search.clinicalgenome.org/kb/gene-validity/CGGV:assertion_2e1d2e1b-52a6-4371-9055-0e1cc74da39d-2021-03-16T132748.373Z","Antibody Deficiencies GCEP","","",""
"BLOC1S3","HGNC:20914","https://search.clinicalgenome.org/kb/genes/HGNC:20914","Hermansky-Pudlak syndrome 8","MONDO:0013560","https://search.clinicalgenome.org/kb/conditions/MONDO:0013560","Autosomal recessive inheritance","","","","","moderate evidence (04/07/2025)","https://search.clinicalgenome.org/kb/gene-validity/CGGV:assertion_bdeec503-f903-4507-89e7-33c9255b5ad1-2025-04-07T160000.000Z","Hemostasis Thrombosis","","",""
"BLOC1S5","HGNC:18561","https://search.clinicalgenome.org/kb/genes/HGNC:18561","Hermansky-Pudlak syndrome 11","MONDO:0030903","https://search.clinicalgenome.org/kb/conditions/MONDO:0030903","Autosomal recessive inheritance","","","","","definitive evidence (09/06/2023)","https://search.clinicalgenome.org/kb/gene-validity/CGGV:assertion_85cca8f5-d263-42c4-b84a-2d49deeee682-2023-09-06T160000.000Z","Hemostasis Thrombosis","","",""
"BLOC1S6","HGNC:8549","https://search.clinicalgenome.org/kb/genes/HGNC:8549","Hermansky-Pudlak syndrome 9","MONDO:0013606","https://search.clinicalgenome.org/kb/conditions/MONDO:0013606","Autosomal recessive inheritance","","","","","definitive evidence (05/25/2022)","https://search.clinicalgenome.org/kb/gene-validity/CGGV:assertion_984682a2-afb9-48b3-afe8-20e0f633022d-2022-05-25T165516.466Z","Hemostasis Thrombosis","","",""
"BLVRA","HGNC:1062","https://search.clinicalgenome.org/kb/genes/HGNC:1062","hyperbiliverdinemia","MONDO:0013595","https://search.clinicalgenome.org/kb/conditions/MONDO:0013595","Autosomal recessive inheritance","","","","","moderate evidence (01/10/2025)","https://search.clinicalgenome.org/kb/gene-validity/CGGV:assertion_de6e575f-6a04-45fb-a9b5-0b21c9e6a7a8-2025-01-10T170000.000Z","General Inborn Errors of Metabolism","","",""
"BMP10","HGNC:20869","https://search.clinicalgenome.org/kb/genes/HGNC:20869","congenital heart disease","MONDO:0005453","https://search.clinicalgenome.org/kb/conditions/MONDO:0005453","Autosomal dominant inheritance","","","","","limited evidence (09/11/2023)","https://search.clinicalgenome.org/kb/gene-validity/CGGV:assertion_d1da0a68-cf08-4de9-8461-0808826679bd-2023-09-11T160000.000Z","Congenital Heart Disease","","",""
"BMP10","HGNC:20869","https://search.clinicalgenome.org/kb/genes/HGNC:20869","pulmonary arterial hypertension","MONDO:0015924","https://search.clinicalgenome.org/kb/conditions/MONDO:0015924","Autosomal dominant inheritance","","","","","limited evidence (10/18/2022)","https://search.clinicalgenome.org/kb/gene-validity/CGGV:assertion_98be8b85-16ad-46d3-9736-2b240803da21-2022-10-18T160000.000Z","Pulmonary Hypertension","","",""
"BMP4","HGNC:1071","https://search.clinicalgenome.org/kb/genes/HGNC:1071","BMP4-related ocular growth disorder","MONDO:0100613","https://search.clinicalgenome.org/kb/conditions/MONDO:0100613","Autosomal dominant inheritance","3 - Sufficient Evidence for Haploinsufficiency (04/23/2025)","0 - No Evidence for Triplosensitivity (04/23/2025)","https://search.clinicalgenome.org/kb/gene-dosage/HGNC:1071","Dosage Working Group","definitive evidence (02/20/2025)","https://search.clinicalgenome.org/kb/gene-validity/CGGV:assertion_5e7832a8-8a0b-4719-aaf9-1cbdcc392776-2025-02-20T200000.000Z","Glaucoma and Neuro-Ophthalmology","","",""
"BMP4","HGNC:1071","https://search.clinicalgenome.org/kb/genes/HGNC:1071","microphthalmia with brain and digit anomalies","MONDO:0011936","https://search.clinicalgenome.org/kb/conditions/MONDO:0011936","N/A","3 - Sufficient Evidence for Haploinsufficiency (04/23/2025)","0 - No Evidence for Triplosensitivity (04/23/2025)","https://search.clinicalgenome.org/kb/gene-dosage/HGNC:1071","Dosage Working Group","","","","","",""
"BMP6","HGNC:1073","https://search.clinicalgenome.org/kb/genes/HGNC:1073","iron overload, susceptibility to","MONDO:0859316","https://search.clinicalgenome.org/kb/conditions/MONDO:0859316","Autosomal dominant inheritance","","","","","limited evidence (06/06/2025)","https://search.clinicalgenome.org/kb/gene-validity/CGGV:assertion_61e1d5f4-7b1a-4abc-89e7-9ce04b34e2a9-2025-06-06T170000.000Z","General Inborn Errors of Metabolism","","",""
"BMPER","HGNC:24154","https://search.clinicalgenome.org/kb/genes/HGNC:24154","diaphanospondylodysostosis","MONDO:0011946","https://search.clinicalgenome.org/kb/conditions/MONDO:0011946","N/A","30 - Gene Associated with Autosomal Recessive Phenotype (08/22/2016)","","https://search.clinicalgenome.org/kb/gene-dosage/HGNC:24154","Dosage Working Group","","","","","",""
"BMPR1A","HGNC:1076","https://search.clinicalgenome.org/kb/genes/HGNC:1076","juvenile polyposis syndrome","MONDO:0017380","https://search.clinicalgenome.org/kb/conditions/MONDO:0017380","Autosomal dominant inheritance","3 - Sufficient Evidence for Haploinsufficiency (06/24/2020)","0 - No Evidence for Triplosensitivity (06/24/2020)","https://search.clinicalgenome.org/kb/gene-dosage/HGNC:1076","Dosage Working Group","definitive evidence (12/30/2022)","https://search.clinicalgenome.org/kb/gene-validity/CGGV:assertion_7004b10e-0eb6-4517-8deb-2d4b7264d2f8-2022-12-30T180000.000Z","Hereditary Cancer","Moderate Actionability (10/17/2022) | Strong Actionability (10/17/2022)","https://actionability.clinicalgenome.org/ac/Adult/ui/stg2SummaryRpt?doc=AC066 | https://actionability.clinicalgenome.org/ac/Pediatric/ui/stg2SummaryRpt?doc=AC066","Adult Actionability Working Group | Pediatric Actionability Working Group"
"BMPR1A","HGNC:1076","https://search.clinicalgenome.org/kb/genes/HGNC:1076","pulmonary arterial hypertension","MONDO:0015924","https://search.clinicalgenome.org/kb/conditions/MONDO:0015924","Mode of inheritance","3 - Sufficient Evidence for Haploinsufficiency (06/24/2020)","0 - No Evidence for Triplosensitivity (06/24/2020)","https://search.clinicalgenome.org/kb/gene-dosage/HGNC:1076","Dosage Working Group","disputing (10/18/2022)","https://search.clinicalgenome.org/kb/gene-validity/CGGV:assertion_e810879d-f635-4851-b20e-86998b000fcc-2022-10-18T160000.000Z","Pulmonary Hypertension","","",""
"BMPR1A","HGNC:1076","https://search.clinicalgenome.org/kb/genes/HGNC:1076","generalized juvenile polyposis/juvenile polyposis coli","MONDO:0008276","https://search.clinicalgenome.org/kb/conditions/MONDO:0008276","N/A","3 - Sufficient Evidence for Haploinsufficiency (06/24/2020)","0 - No Evidence for Triplosensitivity (06/24/2020)","https://search.clinicalgenome.org/kb/gene-dosage/HGNC:1076","Dosage Working Group","","","","Moderate Actionability (10/17/2022) | Strong Actionability (10/17/2022)","https://actionability.clinicalgenome.org/ac/Adult/ui/stg2SummaryRpt?doc=AC066 | https://actionability.clinicalgenome.org/ac/Pediatric/ui/stg2SummaryRpt?doc=AC066","Adult Actionability Working Group | Pediatric Actionability Working Group"
"BMPR1B","HGNC:1077","https://search.clinicalgenome.org/kb/genes/HGNC:1077","pulmonary arterial hypertension","MONDO:0015924","https://search.clinicalgenome.org/kb/conditions/MONDO:0015924","Mode of inheritance","","","","","disputing (10/18/2022)","https://search.clinicalgenome.org/kb/gene-validity/CGGV:assertion_a21917a1-31d3-42dd-b6d3-ea5fa6edd6c1-2022-10-18T160000.000Z","Pulmonary Hypertension","","",""
"BMPR2","HGNC:1078","https://search.clinicalgenome.org/kb/genes/HGNC:1078","pulmonary arterial hypertension","MONDO:0015924","https://search.clinicalgenome.org/kb/conditions/MONDO:0015924","Autosomal dominant inheritance","3 - Sufficient Evidence for Haploinsufficiency (08/26/2020)","0 - No Evidence for Triplosensitivity (08/26/2020)","https://search.clinicalgenome.org/kb/gene-dosage/HGNC:1078","Dosage Working Group","definitive evidence (12/07/2020)","https://search.clinicalgenome.org/kb/gene-validity/CGGV:assertion_a20ce78b-18ba-436c-877e-a08d092ac7c7-2020-12-07T172318.621Z","Pulmonary Hypertension","","",""
"BMPR2","HGNC:1078","https://search.clinicalgenome.org/kb/genes/HGNC:1078","congenital heart disease","MONDO:0005453","https://search.clinicalgenome.org/kb/conditions/MONDO:0005453","Autosomal dominant inheritance","3 - Sufficient Evidence for Haploinsufficiency (08/26/2020)","0 - No Evidence for Triplosensitivity (08/26/2020)","https://search.clinicalgenome.org/kb/gene-dosage/HGNC:1078","Dosage Working Group","limited evidence (09/18/2023)","https://search.clinicalgenome.org/kb/gene-validity/CGGV:assertion_1b4322da-10a2-46c4-be0c-b5163ab5f401-2023-09-18T160000.000Z","Congenital Heart Disease","","",""
"BMPR2","HGNC:1078","https://search.clinicalgenome.org/kb/genes/HGNC:1078","pulmonary hypertension, primary, 1","MONDO:0024533","https://search.clinicalgenome.org/kb/conditions/MONDO:0024533","N/A","3 - Sufficient Evidence for Haploinsufficiency (08/26/2020)","0 - No Evidence for Triplosensitivity (08/26/2020)","https://search.clinicalgenome.org/kb/gene-dosage/HGNC:1078","Dosage Working Group","","","","Moderate Actionability (09/11/2017)","https://actionability.clinicalgenome.org/ac/Adult/ui/stg2SummaryRpt?doc=AC146","Adult Actionability Working Group"
"BMPR2","HGNC:1078","https://search.clinicalgenome.org/kb/genes/HGNC:1078","primary pulmonary hypertension","MONDO:0001999","https://search.clinicalgenome.org/kb/conditions/MONDO:0001999","N/A","3 - Sufficient Evidence for Haploinsufficiency (08/26/2020)","0 - No Evidence for Triplosensitivity (08/26/2020)","https://search.clinicalgenome.org/kb/gene-dosage/HGNC:1078","Dosage Working Group","","","","Moderate Actionability (09/11/2017)","https://actionability.clinicalgenome.org/ac/Adult/ui/stg2SummaryRpt?doc=AC146","Adult Actionability Working Group"
"BMPR2","HGNC:1078","https://search.clinicalgenome.org/kb/genes/HGNC:1078","obsolete idiopathic and/or familial pulmonary arterial hypertension","MONDO:0008347","https://search.clinicalgenome.org/kb/conditions/MONDO:0008347","N/A","3 - Sufficient Evidence for Haploinsufficiency (08/26/2020)","0 - No Evidence for Triplosensitivity (08/26/2020)","https://search.clinicalgenome.org/kb/gene-dosage/HGNC:1078","Dosage Working Group","","","","Moderate Actionability (09/11/2017)","https://actionability.clinicalgenome.org/ac/Adult/ui/stg2SummaryRpt?doc=AC146","Adult Actionability Working Group"
"BOLA3","HGNC:24415","https://search.clinicalgenome.org/kb/genes/HGNC:24415","mitochondrial disease","MONDO:0044970","https://search.clinicalgenome.org/kb/conditions/MONDO:0044970","Autosomal recessive inheritance","","","","","definitive evidence (07/24/2023)","https://search.clinicalgenome.org/kb/gene-validity/CGGV:assertion_7e6c6964-bbb5-4101-abbb-782eb01b0f33-2023-07-24T040000.000Z","Mitochondrial Diseases","","",""
"BPNT2","HGNC:26019","https://search.clinicalgenome.org/kb/genes/HGNC:26019","chondrodysplasia with joint dislocations, gPAPP type","MONDO:0013561","https://search.clinicalgenome.org/kb/conditions/MONDO:0013561","Autosomal recessive inheritance","30 - Gene Associated with Autosomal Recessive Phenotype (08/22/2016)","","https://search.clinicalgenome.org/kb/gene-dosage/HGNC:26019","Dosage Working Group","moderate evidence (05/16/2024)","https://search.clinicalgenome.org/kb/gene-validity/CGGV:assertion_f0edef29-df91-4320-b66d-4cc6a4ec3f94-2024-05-16T160000.000Z","Congenital Disorders of Glycosylation","","",""
"BPTF","HGNC:3581","https://search.clinicalgenome.org/kb/genes/HGNC:3581","syndromic intellectual disability","MONDO:0000508","https://search.clinicalgenome.org/kb/conditions/MONDO:0000508","Autosomal dominant inheritance","3 - Sufficient Evidence for Haploinsufficiency (07/12/2022)","0 - No Evidence for Triplosensitivity (07/12/2022)","https://search.clinicalgenome.org/kb/gene-dosage/HGNC:3581","Dosage Working Group","definitive evidence (07/06/2022)","https://search.clinicalgenome.org/kb/gene-validity/CGGV:assertion_08521bf8-a5a2-4a44-941b-12d9eae7aa4f-2022-07-06T160000.000Z","Intellectual Disability and Autism","","",""
"BRAF","HGNC:1097","https://search.clinicalgenome.org/kb/genes/HGNC:1097","cardiofaciocutaneous syndrome","MONDO:0015280","https://search.clinicalgenome.org/kb/conditions/MONDO:0015280","Autosomal dominant inheritance","0 - No Evidence for Haploinsufficiency (09/24/2025)","0 - No Evidence for Triplosensitivity (09/24/2025)","https://search.clinicalgenome.org/kb/gene-dosage/HGNC:1097","Dosage Working Group","definitive evidence (07/24/2018)","https://search.clinicalgenome.org/kb/gene-validity/CGGV:assertion_a53e5a92-126f-4b00-a89b-af55d4f342ca-2018-07-24T160000.000Z","RASopathy","","",""
"BRAF","HGNC:1097","https://search.clinicalgenome.org/kb/genes/HGNC:1097","Noonan syndrome with multiple lentigines","MONDO:0007893","https://search.clinicalgenome.org/kb/conditions/MONDO:0007893","Autosomal dominant inheritance","0 - No Evidence for Haploinsufficiency (09/24/2025)","0 - No Evidence for Triplosensitivity (09/24/2025)","https://search.clinicalgenome.org/kb/gene-dosage/HGNC:1097","Dosage Working Group","limited evidence (07/24/2018)","https://search.clinicalgenome.org/kb/gene-validity/CGGV:assertion_888875a8-5654-486b-8e64-e1382ccc6650-2018-07-24T160000.000Z","RASopathy","","",""
"BRAF","HGNC:1097","https://search.clinicalgenome.org/kb/genes/HGNC:1097","Noonan syndrome","MONDO:0018997","https://search.clinicalgenome.org/kb/conditions/MONDO:0018997","Autosomal dominant inheritance","0 - No Evidence for Haploinsufficiency (09/24/2025)","0 - No Evidence for Triplosensitivity (09/24/2025)","https://search.clinicalgenome.org/kb/gene-dosage/HGNC:1097","Dosage Working Group","moderate evidence (07/24/2018)","https://search.clinicalgenome.org/kb/gene-validity/CGGV:assertion_47cf08d5-efc6-4d42-b031-a06619873161-2018-07-24T160000.000Z","RASopathy","Assertion Pending (07/01/2019) | Assertion Pending (07/01/2019)","https://actionability.clinicalgenome.org/ac/Adult/ui/stg2SummaryRpt?doc=AC1003 | https://actionability.clinicalgenome.org/ac/Pediatric/ui/stg2SummaryRpt?doc=AC1003","Adult Actionability Working Group | Pediatric Actionability Working Group"
"BRAF","HGNC:1097","https://search.clinicalgenome.org/kb/genes/HGNC:1097","Costello syndrome","MONDO:0009026","https://search.clinicalgenome.org/kb/conditions/MONDO:0009026","Autosomal dominant inheritance","0 - No Evidence for Haploinsufficiency (09/24/2025)","0 - No Evidence for Triplosensitivity (09/24/2025)","https://search.clinicalgenome.org/kb/gene-dosage/HGNC:1097","Dosage Working Group","disputing (07/24/2018)","https://search.clinicalgenome.org/kb/gene-validity/CGGV:assertion_f229eceb-8f5e-4ecb-a484-7863b8dc7d19-2018-07-24T160000.000Z","RASopathy","","",""
"BRAF","HGNC:1097","https://search.clinicalgenome.org/kb/genes/HGNC:1097","Noonan syndrome 7","MONDO:0013379","https://search.clinicalgenome.org/kb/conditions/MONDO:0013379","N/A","0 - No Evidence for Haploinsufficiency (09/24/2025)","0 - No Evidence for Triplosensitivity (09/24/2025)","https://search.clinicalgenome.org/kb/gene-dosage/HGNC:1097","Dosage Working Group","","","","Assertion Pending (07/01/2019) | Assertion Pending (07/01/2019)","https://actionability.clinicalgenome.org/ac/Adult/ui/stg2SummaryRpt?doc=AC1003 | https://actionability.clinicalgenome.org/ac/Pediatric/ui/stg2SummaryRpt?doc=AC1003","Adult Actionability Working Group | Pediatric Actionability Working Group"
"BRAT1","HGNC:21701","https://search.clinicalgenome.org/kb/genes/HGNC:21701","neonatal-onset encephalopathy with rigidity and seizures","MONDO:0013784","https://search.clinicalgenome.org/kb/conditions/MONDO:0013784","Autosomal recessive inheritance","30 - Gene Associated with Autosomal Recessive Phenotype (08/22/2016)","0 - No Evidence for Triplosensitivity (08/22/2016)","https://search.clinicalgenome.org/kb/gene-dosage/HGNC:21701","Dosage Working Group","definitive evidence (09/13/2022)","https://search.clinicalgenome.org/kb/gene-validity/CGGV:assertion_698a4cb3-df52-432b-9d3e-d3d76111db25-2022-09-13T170000.000Z","Epilepsy","","",""
"BRAT1","HGNC:21701","https://search.clinicalgenome.org/kb/genes/HGNC:21701","neurodevelopmental disorder with cerebellar atrophy and with or without seizures","MONDO:0020841","https://search.clinicalgenome.org/kb/conditions/MONDO:0020841","Autosomal recessive inheritance","30 - Gene Associated with Autosomal Recessive Phenotype (08/22/2016)","0 - No Evidence for Triplosensitivity (08/22/2016)","https://search.clinicalgenome.org/kb/gene-dosage/HGNC:21701","Dosage Working Group","definitive evidence (09/06/2022)","https://search.clinicalgenome.org/kb/gene-validity/CGGV:assertion_93a7b6f1-75e5-4f97-be9d-62fb5770b8cb-2022-09-06T170000.000Z","Epilepsy","","",""
"BRCA1","HGNC:1100","https://search.clinicalgenome.org/kb/genes/HGNC:1100","Fanconi anemia, complementation group S","MONDO:0054748","https://search.clinicalgenome.org/kb/conditions/MONDO:0054748","Autosomal recessive inheritance","3 - Sufficient Evidence for Haploinsufficiency (09/23/2021)","0 - No Evidence for Triplosensitivity (09/23/2021)","https://search.clinicalgenome.org/kb/gene-dosage/HGNC:1100","Dosage Working Group","definitive evidence (05/14/2020)","https://search.clinicalgenome.org/kb/gene-validity/CGGV:assertion_aa39798d-9b6e-430d-8bc1-2a01f81f1f72-2020-05-14T003137.538Z","Hereditary Cancer","","",""
"BRCA1","HGNC:1100","https://search.clinicalgenome.org/kb/genes/HGNC:1100","BRCA1-related cancer predisposition","MONDO:0700268","https://search.clinicalgenome.org/kb/conditions/MONDO:0700268","Autosomal dominant inheritance","3 - Sufficient Evidence for Haploinsufficiency (09/23/2021)","0 - No Evidence for Triplosensitivity (09/23/2021)","https://search.clinicalgenome.org/kb/gene-dosage/HGNC:1100","Dosage Working Group","definitive evidence (08/29/2024)","https://search.clinicalgenome.org/kb/gene-validity/CGGV:assertion_0f31f200-3b65-4cfd-80c8-bd7d3cc216b8-2024-08-29T170000.000Z","Hereditary Cancer","Definitive Actionability (01/28/2014) | Has Insufficient Evidence for Actionability Based on Early Rule-out (09/15/2021)","https://actionability.clinicalgenome.org/ac/Adult/ui/stg2SummaryRpt?doc=AC133 | https://actionability.clinicalgenome.org/ac/Pediatric/ui/stg2SummaryRpt?doc=AC133","Adult Actionability Working Group | Pediatric Actionability Working Group"
"BRCA1","HGNC:1100","https://search.clinicalgenome.org/kb/genes/HGNC:1100","breast-ovarian cancer, familial, susceptibility to, 1","MONDO:0011450","https://search.clinicalgenome.org/kb/conditions/MONDO:0011450","N/A","3 - Sufficient Evidence for Haploinsufficiency (09/23/2021)","0 - No Evidence for Triplosensitivity (09/23/2021)","https://search.clinicalgenome.org/kb/gene-dosage/HGNC:1100","Dosage Working Group","","","","Definitive Actionability (01/28/2014) | Has Insufficient Evidence for Actionability Based on Early Rule-out (09/15/2021)","https://actionability.clinicalgenome.org/ac/Adult/ui/stg2SummaryRpt?doc=AC133 | https://actionability.clinicalgenome.org/ac/Pediatric/ui/stg2SummaryRpt?doc=AC133","Adult Actionability Working Group | Pediatric Actionability Working Group"
"BRCA1","HGNC:1100","https://search.clinicalgenome.org/kb/genes/HGNC:1100","hereditary breast ovarian cancer syndrome","MONDO:0003582","https://search.clinicalgenome.org/kb/conditions/MONDO:0003582","N/A","3 - Sufficient Evidence for Haploinsufficiency (09/23/2021)","0 - No Evidence for Triplosensitivity (09/23/2021)","https://search.clinicalgenome.org/kb/gene-dosage/HGNC:1100","Dosage Working Group","","","","Definitive Actionability (01/28/2014) | Has Insufficient Evidence for Actionability Based on Early Rule-out (09/15/2021)","https://actionability.clinicalgenome.org/ac/Adult/ui/stg2SummaryRpt?doc=AC133 | https://actionability.clinicalgenome.org/ac/Pediatric/ui/stg2SummaryRpt?doc=AC133","Adult Actionability Working Group | Pediatric Actionability Working Group"
"BRCA2","HGNC:1101","https://search.clinicalgenome.org/kb/genes/HGNC:1101","Fanconi anemia complementation group D1","MONDO:0011584","https://search.clinicalgenome.org/kb/conditions/MONDO:0011584","Autosomal recessive inheritance","3 - Sufficient Evidence for Haploinsufficiency (07/14/2021)","0 - No Evidence for Triplosensitivity (07/14/2021)","https://search.clinicalgenome.org/kb/gene-dosage/HGNC:1101","Dosage Working Group","definitive evidence (04/19/2019)","https://search.clinicalgenome.org/kb/gene-validity/CGGV:assertion_48faf04b-ffc4-4163-8570-22f5c29c4064-2019-04-19T160000.000Z","Hereditary Cancer","Moderate Actionability (10/28/2019) | Moderate Actionability (10/28/2019)","https://actionability.clinicalgenome.org/ac/Adult/ui/stg2SummaryRpt?doc=AC1008 | https://actionability.clinicalgenome.org/ac/Pediatric/ui/stg2SummaryRpt?doc=AC1008","Adult Actionability Working Group | Pediatric Actionability Working Group"
"BRCA2","HGNC:1101","https://search.clinicalgenome.org/kb/genes/HGNC:1101","BRCA2-related cancer predisposition","MONDO:0700269","https://search.clinicalgenome.org/kb/conditions/MONDO:0700269","Autosomal dominant inheritance","3 - Sufficient Evidence for Haploinsufficiency (07/14/2021)","0 - No Evidence for Triplosensitivity (07/14/2021)","https://search.clinicalgenome.org/kb/gene-dosage/HGNC:1101","Dosage Working Group","definitive evidence (08/29/2024)","https://search.clinicalgenome.org/kb/gene-validity/CGGV:assertion_4e504fdc-d8b1-474e-8f01-d1b1f8267c79-2024-08-29T170000.000Z","Hereditary Cancer","Definitive Actionability (01/28/2014) | Has Insufficient Evidence for Actionability Based on Early Rule-out (09/15/2021)","https://actionability.clinicalgenome.org/ac/Adult/ui/stg2SummaryRpt?doc=AC133 | https://actionability.clinicalgenome.org/ac/Pediatric/ui/stg2SummaryRpt?doc=AC133","Adult Actionability Working Group | Pediatric Actionability Working Group"
"BRCA2","HGNC:1101","https://search.clinicalgenome.org/kb/genes/HGNC:1101","Fanconi anemia","MONDO:0019391","https://search.clinicalgenome.org/kb/conditions/MONDO:0019391","N/A","3 - Sufficient Evidence for Haploinsufficiency (07/14/2021)","0 - No Evidence for Triplosensitivity (07/14/2021)","https://search.clinicalgenome.org/kb/gene-dosage/HGNC:1101","Dosage Working Group","","","","Moderate Actionability (10/28/2019) | Moderate Actionability (10/28/2019)","https://actionability.clinicalgenome.org/ac/Adult/ui/stg2SummaryRpt?doc=AC1008 | https://actionability.clinicalgenome.org/ac/Pediatric/ui/stg2SummaryRpt?doc=AC1008","Adult Actionability Working Group | Pediatric Actionability Working Group"
"BRCA2","HGNC:1101","https://search.clinicalgenome.org/kb/genes/HGNC:1101","hereditary breast ovarian cancer syndrome","MONDO:0003582","https://search.clinicalgenome.org/kb/conditions/MONDO:0003582","N/A","3 - Sufficient Evidence for Haploinsufficiency (07/14/2021)","0 - No Evidence for Triplosensitivity (07/14/2021)","https://search.clinicalgenome.org/kb/gene-dosage/HGNC:1101","Dosage Working Group","","","","Definitive Actionability (01/28/2014) | Has Insufficient Evidence for Actionability Based on Early Rule-out (09/15/2021)","https://actionability.clinicalgenome.org/ac/Adult/ui/stg2SummaryRpt?doc=AC133 | https://actionability.clinicalgenome.org/ac/Pediatric/ui/stg2SummaryRpt?doc=AC133","Adult Actionability Working Group | Pediatric Actionability Working Group"
"BRCA2","HGNC:1101","https://search.clinicalgenome.org/kb/genes/HGNC:1101","breast-ovarian cancer, familial, susceptibility to, 2","MONDO:0012933","https://search.clinicalgenome.org/kb/conditions/MONDO:0012933","N/A","3 - Sufficient Evidence for Haploinsufficiency (07/14/2021)","0 - No Evidence for Triplosensitivity (07/14/2021)","https://search.clinicalgenome.org/kb/gene-dosage/HGNC:1101","Dosage Working Group","","","","Definitive Actionability (01/28/2014) | Has Insufficient Evidence for Actionability Based on Early Rule-out (09/15/2021)","https://actionability.clinicalgenome.org/ac/Adult/ui/stg2SummaryRpt?doc=AC133 | https://actionability.clinicalgenome.org/ac/Pediatric/ui/stg2SummaryRpt?doc=AC133","Adult Actionability Working Group | Pediatric Actionability Working Group"
"BRD4","HGNC:13575","https://search.clinicalgenome.org/kb/genes/HGNC:13575","syndromic intellectual disability","MONDO:0000508","https://search.clinicalgenome.org/kb/conditions/MONDO:0000508","Autosomal dominant inheritance","","","","","definitive evidence (04/20/2022)","https://search.clinicalgenome.org/kb/gene-validity/CGGV:assertion_8b28cda3-bce6-4a8f-b359-0ab398a1111d-2022-04-20T160000.000Z","Intellectual Disability and Autism","","",""
"BRIP1","HGNC:20473","https://search.clinicalgenome.org/kb/genes/HGNC:20473","familial ovarian cancer","MONDO:0016248","https://search.clinicalgenome.org/kb/conditions/MONDO:0016248","Autosomal dominant inheritance","3 - Sufficient Evidence for Haploinsufficiency (10/09/2025)","0 - No Evidence for Triplosensitivity (10/09/2025)","https://search.clinicalgenome.org/kb/gene-dosage/HGNC:20473","Dosage Working Group","definitive evidence (12/20/2023)","https://search.clinicalgenome.org/kb/gene-validity/CGGV:assertion_b1224a6d-5676-4109-b844-a577bd0bff62-2023-12-20T180000.000Z","Hereditary Cancer","Assertion Pending (03/17/2017) | Has Insufficient Evidence for Actionability Based on Early Rule-out (06/04/2025)","https://actionability.clinicalgenome.org/ac/Adult/ui/stg2SummaryRpt?doc=AC136 | https://actionability.clinicalgenome.org/ac/Pediatric/ui/stg2SummaryRpt?doc=AC136","Adult Actionability Working Group | Pediatric Actionability Working Group"
"BRIP1","HGNC:20473","https://search.clinicalgenome.org/kb/genes/HGNC:20473","Fanconi anemia complementation group J","MONDO:0012187","https://search.clinicalgenome.org/kb/conditions/MONDO:0012187","Autosomal recessive inheritance","3 - Sufficient Evidence for Haploinsufficiency (10/09/2025)","0 - No Evidence for Triplosensitivity (10/09/2025)","https://search.clinicalgenome.org/kb/gene-dosage/HGNC:20473","Dosage Working Group","definitive evidence (08/18/2019)","https://search.clinicalgenome.org/kb/gene-validity/CGGV:assertion_40aae4ea-8c9b-42a7-9d02-0f52a184712f-2019-08-18T160442.255Z","Hereditary Cancer","Moderate Actionability (10/28/2019) | Moderate Actionability (10/28/2019)","https://actionability.clinicalgenome.org/ac/Adult/ui/stg2SummaryRpt?doc=AC1008 | https://actionability.clinicalgenome.org/ac/Pediatric/ui/stg2SummaryRpt?doc=AC1008","Adult Actionability Working Group | Pediatric Actionability Working Group"
"BRIP1","HGNC:20473","https://search.clinicalgenome.org/kb/genes/HGNC:20473","hereditary breast carcinoma","MONDO:0016419","https://search.clinicalgenome.org/kb/conditions/MONDO:0016419","Autosomal dominant inheritance","3 - Sufficient Evidence for Haploinsufficiency (10/09/2025)","0 - No Evidence for Triplosensitivity (10/09/2025)","https://search.clinicalgenome.org/kb/gene-dosage/HGNC:20473","Dosage Working Group","refuting evidence (12/21/2023)","https://search.clinicalgenome.org/kb/gene-validity/CGGV:assertion_87aa8181-721b-4583-98cf-0dead1827e27-2023-12-21T180000.000Z","Hereditary Cancer","","",""
"BRIP1","HGNC:20473","https://search.clinicalgenome.org/kb/genes/HGNC:20473","Fanconi anemia","MONDO:0019391","https://search.clinicalgenome.org/kb/conditions/MONDO:0019391","N/A","3 - Sufficient Evidence for Haploinsufficiency (10/09/2025)","0 - No Evidence for Triplosensitivity (10/09/2025)","https://search.clinicalgenome.org/kb/gene-dosage/HGNC:20473","Dosage Working Group","","","","Moderate Actionability (10/28/2019) | Moderate Actionability (10/28/2019)","https://actionability.clinicalgenome.org/ac/Adult/ui/stg2SummaryRpt?doc=AC1008 | https://actionability.clinicalgenome.org/ac/Pediatric/ui/stg2SummaryRpt?doc=AC1008","Adult Actionability Working Group | Pediatric Actionability Working Group"
"BRPF1","HGNC:14255","https://search.clinicalgenome.org/kb/genes/HGNC:14255","syndromic complex neurodevelopmental disorder","MONDO:0800439","https://search.clinicalgenome.org/kb/conditions/MONDO:0800439","Autosomal dominant inheritance","3 - Sufficient Evidence for Haploinsufficiency (08/23/2023)","0 - No Evidence for Triplosensitivity (08/23/2023)","https://search.clinicalgenome.org/kb/gene-dosage/HGNC:14255","Dosage Working Group","definitive evidence (04/15/2025)","https://search.clinicalgenome.org/kb/gene-validity/CGGV:assertion_ca6ab404-7df4-475b-bb61-b056716dce7b-2025-04-15T160000.000Z","Intellectual Disability and Autism","","",""
"BRPF1","HGNC:14255","https://search.clinicalgenome.org/kb/genes/HGNC:14255","intellectual developmental disorder with dysmorphic facies and ptosis","MONDO:0015022","https://search.clinicalgenome.org/kb/conditions/MONDO:0015022","N/A","3 - Sufficient Evidence for Haploinsufficiency (08/23/2023)","0 - No Evidence for Triplosensitivity (08/23/2023)","https://search.clinicalgenome.org/kb/gene-dosage/HGNC:14255","Dosage Working Group","","","","","",""
"BRSK2","HGNC:11405","https://search.clinicalgenome.org/kb/genes/HGNC:11405","complex neurodevelopmental disorder","MONDO:0100038","https://search.clinicalgenome.org/kb/conditions/MONDO:0100038","Autosomal dominant inheritance","","","","","definitive evidence (02/03/2021)","https://search.clinicalgenome.org/kb/gene-validity/CGGV:assertion_327881a5-52fd-42bd-a500-c94514a7aed3-2021-02-03T170000.000Z","Intellectual Disability and Autism","","",""
"BRWD1","HGNC:12760","https://search.clinicalgenome.org/kb/genes/HGNC:12760","primary ciliary dyskinesia","MONDO:0016575","https://search.clinicalgenome.org/kb/conditions/MONDO:0016575","Autosomal recessive inheritance","","","","","disputing (11/10/2022)","https://search.clinicalgenome.org/kb/gene-validity/CGGV:assertion_9f74ee87-e640-4604-9bb7-e7617907f92c-2022-11-10T110000.000Z","Motile Ciliopathy","","",""
"BRWD1","HGNC:12760","https://search.clinicalgenome.org/kb/genes/HGNC:12760","agammaglobulinemia","MONDO:0015977","https://search.clinicalgenome.org/kb/conditions/MONDO:0015977","Autosomal dominant inheritance","","","","","limited evidence (12/08/2022)","https://search.clinicalgenome.org/kb/gene-validity/CGGV:assertion_a44471f3-0951-4456-955d-916b691e59f5-2022-12-08T170000.000Z","Antibody Deficiencies GCEP","","",""
"BRWD3","HGNC:17342","https://search.clinicalgenome.org/kb/genes/HGNC:17342","X-linked syndromic intellectual disability","MONDO:0020119","https://search.clinicalgenome.org/kb/conditions/MONDO:0020119","X-linked inheritance","3 - Sufficient Evidence for Haploinsufficiency (08/24/2022)","0 - No Evidence for Triplosensitivity (08/24/2022)","https://search.clinicalgenome.org/kb/gene-dosage/HGNC:17342","Dosage Working Group","definitive evidence (07/18/2018)","https://search.clinicalgenome.org/kb/gene-validity/CGGV:assertion_b8a924e2-e76b-4363-bf38-d95fd53d6141-2018-07-18T160000.000Z","Intellectual Disability and Autism","","",""
"BRWD3","HGNC:17342","https://search.clinicalgenome.org/kb/genes/HGNC:17342","X-linked intellectual disability","MONDO:0100284","https://search.clinicalgenome.org/kb/conditions/MONDO:0100284","N/A","3 - Sufficient Evidence for Haploinsufficiency (08/24/2022)","0 - No Evidence for Triplosensitivity (08/24/2022)","https://search.clinicalgenome.org/kb/gene-dosage/HGNC:17342","Dosage Working Group","","","","","",""
"BSCL2","HGNC:15832","https://search.clinicalgenome.org/kb/genes/HGNC:15832","distal hereditary motor neuropathy","MONDO:0018894","https://search.clinicalgenome.org/kb/conditions/MONDO:0018894","Autosomal dominant inheritance","","","","","definitive evidence (09/23/2022)","https://search.clinicalgenome.org/kb/gene-validity/CGGV:assertion_02472719-c26d-40ff-8ad4-897ef7a6800a-2022-09-23T160000.000Z","Charcot-Marie-Tooth","","",""
"BSCL2","HGNC:15832","https://search.clinicalgenome.org/kb/genes/HGNC:15832","lipodystrophy","MONDO:0006573","https://search.clinicalgenome.org/kb/conditions/MONDO:0006573","Autosomal recessive inheritance","","","","","definitive evidence (11/13/2024)","https://search.clinicalgenome.org/kb/gene-validity/CGGV:assertion_e6b2f631-aedd-4396-8170-a1878ccac459-2024-11-13T170000.000Z","Monogenic Diabetes","","",""
"BSND","HGNC:16512","https://search.clinicalgenome.org/kb/genes/HGNC:16512","Bartter disease type 4A","MONDO:0011242","https://search.clinicalgenome.org/kb/conditions/MONDO:0011242","Autosomal recessive inheritance","30 - Gene Associated with Autosomal Recessive Phenotype (05/17/2012)","0 - No Evidence for Triplosensitivity (05/17/2012)","https://search.clinicalgenome.org/kb/gene-dosage/HGNC:16512","Dosage Working Group","definitive evidence (07/10/2018)","https://search.clinicalgenome.org/kb/gene-validity/CGGV:assertion_9b69acb1-93bc-4bc0-8a33-77bf64179c32-2018-07-10T160000.000Z","Hearing Loss","","",""
"BTD","HGNC:1122","https://search.clinicalgenome.org/kb/genes/HGNC:1122","Leigh syndrome","MONDO:0009723","https://search.clinicalgenome.org/kb/conditions/MONDO:0009723","Autosomal recessive inheritance","30 - Gene Associated with Autosomal Recessive Phenotype (05/21/2015)","0 - No Evidence for Triplosensitivity (05/21/2015)","https://search.clinicalgenome.org/kb/gene-dosage/HGNC:1122","Dosage Working Group","moderate evidence (06/14/2021)","https://search.clinicalgenome.org/kb/gene-validity/CGGV:assertion_74599afe-02f9-4225-9e50-63306f04a552-2021-06-14T140327.018Z","Mitochondrial Diseases","","",""
"BTD","HGNC:1122","https://search.clinicalgenome.org/kb/genes/HGNC:1122","biotinidase deficiency","MONDO:0009665","https://search.clinicalgenome.org/kb/conditions/MONDO:0009665","Autosomal recessive inheritance","30 - Gene Associated with Autosomal Recessive Phenotype (05/21/2015)","0 - No Evidence for Triplosensitivity (05/21/2015)","https://search.clinicalgenome.org/kb/gene-dosage/HGNC:1122","Dosage Working Group","definitive evidence (02/10/2020)","https://search.clinicalgenome.org/kb/gene-validity/CGGV:assertion_847f7f2b-575f-4a90-bf02-179d464e4841-2020-02-10T180000.000Z","Hearing Loss","Limited Actionability (05/31/2022) | Definitive Actionability (05/31/2022)","https://actionability.clinicalgenome.org/ac/Adult/ui/stg2SummaryRpt?doc=AC098 | https://actionability.clinicalgenome.org/ac/Pediatric/ui/stg2SummaryRpt?doc=AC098","Adult Actionability Working Group | Pediatric Actionability Working Group"
"BTD","HGNC:1122","https://search.clinicalgenome.org/kb/genes/HGNC:1122","multiple carboxylase deficiency","MONDO:0015454","https://search.clinicalgenome.org/kb/conditions/MONDO:0015454","N/A","30 - Gene Associated with Autosomal Recessive Phenotype (05/21/2015)","0 - No Evidence for Triplosensitivity (05/21/2015)","https://search.clinicalgenome.org/kb/gene-dosage/HGNC:1122","Dosage Working Group","","","","Limited Actionability (05/31/2022) | Definitive Actionability (05/31/2022)","https://actionability.clinicalgenome.org/ac/Adult/ui/stg2SummaryRpt?doc=AC098 | https://actionability.clinicalgenome.org/ac/Pediatric/ui/stg2SummaryRpt?doc=AC098","Adult Actionability Working Group | Pediatric Actionability Working Group"
"BTK","HGNC:1133","https://search.clinicalgenome.org/kb/genes/HGNC:1133","isolated growth hormone deficiency type III","MONDO:0010615","https://search.clinicalgenome.org/kb/conditions/MONDO:0010615","X-linked inheritance","3 - Sufficient Evidence for Haploinsufficiency (03/24/2021)","0 - No Evidence for Triplosensitivity (03/24/2021)","https://search.clinicalgenome.org/kb/gene-dosage/HGNC:1133","Dosage Working Group","disputing (11/17/2020)","https://search.clinicalgenome.org/kb/gene-validity/CGGV:assertion_6341781b-9ba9-41b1-889a-8d65a9b3ebb7-2020-11-17T170000.000Z","Antibody Deficiencies GCEP","","",""
"BTK","HGNC:1133","https://search.clinicalgenome.org/kb/genes/HGNC:1133","Bruton-type agammaglobulinemia","MONDO:0010421","https://search.clinicalgenome.org/kb/conditions/MONDO:0010421","X-linked inheritance","3 - Sufficient Evidence for Haploinsufficiency (03/24/2021)","0 - No Evidence for Triplosensitivity (03/24/2021)","https://search.clinicalgenome.org/kb/gene-dosage/HGNC:1133","Dosage Working Group","definitive evidence (10/20/2020)","https://search.clinicalgenome.org/kb/gene-validity/CGGV:assertion_8dc4d594-2103-46ad-a786-f4bda9b95995-2020-10-20T160000.000Z","Antibody Deficiencies GCEP","","",""
"BUB1","HGNC:1148","https://search.clinicalgenome.org/kb/genes/HGNC:1148","colorectal cancer","MONDO:0005575","https://search.clinicalgenome.org/kb/conditions/MONDO:0005575","Autosomal dominant inheritance","","","","","limited evidence (12/20/2023)","https://search.clinicalgenome.org/kb/gene-validity/CGGV:assertion_018019f0-2a13-42e7-9a03-b7eac3a4c483-2023-12-20T180000.000Z","Hereditary Cancer","","",""
"BUB1B","HGNC:1149","https://search.clinicalgenome.org/kb/genes/HGNC:1149","mosaic variegated aneuploidy syndrome 1","MONDO:0009759","https://search.clinicalgenome.org/kb/conditions/MONDO:0009759","Autosomal recessive inheritance","30 - Gene Associated with Autosomal Recessive Phenotype (02/02/2022)","0 - No Evidence for Triplosensitivity (02/02/2022)","https://search.clinicalgenome.org/kb/gene-dosage/HGNC:1149","Dosage Working Group","definitive evidence (11/22/2019)","https://search.clinicalgenome.org/kb/gene-validity/CGGV:assertion_59147f27-d5a3-4760-ba8d-0429bae3c906-2019-11-22T145326.352Z","Hereditary Cancer","","",""
"BVES","HGNC:1152","https://search.clinicalgenome.org/kb/genes/HGNC:1152","autosomal recessive limb-girdle muscular dystrophy","MONDO:0015152","https://search.clinicalgenome.org/kb/conditions/MONDO:0015152","Autosomal recessive inheritance","","","","","definitive evidence (08/29/2024)","https://search.clinicalgenome.org/kb/gene-validity/CGGV:assertion_31a0db34-cad3-4746-a40f-2912318dfbd2-2024-08-29T190000.000Z","Muscular Dystrophies and Myopathies","","",""
"C19orf12","HGNC:25443","https://search.clinicalgenome.org/kb/genes/HGNC:25443","neurodegeneration with brain iron accumulation 4","MONDO:0013674","https://search.clinicalgenome.org/kb/conditions/MONDO:0013674","Autosomal dominant inheritance | Autosomal recessive inheritance","30 - Gene Associated with Autosomal Recessive Phenotype (08/22/2016)","0 - No Evidence for Triplosensitivity (08/22/2016)","https://search.clinicalgenome.org/kb/gene-dosage/HGNC:25443","Dosage Working Group","moderate evidence (02/28/2023) | definitive evidence (02/28/2023)","https://search.clinicalgenome.org/kb/gene-validity/CGGV:assertion_c78e8a8a-49db-40f5-96a3-d126a3834976-2023-02-28T170000.000Z | https://search.clinicalgenome.org/kb/gene-validity/CGGV:assertion_20b64ab8-0b48-40d4-8ef5-b3d251e4bec0-2023-02-28T170000.000Z","Syndromic Disorders | Syndromic Disorders","","",""
"C1GALT1C1","HGNC:24338","https://search.clinicalgenome.org/kb/genes/HGNC:24338","hemolytic uremic syndrome, atypical, 8, with rhizomelic short stature","MONDO:0957495","https://search.clinicalgenome.org/kb/conditions/MONDO:0957495","X-linked inheritance","","","","","limited evidence (01/28/2025)","https://search.clinicalgenome.org/kb/gene-validity/CGGV:assertion_5a5ca158-bc76-49f8-84a0-fc60e6b13fdb-2025-01-28T170000.000Z","Congenital Disorders of Glycosylation","","",""
"C1QB","HGNC:1242","https://search.clinicalgenome.org/kb/genes/HGNC:1242","C1Q deficiency","MONDO:0013343","https://search.clinicalgenome.org/kb/conditions/MONDO:0013343","Autosomal recessive inheritance","30 - Gene Associated with Autosomal Recessive Phenotype (01/17/2017)","0 - No Evidence for Triplosensitivity (01/17/2017)","https://search.clinicalgenome.org/kb/gene-dosage/HGNC:1242","Dosage Working Group","definitive evidence (01/09/2017)","https://search.clinicalgenome.org/kb/gene-validity/CGGCIEX:assertion_3216","General Gene Curation","","",""
"C1QBP","HGNC:1243","https://search.clinicalgenome.org/kb/genes/HGNC:1243","mitochondrial disease","MONDO:0044970","https://search.clinicalgenome.org/kb/conditions/MONDO:0044970","Autosomal recessive inheritance","","","","","definitive evidence (08/15/2022)","https://search.clinicalgenome.org/kb/gene-validity/CGGV:assertion_8e98e3a8-77f2-4011-96cb-6bcc54f36a8b-2022-08-15T160000.000Z","Mitochondrial Diseases","","",""
"C1QTNF5","HGNC:14344","https://search.clinicalgenome.org/kb/genes/HGNC:14344","inherited retinal dystrophy","MONDO:0019118","https://search.clinicalgenome.org/kb/conditions/MONDO:0019118","Autosomal dominant inheritance","","","","","definitive evidence (09/05/2024)","https://search.clinicalgenome.org/kb/gene-validity/CGGV:assertion_6ac4ac55-5f45-4ca8-ab83-7065e31f4efc-2024-09-05T160000.000Z","Retina","","",""
"C2CD3","HGNC:24564","https://search.clinicalgenome.org/kb/genes/HGNC:24564","orofaciodigital syndrome type 14","MONDO:0014413","https://search.clinicalgenome.org/kb/conditions/MONDO:0014413","Autosomal recessive inheritance","","","","","definitive evidence (05/24/2023)","https://search.clinicalgenome.org/kb/gene-validity/CGGV:assertion_ca993ab8-029f-46f6-9fc5-ffc1f54cb120-2023-05-24T160000.000Z","Kidney Cystic and Ciliopathy Disorders","","",""
"C3","HGNC:1318","https://search.clinicalgenome.org/kb/genes/HGNC:1318","atypical hemolytic-uremic syndrome with C3 anomaly","MONDO:0013043","https://search.clinicalgenome.org/kb/conditions/MONDO:0013043","Autosomal dominant inheritance","","","","","definitive evidence (09/29/2023)","https://search.clinicalgenome.org/kb/gene-validity/CGGV:assertion_78a4d83e-8fb0-4b47-9dfc-5dfe618e1aa3-2023-09-29T160000.000Z","Complement-Mediated Kidney Diseases","","",""
"C3","HGNC:1318","https://search.clinicalgenome.org/kb/genes/HGNC:1318","C3 glomerulonephritis","MONDO:0013892","https://search.clinicalgenome.org/kb/conditions/MONDO:0013892","Autosomal dominant inheritance","","","","","moderate evidence (03/29/2024)","https://search.clinicalgenome.org/kb/gene-validity/CGGV:assertion_2e000b88-9487-46a6-830a-7a613152853d-2024-03-29T160000.000Z","Complement-Mediated Kidney Diseases","","",""
"C9orf72","HGNC:28337","https://search.clinicalgenome.org/kb/genes/HGNC:28337","frontotemporal dementia and/or amyotrophic lateral sclerosis 1","MONDO:0007105","https://search.clinicalgenome.org/kb/conditions/MONDO:0007105","Autosomal dominant inheritance","","","","","definitive evidence (09/21/2021)","https://search.clinicalgenome.org/kb/gene-validity/CGGV:assertion_afd5a267-72c8-4a04-8404-4c819efe61c5-2021-09-21T030209.665Z","Amyotrophic Lateral Sclerosis Spectrum Disorders","","",""
"CA12","HGNC:1371","https://search.clinicalgenome.org/kb/genes/HGNC:1371","isolated hyperchlorhidrosis","MONDO:0007747","https://search.clinicalgenome.org/kb/conditions/MONDO:0007747","N/A","30 - Gene Associated with Autosomal Recessive Phenotype (08/22/2016)","","https://search.clinicalgenome.org/kb/gene-dosage/HGNC:1371","Dosage Working Group","","","","","",""
"CA2","HGNC:1373","https://search.clinicalgenome.org/kb/genes/HGNC:1373","autosomal recessive osteopetrosis 3","MONDO:0009818","https://search.clinicalgenome.org/kb/conditions/MONDO:0009818","Autosomal recessive inheritance","","","","","definitive evidence (06/10/2024)","https://search.clinicalgenome.org/kb/gene-validity/CGGV:assertion_55a34937-7d48-45b0-a6c8-8d799f0d5934-2024-06-10T160000.000Z","Skeletal Disorders","","",""
"CA5A","HGNC:1377","https://search.clinicalgenome.org/kb/genes/HGNC:1377","hyperammonemic encephalopathy due to carbonic anhydrase VA deficiency","MONDO:0014332","https://search.clinicalgenome.org/kb/conditions/MONDO:0014332","Autosomal recessive inheritance","30 - Gene Associated with Autosomal Recessive Phenotype (08/22/2016)","0 - No Evidence for Triplosensitivity (08/22/2016)","https://search.clinicalgenome.org/kb/gene-dosage/HGNC:1377","Dosage Working Group","definitive evidence (09/10/2018)","https://search.clinicalgenome.org/kb/gene-validity/CGGV:assertion_f7c5731a-866e-4a96-abb0-f0747f89280b-2018-09-10T160000.000Z","Aminoacidopathy","Has Insufficient Evidence for Actionability Based on Early Rule-out (09/19/2022)","https://actionability.clinicalgenome.org/ac/Adult/ui/stg2SummaryRpt?doc=AC1058","Adult Actionability Working Group"
"CA8","HGNC:1382","https://search.clinicalgenome.org/kb/genes/HGNC:1382","cerebellar ataxia","MONDO:0000437","https://search.clinicalgenome.org/kb/conditions/MONDO:0000437","Autosomal recessive inheritance","30 - Gene Associated with Autosomal Recessive Phenotype (08/22/2016)","0 - No Evidence for Triplosensitivity (08/22/2016)","https://search.clinicalgenome.org/kb/gene-dosage/HGNC:1382","Dosage Working Group","moderate evidence (01/16/2024)","https://search.clinicalgenome.org/kb/gene-validity/CGGV:assertion_a0800c48-e3b1-4cb2-bbd1-4d649e506ebd-2024-01-15T230000.000Z","Intellectual Disability and Autism","","",""
"CA8","HGNC:1382","https://search.clinicalgenome.org/kb/genes/HGNC:1382","cerebellar ataxia, intellectual disability, and dysequilibrium syndrome 3","MONDO:0013188","https://search.clinicalgenome.org/kb/conditions/MONDO:0013188","N/A","30 - Gene Associated with Autosomal Recessive Phenotype (08/22/2016)","0 - No Evidence for Triplosensitivity (08/22/2016)","https://search.clinicalgenome.org/kb/gene-dosage/HGNC:1382","Dosage Working Group","","","","","",""
"CABP2","HGNC:1385","https://search.clinicalgenome.org/kb/genes/HGNC:1385","nonsyndromic genetic hearing loss","MONDO:0019497","https://search.clinicalgenome.org/kb/conditions/MONDO:0019497","Autosomal recessive inheritance","30 - Gene Associated with Autosomal Recessive Phenotype (08/20/2021)","0 - No Evidence for Triplosensitivity (08/20/2021)","https://search.clinicalgenome.org/kb/gene-dosage/HGNC:1385","Dosage Working Group","definitive evidence (02/06/2020)","https://search.clinicalgenome.org/kb/gene-validity/CGGV:assertion_20de88d2-6681-4522-9e11-26cdf66a2c15-2020-02-06T170000.000Z","Hearing Loss","Strong Actionability (10/29/2020)","https://actionability.clinicalgenome.org/ac/Pediatric/ui/stg2SummaryRpt?doc=AC1018","Pediatric Actionability Working Group"
"CABP2","HGNC:1385","https://search.clinicalgenome.org/kb/genes/HGNC:1385","hearing loss, autosomal recessive","MONDO:0019588","https://search.clinicalgenome.org/kb/conditions/MONDO:0019588","N/A","30 - Gene Associated with Autosomal Recessive Phenotype (08/20/2021)","0 - No Evidence for Triplosensitivity (08/20/2021)","https://search.clinicalgenome.org/kb/gene-dosage/HGNC:1385","Dosage Working Group","","","","Strong Actionability (10/29/2020)","https://actionability.clinicalgenome.org/ac/Pediatric/ui/stg2SummaryRpt?doc=AC1018","Pediatric Actionability Working Group"
"CABP2","HGNC:1385","https://search.clinicalgenome.org/kb/genes/HGNC:1385","prelingual non-syndromic genetic hearing loss","MONDO:0016297","https://search.clinicalgenome.org/kb/conditions/MONDO:0016297","N/A","30 - Gene Associated with Autosomal Recessive Phenotype (08/20/2021)","0 - No Evidence for Triplosensitivity (08/20/2021)","https://search.clinicalgenome.org/kb/gene-dosage/HGNC:1385","Dosage Working Group","","","","Strong Actionability (10/29/2020)","https://actionability.clinicalgenome.org/ac/Pediatric/ui/stg2SummaryRpt?doc=AC1018","Pediatric Actionability Working Group"
"CABP2","HGNC:1385","https://search.clinicalgenome.org/kb/genes/HGNC:1385","autosomal recessive nonsyndromic hearing loss 93","MONDO:0013963","https://search.clinicalgenome.org/kb/conditions/MONDO:0013963","N/A","30 - Gene Associated with Autosomal Recessive Phenotype (08/20/2021)","0 - No Evidence for Triplosensitivity (08/20/2021)","https://search.clinicalgenome.org/kb/gene-dosage/HGNC:1385","Dosage Working Group","","","","Strong Actionability (10/29/2020)","https://actionability.clinicalgenome.org/ac/Pediatric/ui/stg2SummaryRpt?doc=AC1018","Pediatric Actionability Working Group"
"CABP4","HGNC:1386","https://search.clinicalgenome.org/kb/genes/HGNC:1386","cone-rod synaptic disorder, congenital nonprogressive","MONDO:0012490","https://search.clinicalgenome.org/kb/conditions/MONDO:0012490","N/A","30 - Gene Associated with Autosomal Recessive Phenotype (08/22/2016)","0 - No Evidence for Triplosensitivity (08/22/2016)","https://search.clinicalgenome.org/kb/gene-dosage/HGNC:1386","Dosage Working Group","","","","","",""
"CACNA1A","HGNC:1388","https://search.clinicalgenome.org/kb/genes/HGNC:1388","episodic ataxia type 2","MONDO:0007163","https://search.clinicalgenome.org/kb/conditions/MONDO:0007163","N/A","3 - Sufficient Evidence for Haploinsufficiency (05/21/2017)","0 - No Evidence for Triplosensitivity (05/21/2017)","https://search.clinicalgenome.org/kb/gene-dosage/HGNC:1388","Dosage Working Group","","","","","",""
"CACNA1B","HGNC:1389","https://search.clinicalgenome.org/kb/genes/HGNC:1389","complex neurodevelopmental disorder with motor features","MONDO:0100516","https://search.clinicalgenome.org/kb/conditions/MONDO:0100516","Autosomal recessive inheritance","","","","","moderate evidence (08/21/2023)","https://search.clinicalgenome.org/kb/gene-validity/CGGV:assertion_df8ed53b-a959-4e5b-a323-7a80b152a98b-2023-08-21T180000.000Z","Cerebral Palsy","","",""
"CACNA1C","HGNC:1390","https://search.clinicalgenome.org/kb/genes/HGNC:1390","Timothy syndrome","MONDO:0010979","https://search.clinicalgenome.org/kb/conditions/MONDO:0010979","Autosomal dominant inheritance","1 - Little Evidence for Haploinsufficiency (03/24/2016)","0 - No Evidence for Triplosensitivity (03/24/2016)","https://search.clinicalgenome.org/kb/gene-dosage/HGNC:1390","Dosage Working Group","definitive evidence (04/14/2023)","https://search.clinicalgenome.org/kb/gene-validity/CGGV:assertion_a1fc2dfc-d200-40d0-9cd6-421276578e6e-2023-04-14T020000.000Z","Hereditary Cardiovascular Disease","","",""
"CACNA1C","HGNC:1390","https://search.clinicalgenome.org/kb/genes/HGNC:1390","long QT syndrome","MONDO:0002442","https://search.clinicalgenome.org/kb/conditions/MONDO:0002442","Autosomal dominant inheritance","1 - Little Evidence for Haploinsufficiency (03/24/2016)","0 - No Evidence for Triplosensitivity (03/24/2016)","https://search.clinicalgenome.org/kb/gene-dosage/HGNC:1390","Dosage Working Group","moderate evidence (04/24/2020)","https://search.clinicalgenome.org/kb/gene-validity/CGGV:assertion_c496551d-c7a7-4e49-ad41-8cfd49840dc1-2020-04-24T040000.000Z","Long QT Syndrome","","",""
"CACNA1C","HGNC:1390","https://search.clinicalgenome.org/kb/genes/HGNC:1390","short QT syndrome","MONDO:0000453","https://search.clinicalgenome.org/kb/conditions/MONDO:0000453","Autosomal dominant inheritance","1 - Little Evidence for Haploinsufficiency (03/24/2016)","0 - No Evidence for Triplosensitivity (03/24/2016)","https://search.clinicalgenome.org/kb/gene-dosage/HGNC:1390","Dosage Working Group","disputing (08/03/2020)","https://search.clinicalgenome.org/kb/gene-validity/CGGV:assertion_51dae85e-8745-48c1-8fb9-cabc2501d3fb-2020-08-03T160000.000Z","Short QT Syndrome","","",""
"CACNA1C","HGNC:1390","https://search.clinicalgenome.org/kb/genes/HGNC:1390","Brugada syndrome","MONDO:0015263","https://search.clinicalgenome.org/kb/conditions/MONDO:0015263","Autosomal dominant inheritance","1 - Little Evidence for Haploinsufficiency (03/24/2016)","0 - No Evidence for Triplosensitivity (03/24/2016)","https://search.clinicalgenome.org/kb/gene-dosage/HGNC:1390","Dosage Working Group","disputing (02/25/2025)","https://search.clinicalgenome.org/kb/gene-validity/CGGV:assertion_0d869dbe-c00c-4875-93c8-80ba0436b895-2025-02-25T010000.000Z","Hereditary Cardiovascular Disease","","",""
"CACNA1D","HGNC:1391","https://search.clinicalgenome.org/kb/genes/HGNC:1391","complex neurodevelopmental disorder","MONDO:0100038","https://search.clinicalgenome.org/kb/conditions/MONDO:0100038","Autosomal dominant inheritance","","","","","definitive evidence (09/04/2024)","https://search.clinicalgenome.org/kb/gene-validity/CGGV:assertion_9eb44537-f403-45ce-b89e-83363918f986-2024-09-04T160000.000Z","Intellectual Disability and Autism","","",""
"CACNA1D","HGNC:1391","https://search.clinicalgenome.org/kb/genes/HGNC:1391","sinoatrial node dysfunction and deafness","MONDO:0013960","https://search.clinicalgenome.org/kb/conditions/MONDO:0013960","Autosomal recessive inheritance","","","","","moderate evidence (04/17/2024)","https://search.clinicalgenome.org/kb/gene-validity/CGGV:assertion_8249f2c1-ff59-4ea2-8e7e-11256c73433e-2024-04-17T160000.000Z","Hearing Loss","","",""
"CACNA1E","HGNC:1392","https://search.clinicalgenome.org/kb/genes/HGNC:1392","genetic developmental and epileptic encephalopathy","MONDO:0100062","https://search.clinicalgenome.org/kb/conditions/MONDO:0100062","Autosomal dominant inheritance","1 - Little Evidence for Haploinsufficiency (09/10/2024)","0 - No Evidence for Triplosensitivity (09/10/2024)","https://search.clinicalgenome.org/kb/gene-dosage/HGNC:1392","Dosage Working Group","definitive evidence (12/06/2023)","https://search.clinicalgenome.org/kb/gene-validity/CGGV:assertion_0cf0db0a-4af2-4e60-ab64-ce0115241caf-2023-12-06T200000.000Z","Intellectual Disability and Autism","","",""
"CACNA1E","HGNC:1392","https://search.clinicalgenome.org/kb/genes/HGNC:1392","developmental and epileptic encephalopathy, 69","MONDO:0032657","https://search.clinicalgenome.org/kb/conditions/MONDO:0032657","N/A","1 - Little Evidence for Haploinsufficiency (09/10/2024)","0 - No Evidence for Triplosensitivity (09/10/2024)","https://search.clinicalgenome.org/kb/gene-dosage/HGNC:1392","Dosage Working Group","","","","","",""
"CACNA1F","HGNC:1393","https://search.clinicalgenome.org/kb/genes/HGNC:1393","CACNA1F-related retinopathy","MONDO:0700243","https://search.clinicalgenome.org/kb/conditions/MONDO:0700243","X-linked inheritance","","","","","definitive evidence (01/05/2023)","https://search.clinicalgenome.org/kb/gene-validity/CGGV:assertion_c7800cd0-11d8-4e50-85f0-04574c8798f4-2023-01-05T170000.000Z","Retina","","",""
"CACNA1S","HGNC:1397","https://search.clinicalgenome.org/kb/genes/HGNC:1397","malignant hyperthermia, susceptibility to, 5","MONDO:0011163","https://search.clinicalgenome.org/kb/conditions/MONDO:0011163","Autosomal dominant inheritance","0 - No Evidence for Haploinsufficiency (01/18/2016)","0 - No Evidence for Triplosensitivity (01/18/2016)","https://search.clinicalgenome.org/kb/gene-dosage/HGNC:1397","Dosage Working Group","moderate evidence (04/26/2023)","https://search.clinicalgenome.org/kb/gene-validity/CGGV:assertion_22fff996-ca2e-473d-8a57-d2b8ff022a92-2023-04-26T160000.000Z","General Gene Curation","Strong Actionability (01/12/2021) | Strong Actionability (01/12/2021)","https://actionability.clinicalgenome.org/ac/Adult/ui/stg2SummaryRpt?doc=AC076 | https://actionability.clinicalgenome.org/ac/Pediatric/ui/stg2SummaryRpt?doc=AC076","Adult Actionability Working Group | Pediatric Actionability Working Group"
"CACNA1S","HGNC:1397","https://search.clinicalgenome.org/kb/genes/HGNC:1397","malignant hyperthermia of anesthesia","MONDO:0018493","https://search.clinicalgenome.org/kb/conditions/MONDO:0018493","N/A","0 - No Evidence for Haploinsufficiency (01/18/2016)","0 - No Evidence for Triplosensitivity (01/18/2016)","https://search.clinicalgenome.org/kb/gene-dosage/HGNC:1397","Dosage Working Group","","","","Strong Actionability (01/12/2021) | Strong Actionability (01/12/2021)","https://actionability.clinicalgenome.org/ac/Adult/ui/stg2SummaryRpt?doc=AC076 | https://actionability.clinicalgenome.org/ac/Pediatric/ui/stg2SummaryRpt?doc=AC076","Adult Actionability Working Group | Pediatric Actionability Working Group"
"CACNA2D1","HGNC:1399","https://search.clinicalgenome.org/kb/genes/HGNC:1399","short QT syndrome","MONDO:0000453","https://search.clinicalgenome.org/kb/conditions/MONDO:0000453","Autosomal dominant inheritance","","","","","disputing (09/05/2020)","https://search.clinicalgenome.org/kb/gene-validity/CGGV:assertion_896733cc-c686-4279-affb-e1860fd10ca2-2020-09-05T160000.000Z","Short QT Syndrome","","",""
"CACNA2D1","HGNC:1399","https://search.clinicalgenome.org/kb/genes/HGNC:1399","Brugada syndrome 1","MONDO:0011001","https://search.clinicalgenome.org/kb/conditions/MONDO:0011001","Autosomal dominant inheritance","","","","","disputing (11/21/2017)","https://search.clinicalgenome.org/kb/gene-validity/CGGCIEX:assertion_10147","Brugada Syndrome","","",""
"CACNA2D2","HGNC:1400","https://search.clinicalgenome.org/kb/genes/HGNC:1400","complex neurodevelopmental disorder","MONDO:0100038","https://search.clinicalgenome.org/kb/conditions/MONDO:0100038","Autosomal recessive inheritance","","","","","moderate evidence (11/21/2023)","https://search.clinicalgenome.org/kb/gene-validity/CGGV:assertion_aadbfa17-bd3f-4521-bb7f-c5ada786d05c-2023-11-21T080000.000Z","Epilepsy","","",""
"CACNA2D4","HGNC:20202","https://search.clinicalgenome.org/kb/genes/HGNC:20202","CACNA2D4-related retinopathy","MONDO:0700244","https://search.clinicalgenome.org/kb/conditions/MONDO:0700244","Autosomal recessive inheritance","","","","","definitive evidence (03/02/2023)","https://search.clinicalgenome.org/kb/gene-validity/CGGV:assertion_f413ef18-b8cf-44c3-abde-b7533e1dd54f-2023-03-02T170000.000Z","Retina","","",""
"CACNB2","HGNC:1402","https://search.clinicalgenome.org/kb/genes/HGNC:1402","cardiogenetic disease","MONDO:0100547","https://search.clinicalgenome.org/kb/conditions/MONDO:0100547","Autosomal dominant inheritance","","","","","disputing (07/22/2025)","https://search.clinicalgenome.org/kb/gene-validity/CGGV:assertion_1dd59b42-2ed6-4685-b93b-39ba49ece50b-2025-07-22T160000.000Z","Hereditary Cardiovascular Disease","","",""
"CACNB4","HGNC:1404","https://search.clinicalgenome.org/kb/genes/HGNC:1404","epilepsy","MONDO:0005027","https://search.clinicalgenome.org/kb/conditions/MONDO:0005027","Autosomal dominant inheritance","","","","","refuting evidence (07/05/2022)","https://search.clinicalgenome.org/kb/gene-validity/CGGV:assertion_d2fad131-8e91-4874-9394-8b86d6d62abb-2022-07-05T160000.000Z","Epilepsy","","",""
"CACNG2","HGNC:1406","https://search.clinicalgenome.org/kb/genes/HGNC:1406","complex neurodevelopmental disorder","MONDO:0100038","https://search.clinicalgenome.org/kb/conditions/MONDO:0100038","Autosomal dominant inheritance","","","","","limited evidence (07/29/2021)","https://search.clinicalgenome.org/kb/gene-validity/CGGV:assertion_a61ad78f-0f37-4221-82f4-710275033666-2021-07-29T210333.496Z","Intellectual Disability and Autism","","",""
"CAD","HGNC:1424","https://search.clinicalgenome.org/kb/genes/HGNC:1424","developmental and epileptic encephalopathy, 50","MONDO:0014647","https://search.clinicalgenome.org/kb/conditions/MONDO:0014647","Autosomal recessive inheritance","","","","","definitive evidence (04/03/2024)","https://search.clinicalgenome.org/kb/gene-validity/CGGV:assertion_e4a828c0-e00b-4756-aec7-b83e529ec8e4-2024-04-03T160000.000Z","Congenital Disorders of Glycosylation","","",""
"CALM1","HGNC:1442","https://search.clinicalgenome.org/kb/genes/HGNC:1442","long QT syndrome","MONDO:0002442","https://search.clinicalgenome.org/kb/conditions/MONDO:0002442","Autosomal dominant inheritance","0 - No Evidence for Haploinsufficiency (12/12/2023)","0 - No Evidence for Triplosensitivity (12/12/2023)","https://search.clinicalgenome.org/kb/gene-dosage/HGNC:1442","Dosage Working Group","definitive evidence (09/25/2018)","https://search.clinicalgenome.org/kb/gene-validity/CGGV:assertion_4a150cd9-e16b-4992-8cc7-5ccec44b4d6b-2018-09-25T160000.000Z","Long QT Syndrome","","",""
"CALM1","HGNC:1442","https://search.clinicalgenome.org/kb/genes/HGNC:1442","catecholaminergic polymorphic ventricular tachycardia","MONDO:0017990","https://search.clinicalgenome.org/kb/conditions/MONDO:0017990","Autosomal dominant inheritance","0 - No Evidence for Haploinsufficiency (12/12/2023)","0 - No Evidence for Triplosensitivity (12/12/2023)","https://search.clinicalgenome.org/kb/gene-dosage/HGNC:1442","Dosage Working Group","moderate evidence (06/17/2021)","https://search.clinicalgenome.org/kb/gene-validity/CGGV:assertion_1ca1d8df-10fa-48ef-aea4-fb4dc6564dd0-2021-06-17T160000.000Z","Catecholaminergic Polymorphic Ventricular Tachycardia","Moderate Actionability (03/11/2021) | Strong Actionability (03/11/2021)","https://actionability.clinicalgenome.org/ac/Adult/ui/stg2SummaryRpt?doc=AC042 | https://actionability.clinicalgenome.org/ac/Pediatric/ui/stg2SummaryRpt?doc=AC042","Adult Actionability Working Group | Pediatric Actionability Working Group"
"CALM1","HGNC:1442","https://search.clinicalgenome.org/kb/genes/HGNC:1442","catecholaminergic polymorphic ventricular tachycardia 4","MONDO:0013966","https://search.clinicalgenome.org/kb/conditions/MONDO:0013966","N/A","0 - No Evidence for Haploinsufficiency (12/12/2023)","0 - No Evidence for Triplosensitivity (12/12/2023)","https://search.clinicalgenome.org/kb/gene-dosage/HGNC:1442","Dosage Working Group","","","","Moderate Actionability (03/11/2021) | Strong Actionability (03/11/2021)","https://actionability.clinicalgenome.org/ac/Adult/ui/stg2SummaryRpt?doc=AC042 | https://actionability.clinicalgenome.org/ac/Pediatric/ui/stg2SummaryRpt?doc=AC042","Adult Actionability Working Group | Pediatric Actionability Working Group"
"CALM2","HGNC:1445","https://search.clinicalgenome.org/kb/genes/HGNC:1445","long QT syndrome","MONDO:0002442","https://search.clinicalgenome.org/kb/conditions/MONDO:0002442","Autosomal dominant inheritance","0 - No Evidence for Haploinsufficiency (07/09/2024)","0 - No Evidence for Triplosensitivity (07/09/2024)","https://search.clinicalgenome.org/kb/gene-dosage/HGNC:1445","Dosage Working Group","definitive evidence (09/25/2018)","https://search.clinicalgenome.org/kb/gene-validity/CGGV:assertion_86e4b783-3b60-4a1d-ab34-e61d27751ca6-2018-09-25T160000.000Z","Long QT Syndrome","","",""
"CALM2","HGNC:1445","https://search.clinicalgenome.org/kb/genes/HGNC:1445","catecholaminergic polymorphic ventricular tachycardia","MONDO:0017990","https://search.clinicalgenome.org/kb/conditions/MONDO:0017990","Autosomal dominant inheritance","0 - No Evidence for Haploinsufficiency (07/09/2024)","0 - No Evidence for Triplosensitivity (07/09/2024)","https://search.clinicalgenome.org/kb/gene-dosage/HGNC:1445","Dosage Working Group","moderate evidence (06/17/2021)","https://search.clinicalgenome.org/kb/gene-validity/CGGV:assertion_42d280da-accc-46f2-8832-47d5a3eeeba7-2021-06-17T160000.000Z","Catecholaminergic Polymorphic Ventricular Tachycardia","Moderate Actionability (03/11/2021) | Strong Actionability (03/11/2021)","https://actionability.clinicalgenome.org/ac/Adult/ui/stg2SummaryRpt?doc=AC042 | https://actionability.clinicalgenome.org/ac/Pediatric/ui/stg2SummaryRpt?doc=AC042","Adult Actionability Working Group | Pediatric Actionability Working Group"
"CALM3","HGNC:1449","https://search.clinicalgenome.org/kb/genes/HGNC:1449","long QT syndrome","MONDO:0002442","https://search.clinicalgenome.org/kb/conditions/MONDO:0002442","Autosomal dominant inheritance","0 - No Evidence for Haploinsufficiency (07/09/2024)","0 - No Evidence for Triplosensitivity (07/09/2024)","https://search.clinicalgenome.org/kb/gene-dosage/HGNC:1449","Dosage Working Group","definitive evidence (09/25/2018)","https://search.clinicalgenome.org/kb/gene-validity/CGGV:assertion_3cc2a1ae-5f3d-445c-b124-f3d38fdd070a-2018-09-25T160000.000Z","Long QT Syndrome","","",""
"CALM3","HGNC:1449","https://search.clinicalgenome.org/kb/genes/HGNC:1449","catecholaminergic polymorphic ventricular tachycardia","MONDO:0017990","https://search.clinicalgenome.org/kb/conditions/MONDO:0017990","Autosomal dominant inheritance","0 - No Evidence for Haploinsufficiency (07/09/2024)","0 - No Evidence for Triplosensitivity (07/09/2024)","https://search.clinicalgenome.org/kb/gene-dosage/HGNC:1449","Dosage Working Group","moderate evidence (06/17/2021)","https://search.clinicalgenome.org/kb/gene-validity/CGGV:assertion_1b7fc965-a109-4448-94a0-00a9b078b484-2021-06-17T160000.000Z","Catecholaminergic Polymorphic Ventricular Tachycardia","Moderate Actionability (03/11/2021) | Strong Actionability (03/11/2021)","https://actionability.clinicalgenome.org/ac/Adult/ui/stg2SummaryRpt?doc=AC042 | https://actionability.clinicalgenome.org/ac/Pediatric/ui/stg2SummaryRpt?doc=AC042","Adult Actionability Working Group | Pediatric Actionability Working Group"
"CALM3","HGNC:1449","https://search.clinicalgenome.org/kb/genes/HGNC:1449","long QT syndrome 16","MONDO:0032915","https://search.clinicalgenome.org/kb/conditions/MONDO:0032915","N/A","0 - No Evidence for Haploinsufficiency (07/09/2024)","0 - No Evidence for Triplosensitivity (07/09/2024)","https://search.clinicalgenome.org/kb/gene-dosage/HGNC:1449","Dosage Working Group","","","","Moderate Actionability (03/11/2021) | Strong Actionability (03/11/2021)","https://actionability.clinicalgenome.org/ac/Adult/ui/stg2SummaryRpt?doc=AC042 | https://actionability.clinicalgenome.org/ac/Pediatric/ui/stg2SummaryRpt?doc=AC042","Adult Actionability Working Group | Pediatric Actionability Working Group"
"CALR3","HGNC:20407","https://search.clinicalgenome.org/kb/genes/HGNC:20407","hypertrophic cardiomyopathy","MONDO:0005045","https://search.clinicalgenome.org/kb/conditions/MONDO:0005045","Autosomal dominant inheritance","","","","","disputing (01/11/2023)","https://search.clinicalgenome.org/kb/gene-validity/CGGV:assertion_fd8036e5-bf01-4b89-b4fc-94080d835d99-2023-01-11T170000.000Z","Hereditary Cardiovascular Disease","","",""
"CAMK2A","HGNC:1460","https://search.clinicalgenome.org/kb/genes/HGNC:1460","complex neurodevelopmental disorder","MONDO:0100038","https://search.clinicalgenome.org/kb/conditions/MONDO:0100038","Autosomal dominant inheritance","1 - Little Evidence for Haploinsufficiency (05/24/2023)","0 - No Evidence for Triplosensitivity (05/24/2023)","https://search.clinicalgenome.org/kb/gene-dosage/HGNC:1460","Dosage Working Group","definitive evidence (10/15/2024)","https://search.clinicalgenome.org/kb/gene-validity/CGGV:assertion_82e77410-49d7-41b8-a5b8-278afac7dc26-2024-10-15T190000.000Z","Intellectual Disability and Autism","","",""
"CAMK2A","HGNC:1460","https://search.clinicalgenome.org/kb/genes/HGNC:1460","intellectual disability, autosomal dominant 53","MONDO:0030919","https://search.clinicalgenome.org/kb/conditions/MONDO:0030919","N/A","1 - Little Evidence for Haploinsufficiency (05/24/2023)","0 - No Evidence for Triplosensitivity (05/24/2023)","https://search.clinicalgenome.org/kb/gene-dosage/HGNC:1460","Dosage Working Group","","","","","",""
"CAMK2B","HGNC:1461","https://search.clinicalgenome.org/kb/genes/HGNC:1461","intellectual disability, autosomal dominant 54","MONDO:0030920","https://search.clinicalgenome.org/kb/conditions/MONDO:0030920","N/A","1 - Little Evidence for Haploinsufficiency (01/25/2023)","0 - No Evidence for Triplosensitivity (01/25/2023)","https://search.clinicalgenome.org/kb/gene-dosage/HGNC:1461","Dosage Working Group","","","","","",""
"CAMK2G","HGNC:1463","https://search.clinicalgenome.org/kb/genes/HGNC:1463","intellectual developmental disorder 59","MONDO:0032795","https://search.clinicalgenome.org/kb/conditions/MONDO:0032795","Autosomal dominant inheritance","","","","","limited evidence (04/04/2025)","https://search.clinicalgenome.org/kb/gene-validity/CGGV:assertion_525f1ddb-a662-4baf-b877-45fc26e07b71-2025-04-04T160000.000Z","Syndromic Disorders","","",""
"CAMLG","HGNC:1471","https://search.clinicalgenome.org/kb/genes/HGNC:1471","congenital disorder of glycosylation, type IIz","MONDO:0859357","https://search.clinicalgenome.org/kb/conditions/MONDO:0859357","Autosomal recessive inheritance","","","","","limited evidence (09/25/2024)","https://search.clinicalgenome.org/kb/gene-validity/CGGV:assertion_c077f9b7-9845-44dc-8007-be476f7b291e-2024-09-25T160000.000Z","Congenital Disorders of Glycosylation","","",""
"CAMTA1","HGNC:18806","https://search.clinicalgenome.org/kb/genes/HGNC:18806","cerebellar dysfunction with variable cognitive and behavioral abnormalities","MONDO:0013886","https://search.clinicalgenome.org/kb/conditions/MONDO:0013886","Autosomal dominant inheritance","3 - Sufficient Evidence for Haploinsufficiency (12/14/2017)","0 - No Evidence for Triplosensitivity (12/14/2017)","https://search.clinicalgenome.org/kb/gene-dosage/HGNC:18806","Dosage Working Group","definitive evidence (05/16/2023)","https://search.clinicalgenome.org/kb/gene-validity/CGGV:assertion_c099ca83-11be-4d06-b8d7-f2cd8efca1a5-2023-05-16T060000.000Z","Intellectual Disability and Autism","","",""
"CANT1","HGNC:19721","https://search.clinicalgenome.org/kb/genes/HGNC:19721","Desbuquois dysplasia 1","MONDO:0009629","https://search.clinicalgenome.org/kb/conditions/MONDO:0009629","Autosomal recessive inheritance","30 - Gene Associated with Autosomal Recessive Phenotype (08/22/2016)","","https://search.clinicalgenome.org/kb/gene-dosage/HGNC:19721","Dosage Working Group","definitive evidence (11/20/2024)","https://search.clinicalgenome.org/kb/gene-validity/CGGV:assertion_30c64852-60e0-44ce-bf10-cf7af11b1fa9-2024-11-20T170000.000Z","Prenatal","","",""
"CAPN3","HGNC:1480","https://search.clinicalgenome.org/kb/genes/HGNC:1480","muscular dystrophy, limb-girdle, autosomal dominant","MONDO:0015151","https://search.clinicalgenome.org/kb/conditions/MONDO:0015151","Autosomal dominant inheritance","30 - Gene Associated with Autosomal Recessive Phenotype (08/22/2016)","0 - No Evidence for Triplosensitivity (08/22/2016)","https://search.clinicalgenome.org/kb/gene-dosage/HGNC:1480","Dosage Working Group","definitive evidence (05/13/2025)","https://search.clinicalgenome.org/kb/gene-validity/CGGV:assertion_6c9eee52-920c-47e4-99f9-a5afb97d49f2-2025-05-13T160000.000Z","Muscular Dystrophies and Myopathies","","",""
"CAPN3","HGNC:1480","https://search.clinicalgenome.org/kb/genes/HGNC:1480","autosomal recessive limb-girdle muscular dystrophy","MONDO:0015152","https://search.clinicalgenome.org/kb/conditions/MONDO:0015152","Autosomal recessive inheritance","30 - Gene Associated with Autosomal Recessive Phenotype (08/22/2016)","0 - No Evidence for Triplosensitivity (08/22/2016)","https://search.clinicalgenome.org/kb/gene-dosage/HGNC:1480","Dosage Working Group","definitive evidence (08/29/2024)","https://search.clinicalgenome.org/kb/gene-validity/CGGV:assertion_86925075-3fea-401c-90b3-6b40b2b045ca-2024-08-29T190000.000Z","Muscular Dystrophies and Myopathies","","",""
"CAPN3","HGNC:1480","https://search.clinicalgenome.org/kb/genes/HGNC:1480","autosomal recessive limb-girdle muscular dystrophy type 2A","MONDO:0009675","https://search.clinicalgenome.org/kb/conditions/MONDO:0009675","N/A","30 - Gene Associated with Autosomal Recessive Phenotype (08/22/2016)","0 - No Evidence for Triplosensitivity (08/22/2016)","https://search.clinicalgenome.org/kb/gene-dosage/HGNC:1480","Dosage Working Group","","","","","",""
"CAPN5","HGNC:1482","https://search.clinicalgenome.org/kb/genes/HGNC:1482","CAPN5-related vitreoretinopathy","MONDO:0100450","https://search.clinicalgenome.org/kb/conditions/MONDO:0100450","Autosomal dominant inheritance","","","","","definitive evidence (08/05/2021)","https://search.clinicalgenome.org/kb/gene-validity/CGGV:assertion_7d39e430-b1fc-43f1-957b-1c02eb66a69c-2021-08-05T160000.000Z","Retina","","",""
"CAPRIN1","HGNC:6743","https://search.clinicalgenome.org/kb/genes/HGNC:6743","complex neurodevelopmental disorder","MONDO:0100038","https://search.clinicalgenome.org/kb/conditions/MONDO:0100038","N/A","1 - Little Evidence for Haploinsufficiency (07/24/2024)","0 - No Evidence for Triplosensitivity (07/24/2024)","https://search.clinicalgenome.org/kb/gene-dosage/HGNC:6743","Dosage Working Group","","","","","",""
"CARD11","HGNC:16393","https://search.clinicalgenome.org/kb/genes/HGNC:16393","immunodeficiency 11b with atopic dermatitis","MONDO:0054697","https://search.clinicalgenome.org/kb/conditions/MONDO:0054697","Autosomal dominant inheritance","","","","","definitive evidence (03/15/2022)","https://search.clinicalgenome.org/kb/gene-validity/CGGV:assertion_603e8c98-82b7-41b5-8174-1fdbfc724a7d-2022-03-15T131220.080Z","Antibody Deficiencies GCEP","","",""
"CARD11","HGNC:16393","https://search.clinicalgenome.org/kb/genes/HGNC:16393","BENTA disease","MONDO:0014645","https://search.clinicalgenome.org/kb/conditions/MONDO:0014645","Autosomal dominant inheritance","","","","","definitive evidence (03/15/2022)","https://search.clinicalgenome.org/kb/gene-validity/CGGV:assertion_23dd1a19-585b-46bb-9241-682b200bfd7d-2022-03-15T131318.170Z","Antibody Deficiencies GCEP","","",""
"CARD11","HGNC:16393","https://search.clinicalgenome.org/kb/genes/HGNC:16393","severe combined immunodeficiency due to CARD11 deficiency","MONDO:0014081","https://search.clinicalgenome.org/kb/conditions/MONDO:0014081","Autosomal recessive inheritance","","","","","definitive evidence (03/15/2022)","https://search.clinicalgenome.org/kb/gene-validity/CGGV:assertion_3ce06b6f-cf7f-43f3-bf9c-5d3978f1db61-2022-03-15T131409.712Z","Antibody Deficiencies GCEP","","",""
"CARMIL2","HGNC:27089","https://search.clinicalgenome.org/kb/genes/HGNC:27089","severe combined immunodeficiency due to CARMIL2 deficiency","MONDO:0029134","https://search.clinicalgenome.org/kb/conditions/MONDO:0029134","Autosomal recessive inheritance","","","","","definitive evidence (03/12/2024)","https://search.clinicalgenome.org/kb/gene-validity/CGGV:assertion_0055cbc0-64df-4f38-9074-495f4ac74e1c-2024-03-12T160000.000Z","Primary Immune Regulatory Disorders","","",""
"CARS2","HGNC:25695","https://search.clinicalgenome.org/kb/genes/HGNC:25695","mitochondrial disease","MONDO:0044970","https://search.clinicalgenome.org/kb/conditions/MONDO:0044970","Autosomal recessive inheritance","","","","","moderate evidence (05/19/2022)","https://search.clinicalgenome.org/kb/gene-validity/CGGV:assertion_a07aaa07-ad0d-4dac-8751-18242a3f36a9-2022-05-19T160000.000Z","Mitochondrial Diseases","","",""
"CASK","HGNC:1497","https://search.clinicalgenome.org/kb/genes/HGNC:1497","X-linked syndromic intellectual disability","MONDO:0020119","https://search.clinicalgenome.org/kb/conditions/MONDO:0020119","X-linked inheritance","3 - Sufficient Evidence for Haploinsufficiency (06/28/2012)","0 - No Evidence for Triplosensitivity (06/28/2012)","https://search.clinicalgenome.org/kb/gene-dosage/HGNC:1497","Dosage Working Group","definitive evidence (07/09/2019)","https://search.clinicalgenome.org/kb/gene-validity/CGGV:assertion_ca0e703c-3fe1-44a1-8632-036554b2f158-2019-07-09T160000.000Z","Intellectual Disability and Autism","","",""
"CASK","HGNC:1497","https://search.clinicalgenome.org/kb/genes/HGNC:1497","syndromic X-linked intellectual disability Najm type","MONDO:0010417","https://search.clinicalgenome.org/kb/conditions/MONDO:0010417","N/A","3 - Sufficient Evidence for Haploinsufficiency (06/28/2012)","0 - No Evidence for Triplosensitivity (06/28/2012)","https://search.clinicalgenome.org/kb/gene-dosage/HGNC:1497","Dosage Working Group","","","","","",""
"CASP10","HGNC:1500","https://search.clinicalgenome.org/kb/genes/HGNC:1500","autoimmune lymphoproliferative syndrome type 2A","MONDO:0011383","https://search.clinicalgenome.org/kb/conditions/MONDO:0011383","Autosomal dominant inheritance","1 - Little Evidence for Haploinsufficiency (04/10/2020)","0 - No Evidence for Triplosensitivity (04/10/2020)","https://search.clinicalgenome.org/kb/gene-dosage/HGNC:1500","Dosage Working Group","limited evidence (03/19/2024)","https://search.clinicalgenome.org/kb/gene-validity/CGGV:assertion_dd4bc3b7-ee3f-4fe0-b24a-be27e0840506-2024-03-19T160000.000Z","Primary Immune Regulatory Disorders","","",""
"CASQ2","HGNC:1513","https://search.clinicalgenome.org/kb/genes/HGNC:1513","hypertrophic cardiomyopathy","MONDO:0005045","https://search.clinicalgenome.org/kb/conditions/MONDO:0005045","Autosomal dominant inheritance","30 - Gene Associated with Autosomal Recessive Phenotype (08/22/2016)","","https://search.clinicalgenome.org/kb/gene-dosage/HGNC:1513","Dosage Working Group","disputing (05/10/2022)","https://search.clinicalgenome.org/kb/gene-validity/CGGV:assertion_07177c89-7845-4df5-ba3e-bdd415b5c8b3-2022-05-10T160000.000Z","Hereditary Cardiovascular Disease","","",""
"CASQ2","HGNC:1513","https://search.clinicalgenome.org/kb/genes/HGNC:1513","catecholaminergic polymorphic ventricular tachycardia","MONDO:0017990","https://search.clinicalgenome.org/kb/conditions/MONDO:0017990","Autosomal recessive inheritance | Autosomal dominant inheritance","30 - Gene Associated with Autosomal Recessive Phenotype (08/22/2016)","","https://search.clinicalgenome.org/kb/gene-dosage/HGNC:1513","Dosage Working Group","definitive evidence (01/20/2021) | moderate evidence (01/20/2021)","https://search.clinicalgenome.org/kb/gene-validity/CGGV:assertion_991ee32e-280d-4bea-a638-aa1b6fa6f781-2021-01-20T170000.000Z | https://search.clinicalgenome.org/kb/gene-validity/CGGV:assertion_c778b145-fcfc-4252-8dd8-33f982b288e8-2021-01-20T170000.000Z","Catecholaminergic Polymorphic Ventricular Tachycardia | Catecholaminergic Polymorphic Ventricular Tachycardia","Strong Actionability (03/11/2021) | Strong Actionability (03/11/2021)","https://actionability.clinicalgenome.org/ac/Adult/ui/stg2SummaryRpt?doc=AC042 | https://actionability.clinicalgenome.org/ac/Pediatric/ui/stg2SummaryRpt?doc=AC042","Adult Actionability Working Group | Pediatric Actionability Working Group"
"CASQ2","HGNC:1513","https://search.clinicalgenome.org/kb/genes/HGNC:1513","catecholaminergic polymorphic ventricular tachycardia 2","MONDO:0012762","https://search.clinicalgenome.org/kb/conditions/MONDO:0012762","N/A","30 - Gene Associated with Autosomal Recessive Phenotype (08/22/2016)","","https://search.clinicalgenome.org/kb/gene-dosage/HGNC:1513","Dosage Working Group","","","","Strong Actionability (03/11/2021) | Strong Actionability (03/11/2021)","https://actionability.clinicalgenome.org/ac/Adult/ui/stg2SummaryRpt?doc=AC042 | https://actionability.clinicalgenome.org/ac/Pediatric/ui/stg2SummaryRpt?doc=AC042","Adult Actionability Working Group | Pediatric Actionability Working Group"
"CASR","HGNC:1514","https://search.clinicalgenome.org/kb/genes/HGNC:1514","epilepsy","MONDO:0005027","https://search.clinicalgenome.org/kb/conditions/MONDO:0005027","Autosomal dominant inheritance","0 - No Evidence for Haploinsufficiency (03/02/2012)","0 - No Evidence for Triplosensitivity (03/02/2012)","https://search.clinicalgenome.org/kb/gene-dosage/HGNC:1514","Dosage Working Group","disputing (03/03/2021)","https://search.clinicalgenome.org/kb/gene-validity/CGGV:assertion_ddebf083-3434-4401-9b6b-9ec24aceec89-2021-03-03T123827.967Z","Epilepsy","","",""
"CASR","HGNC:1514","https://search.clinicalgenome.org/kb/genes/HGNC:1514","autosomal dominant hypocalcemia 1","MONDO:0011013","https://search.clinicalgenome.org/kb/conditions/MONDO:0011013","Autosomal dominant inheritance","0 - No Evidence for Haploinsufficiency (03/02/2012)","0 - No Evidence for Triplosensitivity (03/02/2012)","https://search.clinicalgenome.org/kb/gene-dosage/HGNC:1514","Dosage Working Group","definitive evidence (07/20/2023)","https://search.clinicalgenome.org/kb/gene-validity/CGGV:assertion_f699475d-1482-4998-a921-939b8be1bc2c-2023-07-20T160000.000Z","Tubulopathy","","",""
"CASR","HGNC:1514","https://search.clinicalgenome.org/kb/genes/HGNC:1514","familial hypocalciuric hypercalcemia 1","MONDO:0007791","https://search.clinicalgenome.org/kb/conditions/MONDO:0007791","Autosomal dominant inheritance","0 - No Evidence for Haploinsufficiency (03/02/2012)","0 - No Evidence for Triplosensitivity (03/02/2012)","https://search.clinicalgenome.org/kb/gene-dosage/HGNC:1514","Dosage Working Group","definitive evidence (07/20/2023)","https://search.clinicalgenome.org/kb/gene-validity/CGGV:assertion_4cb3c61b-f7eb-4682-94af-5fde40c04e26-2023-07-20T160000.000Z","Tubulopathy","","",""
"CASR","HGNC:1514","https://search.clinicalgenome.org/kb/genes/HGNC:1514","neonatal severe primary hyperparathyroidism","MONDO:0009397","https://search.clinicalgenome.org/kb/conditions/MONDO:0009397","Autosomal recessive inheritance","0 - No Evidence for Haploinsufficiency (03/02/2012)","0 - No Evidence for Triplosensitivity (03/02/2012)","https://search.clinicalgenome.org/kb/gene-dosage/HGNC:1514","Dosage Working Group","definitive evidence (07/20/2023)","https://search.clinicalgenome.org/kb/gene-validity/CGGV:assertion_095b6507-5537-4017-b2b9-28715cc23df7-2023-07-20T160000.000Z","Tubulopathy","","",""
"CASZ1","HGNC:26002","https://search.clinicalgenome.org/kb/genes/HGNC:26002","congenital heart disease","MONDO:0005453","https://search.clinicalgenome.org/kb/conditions/MONDO:0005453","Autosomal dominant inheritance","1 - Little Evidence for Haploinsufficiency (04/25/2019)","0 - No Evidence for Triplosensitivity (04/25/2019)","https://search.clinicalgenome.org/kb/gene-dosage/HGNC:26002","Dosage Working Group","limited evidence (08/12/2024)","https://search.clinicalgenome.org/kb/gene-validity/CGGV:assertion_754d56b3-0749-4292-b6c8-96ab61232076-2024-08-12T160000.000Z","Congenital Heart Disease","","",""
"CAT","HGNC:1516","https://search.clinicalgenome.org/kb/genes/HGNC:1516","acatalasia","MONDO:0013571","https://search.clinicalgenome.org/kb/conditions/MONDO:0013571","Autosomal recessive inheritance","","","","","moderate evidence (02/07/2025)","https://search.clinicalgenome.org/kb/gene-validity/CGGV:assertion_7381d0cc-74d3-4dfc-bc2e-62416afbb0ee-2025-02-07T170000.000Z","Peroxisomal Disorders","","",""
"CAV1","HGNC:1527","https://search.clinicalgenome.org/kb/genes/HGNC:1527","pulmonary arterial hypertension","MONDO:0015924","https://search.clinicalgenome.org/kb/conditions/MONDO:0015924","Autosomal dominant inheritance","","","","","definitive evidence (07/30/2025)","https://search.clinicalgenome.org/kb/gene-validity/CGGV:assertion_1f4c3d64-7993-4196-a002-6cc9904a4360-2025-07-30T160000.000Z","Pulmonary Hypertension","","",""
"CAV1","HGNC:1527","https://search.clinicalgenome.org/kb/genes/HGNC:1527","amyotrophic lateral sclerosis","MONDO:0004976","https://search.clinicalgenome.org/kb/conditions/MONDO:0004976","Autosomal dominant inheritance","","","","","limited evidence (12/21/2023)","https://search.clinicalgenome.org/kb/gene-validity/CGGV:assertion_cab41529-d295-466c-8821-75a16bb12c38-2023-12-21T170000.000Z","Amyotrophic Lateral Sclerosis Spectrum Disorders","","",""
"CAV1","HGNC:1527","https://search.clinicalgenome.org/kb/genes/HGNC:1527","congenital generalized lipodystrophy type 3","MONDO:0012923","https://search.clinicalgenome.org/kb/conditions/MONDO:0012923","Autosomal recessive inheritance","","","","","definitive evidence (06/11/2025)","https://search.clinicalgenome.org/kb/gene-validity/CGGV:assertion_8c3e1365-0b20-43c6-87a5-3c15951a2acf-2025-06-11T160000.000Z","Monogenic Diabetes","","",""
"CAV1","HGNC:1527","https://search.clinicalgenome.org/kb/genes/HGNC:1527","lipodystrophy","MONDO:0006573","https://search.clinicalgenome.org/kb/conditions/MONDO:0006573","Autosomal dominant inheritance","","","","","limited evidence (07/16/2025)","https://search.clinicalgenome.org/kb/gene-validity/CGGV:assertion_7278df5e-7003-4ff8-bcb6-f043cf2fcb60-2025-07-16T160000.000Z","Monogenic Diabetes","","",""
"CAV2","HGNC:1528","https://search.clinicalgenome.org/kb/genes/HGNC:1528","amyotrophic lateral sclerosis","MONDO:0004976","https://search.clinicalgenome.org/kb/conditions/MONDO:0004976","Autosomal dominant inheritance","","","","","limited evidence (12/21/2023)","https://search.clinicalgenome.org/kb/gene-validity/CGGV:assertion_38faae4c-13ae-4c28-bea4-43e3ad15e178-2023-12-21T170000.000Z","Amyotrophic Lateral Sclerosis Spectrum Disorders","","",""
"CAV3","HGNC:1529","https://search.clinicalgenome.org/kb/genes/HGNC:1529","long QT syndrome","MONDO:0002442","https://search.clinicalgenome.org/kb/conditions/MONDO:0002442","Autosomal dominant inheritance","","","","","limited evidence (12/15/2020)","https://search.clinicalgenome.org/kb/gene-validity/CGGV:assertion_74aabddc-3402-46de-ba1e-f66aa273cd9c-2020-12-15T002855.870Z","Long QT Syndrome","","",""
"CAV3","HGNC:1529","https://search.clinicalgenome.org/kb/genes/HGNC:1529","caveolinopathy","MONDO:0016146","https://search.clinicalgenome.org/kb/conditions/MONDO:0016146","Autosomal dominant inheritance","","","","","definitive evidence (09/13/2022)","https://search.clinicalgenome.org/kb/gene-validity/CGGV:assertion_a314687e-b35d-4bb4-8b93-efcc83d1fa9b-2022-09-13T160000.000Z","Muscular Dystrophies and Myopathies","","",""
"CAVIN1","HGNC:9688","https://search.clinicalgenome.org/kb/genes/HGNC:9688","lipodystrophy","MONDO:0006573","https://search.clinicalgenome.org/kb/conditions/MONDO:0006573","Autosomal recessive inheritance","","","","","definitive evidence (01/16/2025)","https://search.clinicalgenome.org/kb/gene-validity/CGGV:assertion_9676952d-3e95-4e05-ac04-04fc1b4ed7b3-2025-01-16T170000.000Z","Monogenic Diabetes","","",""
"CBL","HGNC:1541","https://search.clinicalgenome.org/kb/genes/HGNC:1541","CBL-related disorder","MONDO:0013308","https://search.clinicalgenome.org/kb/conditions/MONDO:0013308","Autosomal dominant inheritance","0 - No Evidence for Haploinsufficiency (02/14/2024)","0 - No Evidence for Triplosensitivity (02/14/2024)","https://search.clinicalgenome.org/kb/gene-dosage/HGNC:1541","Dosage Working Group","definitive evidence (04/29/2019)","https://search.clinicalgenome.org/kb/gene-validity/CGGV:assertion_4a1a76fd-7e23-44a7-b2fc-4495bc5d5ee6-2019-04-29T160000.000Z","RASopathy","","",""
"CBS","HGNC:1550","https://search.clinicalgenome.org/kb/genes/HGNC:1550","classic homocystinuria","MONDO:0009352","https://search.clinicalgenome.org/kb/conditions/MONDO:0009352","Autosomal recessive inheritance","30 - Gene Associated with Autosomal Recessive Phenotype (08/22/2016)","0 - No Evidence for Triplosensitivity (08/22/2016)","https://search.clinicalgenome.org/kb/gene-dosage/HGNC:1550","Dosage Working Group","definitive evidence (04/12/2019)","https://search.clinicalgenome.org/kb/gene-validity/CGGV:assertion_a9086d29-767b-4ab8-9274-1249b5480834-2019-04-12T160000.000Z","Aminoacidopathy","Moderate Actionability (06/23/2023) | Strong Actionability (06/23/2023)","https://actionability.clinicalgenome.org/ac/Adult/ui/stg2SummaryRpt?doc=AC097 | https://actionability.clinicalgenome.org/ac/Pediatric/ui/stg2SummaryRpt?doc=AC097","Adult Actionability Working Group | Pediatric Actionability Working Group"
"CBS","HGNC:1550","https://search.clinicalgenome.org/kb/genes/HGNC:1550","homocystinuria","MONDO:0004737","https://search.clinicalgenome.org/kb/conditions/MONDO:0004737","N/A","30 - Gene Associated with Autosomal Recessive Phenotype (08/22/2016)","0 - No Evidence for Triplosensitivity (08/22/2016)","https://search.clinicalgenome.org/kb/gene-dosage/HGNC:1550","Dosage Working Group","","","","Moderate Actionability (06/23/2023) | Strong Actionability (06/23/2023)","https://actionability.clinicalgenome.org/ac/Adult/ui/stg2SummaryRpt?doc=AC097 | https://actionability.clinicalgenome.org/ac/Pediatric/ui/stg2SummaryRpt?doc=AC097","Adult Actionability Working Group | Pediatric Actionability Working Group"
"CC2D1A","HGNC:30237","https://search.clinicalgenome.org/kb/genes/HGNC:30237","complex neurodevelopmental disorder","MONDO:0100038","https://search.clinicalgenome.org/kb/conditions/MONDO:0100038","Autosomal recessive inheritance","","","","","definitive evidence (01/08/2020)","https://search.clinicalgenome.org/kb/gene-validity/CGGV:assertion_63def86b-765e-4f12-93a3-94ef911c3190-2020-01-08T170000.000Z","Intellectual Disability and Autism","","",""
"CC2D2A","HGNC:29253","https://search.clinicalgenome.org/kb/genes/HGNC:29253","ciliopathy","MONDO:0005308","https://search.clinicalgenome.org/kb/conditions/MONDO:0005308","Autosomal recessive inheritance","30 - Gene Associated with Autosomal Recessive Phenotype (07/17/2013)","0 - No Evidence for Triplosensitivity (07/17/2013)","https://search.clinicalgenome.org/kb/gene-dosage/HGNC:29253","Dosage Working Group","definitive evidence (08/24/2022)","https://search.clinicalgenome.org/kb/gene-validity/CGGV:assertion_0acbae16-a383-4345-978c-9d28dda80d02-2022-08-24T160000.000Z","Kidney Cystic and Ciliopathy Disorders","","",""
"CC2D2A","HGNC:29253","https://search.clinicalgenome.org/kb/genes/HGNC:29253","Joubert syndrome and related disorders","MONDO:0015369","https://search.clinicalgenome.org/kb/conditions/MONDO:0015369","N/A","30 - Gene Associated with Autosomal Recessive Phenotype (07/17/2013)","0 - No Evidence for Triplosensitivity (07/17/2013)","https://search.clinicalgenome.org/kb/gene-dosage/HGNC:29253","Dosage Working Group","","","","","",""
"CCBE1","HGNC:29426","https://search.clinicalgenome.org/kb/genes/HGNC:29426","Hennekam lymphangiectasia-lymphedema syndrome 1","MONDO:0009337","https://search.clinicalgenome.org/kb/conditions/MONDO:0009337","N/A","30 - Gene Associated with Autosomal Recessive Phenotype (08/22/2016)","","https://search.clinicalgenome.org/kb/gene-dosage/HGNC:29426","Dosage Working Group","","","","","",""
"CCDC103","HGNC:32700","https://search.clinicalgenome.org/kb/genes/HGNC:32700","primary ciliary dyskinesia 17","MONDO:0013854","https://search.clinicalgenome.org/kb/conditions/MONDO:0013854","Autosomal recessive inheritance","30 - Gene Associated with Autosomal Recessive Phenotype (08/22/2016)","","https://search.clinicalgenome.org/kb/gene-dosage/HGNC:32700","Dosage Working Group","definitive evidence (12/30/2022)","https://search.clinicalgenome.org/kb/gene-validity/CGGV:assertion_9974aaef-9082-4bcd-b05a-28869447b5de-2022-12-30T120000.000Z","Motile Ciliopathy","Moderate Actionability (11/15/2022) | Limited Actionability (11/15/2022)","https://actionability.clinicalgenome.org/ac/Pediatric/ui/stg2SummaryRpt?doc=AC1007 | https://actionability.clinicalgenome.org/ac/Adult/ui/stg2SummaryRpt?doc=AC1007","Pediatric Actionability Working Group | Adult Actionability Working Group"
"CCDC115","HGNC:28178","https://search.clinicalgenome.org/kb/genes/HGNC:28178","CCDC115-CDG","MONDO:0014789","https://search.clinicalgenome.org/kb/conditions/MONDO:0014789","Autosomal recessive inheritance","","","","","moderate evidence (09/04/2024)","https://search.clinicalgenome.org/kb/gene-validity/CGGV:assertion_a15c4c38-77c7-4bad-95f8-b2d2a163d05a-2024-09-04T160000.000Z","Congenital Disorders of Glycosylation","","",""
"CCDC22","HGNC:28909","https://search.clinicalgenome.org/kb/genes/HGNC:28909","Ritscher-Schinzel syndrome 2","MONDO:0010499","https://search.clinicalgenome.org/kb/conditions/MONDO:0010499","X-linked inheritance","","","","","moderate evidence (06/07/2023)","https://search.clinicalgenome.org/kb/gene-validity/CGGV:assertion_3d62f7f8-4a91-4e0c-86b2-3f1d5d38d54b-2023-06-07T160000.000Z","Intellectual Disability and Autism","","",""
"CCDC32","HGNC:28295","https://search.clinicalgenome.org/kb/genes/HGNC:28295","cardiofacioneurodevelopmental syndrome","MONDO:0030873","https://search.clinicalgenome.org/kb/conditions/MONDO:0030873","Autosomal recessive inheritance","","","","","moderate evidence (10/18/2024)","https://search.clinicalgenome.org/kb/gene-validity/CGGV:assertion_29c6c0dd-bbaf-45ce-92af-4c67059cac8f-2024-10-18T160000.000Z","Syndromic Disorders","","",""
"CCDC39","HGNC:25244","https://search.clinicalgenome.org/kb/genes/HGNC:25244","primary ciliary dyskinesia 14","MONDO:0013434","https://search.clinicalgenome.org/kb/conditions/MONDO:0013434","Autosomal recessive inheritance","30 - Gene Associated with Autosomal Recessive Phenotype (08/22/2016)","0 - No Evidence for Triplosensitivity (08/22/2016)","https://search.clinicalgenome.org/kb/gene-dosage/HGNC:25244","Dosage Working Group","definitive evidence (11/02/2021)","https://search.clinicalgenome.org/kb/gene-validity/CGGV:assertion_79c47f13-dd33-45e4-a170-6ff26aa2732c-2021-11-02T204310.116Z","Motile Ciliopathy","Moderate Actionability (11/15/2022) | Limited Actionability (11/15/2022)","https://actionability.clinicalgenome.org/ac/Pediatric/ui/stg2SummaryRpt?doc=AC1007 | https://actionability.clinicalgenome.org/ac/Adult/ui/stg2SummaryRpt?doc=AC1007","Pediatric Actionability Working Group | Adult Actionability Working Group"
"CCDC40","HGNC:26090","https://search.clinicalgenome.org/kb/genes/HGNC:26090","primary ciliary dyskinesia 15","MONDO:0013435","https://search.clinicalgenome.org/kb/conditions/MONDO:0013435","Autosomal recessive inheritance","30 - Gene Associated with Autosomal Recessive Phenotype (08/22/2016)","","https://search.clinicalgenome.org/kb/gene-dosage/HGNC:26090","Dosage Working Group","definitive evidence (12/10/2021)","https://search.clinicalgenome.org/kb/gene-validity/CGGV:assertion_e9c192c6-9f74-4beb-85ba-a42199e9794a-2021-12-10T031508.185Z","Motile Ciliopathy","Moderate Actionability (11/15/2022) | Limited Actionability (11/15/2022)","https://actionability.clinicalgenome.org/ac/Pediatric/ui/stg2SummaryRpt?doc=AC1007 | https://actionability.clinicalgenome.org/ac/Adult/ui/stg2SummaryRpt?doc=AC1007","Pediatric Actionability Working Group | Adult Actionability Working Group"
"CCDC50","HGNC:18111","https://search.clinicalgenome.org/kb/genes/HGNC:18111","nonsyndromic genetic hearing loss","MONDO:0019497","https://search.clinicalgenome.org/kb/conditions/MONDO:0019497","Autosomal dominant inheritance","","","","","limited evidence (06/25/2024)","https://search.clinicalgenome.org/kb/gene-validity/CGGV:assertion_cf656dcb-6644-41bb-a29a-d7bdf54b28f7-2024-06-25T160000.000Z","Hearing Loss","","",""
"CCDC65","HGNC:29937","https://search.clinicalgenome.org/kb/genes/HGNC:29937","primary ciliary dyskinesia 27","MONDO:0014215","https://search.clinicalgenome.org/kb/conditions/MONDO:0014215","Autosomal recessive inheritance","","","","","definitive evidence (08/08/2024)","https://search.clinicalgenome.org/kb/gene-validity/CGGV:assertion_662ab516-ba5f-46aa-97b2-ef4c8f3201a5-2024-08-08T160000.000Z","Motile Ciliopathy","","",""
"CCDC78","HGNC:14153","https://search.clinicalgenome.org/kb/genes/HGNC:14153","centronuclear myopathy","MONDO:0018947","https://search.clinicalgenome.org/kb/conditions/MONDO:0018947","Autosomal dominant inheritance","","","","","limited evidence (12/09/2019)","https://search.clinicalgenome.org/kb/gene-validity/CGGV:assertion_886b45ae-232d-4635-ab94-88a0d15bbcca-2019-12-09T170000.000Z","Congenital Myopathies","","",""
"CCDC8","HGNC:25367","https://search.clinicalgenome.org/kb/genes/HGNC:25367","3M syndrome 3","MONDO:0013627","https://search.clinicalgenome.org/kb/conditions/MONDO:0013627","N/A","30 - Gene Associated with Autosomal Recessive Phenotype (08/22/2016)","0 - No Evidence for Triplosensitivity (08/22/2016)","https://search.clinicalgenome.org/kb/gene-dosage/HGNC:25367","Dosage Working Group","","","","","",""
"CCM2","HGNC:21708","https://search.clinicalgenome.org/kb/genes/HGNC:21708","cerebral cavernous malformation 2","MONDO:0011304","https://search.clinicalgenome.org/kb/conditions/MONDO:0011304","Autosomal dominant inheritance","","","","","definitive evidence (05/27/2025)","https://search.clinicalgenome.org/kb/gene-validity/CGGV:assertion_1013c58b-cea9-4e16-b68a-91a8a18bf989-2025-05-27T160000.000Z","Neurovascular","Limited Actionability (04/04/2017)","https://actionability.clinicalgenome.org/ac/Adult/ui/stg2SummaryRpt?doc=AC116","Adult Actionability Working Group"
"CCM2","HGNC:21708","https://search.clinicalgenome.org/kb/genes/HGNC:21708","famililal cerebral cavernous malformations","MONDO:0031037","https://search.clinicalgenome.org/kb/conditions/MONDO:0031037","N/A","","","","","","","","Limited Actionability (04/04/2017)","https://actionability.clinicalgenome.org/ac/Adult/ui/stg2SummaryRpt?doc=AC116","Adult Actionability Working Group"
"CCM2","HGNC:21708","https://search.clinicalgenome.org/kb/genes/HGNC:21708","cerebral cavernous malformation","MONDO:0000820","https://search.clinicalgenome.org/kb/conditions/MONDO:0000820","N/A","","","","","","","","Limited Actionability (04/04/2017)","https://actionability.clinicalgenome.org/ac/Adult/ui/stg2SummaryRpt?doc=AC116","Adult Actionability Working Group"
"CCN6","HGNC:12771","https://search.clinicalgenome.org/kb/genes/HGNC:12771","progressive pseudorheumatoid arthropathy of childhood","MONDO:0008827","https://search.clinicalgenome.org/kb/conditions/MONDO:0008827","Autosomal recessive inheritance","30 - Gene Associated with Autosomal Recessive Phenotype (08/22/2016)","","https://search.clinicalgenome.org/kb/gene-dosage/HGNC:12771","Dosage Working Group","definitive evidence (09/04/2024)","https://search.clinicalgenome.org/kb/gene-validity/CGGV:assertion_915a010c-e5d0-4a56-b7b7-f9c8acc4f6f0-2024-09-04T160000.000Z","Skeletal Disorders","","",""
"CCND2","HGNC:1583","https://search.clinicalgenome.org/kb/genes/HGNC:1583","megalencephaly-polymicrogyria-polydactyly-hydrocephalus syndrome 3","MONDO:0014408","https://search.clinicalgenome.org/kb/conditions/MONDO:0014408","Autosomal dominant inheritance","","","","","definitive evidence (05/27/2025)","https://search.clinicalgenome.org/kb/gene-validity/CGGV:assertion_8657a0bf-65fa-4413-b4e8-e64193c2731e-2025-05-27T170000.000Z","Brain Malformations","","",""
"CCNF","HGNC:1591","https://search.clinicalgenome.org/kb/genes/HGNC:1591","frontotemporal dementia and/or amyotrophic lateral sclerosis 5","MONDO:0030875","https://search.clinicalgenome.org/kb/conditions/MONDO:0030875","Autosomal dominant inheritance","","","","","limited evidence (04/05/2022)","https://search.clinicalgenome.org/kb/gene-validity/CGGV:assertion_7d6c258c-ce66-459a-a4ae-7376fcefde0d-2022-04-05T230455.308Z","Amyotrophic Lateral Sclerosis Spectrum Disorders","","",""
"CCNO","HGNC:18576","https://search.clinicalgenome.org/kb/genes/HGNC:18576","primary ciliary dyskinesia 29","MONDO:0014378","https://search.clinicalgenome.org/kb/conditions/MONDO:0014378","Autosomal recessive inheritance","","","","","definitive evidence (08/19/2022)","https://search.clinicalgenome.org/kb/gene-validity/CGGV:assertion_20a78ac7-91a7-44a6-b42e-22611de2d170-2022-08-19T160000.000Z","Motile Ciliopathy","Moderate Actionability (11/15/2022) | Limited Actionability (11/15/2022)","https://actionability.clinicalgenome.org/ac/Pediatric/ui/stg2SummaryRpt?doc=AC1007 | https://actionability.clinicalgenome.org/ac/Adult/ui/stg2SummaryRpt?doc=AC1007","Pediatric Actionability Working Group | Adult Actionability Working Group"
"CCNQ","HGNC:28434","https://search.clinicalgenome.org/kb/genes/HGNC:28434","syndactyly-telecanthus-anogenital and renal malformations syndrome","MONDO:0010408","https://search.clinicalgenome.org/kb/conditions/MONDO:0010408","X-linked inheritance","1 - Little Evidence for Haploinsufficiency (06/11/2024)","0 - No Evidence for Triplosensitivity (06/11/2024)","https://search.clinicalgenome.org/kb/gene-dosage/HGNC:28434","Dosage Working Group","moderate evidence (07/19/2024)","https://search.clinicalgenome.org/kb/gene-validity/CGGV:assertion_23aca7cf-8896-4a9d-a40b-94b6c8f18398-2024-07-19T160000.000Z","Syndromic Disorders","","",""
"CCS","HGNC:1613","https://search.clinicalgenome.org/kb/genes/HGNC:1613","disorder of copper metabolism","MONDO:0017762","https://search.clinicalgenome.org/kb/conditions/MONDO:0017762","Mode of inheritance","","","","","no known disease relationship (09/30/2024)","https://search.clinicalgenome.org/kb/gene-validity/CGGV:assertion_e2f759b8-ef60-4bfd-a56f-f62feb409840-2024-09-30T170000.000Z","General Inborn Errors of Metabolism","","",""
"CCT5","HGNC:1618","https://search.clinicalgenome.org/kb/genes/HGNC:1618","hereditary sensory and autonomic neuropathy with spastic paraplegia","MONDO:0009748","https://search.clinicalgenome.org/kb/conditions/MONDO:0009748","N/A","30 - Gene Associated with Autosomal Recessive Phenotype (08/22/2016)","0 - No Evidence for Triplosensitivity (08/22/2016)","https://search.clinicalgenome.org/kb/gene-dosage/HGNC:1618","Dosage Working Group","","","","","",""
"CD164","HGNC:1632","https://search.clinicalgenome.org/kb/genes/HGNC:1632","autosomal dominant nonsyndromic hearing loss","MONDO:0019587","https://search.clinicalgenome.org/kb/conditions/MONDO:0019587","Autosomal dominant inheritance","","","","","moderate evidence (06/25/2024)","https://search.clinicalgenome.org/kb/gene-validity/CGGV:assertion_e9524ca4-7d17-4691-b650-0d457531c7fd-2024-06-25T160000.000Z","Hearing Loss","","",""
"CD19","HGNC:1633","https://search.clinicalgenome.org/kb/genes/HGNC:1633","immunodeficiency, common variable, 3","MONDO:0013283","https://search.clinicalgenome.org/kb/conditions/MONDO:0013283","Autosomal recessive inheritance","30 - Gene Associated with Autosomal Recessive Phenotype (08/22/2016)","","https://search.clinicalgenome.org/kb/gene-dosage/HGNC:1633","Dosage Working Group","definitive evidence (05/24/2022)","https://search.clinicalgenome.org/kb/gene-validity/CGGV:assertion_a6576337-703e-4d76-9120-5f6800730774-2022-05-24T160000.000Z","Antibody Deficiencies GCEP","","",""
"CD247","HGNC:1677","https://search.clinicalgenome.org/kb/genes/HGNC:1677","immunodeficiency 25","MONDO:0012426","https://search.clinicalgenome.org/kb/conditions/MONDO:0012426","Autosomal recessive inheritance","","","","","definitive evidence (03/11/2022)","https://search.clinicalgenome.org/kb/gene-validity/CGGV:assertion_438b6c1f-edc0-4a81-9c82-39627e5a69cd-2022-03-11T140552.812Z","SCID-CID","","",""
"CD27","HGNC:11922","https://search.clinicalgenome.org/kb/genes/HGNC:11922","lymphoproliferative syndrome 2","MONDO:0014054","https://search.clinicalgenome.org/kb/conditions/MONDO:0014054","N/A","30 - Gene Associated with Autosomal Recessive Phenotype (07/28/2023)","","https://search.clinicalgenome.org/kb/gene-dosage/HGNC:11922","Dosage Working Group","","","","","",""
"CD28","HGNC:1653","https://search.clinicalgenome.org/kb/genes/HGNC:1653","immunodeficiency 123 with HPV-related verrucosis","MONDO:0971177","https://search.clinicalgenome.org/kb/conditions/MONDO:0971177","Autosomal recessive inheritance","","","","","moderate evidence (10/29/2024)","https://search.clinicalgenome.org/kb/gene-validity/CGGV:assertion_01ff1097-4da6-4dfb-be34-9161c65f986e-2024-10-29T160000.000Z","SCID-CID","","",""
"CD2AP","HGNC:14258","https://search.clinicalgenome.org/kb/genes/HGNC:14258","inherited focal segmental glomerulosclerosis","MONDO:0005363","https://search.clinicalgenome.org/kb/conditions/MONDO:0005363","Autosomal dominant inheritance","","","","","moderate evidence (06/28/2024)","https://search.clinicalgenome.org/kb/gene-validity/CGGV:assertion_2cae2640-258f-4ba1-8510-2b4db97cf36c-2024-06-28T160000.000Z","Glomerulopathy","","",""
"CD2AP","HGNC:14258","https://search.clinicalgenome.org/kb/genes/HGNC:14258","focal segmental glomerulosclerosis 3, susceptibility to","MONDO:0011917","https://search.clinicalgenome.org/kb/conditions/MONDO:0011917","Autosomal recessive inheritance","","","","","definitive evidence (04/08/2024)","https://search.clinicalgenome.org/kb/gene-validity/CGGV:assertion_e4bd2904-da48-4a7d-875e-bc90d56f59da-2024-04-08T160000.000Z","Glomerulopathy","","",""
"CD320","HGNC:16692","https://search.clinicalgenome.org/kb/genes/HGNC:16692","methylmalonic acidemia due to transcobalamin receptor defect","MONDO:0013341","https://search.clinicalgenome.org/kb/conditions/MONDO:0013341","Autosomal recessive inheritance","","","","","definitive evidence (09/23/2022)","https://search.clinicalgenome.org/kb/gene-validity/CGGV:assertion_d98515f5-4296-4d41-95a9-adac90c00349-2022-09-23T160000.000Z","General Inborn Errors of Metabolism","","",""
"CD36","HGNC:1663","https://search.clinicalgenome.org/kb/genes/HGNC:1663","platelet-type bleeding disorder 10","MONDO:0012031","https://search.clinicalgenome.org/kb/conditions/MONDO:0012031","N/A","30 - Gene Associated with Autosomal Recessive Phenotype (08/22/2016)","","https://search.clinicalgenome.org/kb/gene-dosage/HGNC:1663","Dosage Working Group","","","","","",""
"CD3D","HGNC:1673","https://search.clinicalgenome.org/kb/genes/HGNC:1673","immunodeficiency 19","MONDO:0014280","https://search.clinicalgenome.org/kb/conditions/MONDO:0014280","Autosomal recessive inheritance","30 - Gene Associated with Autosomal Recessive Phenotype (08/22/2016)","","https://search.clinicalgenome.org/kb/gene-dosage/HGNC:1673","Dosage Working Group","definitive evidence (05/10/2022)","https://search.clinicalgenome.org/kb/gene-validity/CGGV:assertion_3d59cf46-9acb-42f7-92da-d17113d39b38-2022-05-10T185446.511Z","SCID-CID","","",""
"CD3E","HGNC:1674","https://search.clinicalgenome.org/kb/genes/HGNC:1674","immunodeficiency 18","MONDO:0014278","https://search.clinicalgenome.org/kb/conditions/MONDO:0014278","Autosomal recessive inheritance","30 - Gene Associated with Autosomal Recessive Phenotype (05/09/2017)","0 - No Evidence for Triplosensitivity (05/09/2017)","https://search.clinicalgenome.org/kb/gene-dosage/HGNC:1674","Dosage Working Group","definitive evidence (01/26/2021)","https://search.clinicalgenome.org/kb/gene-validity/CGGV:assertion_29d6bb32-65b3-4c78-9c94-da71cc591565-2021-01-26T172908.775Z","SCID-CID","","",""
"CD3G","HGNC:1675","https://search.clinicalgenome.org/kb/genes/HGNC:1675","combined immunodeficiency due to CD3gamma deficiency","MONDO:0014276","https://search.clinicalgenome.org/kb/conditions/MONDO:0014276","Autosomal recessive inheritance","30 - Gene Associated with Autosomal Recessive Phenotype (08/22/2016)","","https://search.clinicalgenome.org/kb/gene-dosage/HGNC:1675","Dosage Working Group","definitive evidence (07/15/2021)","https://search.clinicalgenome.org/kb/gene-validity/CGGV:assertion_8ea83aa7-473b-4670-88dd-36b1abe277f8-2021-07-15T160000.000Z","SCID-CID","","",""
"CD40","HGNC:11919","https://search.clinicalgenome.org/kb/genes/HGNC:11919","hyper-IgM syndrome type 3","MONDO:0011735","https://search.clinicalgenome.org/kb/conditions/MONDO:0011735","Autosomal recessive inheritance","","","","","definitive evidence (10/18/2022)","https://search.clinicalgenome.org/kb/gene-validity/CGGV:assertion_debbb2e7-89a7-45b8-b5e1-41ccb56a3423-2022-10-18T160000.000Z","Antibody Deficiencies GCEP","","",""
"CD40LG","HGNC:11935","https://search.clinicalgenome.org/kb/genes/HGNC:11935","hyper-IgM syndrome type 1","MONDO:0010626","https://search.clinicalgenome.org/kb/conditions/MONDO:0010626","X-linked inheritance","3 - Sufficient Evidence for Haploinsufficiency (04/08/2020)","0 - No Evidence for Triplosensitivity (04/08/2020)","https://search.clinicalgenome.org/kb/gene-dosage/HGNC:11935","Dosage Working Group","definitive evidence (03/22/2021)","https://search.clinicalgenome.org/kb/gene-validity/CGGV:assertion_4184ad10-d95f-4027-b75d-e4e11127febf-2021-03-22T154242.503Z","SCID-CID","","",""
"CD46","HGNC:6953","https://search.clinicalgenome.org/kb/genes/HGNC:6953","atypical hemolytic-uremic syndrome","MONDO:0016244","https://search.clinicalgenome.org/kb/conditions/MONDO:0016244","Semidominant inheritance","","","","","definitive evidence (06/27/2024)","https://search.clinicalgenome.org/kb/gene-validity/CGGV:assertion_bddaec4f-9f57-41b7-81a4-2f6ff3fc5e7b-2024-06-27T160000.000Z","Complement-Mediated Kidney Diseases","","",""
"CD59","HGNC:1689","https://search.clinicalgenome.org/kb/genes/HGNC:1689","primary CD59 deficiency","MONDO:0012858","https://search.clinicalgenome.org/kb/conditions/MONDO:0012858","N/A","30 - Gene Associated with Autosomal Recessive Phenotype (08/22/2016)","","https://search.clinicalgenome.org/kb/gene-dosage/HGNC:1689","Dosage Working Group","","","","","",""
"CD70","HGNC:11937","https://search.clinicalgenome.org/kb/genes/HGNC:11937","severe combined immunodeficiency due to CD70 deficiency","MONDO:0034054","https://search.clinicalgenome.org/kb/conditions/MONDO:0034054","Autosomal recessive inheritance","","","","","definitive evidence (02/05/2025)","https://search.clinicalgenome.org/kb/gene-validity/CGGV:assertion_69aa819c-1f25-42fe-8469-4641fc088a57-2025-02-05T170000.000Z","Primary Immune Regulatory Disorders","","",""
"CD79A","HGNC:1698","https://search.clinicalgenome.org/kb/genes/HGNC:1698","agammaglobulinemia 3, autosomal recessive","MONDO:0013288","https://search.clinicalgenome.org/kb/conditions/MONDO:0013288","Autosomal recessive inheritance","","","","","definitive evidence (12/15/2020)","https://search.clinicalgenome.org/kb/gene-validity/CGGV:assertion_12a6257c-c9ca-432a-ab76-b05985283381-2020-12-15T135909.057Z","Antibody Deficiencies GCEP","","",""
"CD79B","HGNC:1699","https://search.clinicalgenome.org/kb/genes/HGNC:1699","agammaglobulinemia 6, autosomal recessive","MONDO:0012987","https://search.clinicalgenome.org/kb/conditions/MONDO:0012987","Autosomal recessive inheritance","","","","","definitive evidence (01/26/2021)","https://search.clinicalgenome.org/kb/gene-validity/CGGV:assertion_9c252b2c-2183-4e7d-8ceb-69f7a01cc1d9-2021-01-26T171006.440Z","Antibody Deficiencies GCEP","","",""
"CD81","HGNC:1701","https://search.clinicalgenome.org/kb/genes/HGNC:1701","immunodeficiency, common variable, 6","MONDO:0013286","https://search.clinicalgenome.org/kb/conditions/MONDO:0013286","Autosomal recessive inheritance","","","","","limited evidence (04/29/2021)","https://search.clinicalgenome.org/kb/gene-validity/CGGV:assertion_e2092b4c-a8ff-4b40-bc09-17fbe33aa3e7-2021-04-29T210806.386Z","Antibody Deficiencies GCEP","","",""
"CD8A","HGNC:1706","https://search.clinicalgenome.org/kb/genes/HGNC:1706","susceptibility to respiratory infections associated with CD8alpha chain mutation","MONDO:0012161","https://search.clinicalgenome.org/kb/conditions/MONDO:0012161","Autosomal recessive inheritance","30 - Gene Associated with Autosomal Recessive Phenotype (08/22/2016)","0 - No Evidence for Triplosensitivity (08/22/2016)","https://search.clinicalgenome.org/kb/gene-dosage/HGNC:1706","Dosage Working Group","limited evidence (08/18/2022)","https://search.clinicalgenome.org/kb/gene-validity/CGGV:assertion_f770ad34-1c95-4454-92c7-26bff4404cc2-2022-08-18T160000.000Z","SCID-CID","","",""
"CD96","HGNC:16892","https://search.clinicalgenome.org/kb/genes/HGNC:16892","C syndrome","MONDO:0008893","https://search.clinicalgenome.org/kb/conditions/MONDO:0008893","Autosomal dominant inheritance","","","","","limited evidence (01/16/2025)","https://search.clinicalgenome.org/kb/gene-validity/CGGV:assertion_fdae504e-96de-425c-a175-8934a38510de-2025-01-16T170000.000Z","Craniofacial Malformations","","",""
"CDAN1","HGNC:1713","https://search.clinicalgenome.org/kb/genes/HGNC:1713","anemia, congenital dyserythropoietic, type 1a","MONDO:0009135","https://search.clinicalgenome.org/kb/conditions/MONDO:0009135","Autosomal recessive inheritance","30 - Gene Associated with Autosomal Recessive Phenotype (08/22/2016)","0 - No Evidence for Triplosensitivity (08/22/2016)","https://search.clinicalgenome.org/kb/gene-dosage/HGNC:1713","Dosage Working Group","definitive evidence (01/07/2025)","https://search.clinicalgenome.org/kb/gene-validity/CGGV:assertion_c9465f7d-4fc8-49b6-aa2c-4b92eb5f8c32-2025-01-07T170000.000Z","Prenatal","","",""
"CDC14A","HGNC:1718","https://search.clinicalgenome.org/kb/genes/HGNC:1718","nonsyndromic genetic hearing loss","MONDO:0019497","https://search.clinicalgenome.org/kb/conditions/MONDO:0019497","Autosomal recessive inheritance","","","","","definitive evidence (02/25/2025)","https://search.clinicalgenome.org/kb/gene-validity/CGGV:assertion_e869e4b1-30e2-4d9b-9b69-124903d7b307-2025-02-25T170000.000Z","Hearing Loss","","",""
"CDC14A","HGNC:1718","https://search.clinicalgenome.org/kb/genes/HGNC:1718","hearing impairment and infertile male syndrome","MONDO:0100069","https://search.clinicalgenome.org/kb/conditions/MONDO:0100069","Autosomal recessive inheritance","","","","","strong evidence (06/01/2023)","https://search.clinicalgenome.org/kb/gene-validity/CGGV:assertion_144089d2-83ec-4c6c-8b43-9a4cae801d51-2023-06-01T160000.000Z","Hearing Loss","","",""
"CDC42","HGNC:1736","https://search.clinicalgenome.org/kb/genes/HGNC:1736","macrothrombocytopenia-lymphedema-developmental delay-facial dysmorphism-camptodactyly syndrome","MONDO:0014757","https://search.clinicalgenome.org/kb/conditions/MONDO:0014757","Autosomal dominant inheritance","","","","","definitive evidence (10/27/2021)","https://search.clinicalgenome.org/kb/gene-validity/CGGV:assertion_95177a3a-0dca-4945-8a44-f63697739cef-2021-10-27T162623.932Z","Hemostasis Thrombosis","","",""
"CDC42BPB","HGNC:1738","https://search.clinicalgenome.org/kb/genes/HGNC:1738","complex neurodevelopmental disorder","MONDO:0100038","https://search.clinicalgenome.org/kb/conditions/MONDO:0100038","N/A","2 - Emerging Evidence for Haploinsufficiency (07/23/2025)","0 - No Evidence for Triplosensitivity (07/23/2025)","https://search.clinicalgenome.org/kb/gene-dosage/HGNC:1738","Dosage Working Group","","","","","",""
"CDC45","HGNC:1739","https://search.clinicalgenome.org/kb/genes/HGNC:1739","Meier-Gorlin syndrome 7","MONDO:0014894","https://search.clinicalgenome.org/kb/conditions/MONDO:0014894","Autosomal recessive inheritance","","","","","definitive evidence (05/30/2023)","https://search.clinicalgenome.org/kb/gene-validity/CGGV:assertion_ab0dc4e6-06ae-4f78-8393-05ac2bbb563f-2023-05-30T160000.000Z","Syndromic Disorders","","",""
"CDC6","HGNC:1744","https://search.clinicalgenome.org/kb/genes/HGNC:1744","Meier-Gorlin syndrome 5","MONDO:0013432","https://search.clinicalgenome.org/kb/conditions/MONDO:0013432","Autosomal recessive inheritance","","","","","limited evidence (01/17/2025)","https://search.clinicalgenome.org/kb/gene-validity/CGGV:assertion_05b74230-8c08-4dcf-af1a-903a2584baf4-2025-01-17T170000.000Z","Syndromic Disorders","","",""
"CDC73","HGNC:16783","https://search.clinicalgenome.org/kb/genes/HGNC:16783","hyperparathyroidism 2 with jaw tumors","MONDO:0007768","https://search.clinicalgenome.org/kb/conditions/MONDO:0007768","Autosomal dominant inheritance","3 - Sufficient Evidence for Haploinsufficiency (04/13/2022)","0 - No Evidence for Triplosensitivity (04/13/2022)","https://search.clinicalgenome.org/kb/gene-dosage/HGNC:16783","Dosage Working Group","definitive evidence (04/19/2019)","https://search.clinicalgenome.org/kb/gene-validity/CGGV:assertion_a5bd498b-dc86-4f2d-a51b-48baf7017a02-2019-04-19T160000.000Z","Hereditary Cancer","Moderate Actionability (11/28/2023) | Moderate Actionability (11/28/2023)","https://actionability.clinicalgenome.org/ac/Adult/ui/stg2SummaryRpt?doc=AC119 | https://actionability.clinicalgenome.org/ac/Pediatric/ui/stg2SummaryRpt?doc=AC119","Adult Actionability Working Group | Pediatric Actionability Working Group"
"CDC73","HGNC:16783","https://search.clinicalgenome.org/kb/genes/HGNC:16783","parathyroid gland carcinoma","MONDO:0012004","https://search.clinicalgenome.org/kb/conditions/MONDO:0012004","N/A","3 - Sufficient Evidence for Haploinsufficiency (04/13/2022)","0 - No Evidence for Triplosensitivity (04/13/2022)","https://search.clinicalgenome.org/kb/gene-dosage/HGNC:16783","Dosage Working Group","","","","Moderate Actionability (11/28/2023)","https://actionability.clinicalgenome.org/ac/Adult/ui/stg2SummaryRpt?doc=AC119","Adult Actionability Working Group"
"CDC73","HGNC:16783","https://search.clinicalgenome.org/kb/genes/HGNC:16783","hyperparathyroidism 1","MONDO:0007767","https://search.clinicalgenome.org/kb/conditions/MONDO:0007767","N/A","3 - Sufficient Evidence for Haploinsufficiency (04/13/2022)","0 - No Evidence for Triplosensitivity (04/13/2022)","https://search.clinicalgenome.org/kb/gene-dosage/HGNC:16783","Dosage Working Group","","","","Moderate Actionability (11/28/2023)","https://actionability.clinicalgenome.org/ac/Adult/ui/stg2SummaryRpt?doc=AC119","Adult Actionability Working Group"
"CDCA7","HGNC:14628","https://search.clinicalgenome.org/kb/genes/HGNC:14628","immunodeficiency-centromeric instability-facial anomalies syndrome 3","MONDO:0014828","https://search.clinicalgenome.org/kb/conditions/MONDO:0014828","Autosomal recessive inheritance","","","","","limited evidence (04/20/2023)","https://search.clinicalgenome.org/kb/gene-validity/CGGV:assertion_357faf0e-a1db-4240-8268-bc9925a2c0ef-2023-04-20T170000.000Z","SCID-CID","","",""
"CDH1","HGNC:1748","https://search.clinicalgenome.org/kb/genes/HGNC:1748","CDH1-related diffuse gastric and lobular breast cancer syndrome","MONDO:0100488","https://search.clinicalgenome.org/kb/conditions/MONDO:0100488","Autosomal dominant inheritance","3 - Sufficient Evidence for Haploinsufficiency (04/10/2020)","0 - No Evidence for Triplosensitivity (04/10/2020)","https://search.clinicalgenome.org/kb/gene-dosage/HGNC:1748","Dosage Working Group","definitive evidence (03/22/2024)","https://search.clinicalgenome.org/kb/gene-validity/CGGV:assertion_14223ff7-e6b0-4c60-bee6-df55301d2017-2024-03-22T170000.000Z","Hereditary Cancer","Moderate Actionability (06/04/2019) | Limited Actionability (06/04/2019)","https://actionability.clinicalgenome.org/ac/Adult/ui/stg2SummaryRpt?doc=AC103 | https://actionability.clinicalgenome.org/ac/Pediatric/ui/stg2SummaryRpt?doc=AC103","Adult Actionability Working Group | Pediatric Actionability Working Group"
"CDH1","HGNC:1748","https://search.clinicalgenome.org/kb/genes/HGNC:1748","familial ovarian cancer","MONDO:0016248","https://search.clinicalgenome.org/kb/conditions/MONDO:0016248","Autosomal dominant inheritance","3 - Sufficient Evidence for Haploinsufficiency (04/10/2020)","0 - No Evidence for Triplosensitivity (04/10/2020)","https://search.clinicalgenome.org/kb/gene-dosage/HGNC:1748","Dosage Working Group","no known disease relationship (08/03/2017)","https://search.clinicalgenome.org/kb/gene-validity/CGGCIEX:assertion_8503","Breast/Ovarian Cancer","","",""
"CDH1","HGNC:1748","https://search.clinicalgenome.org/kb/genes/HGNC:1748","hereditary diffuse gastric adenocarcinoma","MONDO:0007648","https://search.clinicalgenome.org/kb/conditions/MONDO:0007648","N/A","3 - Sufficient Evidence for Haploinsufficiency (04/10/2020)","0 - No Evidence for Triplosensitivity (04/10/2020)","https://search.clinicalgenome.org/kb/gene-dosage/HGNC:1748","Dosage Working Group","","","","","",""
"CDH11","HGNC:1750","https://search.clinicalgenome.org/kb/genes/HGNC:1750","Elsahy-Waters syndrome","MONDO:0008885","https://search.clinicalgenome.org/kb/conditions/MONDO:0008885","Autosomal recessive inheritance","","","","","definitive evidence (05/17/2024)","https://search.clinicalgenome.org/kb/gene-validity/CGGV:assertion_41cee7da-44c3-49fa-b174-80ae3da5d153-2024-05-17T160000.000Z","Syndromic Disorders","","",""
"CDH11","HGNC:1750","https://search.clinicalgenome.org/kb/genes/HGNC:1750","Teebi hypertelorism syndrome 2","MONDO:0030674","https://search.clinicalgenome.org/kb/conditions/MONDO:0030674","Autosomal dominant inheritance","","","","","moderate evidence (05/17/2024)","https://search.clinicalgenome.org/kb/gene-validity/CGGV:assertion_d159047f-2ee5-4406-8def-c5fe63b7ffe8-2024-05-17T160000.000Z","Syndromic Disorders","","",""
"CDH15","HGNC:1754","https://search.clinicalgenome.org/kb/genes/HGNC:1754","intellectual disability","MONDO:0001071","https://search.clinicalgenome.org/kb/conditions/MONDO:0001071","Autosomal dominant inheritance","0 - No Evidence for Haploinsufficiency (08/08/2013)","0 - No Evidence for Triplosensitivity (08/08/2013)","https://search.clinicalgenome.org/kb/gene-dosage/HGNC:1754","Dosage Working Group","disputing (02/17/2021)","https://search.clinicalgenome.org/kb/gene-validity/CGGV:assertion_9295bddb-d61c-47c2-b186-97296b9c4d94-2021-02-17T170000.000Z","Intellectual Disability and Autism","","",""
"CDH15","HGNC:1754","https://search.clinicalgenome.org/kb/genes/HGNC:1754","intellectual disability, autosomal dominant 3","MONDO:0012946","https://search.clinicalgenome.org/kb/conditions/MONDO:0012946","N/A","0 - No Evidence for Haploinsufficiency (08/08/2013)","0 - No Evidence for Triplosensitivity (08/08/2013)","https://search.clinicalgenome.org/kb/gene-dosage/HGNC:1754","Dosage Working Group","","","","","",""
"CDH2","HGNC:1759","https://search.clinicalgenome.org/kb/genes/HGNC:1759","arrhythmogenic right ventricular cardiomyopathy","MONDO:0016587","https://search.clinicalgenome.org/kb/conditions/MONDO:0016587","Autosomal dominant inheritance","","","","","limited evidence (07/13/2018)","https://search.clinicalgenome.org/kb/gene-validity/CGGV:assertion_c7a03805-bf73-4d2d-9756-c666c67be119-2018-07-13T160000.000Z","Arrhythmogenic Right Ventricular Cardiomyopathy","","",""
"CDH2","HGNC:1759","https://search.clinicalgenome.org/kb/genes/HGNC:1759","dilated cardiomyopathy","MONDO:0005021","https://search.clinicalgenome.org/kb/conditions/MONDO:0005021","Autosomal dominant inheritance","","","","","limited evidence (05/16/2025)","https://search.clinicalgenome.org/kb/gene-validity/CGGV:assertion_73900af1-14ee-4933-b5dc-832753e6cc6c-2025-05-16T160000.000Z","Dilated Cardiomyopathy","","",""
"CDH23","HGNC:13733","https://search.clinicalgenome.org/kb/genes/HGNC:13733","nonsyndromic genetic hearing loss","MONDO:0019497","https://search.clinicalgenome.org/kb/conditions/MONDO:0019497","Autosomal recessive inheritance","30 - Gene Associated with Autosomal Recessive Phenotype (08/22/2016)","","https://search.clinicalgenome.org/kb/gene-dosage/HGNC:13733","Dosage Working Group","definitive evidence (05/22/2018)","https://search.clinicalgenome.org/kb/gene-validity/CGGV:assertion_f5799772-f233-4004-99a8-e6a0dddf0e8b-2018-05-22T040000.000Z","Hearing Loss","Strong Actionability (10/29/2020)","https://actionability.clinicalgenome.org/ac/Pediatric/ui/stg2SummaryRpt?doc=AC1018","Pediatric Actionability Working Group"
"CDH23","HGNC:13733","https://search.clinicalgenome.org/kb/genes/HGNC:13733","Usher syndrome type 1","MONDO:0010168","https://search.clinicalgenome.org/kb/conditions/MONDO:0010168","Autosomal recessive inheritance","30 - Gene Associated with Autosomal Recessive Phenotype (08/22/2016)","","https://search.clinicalgenome.org/kb/gene-dosage/HGNC:13733","Dosage Working Group","definitive evidence (01/30/2017)","https://search.clinicalgenome.org/kb/gene-validity/CGGCIEX:assertion_5610","Hearing Loss","","",""
"CDH23","HGNC:13733","https://search.clinicalgenome.org/kb/genes/HGNC:13733","hearing loss, autosomal recessive","MONDO:0019588","https://search.clinicalgenome.org/kb/conditions/MONDO:0019588","N/A","30 - Gene Associated with Autosomal Recessive Phenotype (08/22/2016)","","https://search.clinicalgenome.org/kb/gene-dosage/HGNC:13733","Dosage Working Group","","","","Strong Actionability (10/29/2020)","https://actionability.clinicalgenome.org/ac/Pediatric/ui/stg2SummaryRpt?doc=AC1018","Pediatric Actionability Working Group"
"CDH23","HGNC:13733","https://search.clinicalgenome.org/kb/genes/HGNC:13733","autosomal recessive nonsyndromic hearing loss 12","MONDO:0011067","https://search.clinicalgenome.org/kb/conditions/MONDO:0011067","N/A","30 - Gene Associated with Autosomal Recessive Phenotype (08/22/2016)","","https://search.clinicalgenome.org/kb/gene-dosage/HGNC:13733","Dosage Working Group","","","","Strong Actionability (10/29/2020)","https://actionability.clinicalgenome.org/ac/Pediatric/ui/stg2SummaryRpt?doc=AC1018","Pediatric Actionability Working Group"
"CDH23","HGNC:13733","https://search.clinicalgenome.org/kb/genes/HGNC:13733","sensorineural hearing loss disorder","MONDO:0020678","https://search.clinicalgenome.org/kb/conditions/MONDO:0020678","N/A","30 - Gene Associated with Autosomal Recessive Phenotype (08/22/2016)","","https://search.clinicalgenome.org/kb/gene-dosage/HGNC:13733","Dosage Working Group","","","","Strong Actionability (10/29/2020)","https://actionability.clinicalgenome.org/ac/Pediatric/ui/stg2SummaryRpt?doc=AC1018","Pediatric Actionability Working Group"
"CDH23","HGNC:13733","https://search.clinicalgenome.org/kb/genes/HGNC:13733","prelingual non-syndromic genetic hearing loss","MONDO:0016297","https://search.clinicalgenome.org/kb/conditions/MONDO:0016297","N/A","30 - Gene Associated with Autosomal Recessive Phenotype (08/22/2016)","","https://search.clinicalgenome.org/kb/gene-dosage/HGNC:13733","Dosage Working Group","","","","Strong Actionability (10/29/2020)","https://actionability.clinicalgenome.org/ac/Pediatric/ui/stg2SummaryRpt?doc=AC1018","Pediatric Actionability Working Group"
"CDH23","HGNC:13733","https://search.clinicalgenome.org/kb/genes/HGNC:13733","inherited auditory system disease","MONDO:0037940","https://search.clinicalgenome.org/kb/conditions/MONDO:0037940","N/A","30 - Gene Associated with Autosomal Recessive Phenotype (08/22/2016)","","https://search.clinicalgenome.org/kb/gene-dosage/HGNC:13733","Dosage Working Group","","","","","",""
"CDH3","HGNC:1762","https://search.clinicalgenome.org/kb/genes/HGNC:1762","EEM syndrome","MONDO:0009155","https://search.clinicalgenome.org/kb/conditions/MONDO:0009155","Autosomal recessive inheritance","","","","","definitive evidence (08/05/2021)","https://search.clinicalgenome.org/kb/gene-validity/CGGV:assertion_5791d618-93bf-4517-9c60-48e6490319a6-2021-08-05T160000.000Z","Retina","","",""
"CDHR1","HGNC:14550","https://search.clinicalgenome.org/kb/genes/HGNC:14550","retinitis pigmentosa 65","MONDO:0800352","https://search.clinicalgenome.org/kb/conditions/MONDO:0800352","Autosomal recessive inheritance","30 - Gene Associated with Autosomal Recessive Phenotype (08/22/2016)","","https://search.clinicalgenome.org/kb/gene-dosage/HGNC:14550","Dosage Working Group","definitive evidence (06/12/2025)","https://search.clinicalgenome.org/kb/gene-validity/CGGV:assertion_2774d220-f9c0-419c-b9d2-eb7a1dc8f4f1-2025-06-12T160000.000Z","Retina","","",""
"CDHR1","HGNC:14550","https://search.clinicalgenome.org/kb/genes/HGNC:14550","cone-rod dystrophy 15","MONDO:0013348","https://search.clinicalgenome.org/kb/conditions/MONDO:0013348","N/A","30 - Gene Associated with Autosomal Recessive Phenotype (08/22/2016)","","https://search.clinicalgenome.org/kb/gene-dosage/HGNC:14550","Dosage Working Group","","","","","",""
"CDIN1","HGNC:26929","https://search.clinicalgenome.org/kb/genes/HGNC:26929","congenital dyserythropoietic anemia type type 1B","MONDO:0014285","https://search.clinicalgenome.org/kb/conditions/MONDO:0014285","N/A","30 - Gene Associated with Autosomal Recessive Phenotype (08/22/2016)","","https://search.clinicalgenome.org/kb/gene-dosage/HGNC:26929","Dosage Working Group","","","","","",""
"CDK13","HGNC:1733","https://search.clinicalgenome.org/kb/genes/HGNC:1733","syndromic intellectual disability","MONDO:0000508","https://search.clinicalgenome.org/kb/conditions/MONDO:0000508","Autosomal dominant inheritance","3 - Sufficient Evidence for Haploinsufficiency (09/04/2025)","0 - No Evidence for Triplosensitivity (09/04/2025)","https://search.clinicalgenome.org/kb/gene-dosage/HGNC:1733","Dosage Working Group","definitive evidence (12/31/2021)","https://search.clinicalgenome.org/kb/gene-validity/CGGV:assertion_c594bcfa-2b2c-425a-8285-74bae8e01da8-2021-12-31T225720.705Z","Intellectual Disability and Autism","","",""
"CDK16","HGNC:8749","https://search.clinicalgenome.org/kb/genes/HGNC:8749","X-linked complex neurodevelopmental disorder","MONDO:0100148","https://search.clinicalgenome.org/kb/conditions/MONDO:0100148","X-linked inheritance","","","","","limited evidence (10/28/2021)","https://search.clinicalgenome.org/kb/gene-validity/CGGV:assertion_93557c1a-c141-4833-bcbb-83fccbd7d761-2021-10-28T160000.000Z","Intellectual Disability and Autism","","",""
"CDK4","HGNC:1773","https://search.clinicalgenome.org/kb/genes/HGNC:1773","melanoma, cutaneous malignant, susceptibility to, 3","MONDO:0012183","https://search.clinicalgenome.org/kb/conditions/MONDO:0012183","Autosomal dominant inheritance","0 - No Evidence for Haploinsufficiency (09/02/2020)","0 - No Evidence for Triplosensitivity (09/02/2020)","https://search.clinicalgenome.org/kb/gene-dosage/HGNC:1773","Dosage Working Group","definitive evidence (01/13/2020)","https://search.clinicalgenome.org/kb/gene-validity/CGGV:assertion_ca76579b-1432-4edc-84e8-b3332dce4ede-2020-01-13T194434.667Z","Hereditary Cancer","","",""
"CDK5","HGNC:1774","https://search.clinicalgenome.org/kb/genes/HGNC:1774","lissencephaly with cerebellar hypoplasia","MONDO:0019450","https://search.clinicalgenome.org/kb/conditions/MONDO:0019450","Autosomal recessive inheritance","","","","","moderate evidence (04/29/2024)","https://search.clinicalgenome.org/kb/gene-validity/CGGV:assertion_2f6ba2ff-6567-493e-bf39-f05c03013e20-2024-04-29T160000.000Z","Brain Malformations","","",""
"CDK5RAP2","HGNC:18672","https://search.clinicalgenome.org/kb/genes/HGNC:18672","autosomal recessive primary microcephaly","MONDO:0016660","https://search.clinicalgenome.org/kb/conditions/MONDO:0016660","Autosomal recessive inheritance","30 - Gene Associated with Autosomal Recessive Phenotype (08/22/2016)","","https://search.clinicalgenome.org/kb/gene-dosage/HGNC:18672","Dosage Working Group","definitive evidence (01/25/2022)","https://search.clinicalgenome.org/kb/gene-validity/CGGV:assertion_70dace84-4d61-44f5-9de5-a81b5c70cad4-2022-01-25T170000.000Z","Brain Malformations","","",""
"CDK5RAP2","HGNC:18672","https://search.clinicalgenome.org/kb/genes/HGNC:18672","microcephaly 3, primary, autosomal recessive","MONDO:0011488","https://search.clinicalgenome.org/kb/conditions/MONDO:0011488","N/A","30 - Gene Associated with Autosomal Recessive Phenotype (08/22/2016)","","https://search.clinicalgenome.org/kb/gene-dosage/HGNC:18672","Dosage Working Group","","","","","",""
"CDK6","HGNC:1777","https://search.clinicalgenome.org/kb/genes/HGNC:1777","microcephaly 12, primary, autosomal recessive","MONDO:0014484","https://search.clinicalgenome.org/kb/conditions/MONDO:0014484","N/A","30 - Gene Associated with Autosomal Recessive Phenotype (08/22/2016)","","https://search.clinicalgenome.org/kb/gene-dosage/HGNC:1777","Dosage Working Group","","","","","",""
"CDKL5","HGNC:11411","https://search.clinicalgenome.org/kb/genes/HGNC:11411","CDKL5 disorder","MONDO:0100039","https://search.clinicalgenome.org/kb/conditions/MONDO:0100039","X-linked inheritance","3 - Sufficient Evidence for Haploinsufficiency (07/12/2012)","0 - No Evidence for Triplosensitivity (07/12/2012)","https://search.clinicalgenome.org/kb/gene-dosage/HGNC:11411","Dosage Working Group","definitive evidence (07/02/2018)","https://search.clinicalgenome.org/kb/gene-validity/CGGV:assertion_a80cd86d-b085-4f35-9379-12a53ef367e2-2018-07-02T145731.072Z","Rett and Angelman-like Disorders","","",""
"CDKL5","HGNC:11411","https://search.clinicalgenome.org/kb/genes/HGNC:11411","developmental and epileptic encephalopathy, 2","MONDO:0010396","https://search.clinicalgenome.org/kb/conditions/MONDO:0010396","N/A","3 - Sufficient Evidence for Haploinsufficiency (07/12/2012)","0 - No Evidence for Triplosensitivity (07/12/2012)","https://search.clinicalgenome.org/kb/gene-dosage/HGNC:11411","Dosage Working Group","","","","","",""
"CDKN1B","HGNC:1785","https://search.clinicalgenome.org/kb/genes/HGNC:1785","multiple endocrine neoplasia type 4","MONDO:0012552","https://search.clinicalgenome.org/kb/conditions/MONDO:0012552","Autosomal dominant inheritance","3 - Sufficient Evidence for Haploinsufficiency (07/08/2020)","0 - No Evidence for Triplosensitivity (07/08/2020)","https://search.clinicalgenome.org/kb/gene-dosage/HGNC:1785","Dosage Working Group","definitive evidence (12/21/2018)","https://search.clinicalgenome.org/kb/gene-validity/CGGV:assertion_b07f8882-dd5e-4831-9926-f8b4c2a8c265-2018-12-21T154854.477Z","Hereditary Cancer","Moderate Actionability (09/11/2023) | Moderate Actionability (09/11/2023)","https://actionability.clinicalgenome.org/ac/Pediatric/ui/stg2SummaryRpt?doc=AC1061 | https://actionability.clinicalgenome.org/ac/Adult/ui/stg2SummaryRpt?doc=AC1061","Pediatric Actionability Working Group | Adult Actionability Working Group"
"CDKN1B","HGNC:1785","https://search.clinicalgenome.org/kb/genes/HGNC:1785","hereditary nonpolyposis colon cancer","MONDO:0018630","https://search.clinicalgenome.org/kb/conditions/MONDO:0018630","Autosomal recessive inheritance","3 - Sufficient Evidence for Haploinsufficiency (07/08/2020)","0 - No Evidence for Triplosensitivity (07/08/2020)","https://search.clinicalgenome.org/kb/gene-dosage/HGNC:1785","Dosage Working Group","limited evidence (06/08/2017)","https://search.clinicalgenome.org/kb/gene-validity/CGGCIEX:assertion_8434","Colon Cancer","","",""
"CDKN1C","HGNC:1786","https://search.clinicalgenome.org/kb/genes/HGNC:1786","Beckwith-Wiedemann syndrome","MONDO:0007534","https://search.clinicalgenome.org/kb/conditions/MONDO:0007534","N/A","3 - Sufficient Evidence for Haploinsufficiency (09/25/2020)","0 - No Evidence for Triplosensitivity (09/25/2020)","https://search.clinicalgenome.org/kb/gene-dosage/HGNC:1786","Dosage Working Group","","","","","",""
"CDKN2A","HGNC:1787","https://search.clinicalgenome.org/kb/genes/HGNC:1787","melanoma-pancreatic cancer syndrome","MONDO:0011713","https://search.clinicalgenome.org/kb/conditions/MONDO:0011713","Autosomal dominant inheritance","3 - Sufficient Evidence for Haploinsufficiency (03/18/2022)","0 - No Evidence for Triplosensitivity (03/18/2022)","https://search.clinicalgenome.org/kb/gene-dosage/HGNC:1787","Dosage Working Group","definitive evidence (08/14/2019)","https://search.clinicalgenome.org/kb/gene-validity/CGGV:assertion_0c0d2fc0-12b2-4855-b537-60394d0987dd-2019-08-14T194547.089Z","Hereditary Cancer","Moderate Actionability (06/03/2022) | Limited Actionability (06/03/2022)","https://actionability.clinicalgenome.org/ac/Adult/ui/stg2SummaryRpt?doc=AC086 | https://actionability.clinicalgenome.org/ac/Pediatric/ui/stg2SummaryRpt?doc=AC086","Adult Actionability Working Group | Pediatric Actionability Working Group"
"CDKN2A","HGNC:1787","https://search.clinicalgenome.org/kb/genes/HGNC:1787","melanoma, cutaneous malignant, susceptibility to, 2","MONDO:0007964","https://search.clinicalgenome.org/kb/conditions/MONDO:0007964","N/A","3 - Sufficient Evidence for Haploinsufficiency (03/18/2022)","0 - No Evidence for Triplosensitivity (03/18/2022)","https://search.clinicalgenome.org/kb/gene-dosage/HGNC:1787","Dosage Working Group","","","","Limited Actionability (06/03/2022)","https://actionability.clinicalgenome.org/ac/Pediatric/ui/stg2SummaryRpt?doc=AC086","Pediatric Actionability Working Group"
"CDKN2A","HGNC:1787","https://search.clinicalgenome.org/kb/genes/HGNC:1787","familial atypical multiple mole melanoma syndrome","MONDO:0018453","https://search.clinicalgenome.org/kb/conditions/MONDO:0018453","N/A","3 - Sufficient Evidence for Haploinsufficiency (03/18/2022)","0 - No Evidence for Triplosensitivity (03/18/2022)","https://search.clinicalgenome.org/kb/gene-dosage/HGNC:1787","Dosage Working Group","","","","Limited Actionability (06/03/2022)","https://actionability.clinicalgenome.org/ac/Pediatric/ui/stg2SummaryRpt?doc=AC086","Pediatric Actionability Working Group"
"CDT1","HGNC:24576","https://search.clinicalgenome.org/kb/genes/HGNC:24576","Meier-Gorlin syndrome 4","MONDO:0013431","https://search.clinicalgenome.org/kb/conditions/MONDO:0013431","Autosomal recessive inheritance","30 - Gene Associated with Autosomal Recessive Phenotype (08/22/2016)","","https://search.clinicalgenome.org/kb/gene-dosage/HGNC:24576","Dosage Working Group","definitive evidence (03/03/2023)","https://search.clinicalgenome.org/kb/gene-validity/CGGV:assertion_dfc9602f-fb88-419a-8955-6d7c00a52158-2023-03-03T170000.000Z","Syndromic Disorders","","",""
"CEACAM16","HGNC:31948","https://search.clinicalgenome.org/kb/genes/HGNC:31948","nonsyndromic genetic hearing loss","MONDO:0019497","https://search.clinicalgenome.org/kb/conditions/MONDO:0019497","Autosomal dominant inheritance | Autosomal recessive inheritance","","","","","moderate evidence (09/21/2022) | strong evidence (12/21/2022)","https://search.clinicalgenome.org/kb/gene-validity/CGGV:assertion_e25cadf1-752a-495d-aaf2-30565519518a-2022-09-21T160000.000Z | https://search.clinicalgenome.org/kb/gene-validity/CGGV:assertion_bcc9ab02-1df0-485a-a806-2651171120cd-2022-12-21T170000.000Z","Hearing Loss | Hearing Loss","","",""
"CEBPA","HGNC:1833","https://search.clinicalgenome.org/kb/genes/HGNC:1833","acute myeloid leukemia","MONDO:0018874","https://search.clinicalgenome.org/kb/conditions/MONDO:0018874","Autosomal dominant inheritance","0 - No Evidence for Haploinsufficiency (06/09/2022)","0 - No Evidence for Triplosensitivity (06/09/2022)","https://search.clinicalgenome.org/kb/gene-dosage/HGNC:1833","Dosage Working Group","definitive evidence (08/18/2019)","https://search.clinicalgenome.org/kb/gene-validity/CGGV:assertion_4234367e-149b-4f13-9243-341396fb4ccf-2019-08-18T155916.225Z","Hereditary Cancer","","",""
"CEBPE","HGNC:1836","https://search.clinicalgenome.org/kb/genes/HGNC:1836","specific granule deficiency 1","MONDO:0044207","https://search.clinicalgenome.org/kb/conditions/MONDO:0044207","N/A","30 - Gene Associated with Autosomal Recessive Phenotype (08/22/2016)","","https://search.clinicalgenome.org/kb/gene-dosage/HGNC:1836","Dosage Working Group","","","","","",""
"CEL","HGNC:1848","https://search.clinicalgenome.org/kb/genes/HGNC:1848","maturity-onset diabetes of the young type 8","MONDO:0012348","https://search.clinicalgenome.org/kb/conditions/MONDO:0012348","Autosomal dominant inheritance","","","","","moderate evidence (09/13/2023)","https://search.clinicalgenome.org/kb/gene-validity/CGGV:assertion_06571680-3730-4075-8e65-f6de7ddd3e62-2023-09-13T160000.000Z","Monogenic Diabetes","","",""
"CELF4","HGNC:14015","https://search.clinicalgenome.org/kb/genes/HGNC:14015","intellectual disability","MONDO:0001071","https://search.clinicalgenome.org/kb/conditions/MONDO:0001071","N/A","1 - Little Evidence for Haploinsufficiency (12/07/2022)","0 - No Evidence for Triplosensitivity (12/07/2022)","https://search.clinicalgenome.org/kb/gene-dosage/HGNC:14015","Dosage Working Group","","","","","",""
"CEMIP","HGNC:29213","https://search.clinicalgenome.org/kb/genes/HGNC:29213","nonsyndromic genetic hearing loss","MONDO:0019497","https://search.clinicalgenome.org/kb/conditions/MONDO:0019497","Autosomal recessive inheritance","","","","","disputing (07/17/2018)","https://search.clinicalgenome.org/kb/gene-validity/CGGV:assertion_27d840d2-1f58-4d1c-9f6e-307db9f41b60-2018-07-17T160000.000Z","Hearing Loss","","",""
"CENPE","HGNC:1856","https://search.clinicalgenome.org/kb/genes/HGNC:1856","autosomal recessive primary microcephaly","MONDO:0016660","https://search.clinicalgenome.org/kb/conditions/MONDO:0016660","Autosomal recessive inheritance","","","","","limited evidence (12/19/2023)","https://search.clinicalgenome.org/kb/gene-validity/CGGV:assertion_830f266d-32bd-4d1f-9867-e97ffe6f2eae-2023-12-19T180000.000Z","Brain Malformations","","",""
"CENPJ","HGNC:17272","https://search.clinicalgenome.org/kb/genes/HGNC:17272","microcephaly 6 with or without short stature","MONDO:0700054","https://search.clinicalgenome.org/kb/conditions/MONDO:0700054","Autosomal recessive inheritance","30 - Gene Associated with Autosomal Recessive Phenotype (08/22/2016)","","https://search.clinicalgenome.org/kb/gene-dosage/HGNC:17272","Dosage Working Group","definitive evidence (05/21/2022)","https://search.clinicalgenome.org/kb/gene-validity/CGGV:assertion_c10510c1-2c0e-466e-928a-77d896159d06-2022-05-21T104414.354Z","Syndromic Disorders","","",""
"CENPJ","HGNC:17272","https://search.clinicalgenome.org/kb/genes/HGNC:17272","microcephaly 6, primary, autosomal recessive","MONDO:0012029","https://search.clinicalgenome.org/kb/conditions/MONDO:0012029","N/A","30 - Gene Associated with Autosomal Recessive Phenotype (08/22/2016)","","https://search.clinicalgenome.org/kb/gene-dosage/HGNC:17272","Dosage Working Group","","","","","",""
"CEP104","HGNC:24866","https://search.clinicalgenome.org/kb/genes/HGNC:24866","ciliopathy","MONDO:0005308","https://search.clinicalgenome.org/kb/conditions/MONDO:0005308","Autosomal recessive inheritance","","","","","definitive evidence (01/28/2025)","https://search.clinicalgenome.org/kb/gene-validity/CGGV:assertion_be550486-4da7-4de4-9db4-6f5cdb98ff39-2025-01-28T170000.000Z","Kidney Cystic and Ciliopathy Disorders","","",""
"CEP152","HGNC:29298","https://search.clinicalgenome.org/kb/genes/HGNC:29298","microcephaly with or without short stature","MONDO:0100346","https://search.clinicalgenome.org/kb/conditions/MONDO:0100346","Autosomal recessive inheritance","","","","","definitive evidence (06/28/2022)","https://search.clinicalgenome.org/kb/gene-validity/CGGV:assertion_52841ad8-48fd-4b71-bf08-828656cd83f6-2022-06-28T160000.000Z","Brain Malformations","","",""
"CEP164","HGNC:29182","https://search.clinicalgenome.org/kb/genes/HGNC:29182","CEP164-related ciliopathy","MONDO:0700344","https://search.clinicalgenome.org/kb/conditions/MONDO:0700344","Autosomal recessive inheritance","30 - Gene Associated with Autosomal Recessive Phenotype (08/22/2016)","0 - No Evidence for Triplosensitivity (08/22/2016)","https://search.clinicalgenome.org/kb/gene-dosage/HGNC:29182","Dosage Working Group","definitive evidence (10/27/2021)","https://search.clinicalgenome.org/kb/gene-validity/CGGV:assertion_961b81f6-7ad1-49e2-b675-c035b4d8d35d-2021-10-27T160000.000Z","Kidney Cystic and Ciliopathy Disorders","","",""
"CEP164","HGNC:29182","https://search.clinicalgenome.org/kb/genes/HGNC:29182","nephronophthisis 15","MONDO:0013917","https://search.clinicalgenome.org/kb/conditions/MONDO:0013917","N/A","30 - Gene Associated with Autosomal Recessive Phenotype (08/22/2016)","0 - No Evidence for Triplosensitivity (08/22/2016)","https://search.clinicalgenome.org/kb/gene-dosage/HGNC:29182","Dosage Working Group","","","","","",""
"CEP290","HGNC:29021","https://search.clinicalgenome.org/kb/genes/HGNC:29021","CEP290-related ciliopathy","MONDO:0100451","https://search.clinicalgenome.org/kb/conditions/MONDO:0100451","Autosomal recessive inheritance","30 - Gene Associated with Autosomal Recessive Phenotype (08/22/2012)","0 - No Evidence for Triplosensitivity (08/22/2012)","https://search.clinicalgenome.org/kb/gene-dosage/HGNC:29021","Dosage Working Group","definitive evidence (02/03/2022)","https://search.clinicalgenome.org/kb/gene-validity/CGGV:assertion_ec24317e-70bc-48a0-999b-f960f951e8dd-2022-02-03T170000.000Z","Retina","","",""
"CEP290","HGNC:29021","https://search.clinicalgenome.org/kb/genes/HGNC:29021","Joubert syndrome and related disorders","MONDO:0015369","https://search.clinicalgenome.org/kb/conditions/MONDO:0015369","N/A","30 - Gene Associated with Autosomal Recessive Phenotype (08/22/2012)","0 - No Evidence for Triplosensitivity (08/22/2012)","https://search.clinicalgenome.org/kb/gene-dosage/HGNC:29021","Dosage Working Group","","","","","",""
"CEP57","HGNC:30794","https://search.clinicalgenome.org/kb/genes/HGNC:30794","mosaic variegated aneuploidy syndrome 2","MONDO:0013582","https://search.clinicalgenome.org/kb/conditions/MONDO:0013582","Autosomal recessive inheritance","","","","","definitive evidence (11/22/2019)","https://search.clinicalgenome.org/kb/gene-validity/CGGV:assertion_c44921de-14cf-4907-8bef-1525329ee89c-2019-11-22T145303.972Z","Hereditary Cancer","","",""
"CEP78","HGNC:25740","https://search.clinicalgenome.org/kb/genes/HGNC:25740","cone-rod dystrophy and hearing loss","MONDO:0014980","https://search.clinicalgenome.org/kb/conditions/MONDO:0014980","Autosomal recessive inheritance","30 - Gene Associated with Autosomal Recessive Phenotype (10/23/2017)","0 - No Evidence for Triplosensitivity (10/23/2017)","https://search.clinicalgenome.org/kb/gene-dosage/HGNC:25740","Dosage Working Group","strong evidence (04/12/2017)","https://search.clinicalgenome.org/kb/gene-validity/CGGCIEX:assertion_8149","Hearing Loss","","",""
"CEP78","HGNC:25740","https://search.clinicalgenome.org/kb/genes/HGNC:25740","cone-rod dystrophy and hearing loss 1","MONDO:0020778","https://search.clinicalgenome.org/kb/conditions/MONDO:0020778","N/A","30 - Gene Associated with Autosomal Recessive Phenotype (10/23/2017)","0 - No Evidence for Triplosensitivity (10/23/2017)","https://search.clinicalgenome.org/kb/gene-dosage/HGNC:25740","Dosage Working Group","","","","","",""
"CEP85L","HGNC:21638","https://search.clinicalgenome.org/kb/genes/HGNC:21638","lissencephaly 10","MONDO:0030031","https://search.clinicalgenome.org/kb/conditions/MONDO:0030031","Autosomal dominant inheritance","","","","","definitive evidence (09/24/2024)","https://search.clinicalgenome.org/kb/gene-validity/CGGV:assertion_30a3191e-5ee3-467c-afa1-27fada71f9ea-2024-09-24T170000.000Z","Brain Malformations","","",""
"CERKL","HGNC:21699","https://search.clinicalgenome.org/kb/genes/HGNC:21699","CERKL-related retinopathy","MONDO:0800401","https://search.clinicalgenome.org/kb/conditions/MONDO:0800401","Autosomal recessive inheritance","","","","","definitive evidence (09/01/2022)","https://search.clinicalgenome.org/kb/gene-validity/CGGV:assertion_a3003820-dc03-4eb1-921a-6eaee749fa9f-2022-09-01T160000.000Z","Retina","","",""
"CERS1","HGNC:14253","https://search.clinicalgenome.org/kb/genes/HGNC:14253","progressive myoclonus epilepsy","MONDO:0020074","https://search.clinicalgenome.org/kb/conditions/MONDO:0020074","Autosomal recessive inheritance","","","","","moderate evidence (07/16/2024)","https://search.clinicalgenome.org/kb/gene-validity/CGGV:assertion_b06288c1-72ae-4ed0-8a27-f886547a8808-2024-07-16T170000.000Z","Epilepsy","","",""
"CERS3","HGNC:23752","https://search.clinicalgenome.org/kb/genes/HGNC:23752","autosomal recessive congenital ichthyosis 9","MONDO:0014010","https://search.clinicalgenome.org/kb/conditions/MONDO:0014010","N/A","30 - Gene Associated with Autosomal Recessive Phenotype (08/22/2016)","","https://search.clinicalgenome.org/kb/gene-dosage/HGNC:23752","Dosage Working Group","","","","","",""
"CFAP221","HGNC:33720","https://search.clinicalgenome.org/kb/genes/HGNC:33720","primary ciliary dyskinesia","MONDO:0016575","https://search.clinicalgenome.org/kb/conditions/MONDO:0016575","Autosomal recessive inheritance","","","","","moderate evidence (08/10/2023)","https://search.clinicalgenome.org/kb/gene-validity/CGGV:assertion_c7c841e5-2973-4f23-8603-970e9e2cbc92-2023-08-10T160000.000Z","Motile Ciliopathy","","",""
"CFAP298","HGNC:1301","https://search.clinicalgenome.org/kb/genes/HGNC:1301","primary ciliary dyskinesia 26","MONDO:0014211","https://search.clinicalgenome.org/kb/conditions/MONDO:0014211","Autosomal recessive inheritance","","","","","moderate evidence (08/10/2023)","https://search.clinicalgenome.org/kb/gene-validity/CGGV:assertion_f29143ae-869e-4e4c-8464-8c61f2c2663c-2023-08-10T160000.000Z","Motile Ciliopathy","","",""
"CFAP300","HGNC:28188","https://search.clinicalgenome.org/kb/genes/HGNC:28188","ciliary dyskinesia, primary, 38","MONDO:0054843","https://search.clinicalgenome.org/kb/conditions/MONDO:0054843","Autosomal recessive inheritance","","","","","definitive evidence (09/08/2022)","https://search.clinicalgenome.org/kb/gene-validity/CGGV:assertion_6bcfa4e4-37a3-43a7-9b4d-60554bc7600c-2022-09-08T110000.000Z","Motile Ciliopathy","Moderate Actionability (11/15/2022) | Limited Actionability (11/15/2022)","https://actionability.clinicalgenome.org/ac/Pediatric/ui/stg2SummaryRpt?doc=AC1007 | https://actionability.clinicalgenome.org/ac/Adult/ui/stg2SummaryRpt?doc=AC1007","Pediatric Actionability Working Group | Adult Actionability Working Group"
"CFAP410","HGNC:1260","https://search.clinicalgenome.org/kb/genes/HGNC:1260","amyotrophic lateral sclerosis","MONDO:0004976","https://search.clinicalgenome.org/kb/conditions/MONDO:0004976","Semidominant inheritance","","","","","limited evidence (12/12/2023)","https://search.clinicalgenome.org/kb/gene-validity/CGGV:assertion_bde7edf1-ccfa-443e-a917-cf3d2dd9cba6-2023-12-12T180000.000Z","Amyotrophic Lateral Sclerosis Spectrum Disorders","","",""
"CFAP418","HGNC:27232","https://search.clinicalgenome.org/kb/genes/HGNC:27232","ciliopathy","MONDO:0005308","https://search.clinicalgenome.org/kb/conditions/MONDO:0005308","Autosomal recessive inheritance","30 - Gene Associated with Autosomal Recessive Phenotype (08/22/2016)","0 - No Evidence for Triplosensitivity (08/22/2016)","https://search.clinicalgenome.org/kb/gene-dosage/HGNC:27232","Dosage Working Group","definitive evidence (07/11/2024)","https://search.clinicalgenome.org/kb/gene-validity/CGGV:assertion_791b95ad-3c89-436c-aa6e-c153c1c1ea61-2024-07-11T160000.000Z","Retina","","",""
"CFAP418","HGNC:27232","https://search.clinicalgenome.org/kb/genes/HGNC:27232","cone-rod dystrophy 16","MONDO:0013786","https://search.clinicalgenome.org/kb/conditions/MONDO:0013786","N/A","30 - Gene Associated with Autosomal Recessive Phenotype (08/22/2016)","0 - No Evidence for Triplosensitivity (08/22/2016)","https://search.clinicalgenome.org/kb/gene-dosage/HGNC:27232","Dosage Working Group","","","","","",""
"CFAP43","HGNC:26684","https://search.clinicalgenome.org/kb/genes/HGNC:26684","spermatogenic failure 19","MONDO:0054723","https://search.clinicalgenome.org/kb/conditions/MONDO:0054723","Autosomal recessive inheritance","","","","","definitive evidence (12/14/2022)","https://search.clinicalgenome.org/kb/gene-validity/CGGV:assertion_a5055c70-e22e-47e5-af3b-04f3f2a0ed34-2022-12-14T200000.000Z","Motile Ciliopathy","","",""
"CFAP43","HGNC:26684","https://search.clinicalgenome.org/kb/genes/HGNC:26684","normal pressure hydrocephalus","MONDO:0009366","https://search.clinicalgenome.org/kb/conditions/MONDO:0009366","Autosomal dominant inheritance","","","","","limited evidence (12/13/2022)","https://search.clinicalgenome.org/kb/gene-validity/CGGV:assertion_ff67c788-1b69-4da8-84df-f37741c9913f-2022-12-13T200000.000Z","Motile Ciliopathy","","",""
"CFAP43","HGNC:26684","https://search.clinicalgenome.org/kb/genes/HGNC:26684","primary ciliary dyskinesia","MONDO:0016575","https://search.clinicalgenome.org/kb/conditions/MONDO:0016575","Mode of inheritance","","","","","disputing (12/29/2022)","https://search.clinicalgenome.org/kb/gene-validity/CGGV:assertion_f2622390-3981-4f40-8c28-194fb13dd35a-2022-12-29T200000.000Z","Motile Ciliopathy","","",""
"CFAP47","HGNC:26708","https://search.clinicalgenome.org/kb/genes/HGNC:26708","spermatogenic failure, X-linked, 3","MONDO:0025354","https://search.clinicalgenome.org/kb/conditions/MONDO:0025354","X-linked inheritance","","","","","limited evidence (02/09/2023)","https://search.clinicalgenome.org/kb/gene-validity/CGGV:assertion_5d2e51e3-fec5-4aa8-a093-d316c4feec02-2023-02-09T170000.000Z","Motile Ciliopathy","","",""
"CFAP53","HGNC:26530","https://search.clinicalgenome.org/kb/genes/HGNC:26530","heterotaxy, visceral, 6, autosomal","MONDO:0013887","https://search.clinicalgenome.org/kb/conditions/MONDO:0013887","N/A","30 - Gene Associated with Autosomal Recessive Phenotype (08/22/2016)","0 - No Evidence for Triplosensitivity (08/22/2016)","https://search.clinicalgenome.org/kb/gene-dosage/HGNC:26530","Dosage Working Group","","","","","",""
"CFAP54","HGNC:26456","https://search.clinicalgenome.org/kb/genes/HGNC:26456","ciliary dyskinesia, primary, 54","MONDO:0100607","https://search.clinicalgenome.org/kb/conditions/MONDO:0100607","Autosomal recessive inheritance","","","","","strong evidence (07/16/2025)","https://search.clinicalgenome.org/kb/gene-validity/CGGV:assertion_f16ea0ce-7d5d-4bdc-92fe-52d111913161-2025-07-16T190000.000Z","Motile Ciliopathy","","",""
"CFAP57","HGNC:26485","https://search.clinicalgenome.org/kb/genes/HGNC:26485","primary ciliary dyskinesia","MONDO:0016575","https://search.clinicalgenome.org/kb/conditions/MONDO:0016575","Autosomal recessive inheritance","","","","","limited evidence (06/23/2022)","https://search.clinicalgenome.org/kb/gene-validity/CGGV:assertion_50ed292f-0044-4c82-9419-a040cbcaf205-2022-06-23T160000.000Z","Motile Ciliopathy","","",""
"CFAP74","HGNC:29368","https://search.clinicalgenome.org/kb/genes/HGNC:29368","ciliary dyskinesia, primary, 49, without situs inversus","MONDO:0859353","https://search.clinicalgenome.org/kb/conditions/MONDO:0859353","Autosomal recessive inheritance","","","","","moderate evidence (06/18/2025)","https://search.clinicalgenome.org/kb/gene-validity/CGGV:assertion_e5a065a6-73b9-46ba-89a2-afadedb4b82c-2025-06-18T160000.000Z","Motile Ciliopathy","","",""
"CFB","HGNC:1037","https://search.clinicalgenome.org/kb/genes/HGNC:1037","atypical hemolytic-uremic syndrome with B factor anomaly","MONDO:0013042","https://search.clinicalgenome.org/kb/conditions/MONDO:0013042","Autosomal dominant inheritance","","","","","moderate evidence (07/02/2023)","https://search.clinicalgenome.org/kb/gene-validity/CGGV:assertion_ee0e92dc-42db-450e-8e8d-804e5fb4eda8-2023-07-02T160000.000Z","Complement-Mediated Kidney Diseases","","",""
"CFB","HGNC:1037","https://search.clinicalgenome.org/kb/genes/HGNC:1037","C3 glomerulonephritis","MONDO:0013892","https://search.clinicalgenome.org/kb/conditions/MONDO:0013892","Autosomal dominant inheritance","","","","","limited evidence (11/27/2024)","https://search.clinicalgenome.org/kb/gene-validity/CGGV:assertion_58e4da7f-d0a0-4283-9780-abc69d7fddce-2024-11-27T170000.000Z","Complement-Mediated Kidney Diseases","","",""
"CFD","HGNC:2771","https://search.clinicalgenome.org/kb/genes/HGNC:2771","recurrent Neisseria infections due to factor D deficiency","MONDO:0013487","https://search.clinicalgenome.org/kb/conditions/MONDO:0013487","N/A","30 - Gene Associated with Autosomal Recessive Phenotype (08/22/2016)","0 - No Evidence for Triplosensitivity (08/22/2016)","https://search.clinicalgenome.org/kb/gene-dosage/HGNC:2771","Dosage Working Group","","","","","",""
"CFH","HGNC:4883","https://search.clinicalgenome.org/kb/genes/HGNC:4883","atypical hemolytic-uremic syndrome","MONDO:0016244","https://search.clinicalgenome.org/kb/conditions/MONDO:0016244","Semidominant inheritance","","","","","definitive evidence (07/02/2023)","https://search.clinicalgenome.org/kb/gene-validity/CGGV:assertion_b0a234f8-1d8e-4a26-a76f-40219591c75c-2023-07-02T160000.000Z","Complement-Mediated Kidney Diseases","","",""
"CFH","HGNC:4883","https://search.clinicalgenome.org/kb/genes/HGNC:4883","C3 glomerulonephritis","MONDO:0013892","https://search.clinicalgenome.org/kb/conditions/MONDO:0013892","Autosomal recessive inheritance","","","","","definitive evidence (02/21/2024)","https://search.clinicalgenome.org/kb/gene-validity/CGGV:assertion_9eeff991-b5ac-4d1b-a128-47fa2306c1c5-2024-02-21T170000.000Z","Complement-Mediated Kidney Diseases","","",""
"CFI","HGNC:5394","https://search.clinicalgenome.org/kb/genes/HGNC:5394","atypical hemolytic-uremic syndrome","MONDO:0016244","https://search.clinicalgenome.org/kb/conditions/MONDO:0016244","Autosomal dominant inheritance","","","","","definitive evidence (06/01/2023)","https://search.clinicalgenome.org/kb/gene-validity/CGGV:assertion_3a5fcd7c-0da5-4ba3-b0c6-2d40f985c418-2023-06-01T160000.000Z","Complement-Mediated Kidney Diseases","","",""
"CFI","HGNC:5394","https://search.clinicalgenome.org/kb/genes/HGNC:5394","C3 glomerulonephritis","MONDO:0013892","https://search.clinicalgenome.org/kb/conditions/MONDO:0013892","Autosomal dominant inheritance","","","","","moderate evidence (06/28/2024)","https://search.clinicalgenome.org/kb/gene-validity/CGGV:assertion_943f6c06-e32b-4052-8628-4c28de20c838-2024-06-28T160000.000Z","Complement-Mediated Kidney Diseases","","",""
"CFL2","HGNC:1875","https://search.clinicalgenome.org/kb/genes/HGNC:1875","nemaline myopathy 7","MONDO:0012538","https://search.clinicalgenome.org/kb/conditions/MONDO:0012538","Autosomal recessive inheritance","30 - Gene Associated with Autosomal Recessive Phenotype (08/22/2016)","","https://search.clinicalgenome.org/kb/gene-dosage/HGNC:1875","Dosage Working Group","definitive evidence (11/25/2019)","https://search.clinicalgenome.org/kb/gene-validity/CGGV:assertion_3c04b972-6797-42e7-87e8-ee97eb0bbad7-2019-11-25T150139.061Z","Congenital Myopathies","","",""
"CFTR","HGNC:1884","https://search.clinicalgenome.org/kb/genes/HGNC:1884","cystic fibrosis","MONDO:0009061","https://search.clinicalgenome.org/kb/conditions/MONDO:0009061","N/A","30 - Gene Associated with Autosomal Recessive Phenotype (08/22/2016)","","https://search.clinicalgenome.org/kb/gene-dosage/HGNC:1884","Dosage Working Group","","","","","",""
"CHAMP1","HGNC:20311","https://search.clinicalgenome.org/kb/genes/HGNC:20311","complex neurodevelopmental disorder","MONDO:0100038","https://search.clinicalgenome.org/kb/conditions/MONDO:0100038","Autosomal dominant inheritance","1 - Little Evidence for Haploinsufficiency (06/10/2025)","0 - No Evidence for Triplosensitivity (06/10/2025)","https://search.clinicalgenome.org/kb/gene-dosage/HGNC:20311","Dosage Working Group","definitive evidence (01/11/2024)","https://search.clinicalgenome.org/kb/gene-validity/CGGV:assertion_4c67e6d5-1d58-4544-85e3-3078eec26231-2024-01-11T190000.000Z","Intellectual Disability and Autism","","",""
"CHAT","HGNC:1912","https://search.clinicalgenome.org/kb/genes/HGNC:1912","congenital myasthenic syndrome 6","MONDO:0009689","https://search.clinicalgenome.org/kb/conditions/MONDO:0009689","Autosomal recessive inheritance","30 - Gene Associated with Autosomal Recessive Phenotype (08/22/2016)","","https://search.clinicalgenome.org/kb/gene-dosage/HGNC:1912","Dosage Working Group","definitive evidence (03/24/2025)","https://search.clinicalgenome.org/kb/gene-validity/CGGV:assertion_8e6d5128-7f30-407b-9d0b-88bf8a719eb8-2025-03-24T160000.000Z","Congenital Myopathies","","",""
"CHCHD10","HGNC:15559","https://search.clinicalgenome.org/kb/genes/HGNC:15559","frontotemporal dementia and/or amyotrophic lateral sclerosis 2","MONDO:0014395","https://search.clinicalgenome.org/kb/conditions/MONDO:0014395","Autosomal dominant inheritance","","","","","moderate evidence (09/13/2022)","https://search.clinicalgenome.org/kb/gene-validity/CGGV:assertion_d154f67a-25ce-40d3-9de3-1f001753843a-2022-09-13T160000.000Z","Amyotrophic Lateral Sclerosis Spectrum Disorders","","",""
"CHCHD10","HGNC:15559","https://search.clinicalgenome.org/kb/genes/HGNC:15559","mitochondrial disease","MONDO:0044970","https://search.clinicalgenome.org/kb/conditions/MONDO:0044970","Autosomal dominant inheritance","","","","","definitive evidence (05/18/2023)","https://search.clinicalgenome.org/kb/gene-validity/CGGV:assertion_6940c6eb-dacf-46ce-a08c-d8b9f98b04ae-2023-05-18T160000.000Z","Mitochondrial Diseases","","",""
"CHD1","HGNC:1915","https://search.clinicalgenome.org/kb/genes/HGNC:1915","complex neurodevelopmental disorder","MONDO:0100038","https://search.clinicalgenome.org/kb/conditions/MONDO:0100038","Autosomal dominant inheritance","","","","","limited evidence (04/17/2024)","https://search.clinicalgenome.org/kb/gene-validity/CGGV:assertion_1c8b091b-7709-4344-947b-ec74e8dbad58-2024-04-17T160000.000Z","Intellectual Disability and Autism","","",""
"CHD1L","HGNC:1916","https://search.clinicalgenome.org/kb/genes/HGNC:1916","congenital anomaly of kidney and urinary tract","MONDO:0019719","https://search.clinicalgenome.org/kb/conditions/MONDO:0019719","Autosomal dominant inheritance","0 - No Evidence for Haploinsufficiency (08/30/2018)","0 - No Evidence for Triplosensitivity (08/30/2018)","https://search.clinicalgenome.org/kb/gene-dosage/HGNC:1916","Dosage Working Group","limited evidence (11/18/2016)","https://search.clinicalgenome.org/kb/gene-validity/CGGCIEX:assertion_3220","General Gene Curation","","",""
"CHD2","HGNC:1917","https://search.clinicalgenome.org/kb/genes/HGNC:1917","complex neurodevelopmental disorder","MONDO:0100038","https://search.clinicalgenome.org/kb/conditions/MONDO:0100038","Autosomal dominant inheritance","3 - Sufficient Evidence for Haploinsufficiency (10/23/2019)","0 - No Evidence for Triplosensitivity (10/23/2019)","https://search.clinicalgenome.org/kb/gene-dosage/HGNC:1917","Dosage Working Group","definitive evidence (07/14/2022)","https://search.clinicalgenome.org/kb/gene-validity/CGGV:assertion_5af80ea6-31c6-47d2-a5a5-299380f5593c-2022-07-14T190000.000Z","Epilepsy","","",""
"CHD2","HGNC:1917","https://search.clinicalgenome.org/kb/genes/HGNC:1917","developmental and epileptic encephalopathy 94","MONDO:0014150","https://search.clinicalgenome.org/kb/conditions/MONDO:0014150","N/A","3 - Sufficient Evidence for Haploinsufficiency (10/23/2019)","0 - No Evidence for Triplosensitivity (10/23/2019)","https://search.clinicalgenome.org/kb/gene-dosage/HGNC:1917","Dosage Working Group","","","","","",""
"CHD3","HGNC:1918","https://search.clinicalgenome.org/kb/genes/HGNC:1918","Snijders Blok-Campeau syndrome","MONDO:0032600","https://search.clinicalgenome.org/kb/conditions/MONDO:0032600","Autosomal dominant inheritance","","","","","definitive evidence (03/02/2022)","https://search.clinicalgenome.org/kb/gene-validity/CGGV:assertion_0e94c7c1-9c13-4189-8a9f-e9808916526f-2022-03-02T170000.000Z","Intellectual Disability and Autism","","",""
"CHD4","HGNC:1919","https://search.clinicalgenome.org/kb/genes/HGNC:1919","syndromic intellectual disability","MONDO:0000508","https://search.clinicalgenome.org/kb/conditions/MONDO:0000508","Autosomal dominant inheritance","1 - Little Evidence for Haploinsufficiency (11/30/2022)","0 - No Evidence for Triplosensitivity (11/30/2022)","https://search.clinicalgenome.org/kb/gene-dosage/HGNC:1919","Dosage Working Group","definitive evidence (04/19/2023)","https://search.clinicalgenome.org/kb/gene-validity/CGGV:assertion_f1795399-d5bc-456d-bc6b-be07d7ab6af6-2023-04-19T160000.000Z","Intellectual Disability and Autism","","",""
"CHD4","HGNC:1919","https://search.clinicalgenome.org/kb/genes/HGNC:1919","Sifrim-Hitz-Weiss syndrome","MONDO:0014946","https://search.clinicalgenome.org/kb/conditions/MONDO:0014946","N/A","1 - Little Evidence for Haploinsufficiency (11/30/2022)","0 - No Evidence for Triplosensitivity (11/30/2022)","https://search.clinicalgenome.org/kb/gene-dosage/HGNC:1919","Dosage Working Group","","","","","",""
"CHD5","HGNC:16816","https://search.clinicalgenome.org/kb/genes/HGNC:16816","complex neurodevelopmental disorder","MONDO:0100038","https://search.clinicalgenome.org/kb/conditions/MONDO:0100038","N/A","1 - Little Evidence for Haploinsufficiency (09/27/2022)","0 - No Evidence for Triplosensitivity (09/27/2022)","https://search.clinicalgenome.org/kb/gene-dosage/HGNC:16816","Dosage Working Group","","","","","",""
"CHD7","HGNC:20626","https://search.clinicalgenome.org/kb/genes/HGNC:20626","CHARGE syndrome","MONDO:0008965","https://search.clinicalgenome.org/kb/conditions/MONDO:0008965","Autosomal dominant inheritance","3 - Sufficient Evidence for Haploinsufficiency (04/11/2023)","0 - No Evidence for Triplosensitivity (04/11/2023)","https://search.clinicalgenome.org/kb/gene-dosage/HGNC:20626","Dosage Working Group","definitive evidence (08/22/2018)","https://search.clinicalgenome.org/kb/gene-validity/CGGV:assertion_26ae5799-567b-431b-b981-3bc2f8635802-2018-08-22T160000.000Z","Hearing Loss","","",""
"CHD8","HGNC:20153","https://search.clinicalgenome.org/kb/genes/HGNC:20153","complex neurodevelopmental disorder","MONDO:0100038","https://search.clinicalgenome.org/kb/conditions/MONDO:0100038","Autosomal dominant inheritance","3 - Sufficient Evidence for Haploinsufficiency (04/25/2018)","0 - No Evidence for Triplosensitivity (04/25/2018)","https://search.clinicalgenome.org/kb/gene-dosage/HGNC:20153","Dosage Working Group","definitive evidence (07/16/2018)","https://search.clinicalgenome.org/kb/gene-validity/CGGV:assertion_3134b4e1-2fee-4025-99af-b2146cc2ccf8-2018-07-16T160000.000Z","Intellectual Disability and Autism","","",""
"CHEK1","HGNC:1925","https://search.clinicalgenome.org/kb/genes/HGNC:1925","hereditary breast carcinoma","MONDO:0016419","https://search.clinicalgenome.org/kb/conditions/MONDO:0016419","Autosomal dominant inheritance","0 - No Evidence for Haploinsufficiency (11/10/2021)","0 - No Evidence for Triplosensitivity (11/10/2021)","https://search.clinicalgenome.org/kb/gene-dosage/HGNC:1925","Dosage Working Group","no known disease relationship (10/12/2016)","https://search.clinicalgenome.org/kb/gene-validity/CGGCIEX:assertion_8505","Breast/Ovarian Cancer","","",""
"CHEK1","HGNC:1925","https://search.clinicalgenome.org/kb/genes/HGNC:1925","familial ovarian cancer","MONDO:0016248","https://search.clinicalgenome.org/kb/conditions/MONDO:0016248","Autosomal dominant inheritance","0 - No Evidence for Haploinsufficiency (11/10/2021)","0 - No Evidence for Triplosensitivity (11/10/2021)","https://search.clinicalgenome.org/kb/gene-dosage/HGNC:1925","Dosage Working Group","no known disease relationship (10/12/2016)","https://search.clinicalgenome.org/kb/gene-validity/CGGCIEX:assertion_8504","Breast/Ovarian Cancer","","",""
"CHEK2","HGNC:16627","https://search.clinicalgenome.org/kb/genes/HGNC:16627","CHEK2-related cancer predisposition","MONDO:0700271","https://search.clinicalgenome.org/kb/conditions/MONDO:0700271","Autosomal dominant inheritance","3 - Sufficient Evidence for Haploinsufficiency (01/08/2020)","0 - No Evidence for Triplosensitivity (01/08/2020)","https://search.clinicalgenome.org/kb/gene-dosage/HGNC:16627","Dosage Working Group","definitive evidence (11/04/2024)","https://search.clinicalgenome.org/kb/gene-validity/CGGV:assertion_49566325-8710-4b72-ad64-79528585223d-2024-11-04T180000.000Z","Hereditary Cancer","","",""
"CHEK2","HGNC:16627","https://search.clinicalgenome.org/kb/genes/HGNC:16627","familial ovarian cancer","MONDO:0016248","https://search.clinicalgenome.org/kb/conditions/MONDO:0016248","Autosomal dominant inheritance","3 - Sufficient Evidence for Haploinsufficiency (01/08/2020)","0 - No Evidence for Triplosensitivity (01/08/2020)","https://search.clinicalgenome.org/kb/gene-dosage/HGNC:16627","Dosage Working Group","refuting evidence (11/04/2024)","https://search.clinicalgenome.org/kb/gene-validity/CGGV:assertion_9e1071da-cc4a-4bbc-b3fa-4cc07393e74a-2024-11-04T180000.000Z","Hereditary Cancer","","",""
"CHEK2","HGNC:16627","https://search.clinicalgenome.org/kb/genes/HGNC:16627","hereditary nonpolyposis colon cancer","MONDO:0018630","https://search.clinicalgenome.org/kb/conditions/MONDO:0018630","Autosomal dominant inheritance","3 - Sufficient Evidence for Haploinsufficiency (01/08/2020)","0 - No Evidence for Triplosensitivity (01/08/2020)","https://search.clinicalgenome.org/kb/gene-dosage/HGNC:16627","Dosage Working Group","limited evidence (03/13/2017)","https://search.clinicalgenome.org/kb/gene-validity/CGGCIEX:assertion_9862","Breast/Ovarian Cancer","","",""
"CHEK2","HGNC:16627","https://search.clinicalgenome.org/kb/genes/HGNC:16627","hereditary breast carcinoma","MONDO:0016419","https://search.clinicalgenome.org/kb/conditions/MONDO:0016419","N/A","3 - Sufficient Evidence for Haploinsufficiency (01/08/2020)","0 - No Evidence for Triplosensitivity (01/08/2020)","https://search.clinicalgenome.org/kb/gene-dosage/HGNC:16627","Dosage Working Group","","","","Moderate Actionability (09/19/2017) | Has Insufficient Evidence for Actionability Based on Early Rule-out (06/04/2025)","https://actionability.clinicalgenome.org/ac/Adult/ui/stg2SummaryRpt?doc=AC127 | https://actionability.clinicalgenome.org/ac/Pediatric/ui/stg2SummaryRpt?doc=AC127","Adult Actionability Working Group | Pediatric Actionability Working Group"
"CHKB","HGNC:1938","https://search.clinicalgenome.org/kb/genes/HGNC:1938","megaconial type congenital muscular dystrophy","MONDO:0011246","https://search.clinicalgenome.org/kb/conditions/MONDO:0011246","N/A","30 - Gene Associated with Autosomal Recessive Phenotype (08/22/2016)","0 - No Evidence for Triplosensitivity (08/22/2016)","https://search.clinicalgenome.org/kb/gene-dosage/HGNC:1938","Dosage Working Group","","","","","",""
"CHM","HGNC:1940","https://search.clinicalgenome.org/kb/genes/HGNC:1940","choroideremia","MONDO:0010557","https://search.clinicalgenome.org/kb/conditions/MONDO:0010557","X-linked inheritance","3 - Sufficient Evidence for Haploinsufficiency (03/24/2021)","0 - No Evidence for Triplosensitivity (03/24/2021)","https://search.clinicalgenome.org/kb/gene-dosage/HGNC:1940","Dosage Working Group","definitive evidence (10/26/2020)","https://search.clinicalgenome.org/kb/gene-validity/CGGV:assertion_d84b01d6-8b3c-4a1e-bd25-68ee6962f374-2020-10-26T124704.094Z","Retina","","",""
"CHMP1A","HGNC:8740","https://search.clinicalgenome.org/kb/genes/HGNC:8740","pontocerebellar hypoplasia type 8","MONDO:0013990","https://search.clinicalgenome.org/kb/conditions/MONDO:0013990","N/A","30 - Gene Associated with Autosomal Recessive Phenotype (08/22/2016)","0 - No Evidence for Triplosensitivity (08/22/2016)","https://search.clinicalgenome.org/kb/gene-dosage/HGNC:8740","Dosage Working Group","","","","","",""
"CHMP2B","HGNC:24537","https://search.clinicalgenome.org/kb/genes/HGNC:24537","frontotemporal dementia and/or amyotrophic lateral sclerosis 7","MONDO:0010936","https://search.clinicalgenome.org/kb/conditions/MONDO:0010936","Autosomal dominant inheritance","","","","","definitive evidence (07/12/2022)","https://search.clinicalgenome.org/kb/gene-validity/CGGV:assertion_287cab44-b8b6-411c-903a-6214ac5e98af-2022-07-12T160000.000Z","Amyotrophic Lateral Sclerosis Spectrum Disorders","","",""
"CHN1","HGNC:1943","https://search.clinicalgenome.org/kb/genes/HGNC:1943","Duane retraction syndrome 2","MONDO:0011444","https://search.clinicalgenome.org/kb/conditions/MONDO:0011444","Autosomal dominant inheritance","","","","","moderate evidence (07/26/2022)","https://search.clinicalgenome.org/kb/gene-validity/CGGV:assertion_c19544e0-2fb1-4d8a-b1ad-f493068f76bb-2022-07-26T160000.000Z","Brain Malformations","","",""
"CHRD","HGNC:1949","https://search.clinicalgenome.org/kb/genes/HGNC:1949","congenital heart disease","MONDO:0005453","https://search.clinicalgenome.org/kb/conditions/MONDO:0005453","Autosomal recessive inheritance","","","","","limited evidence (10/17/2023)","https://search.clinicalgenome.org/kb/gene-validity/CGGV:assertion_1e02b93a-df51-490f-bc2a-d0881cff957d-2023-10-17T040000.000Z","Congenital Heart Disease","","",""
"CHRDL1","HGNC:29861","https://search.clinicalgenome.org/kb/genes/HGNC:29861","isolated congenital megalocornea","MONDO:0010649","https://search.clinicalgenome.org/kb/conditions/MONDO:0010649","N/A","3 - Sufficient Evidence for Haploinsufficiency (12/08/2016)","0 - No Evidence for Triplosensitivity (12/08/2016)","https://search.clinicalgenome.org/kb/gene-dosage/HGNC:29861","Dosage Working Group","","","","","",""
"CHRNA2","HGNC:1956","https://search.clinicalgenome.org/kb/genes/HGNC:1956","familial sleep-related hypermotor epilepsy","MONDO:0000030","https://search.clinicalgenome.org/kb/conditions/MONDO:0000030","Autosomal dominant inheritance","","","","","limited evidence (12/25/2020)","https://search.clinicalgenome.org/kb/gene-validity/CGGV:assertion_0f832b8a-af5a-494e-bfdb-70cc619addf1-2020-12-25T015652.186Z","Epilepsy","","",""
"CHRNA2","HGNC:1956","https://search.clinicalgenome.org/kb/genes/HGNC:1956","benign familial infantile epilepsy","MONDO:0017615","https://search.clinicalgenome.org/kb/conditions/MONDO:0017615","Autosomal dominant inheritance","","","","","disputing (01/07/2020)","https://search.clinicalgenome.org/kb/gene-validity/CGGV:assertion_7916abab-d963-4e9c-8913-1decc21b680c-2020-01-07T050000.000Z","Epilepsy","","",""
"CHRNA4","HGNC:1958","https://search.clinicalgenome.org/kb/genes/HGNC:1958","familial sleep-related hypermotor epilepsy","MONDO:0000030","https://search.clinicalgenome.org/kb/conditions/MONDO:0000030","Autosomal dominant inheritance","","","","","definitive evidence (02/18/2020)","https://search.clinicalgenome.org/kb/gene-validity/CGGV:assertion_e3aa0108-5514-48ba-a09c-5506b2030d1f-2020-02-18T170000.000Z","Epilepsy","","",""
"CHRNA7","HGNC:1960","https://search.clinicalgenome.org/kb/genes/HGNC:1960","epilepsy","MONDO:0005027","https://search.clinicalgenome.org/kb/conditions/MONDO:0005027","Mode of inheritance","0 - No Evidence for Haploinsufficiency (05/10/2018)","0 - No Evidence for Triplosensitivity (05/10/2018)","https://search.clinicalgenome.org/kb/gene-dosage/HGNC:1960","Dosage Working Group","refuting evidence (02/07/2023)","https://search.clinicalgenome.org/kb/gene-validity/CGGV:assertion_33edac94-9867-4b3f-9d46-2d7a86f4301b-2023-02-07T170000.000Z","Epilepsy","","",""
"CHRNB1","HGNC:1961","https://search.clinicalgenome.org/kb/genes/HGNC:1961","congenital myasthenic syndrome 2C","MONDO:0014582","https://search.clinicalgenome.org/kb/conditions/MONDO:0014582","Autosomal recessive inheritance","","","","","definitive evidence (07/28/2025)","https://search.clinicalgenome.org/kb/gene-validity/CGGV:assertion_f9904daf-082e-487c-b3c8-06c138911d18-2025-07-28T160000.000Z","Congenital Myopathies","","",""
"CHRNB2","HGNC:1962","https://search.clinicalgenome.org/kb/genes/HGNC:1962","familial sleep-related hypermotor epilepsy","MONDO:0000030","https://search.clinicalgenome.org/kb/conditions/MONDO:0000030","Autosomal dominant inheritance","","","","","definitive evidence (02/07/2023)","https://search.clinicalgenome.org/kb/gene-validity/CGGV:assertion_ed365ac2-8cfa-4ae9-8fef-323dd596a22f-2023-02-07T170000.000Z","Epilepsy","","",""
"CHRNG","HGNC:1967","https://search.clinicalgenome.org/kb/genes/HGNC:1967","CHRNG-associated hypo-akinesia disorder of prenatal onset","MONDO:0100158","https://search.clinicalgenome.org/kb/conditions/MONDO:0100158","Autosomal recessive inheritance","","","","","definitive evidence (09/21/2023)","https://search.clinicalgenome.org/kb/gene-validity/CGGV:assertion_c68f759b-0c39-417c-a192-99f9c0e4eeb5-2023-09-21T160000.000Z","Prenatal","","",""
"CHST3","HGNC:1971","https://search.clinicalgenome.org/kb/genes/HGNC:1971","spondyloepiphyseal dysplasia with congenital joint dislocations","MONDO:0007738","https://search.clinicalgenome.org/kb/conditions/MONDO:0007738","Autosomal recessive inheritance","","","","","definitive evidence (08/04/2025)","https://search.clinicalgenome.org/kb/gene-validity/CGGV:assertion_2d3d5a41-bc8d-4a05-bd99-abe526bd391a-2025-08-04T160000.000Z","Skeletal Disorders","","",""
"CHST6","HGNC:6938","https://search.clinicalgenome.org/kb/genes/HGNC:6938","macular corneal dystrophy","MONDO:0009020","https://search.clinicalgenome.org/kb/conditions/MONDO:0009020","N/A","30 - Gene Associated with Autosomal Recessive Phenotype (08/22/2016)","0 - No Evidence for Triplosensitivity (08/22/2016)","https://search.clinicalgenome.org/kb/gene-dosage/HGNC:6938","Dosage Working Group","","","","","",""
"CHSY1","HGNC:17198","https://search.clinicalgenome.org/kb/genes/HGNC:17198","temtamy preaxial brachydactyly syndrome","MONDO:0011533","https://search.clinicalgenome.org/kb/conditions/MONDO:0011533","N/A","30 - Gene Associated with Autosomal Recessive Phenotype (08/22/2016)","0 - No Evidence for Triplosensitivity (08/22/2016)","https://search.clinicalgenome.org/kb/gene-dosage/HGNC:17198","Dosage Working Group","","","","","",""
"CHUK","HGNC:1974","https://search.clinicalgenome.org/kb/genes/HGNC:1974","Bartsocas-Papas syndrome 2","MONDO:0859154","https://search.clinicalgenome.org/kb/conditions/MONDO:0859154","Autosomal recessive inheritance","","","","","moderate evidence (06/07/2024)","https://search.clinicalgenome.org/kb/gene-validity/CGGV:assertion_c75e589b-683e-4b4f-b2f5-59e1eadf42d1-2024-06-07T170000.000Z","SCID-CID","","",""
"CIB2","HGNC:24579","https://search.clinicalgenome.org/kb/genes/HGNC:24579","nonsyndromic genetic hearing loss","MONDO:0019497","https://search.clinicalgenome.org/kb/conditions/MONDO:0019497","Autosomal recessive inheritance","","","","","definitive evidence (02/20/2018)","https://search.clinicalgenome.org/kb/gene-validity/CGGV:assertion_d4187cb6-182f-43fc-aeec-d27297c36bdb-2018-02-20T170000.000Z","Hearing Loss","Strong Actionability (10/29/2020)","https://actionability.clinicalgenome.org/ac/Pediatric/ui/stg2SummaryRpt?doc=AC1018","Pediatric Actionability Working Group"
"CIB2","HGNC:24579","https://search.clinicalgenome.org/kb/genes/HGNC:24579","Usher syndrome type 1","MONDO:0010168","https://search.clinicalgenome.org/kb/conditions/MONDO:0010168","Autosomal recessive inheritance","","","","","refuting evidence (02/19/2019)","https://search.clinicalgenome.org/kb/gene-validity/CGGV:assertion_95709038-78a4-4043-a054-9cbe245d2588-2019-02-19T170000.000Z","Hearing Loss","","",""
"CIB2","HGNC:24579","https://search.clinicalgenome.org/kb/genes/HGNC:24579","prelingual non-syndromic genetic hearing loss","MONDO:0016297","https://search.clinicalgenome.org/kb/conditions/MONDO:0016297","N/A","","","","","","","","Strong Actionability (10/29/2020)","https://actionability.clinicalgenome.org/ac/Pediatric/ui/stg2SummaryRpt?doc=AC1018","Pediatric Actionability Working Group"
"CIB2","HGNC:24579","https://search.clinicalgenome.org/kb/genes/HGNC:24579","hearing loss, autosomal recessive","MONDO:0019588","https://search.clinicalgenome.org/kb/conditions/MONDO:0019588","N/A","","","","","","","","Strong Actionability (10/29/2020)","https://actionability.clinicalgenome.org/ac/Pediatric/ui/stg2SummaryRpt?doc=AC1018","Pediatric Actionability Working Group"
"CIB2","HGNC:24579","https://search.clinicalgenome.org/kb/genes/HGNC:24579","autosomal recessive nonsyndromic hearing loss 48","MONDO:0012273","https://search.clinicalgenome.org/kb/conditions/MONDO:0012273","N/A","","","","","","","","Strong Actionability (10/29/2020)","https://actionability.clinicalgenome.org/ac/Pediatric/ui/stg2SummaryRpt?doc=AC1018","Pediatric Actionability Working Group"
"CIC","HGNC:14214","https://search.clinicalgenome.org/kb/genes/HGNC:14214","complex neurodevelopmental disorder","MONDO:0100038","https://search.clinicalgenome.org/kb/conditions/MONDO:0100038","Autosomal dominant inheritance","3 - Sufficient Evidence for Haploinsufficiency (11/08/2022)","0 - No Evidence for Triplosensitivity (11/08/2022)","https://search.clinicalgenome.org/kb/gene-dosage/HGNC:14214","Dosage Working Group","definitive evidence (01/18/2023)","https://search.clinicalgenome.org/kb/gene-validity/CGGV:assertion_a0f9a222-8872-4054-b767-25f8fb4e404a-2023-01-18T110000.000Z","Intellectual Disability and Autism","","",""
"CIDEC","HGNC:24229","https://search.clinicalgenome.org/kb/genes/HGNC:24229","CIDEC-related familial partial lipodystrophy","MONDO:0014098","https://search.clinicalgenome.org/kb/conditions/MONDO:0014098","N/A","30 - Gene Associated with Autosomal Recessive Phenotype (08/22/2016)","0 - No Evidence for Triplosensitivity (08/22/2016)","https://search.clinicalgenome.org/kb/gene-dosage/HGNC:24229","Dosage Working Group","","","","","",""
"CIITA","HGNC:7067","https://search.clinicalgenome.org/kb/genes/HGNC:7067","MHC class II deficiency","MONDO:0008855","https://search.clinicalgenome.org/kb/conditions/MONDO:0008855","Autosomal recessive inheritance","","","","","definitive evidence (11/03/2022)","https://search.clinicalgenome.org/kb/gene-validity/CGGV:assertion_0dab225e-0bdd-4f96-a351-4e490601ba15-2022-11-03T170000.000Z","SCID-CID","","",""
"CISD2","HGNC:24212","https://search.clinicalgenome.org/kb/genes/HGNC:24212","Wolfram syndrome","MONDO:0018105","https://search.clinicalgenome.org/kb/conditions/MONDO:0018105","Autosomal recessive inheritance","","","","","definitive evidence (06/01/2023)","https://search.clinicalgenome.org/kb/gene-validity/CGGV:assertion_0a18d59c-c00c-4bb3-b6d6-1e59b92d1313-2023-06-01T160000.000Z","Hearing Loss","","",""
"CITED2","HGNC:1987","https://search.clinicalgenome.org/kb/genes/HGNC:1987","congenital heart disease","MONDO:0005453","https://search.clinicalgenome.org/kb/conditions/MONDO:0005453","Autosomal dominant inheritance","0 - No Evidence for Haploinsufficiency (11/29/2023)","0 - No Evidence for Triplosensitivity (11/29/2023)","https://search.clinicalgenome.org/kb/gene-dosage/HGNC:1987","Dosage Working Group","moderate evidence (09/05/2023)","https://search.clinicalgenome.org/kb/gene-validity/CGGV:assertion_007f4832-e639-4b27-9cc0-8b8cfaf45534-2023-09-05T160000.000Z","Congenital Heart Disease","","",""
"CITED2","HGNC:1987","https://search.clinicalgenome.org/kb/genes/HGNC:1987","congenital heart defects, multiple types","MONDO:0000119","https://search.clinicalgenome.org/kb/conditions/MONDO:0000119","N/A","0 - No Evidence for Haploinsufficiency (11/29/2023)","0 - No Evidence for Triplosensitivity (11/29/2023)","https://search.clinicalgenome.org/kb/gene-dosage/HGNC:1987","Dosage Working Group","","","","","",""
"CLCF1","HGNC:17412","https://search.clinicalgenome.org/kb/genes/HGNC:17412","cold-induced sweating syndrome 2","MONDO:0012467","https://search.clinicalgenome.org/kb/conditions/MONDO:0012467","N/A","30 - Gene Associated with Autosomal Recessive Phenotype (08/22/2016)","","https://search.clinicalgenome.org/kb/gene-dosage/HGNC:17412","Dosage Working Group","","","","","",""
"CLCN2","HGNC:2020","https://search.clinicalgenome.org/kb/genes/HGNC:2020","epilepsy","MONDO:0005027","https://search.clinicalgenome.org/kb/conditions/MONDO:0005027","Autosomal dominant inheritance","","","","","refuting evidence (03/15/2022)","https://search.clinicalgenome.org/kb/gene-validity/CGGV:assertion_ba2a1616-b3d7-4762-a546-c838333db683-2022-03-15T040000.000Z","Epilepsy","","",""
"CLCN4","HGNC:2022","https://search.clinicalgenome.org/kb/genes/HGNC:2022","non-syndromic X-linked intellectual disability","MONDO:0019181","https://search.clinicalgenome.org/kb/conditions/MONDO:0019181","X-linked inheritance","1 - Little Evidence for Haploinsufficiency (07/27/2022)","0 - No Evidence for Triplosensitivity (07/27/2022)","https://search.clinicalgenome.org/kb/gene-dosage/HGNC:2022","Dosage Working Group","definitive evidence (10/20/2017)","https://search.clinicalgenome.org/kb/gene-validity/CGGV:assertion_54fbcbc8-77d7-4496-8527-1171cdd7452c-2017-10-20T160000.000Z","Intellectual Disability and Autism","","",""
"CLCN5","HGNC:2023","https://search.clinicalgenome.org/kb/genes/HGNC:2023","Dent disease type 1","MONDO:0010225","https://search.clinicalgenome.org/kb/conditions/MONDO:0010225","X-linked inheritance","3 - Sufficient Evidence for Haploinsufficiency (10/18/2012)","0 - No Evidence for Triplosensitivity (10/18/2012)","https://search.clinicalgenome.org/kb/gene-dosage/HGNC:2023","Dosage Working Group","definitive evidence (07/21/2022)","https://search.clinicalgenome.org/kb/gene-validity/CGGV:assertion_9c5b5abc-4f1f-4491-b5db-5208906f0f1b-2022-07-21T160000.000Z","Tubulopathy","","",""
"CLCN6","HGNC:2024","https://search.clinicalgenome.org/kb/genes/HGNC:2024","neurodegeneration, childhood-onset, with hypotonia, respiratory insufficiency, and brain imaging abnormalities","MONDO:0030947","https://search.clinicalgenome.org/kb/conditions/MONDO:0030947","Autosomal dominant inheritance","","","","","moderate evidence (06/07/2024)","https://search.clinicalgenome.org/kb/gene-validity/CGGV:assertion_6226904f-234f-490b-8353-7d6c63bd8724-2024-06-07T160000.000Z","Lysosomal Diseases GCEP","","",""
"CLCN7","HGNC:2025","https://search.clinicalgenome.org/kb/genes/HGNC:2025","autosomal recessive osteopetrosis 4","MONDO:0012676","https://search.clinicalgenome.org/kb/conditions/MONDO:0012676","Autosomal recessive inheritance","","","","","definitive evidence (10/04/2023)","https://search.clinicalgenome.org/kb/gene-validity/CGGV:assertion_651b6ac5-131e-48b2-9869-71f2a9b42dbe-2023-10-04T160000.000Z","Skeletal Disorders","","",""
"CLCN7","HGNC:2025","https://search.clinicalgenome.org/kb/genes/HGNC:2025","autosomal dominant osteopetrosis 2","MONDO:0008156","https://search.clinicalgenome.org/kb/conditions/MONDO:0008156","Autosomal dominant inheritance","","","","","definitive evidence (12/04/2023)","https://search.clinicalgenome.org/kb/gene-validity/CGGV:assertion_23840c1f-9d30-4ccf-9fc0-604a0cb12eb4-2023-12-04T170000.000Z","Skeletal Disorders","","",""
"CLCN7","HGNC:2025","https://search.clinicalgenome.org/kb/genes/HGNC:2025","hypopigmentation, organomegaly, and delayed myelination and development","MONDO:0032805","https://search.clinicalgenome.org/kb/conditions/MONDO:0032805","Autosomal dominant inheritance","","","","","moderate evidence (12/05/2023)","https://search.clinicalgenome.org/kb/gene-validity/CGGV:assertion_0e47aa25-2107-4e36-8fa8-f9e81eb9de69-2023-12-05T170000.000Z","Lysosomal Diseases GCEP","","",""
"CLCNKA","HGNC:2026","https://search.clinicalgenome.org/kb/genes/HGNC:2026","Bartter disease type 4B","MONDO:0000909","https://search.clinicalgenome.org/kb/conditions/MONDO:0000909","N/A","30 - Gene Associated with Autosomal Recessive Phenotype (05/17/2012)","0 - No Evidence for Triplosensitivity (05/17/2012)","https://search.clinicalgenome.org/kb/gene-dosage/HGNC:2026","Dosage Working Group","","","","","",""
"CLCNKB","HGNC:2027","https://search.clinicalgenome.org/kb/genes/HGNC:2027","Bartter disease type 3","MONDO:0011822","https://search.clinicalgenome.org/kb/conditions/MONDO:0011822","N/A","30 - Gene Associated with Autosomal Recessive Phenotype (11/17/2011)","0 - No Evidence for Triplosensitivity (11/17/2011)","https://search.clinicalgenome.org/kb/gene-dosage/HGNC:2027","Dosage Working Group","","","","","",""
"CLDN14","HGNC:2035","https://search.clinicalgenome.org/kb/genes/HGNC:2035","nonsyndromic genetic hearing loss","MONDO:0019497","https://search.clinicalgenome.org/kb/conditions/MONDO:0019497","Autosomal recessive inheritance","30 - Gene Associated with Autosomal Recessive Phenotype (08/22/2016)","0 - No Evidence for Triplosensitivity (08/22/2016)","https://search.clinicalgenome.org/kb/gene-dosage/HGNC:2035","Dosage Working Group","definitive evidence (05/01/2018)","https://search.clinicalgenome.org/kb/gene-validity/CGGV:assertion_17528cdb-97e0-4128-92de-9e419902aa62-2018-05-01T160000.000Z","Hearing Loss","Strong Actionability (10/29/2020)","https://actionability.clinicalgenome.org/ac/Pediatric/ui/stg2SummaryRpt?doc=AC1018","Pediatric Actionability Working Group"
"CLDN14","HGNC:2035","https://search.clinicalgenome.org/kb/genes/HGNC:2035","hearing loss, autosomal recessive","MONDO:0019588","https://search.clinicalgenome.org/kb/conditions/MONDO:0019588","N/A","30 - Gene Associated with Autosomal Recessive Phenotype (08/22/2016)","0 - No Evidence for Triplosensitivity (08/22/2016)","https://search.clinicalgenome.org/kb/gene-dosage/HGNC:2035","Dosage Working Group","","","","Strong Actionability (10/29/2020)","https://actionability.clinicalgenome.org/ac/Pediatric/ui/stg2SummaryRpt?doc=AC1018","Pediatric Actionability Working Group"
"CLDN14","HGNC:2035","https://search.clinicalgenome.org/kb/genes/HGNC:2035","autosomal recessive nonsyndromic hearing loss 29","MONDO:0013537","https://search.clinicalgenome.org/kb/conditions/MONDO:0013537","N/A","30 - Gene Associated with Autosomal Recessive Phenotype (08/22/2016)","0 - No Evidence for Triplosensitivity (08/22/2016)","https://search.clinicalgenome.org/kb/gene-dosage/HGNC:2035","Dosage Working Group","","","","Strong Actionability (10/29/2020)","https://actionability.clinicalgenome.org/ac/Pediatric/ui/stg2SummaryRpt?doc=AC1018","Pediatric Actionability Working Group"
"CLDN14","HGNC:2035","https://search.clinicalgenome.org/kb/genes/HGNC:2035","prelingual non-syndromic genetic hearing loss","MONDO:0016297","https://search.clinicalgenome.org/kb/conditions/MONDO:0016297","N/A","30 - Gene Associated with Autosomal Recessive Phenotype (08/22/2016)","0 - No Evidence for Triplosensitivity (08/22/2016)","https://search.clinicalgenome.org/kb/gene-dosage/HGNC:2035","Dosage Working Group","","","","Strong Actionability (10/29/2020)","https://actionability.clinicalgenome.org/ac/Pediatric/ui/stg2SummaryRpt?doc=AC1018","Pediatric Actionability Working Group"
"CLDN16","HGNC:2037","https://search.clinicalgenome.org/kb/genes/HGNC:2037","renal hypomagnesemia 3","MONDO:0009550","https://search.clinicalgenome.org/kb/conditions/MONDO:0009550","Autosomal recessive inheritance","","","","","definitive evidence (12/06/2023)","https://search.clinicalgenome.org/kb/gene-validity/CGGV:assertion_cd2b60d4-b932-4d0b-bc46-d6b0827a6333-2023-12-06T170000.000Z","Tubulopathy","","",""
"CLIC2","HGNC:2063","https://search.clinicalgenome.org/kb/genes/HGNC:2063","X-linked complex neurodevelopmental disorder","MONDO:0100148","https://search.clinicalgenome.org/kb/conditions/MONDO:0100148","X-linked inheritance","","","","","disputing (02/16/2021)","https://search.clinicalgenome.org/kb/gene-validity/CGGV:assertion_3e8ec6b8-5189-43eb-a741-833c77e7ce91-2021-02-16T170000.000Z","Intellectual Disability and Autism","","",""
"CLMP","HGNC:24039","https://search.clinicalgenome.org/kb/genes/HGNC:24039","congenital short bowel syndrome, autosomal recessive","MONDO:0020718","https://search.clinicalgenome.org/kb/conditions/MONDO:0020718","N/A","30 - Gene Associated with Autosomal Recessive Phenotype (08/22/2016)","0 - No Evidence for Triplosensitivity (08/22/2016)","https://search.clinicalgenome.org/kb/gene-dosage/HGNC:24039","Dosage Working Group","","","","","",""
"CLN3","HGNC:2074","https://search.clinicalgenome.org/kb/genes/HGNC:2074","neuronal ceroid lipofuscinosis","MONDO:0016295","https://search.clinicalgenome.org/kb/conditions/MONDO:0016295","Autosomal recessive inheritance","30 - Gene Associated with Autosomal Recessive Phenotype (08/22/2016)","","https://search.clinicalgenome.org/kb/gene-dosage/HGNC:2074","Dosage Working Group","definitive evidence (04/04/2023)","https://search.clinicalgenome.org/kb/gene-validity/CGGV:assertion_6be652b4-092f-4d1c-9606-4dfeb689c4b9-2023-04-04T040000.000Z","Epilepsy","","",""
"CLN3","HGNC:2074","https://search.clinicalgenome.org/kb/genes/HGNC:2074","neuronal ceroid lipofuscinosis 3","MONDO:0008767","https://search.clinicalgenome.org/kb/conditions/MONDO:0008767","N/A","30 - Gene Associated with Autosomal Recessive Phenotype (08/22/2016)","","https://search.clinicalgenome.org/kb/gene-dosage/HGNC:2074","Dosage Working Group","","","","","",""
"CLN5","HGNC:2076","https://search.clinicalgenome.org/kb/genes/HGNC:2076","neuronal ceroid lipofuscinosis","MONDO:0016295","https://search.clinicalgenome.org/kb/conditions/MONDO:0016295","Autosomal recessive inheritance","","","","","definitive evidence (09/08/2021)","https://search.clinicalgenome.org/kb/gene-validity/CGGV:assertion_a522b1d6-5ade-4749-94b8-d5426bbe5961-2021-09-08T023930.981Z","Epilepsy","","",""
"CLN6","HGNC:2077","https://search.clinicalgenome.org/kb/genes/HGNC:2077","neuronal ceroid lipofuscinosis","MONDO:0016295","https://search.clinicalgenome.org/kb/conditions/MONDO:0016295","Autosomal recessive inheritance","","","","","definitive evidence (12/01/2020)","https://search.clinicalgenome.org/kb/gene-validity/CGGV:assertion_09654b45-6649-4d11-b43e-aeb6d20fb86d-2020-12-01T170000.000Z","Epilepsy","","",""
"CLN8","HGNC:2079","https://search.clinicalgenome.org/kb/genes/HGNC:2079","neuronal ceroid lipofuscinosis","MONDO:0016295","https://search.clinicalgenome.org/kb/conditions/MONDO:0016295","Autosomal recessive inheritance","30 - Gene Associated with Autosomal Recessive Phenotype (08/22/2016)","","https://search.clinicalgenome.org/kb/gene-dosage/HGNC:2079","Dosage Working Group","definitive evidence (09/07/2020)","https://search.clinicalgenome.org/kb/gene-validity/CGGV:assertion_68775ed0-576e-4ee7-90f2-d16329ecd7c1-2020-09-07T220116.243Z","Epilepsy","","",""
"CLN8","HGNC:2079","https://search.clinicalgenome.org/kb/genes/HGNC:2079","neuronal ceroid lipofuscinosis 8","MONDO:0010830","https://search.clinicalgenome.org/kb/conditions/MONDO:0010830","N/A","30 - Gene Associated with Autosomal Recessive Phenotype (08/22/2016)","","https://search.clinicalgenome.org/kb/gene-dosage/HGNC:2079","Dosage Working Group","","","","","",""
"CLPB","HGNC:30664","https://search.clinicalgenome.org/kb/genes/HGNC:30664","Leigh syndrome","MONDO:0009723","https://search.clinicalgenome.org/kb/conditions/MONDO:0009723","Autosomal recessive inheritance","","","","","limited evidence (11/23/2020)","https://search.clinicalgenome.org/kb/gene-validity/CGGV:assertion_789c591d-1de7-4652-a0d1-f895b639233e-2020-11-23T201057.415Z","Mitochondrial Diseases","","",""
"CLPP","HGNC:2084","https://search.clinicalgenome.org/kb/genes/HGNC:2084","Perrault syndrome 3","MONDO:0013588","https://search.clinicalgenome.org/kb/conditions/MONDO:0013588","Autosomal recessive inheritance","30 - Gene Associated with Autosomal Recessive Phenotype (03/06/2018)","0 - No Evidence for Triplosensitivity (03/06/2018)","https://search.clinicalgenome.org/kb/gene-dosage/HGNC:2084","Dosage Working Group","definitive evidence (03/27/2018)","https://search.clinicalgenome.org/kb/gene-validity/CGGV:assertion_15291cb2-a541-4f88-91c8-0b441e3b64cb-2018-03-27T160000.000Z","Hearing Loss","","",""
"CLRN1","HGNC:12605","https://search.clinicalgenome.org/kb/genes/HGNC:12605","Usher syndrome type 3","MONDO:0016485","https://search.clinicalgenome.org/kb/conditions/MONDO:0016485","Autosomal recessive inheritance","30 - Gene Associated with Autosomal Recessive Phenotype (08/22/2016)","0 - No Evidence for Triplosensitivity (08/22/2016)","https://search.clinicalgenome.org/kb/gene-dosage/HGNC:12605","Dosage Working Group","definitive evidence (03/02/2017)","https://search.clinicalgenome.org/kb/gene-validity/CGGCIEX:assertion_8400","Hearing Loss","","",""
"CLRN1","HGNC:12605","https://search.clinicalgenome.org/kb/genes/HGNC:12605","Usher syndrome type 3A","MONDO:0010170","https://search.clinicalgenome.org/kb/conditions/MONDO:0010170","N/A","30 - Gene Associated with Autosomal Recessive Phenotype (08/22/2016)","0 - No Evidence for Triplosensitivity (08/22/2016)","https://search.clinicalgenome.org/kb/gene-dosage/HGNC:12605","Dosage Working Group","","","","","",""
"CLRN2","HGNC:33939","https://search.clinicalgenome.org/kb/genes/HGNC:33939","nonsyndromic genetic hearing loss","MONDO:0019497","https://search.clinicalgenome.org/kb/conditions/MONDO:0019497","Autosomal recessive inheritance","","","","","moderate evidence (09/23/2025)","https://search.clinicalgenome.org/kb/gene-validity/CGGV:assertion_078ef57b-27ff-4a88-b350-d549449c524e-2025-09-23T160000.000Z","Hearing Loss","","",""
"CLTC","HGNC:2092","https://search.clinicalgenome.org/kb/genes/HGNC:2092","complex neurodevelopmental disorder","MONDO:0100038","https://search.clinicalgenome.org/kb/conditions/MONDO:0100038","N/A","3 - Sufficient Evidence for Haploinsufficiency (09/27/2022)","0 - No Evidence for Triplosensitivity (09/27/2022)","https://search.clinicalgenome.org/kb/gene-dosage/HGNC:2092","Dosage Working Group","","","","","",""
"CLXN","HGNC:25678","https://search.clinicalgenome.org/kb/genes/HGNC:25678","ciliary dyskinesia, primary, 53","MONDO:0957991","https://search.clinicalgenome.org/kb/conditions/MONDO:0957991","Autosomal recessive inheritance","","","","","strong evidence (04/10/2025)","https://search.clinicalgenome.org/kb/gene-validity/CGGV:assertion_18721467-867b-4687-b4f2-5af09951ada5-2025-04-10T160000.000Z","Motile Ciliopathy","","",""
"CNGA1","HGNC:2148","https://search.clinicalgenome.org/kb/genes/HGNC:2148","CNGA1-related retinopathy","MONDO:0800405","https://search.clinicalgenome.org/kb/conditions/MONDO:0800405","Autosomal recessive inheritance","","","","","definitive evidence (10/06/2022)","https://search.clinicalgenome.org/kb/gene-validity/CGGV:assertion_bdf9374a-2ec6-4852-ac0b-ec1a3e638245-2022-10-06T160000.000Z","Retina","","",""
"CNGA3","HGNC:2150","https://search.clinicalgenome.org/kb/genes/HGNC:2150","CNGA3-related retinopathy","MONDO:0800102","https://search.clinicalgenome.org/kb/conditions/MONDO:0800102","Autosomal recessive inheritance","","","","","definitive evidence (02/03/2022)","https://search.clinicalgenome.org/kb/gene-validity/CGGV:assertion_39fe36b7-54c3-486b-a9f9-19bce71f096e-2022-02-03T170000.000Z","Retina","","",""
"CNGB1","HGNC:2151","https://search.clinicalgenome.org/kb/genes/HGNC:2151","CNGB1-related retinopathy","MONDO:0800403","https://search.clinicalgenome.org/kb/conditions/MONDO:0800403","Autosomal recessive inheritance","30 - Gene Associated with Autosomal Recessive Phenotype (08/22/2016)","","https://search.clinicalgenome.org/kb/gene-dosage/HGNC:2151","Dosage Working Group","definitive evidence (09/01/2022)","https://search.clinicalgenome.org/kb/gene-validity/CGGV:assertion_664a3eaa-0139-4f5a-8f97-a4a7e00ddfd3-2022-09-01T160000.000Z","Retina","","",""
"CNGB1","HGNC:2151","https://search.clinicalgenome.org/kb/genes/HGNC:2151","retinitis pigmentosa 45","MONDO:0013413","https://search.clinicalgenome.org/kb/conditions/MONDO:0013413","N/A","30 - Gene Associated with Autosomal Recessive Phenotype (08/22/2016)","","https://search.clinicalgenome.org/kb/gene-dosage/HGNC:2151","Dosage Working Group","","","","","",""
"CNGB3","HGNC:2153","https://search.clinicalgenome.org/kb/genes/HGNC:2153","CNGB3-related retinopathy","MONDO:0100446","https://search.clinicalgenome.org/kb/conditions/MONDO:0100446","Autosomal recessive inheritance","","","","","definitive evidence (05/24/2022)","https://search.clinicalgenome.org/kb/gene-validity/CGGV:assertion_aa7bad05-3d4d-4a69-b4e9-82f9224a77f4-2022-05-24T171317.094Z","Retina","","",""
"CNKSR2","HGNC:19701","https://search.clinicalgenome.org/kb/genes/HGNC:19701","X-linked complex neurodevelopmental disorder","MONDO:0100148","https://search.clinicalgenome.org/kb/conditions/MONDO:0100148","X-linked inheritance","3 - Sufficient Evidence for Haploinsufficiency (01/12/2021)","0 - No Evidence for Triplosensitivity (01/12/2021)","https://search.clinicalgenome.org/kb/gene-dosage/HGNC:19701","Dosage Working Group","definitive evidence (12/16/2020)","https://search.clinicalgenome.org/kb/gene-validity/CGGV:assertion_420ee599-c745-43b9-b9a9-c80dfd7f68a8-2020-12-16T170000.000Z","Intellectual Disability and Autism","","",""
"CNKSR2","HGNC:19701","https://search.clinicalgenome.org/kb/genes/HGNC:19701","intellectual disability, X-linked, syndromic, Houge type","MONDO:0030909","https://search.clinicalgenome.org/kb/conditions/MONDO:0030909","N/A","3 - Sufficient Evidence for Haploinsufficiency (01/12/2021)","0 - No Evidence for Triplosensitivity (01/12/2021)","https://search.clinicalgenome.org/kb/gene-dosage/HGNC:19701","Dosage Working Group","","","","","",""
"CNNM2","HGNC:103","https://search.clinicalgenome.org/kb/genes/HGNC:103","hypomagnesemia, seizures, and intellectual disability 1","MONDO:0020787","https://search.clinicalgenome.org/kb/conditions/MONDO:0020787","Semidominant inheritance","","","","","definitive evidence (02/15/2024)","https://search.clinicalgenome.org/kb/gene-validity/CGGV:assertion_522bb617-c817-4536-a87b-01d4302d7bf0-2024-02-15T170000.000Z","Tubulopathy","","",""
"CNNM4","HGNC:105","https://search.clinicalgenome.org/kb/genes/HGNC:105","Jalili syndrome","MONDO:0009007","https://search.clinicalgenome.org/kb/conditions/MONDO:0009007","Autosomal recessive inheritance","30 - Gene Associated with Autosomal Recessive Phenotype (08/22/2016)","","https://search.clinicalgenome.org/kb/gene-dosage/HGNC:105","Dosage Working Group","definitive evidence (08/06/2021)","https://search.clinicalgenome.org/kb/gene-validity/CGGV:assertion_e3cedd07-df9e-4838-8a6b-b24b2802f223-2021-08-06T154836.361Z","Retina","","",""
"CNOT1","HGNC:7877","https://search.clinicalgenome.org/kb/genes/HGNC:7877","complex neurodevelopmental disorder","MONDO:0100038","https://search.clinicalgenome.org/kb/conditions/MONDO:0100038","Autosomal dominant inheritance","3 - Sufficient Evidence for Haploinsufficiency (12/13/2022)","0 - No Evidence for Triplosensitivity (12/13/2022)","https://search.clinicalgenome.org/kb/gene-dosage/HGNC:7877","Dosage Working Group","definitive evidence (09/19/2023)","https://search.clinicalgenome.org/kb/gene-validity/CGGV:assertion_0684b8e2-5552-44d3-a72e-2022e273e24f-2023-09-19T180000.000Z","Intellectual Disability and Autism","","",""
"CNOT1","HGNC:7877","https://search.clinicalgenome.org/kb/genes/HGNC:7877","holoprosencephaly 12 with or without pancreatic agenesis","MONDO:0032787","https://search.clinicalgenome.org/kb/conditions/MONDO:0032787","Autosomal dominant inheritance","3 - Sufficient Evidence for Haploinsufficiency (12/13/2022)","0 - No Evidence for Triplosensitivity (12/13/2022)","https://search.clinicalgenome.org/kb/gene-dosage/HGNC:7877","Dosage Working Group","limited evidence (09/30/2023)","https://search.clinicalgenome.org/kb/gene-validity/CGGV:assertion_91d394c9-60fe-40cb-918b-9790a08873d9-2023-09-30T160000.000Z","Brain Malformations","","",""
"CNOT2","HGNC:7878","https://search.clinicalgenome.org/kb/genes/HGNC:7878","intellectual developmental disorder with nasal speech, dysmorphic facies, and variable skeletal anomalies","MONDO:0032832","https://search.clinicalgenome.org/kb/conditions/MONDO:0032832","N/A","1 - Little Evidence for Haploinsufficiency (11/08/2022)","0 - No Evidence for Triplosensitivity (11/08/2022)","https://search.clinicalgenome.org/kb/gene-dosage/HGNC:7878","Dosage Working Group","","","","","",""
"CNOT3","HGNC:7879","https://search.clinicalgenome.org/kb/genes/HGNC:7879","complex neurodevelopmental disorder","MONDO:0100038","https://search.clinicalgenome.org/kb/conditions/MONDO:0100038","Autosomal dominant inheritance","0 - No Evidence for Haploinsufficiency (06/27/2018)","0 - No Evidence for Triplosensitivity (06/27/2018)","https://search.clinicalgenome.org/kb/gene-dosage/HGNC:7879","Dosage Working Group","definitive evidence (08/24/2021)","https://search.clinicalgenome.org/kb/gene-validity/CGGV:assertion_585384c5-8958-4934-af26-4040774a644c-2021-08-24T160000.000Z","Intellectual Disability and Autism","","",""
"CNOT9","HGNC:10445","https://search.clinicalgenome.org/kb/genes/HGNC:10445","complex neurodevelopmental disorder","MONDO:0100038","https://search.clinicalgenome.org/kb/conditions/MONDO:0100038","Autosomal dominant inheritance","","","","","limited evidence (04/01/2025)","https://search.clinicalgenome.org/kb/gene-validity/CGGV:assertion_6ed830a6-af3b-44a4-9a84-bd8feb175ed4-2025-04-01T160000.000Z","Intellectual Disability and Autism","","",""
"CNTN1","HGNC:2171","https://search.clinicalgenome.org/kb/genes/HGNC:2171","Compton-North congenital myopathy","MONDO:0012929","https://search.clinicalgenome.org/kb/conditions/MONDO:0012929","N/A","30 - Gene Associated with Autosomal Recessive Phenotype (08/22/2016)","","https://search.clinicalgenome.org/kb/gene-dosage/HGNC:2171","Dosage Working Group","","","","","",""
"CNTN2","HGNC:2172","https://search.clinicalgenome.org/kb/genes/HGNC:2172","complex neurodevelopmental disorder","MONDO:0100038","https://search.clinicalgenome.org/kb/conditions/MONDO:0100038","Autosomal recessive inheritance","30 - Gene Associated with Autosomal Recessive Phenotype (08/22/2016)","0 - No Evidence for Triplosensitivity (08/22/2016)","https://search.clinicalgenome.org/kb/gene-dosage/HGNC:2172","Dosage Working Group","definitive evidence (11/07/2023)","https://search.clinicalgenome.org/kb/gene-validity/CGGV:assertion_fe53f9b9-cb21-49a2-8c24-80f63fc75f0f-2023-11-07T080000.000Z","Epilepsy","","",""
"CNTN2","HGNC:2172","https://search.clinicalgenome.org/kb/genes/HGNC:2172","epilepsy, familial adult myoclonic, 5","MONDO:0014167","https://search.clinicalgenome.org/kb/conditions/MONDO:0014167","N/A","30 - Gene Associated with Autosomal Recessive Phenotype (08/22/2016)","0 - No Evidence for Triplosensitivity (08/22/2016)","https://search.clinicalgenome.org/kb/gene-dosage/HGNC:2172","Dosage Working Group","","","","","",""
"CNTN4","HGNC:2174","https://search.clinicalgenome.org/kb/genes/HGNC:2174","complex neurodevelopmental disorder","MONDO:0100038","https://search.clinicalgenome.org/kb/conditions/MONDO:0100038","Autosomal dominant inheritance","0 - No Evidence for Haploinsufficiency (06/14/2022)","0 - No Evidence for Triplosensitivity (06/14/2022)","https://search.clinicalgenome.org/kb/gene-dosage/HGNC:2174","Dosage Working Group","disputing (04/07/2024)","https://search.clinicalgenome.org/kb/gene-validity/CGGV:assertion_716109ea-60b6-48d9-8ab7-b3883063bae0-2024-04-06T220000.000Z","Intellectual Disability and Autism","","",""
"CNTN6","HGNC:2176","https://search.clinicalgenome.org/kb/genes/HGNC:2176","complex neurodevelopmental disorder","MONDO:0100038","https://search.clinicalgenome.org/kb/conditions/MONDO:0100038","Autosomal dominant inheritance","0 - No Evidence for Haploinsufficiency (09/28/2022)","0 - No Evidence for Triplosensitivity (09/28/2022)","https://search.clinicalgenome.org/kb/gene-dosage/HGNC:2176","Dosage Working Group","disputing (09/20/2022)","https://search.clinicalgenome.org/kb/gene-validity/CGGV:assertion_bda9083a-7edc-4102-be62-e1c62d0a6bc2-2022-09-20T060000.000Z","Intellectual Disability and Autism","","",""
"CNTNAP2","HGNC:13830","https://search.clinicalgenome.org/kb/genes/HGNC:13830","complex neurodevelopmental disorder","MONDO:0100038","https://search.clinicalgenome.org/kb/conditions/MONDO:0100038","Autosomal dominant inheritance | Autosomal recessive inheritance","1 - Little Evidence for Haploinsufficiency (10/23/2019)","0 - No Evidence for Triplosensitivity (10/23/2019)","https://search.clinicalgenome.org/kb/gene-dosage/HGNC:13830","Dosage Working Group","disputing (03/15/2021) | definitive evidence (06/15/2021)","https://search.clinicalgenome.org/kb/gene-validity/CGGV:assertion_e91dc4be-821d-4f54-acdd-755a25070eec-2021-03-16T160000.000Z | https://search.clinicalgenome.org/kb/gene-validity/CGGV:assertion_3af732e2-062d-4bb3-a3cd-2045e460dc8f-2021-06-15T160000.000Z","Intellectual Disability and Autism | Epilepsy","","",""
"CNTNAP5","HGNC:18748","https://search.clinicalgenome.org/kb/genes/HGNC:18748","complex neurodevelopmental disorder","MONDO:0100038","https://search.clinicalgenome.org/kb/conditions/MONDO:0100038","Autosomal dominant inheritance","1 - Little Evidence for Haploinsufficiency (09/24/2024)","0 - No Evidence for Triplosensitivity (09/24/2024)","https://search.clinicalgenome.org/kb/gene-dosage/HGNC:18748","Dosage Working Group","disputing (08/20/2024)","https://search.clinicalgenome.org/kb/gene-validity/CGGV:assertion_1df71cc1-112f-4382-a047-e078a820699c-2024-08-20T100000.000Z","Intellectual Disability and Autism","","",""
"COA3","HGNC:24990","https://search.clinicalgenome.org/kb/genes/HGNC:24990","mitochondrial disease","MONDO:0044970","https://search.clinicalgenome.org/kb/conditions/MONDO:0044970","Autosomal recessive inheritance","","","","","limited evidence (08/15/2022)","https://search.clinicalgenome.org/kb/gene-validity/CGGV:assertion_83ca0cfa-10b9-4bd5-86dd-83bef18e33dc-2022-08-15T160000.000Z","Mitochondrial Diseases","","",""
"COA7","HGNC:25716","https://search.clinicalgenome.org/kb/genes/HGNC:25716","mitochondrial disease","MONDO:0044970","https://search.clinicalgenome.org/kb/conditions/MONDO:0044970","Autosomal recessive inheritance","","","","","definitive evidence (08/22/2024)","https://search.clinicalgenome.org/kb/gene-validity/CGGV:assertion_971c1202-83cf-4ad1-9404-c4ef2fcf0880-2024-08-22T040000.000Z","Mitochondrial Diseases","","",""
"COA8","HGNC:20492","https://search.clinicalgenome.org/kb/genes/HGNC:20492","mitochondrial disease","MONDO:0044970","https://search.clinicalgenome.org/kb/conditions/MONDO:0044970","Autosomal recessive inheritance","","","","","definitive evidence (07/11/2023)","https://search.clinicalgenome.org/kb/gene-validity/CGGV:assertion_7b2b04f9-275d-45e9-acc6-ee86bf20c782-2023-07-11T160000.000Z","Mitochondrial Diseases","","",""
"COCH","HGNC:2180","https://search.clinicalgenome.org/kb/genes/HGNC:2180","nonsyndromic genetic hearing loss","MONDO:0019497","https://search.clinicalgenome.org/kb/conditions/MONDO:0019497","Autosomal dominant inheritance","","","","","definitive evidence (01/05/2018)","https://search.clinicalgenome.org/kb/gene-validity/CGGV:assertion_998da390-3e32-4b80-a733-d64d87d5357b-2018-01-05T170000.000Z","Hearing Loss","","",""
"COG1","HGNC:6545","https://search.clinicalgenome.org/kb/genes/HGNC:6545","COG1-congenital disorder of glycosylation","MONDO:0012637","https://search.clinicalgenome.org/kb/conditions/MONDO:0012637","Autosomal recessive inheritance","30 - Gene Associated with Autosomal Recessive Phenotype (08/22/2016)","","https://search.clinicalgenome.org/kb/gene-dosage/HGNC:6545","Dosage Working Group","moderate evidence (01/03/2024)","https://search.clinicalgenome.org/kb/gene-validity/CGGV:assertion_6607c8c3-e293-49df-904d-da27aa8e0232-2024-01-03T170000.000Z","Congenital Disorders of Glycosylation","","",""
"COG2","HGNC:6546","https://search.clinicalgenome.org/kb/genes/HGNC:6546","congenital disorder of glycosylation, type IIq","MONDO:0054559","https://search.clinicalgenome.org/kb/conditions/MONDO:0054559","Autosomal recessive inheritance","","","","","limited evidence (02/07/2024)","https://search.clinicalgenome.org/kb/gene-validity/CGGV:assertion_67d145eb-648f-4e00-b53f-9447d650cc3e-2024-02-07T170000.000Z","Congenital Disorders of Glycosylation","","",""
"COG3","HGNC:18619","https://search.clinicalgenome.org/kb/genes/HGNC:18619","congenital disorder of glycosylation","MONDO:0015286","https://search.clinicalgenome.org/kb/conditions/MONDO:0015286","Autosomal recessive inheritance","","","","","limited evidence (09/19/2024)","https://search.clinicalgenome.org/kb/gene-validity/CGGV:assertion_6d2120a6-1287-4cba-9f94-f071f0b1abd4-2024-09-19T160000.000Z","Congenital Disorders of Glycosylation","","",""
"COG4","HGNC:18620","https://search.clinicalgenome.org/kb/genes/HGNC:18620","COG4-congenital disorder of glycosylation","MONDO:0013281","https://search.clinicalgenome.org/kb/conditions/MONDO:0013281","Autosomal recessive inheritance","30 - Gene Associated with Autosomal Recessive Phenotype (08/22/2016)","","https://search.clinicalgenome.org/kb/gene-dosage/HGNC:18620","Dosage Working Group","moderate evidence (05/17/2023)","https://search.clinicalgenome.org/kb/gene-validity/CGGV:assertion_6c9f2031-7487-45a5-abbe-ca2d27f1b09c-2023-05-17T180000.000Z","Congenital Disorders of Glycosylation","","",""
"COG5","HGNC:14857","https://search.clinicalgenome.org/kb/genes/HGNC:14857","COG5-congenital disorder of glycosylation","MONDO:0013325","https://search.clinicalgenome.org/kb/conditions/MONDO:0013325","Autosomal recessive inheritance","","","","","definitive evidence (12/15/2024)","https://search.clinicalgenome.org/kb/gene-validity/CGGV:assertion_0104222e-f6a3-445c-becb-b45fa0f7f108-2024-12-15T170000.000Z","Congenital Disorders of Glycosylation","","",""
"COG6","HGNC:18621","https://search.clinicalgenome.org/kb/genes/HGNC:18621","COG6-congenital disorder of glycosylation","MONDO:0013810","https://search.clinicalgenome.org/kb/conditions/MONDO:0013810","Autosomal recessive inheritance","","","","","definitive evidence (12/08/2024)","https://search.clinicalgenome.org/kb/gene-validity/CGGV:assertion_600a651b-6e68-40c0-a50e-f1067c5e87bb-2024-12-08T170000.000Z","Prenatal","","",""
"COG7","HGNC:18622","https://search.clinicalgenome.org/kb/genes/HGNC:18622","COG7-congenital disorder of glycosylation","MONDO:0012118","https://search.clinicalgenome.org/kb/conditions/MONDO:0012118","Autosomal recessive inheritance","30 - Gene Associated with Autosomal Recessive Phenotype (04/09/2015)","0 - No Evidence for Triplosensitivity (04/09/2015)","https://search.clinicalgenome.org/kb/gene-dosage/HGNC:18622","Dosage Working Group","definitive evidence (10/19/2024)","https://search.clinicalgenome.org/kb/gene-validity/CGGV:assertion_398c1212-8417-499e-8427-79a752745aec-2024-10-19T170000.000Z","Congenital Disorders of Glycosylation","","",""
"COG8","HGNC:18623","https://search.clinicalgenome.org/kb/genes/HGNC:18623","COG8-congenital disorder of glycosylation","MONDO:0012635","https://search.clinicalgenome.org/kb/conditions/MONDO:0012635","N/A","30 - Gene Associated with Autosomal Recessive Phenotype (03/25/2015)","0 - No Evidence for Triplosensitivity (03/25/2015)","https://search.clinicalgenome.org/kb/gene-dosage/HGNC:18623","Dosage Working Group","","","","","",""
"COL10A1","HGNC:2185","https://search.clinicalgenome.org/kb/genes/HGNC:2185","Schmid metaphyseal chondrodysplasia","MONDO:0007983","https://search.clinicalgenome.org/kb/conditions/MONDO:0007983","Autosomal dominant inheritance","","","","","definitive evidence (06/28/2024)","https://search.clinicalgenome.org/kb/gene-validity/CGGV:assertion_5529304a-e8aa-4e44-a544-6864b8afe78a-2024-06-28T160000.000Z","Skeletal Disorders","","",""
"COL11A1","HGNC:2186","https://search.clinicalgenome.org/kb/genes/HGNC:2186","autosomal dominant nonsyndromic hearing loss","MONDO:0019587","https://search.clinicalgenome.org/kb/conditions/MONDO:0019587","Autosomal dominant inheritance","1 - Little Evidence for Haploinsufficiency (10/19/2011)","0 - No Evidence for Triplosensitivity (10/19/2011)","https://search.clinicalgenome.org/kb/gene-dosage/HGNC:2186","Dosage Working Group","moderate evidence (06/18/2025)","https://search.clinicalgenome.org/kb/gene-validity/CGGV:assertion_72d6c6cc-1332-45c0-ba33-fd6e2c17e7fb-2025-06-18T160000.000Z","Hearing Loss","","",""
"COL11A1","HGNC:2186","https://search.clinicalgenome.org/kb/genes/HGNC:2186","Stickler syndrome type 2","MONDO:0011493","https://search.clinicalgenome.org/kb/conditions/MONDO:0011493","N/A","1 - Little Evidence for Haploinsufficiency (10/19/2011)","0 - No Evidence for Triplosensitivity (10/19/2011)","https://search.clinicalgenome.org/kb/gene-dosage/HGNC:2186","Dosage Working Group","","","","","",""
"COL11A2","HGNC:2187","https://search.clinicalgenome.org/kb/genes/HGNC:2187","nonsyndromic genetic hearing loss","MONDO:0019497","https://search.clinicalgenome.org/kb/conditions/MONDO:0019497","Autosomal dominant inheritance | Autosomal recessive inheritance","","","","","definitive evidence (11/15/2023) | moderate evidence (11/15/2023)","https://search.clinicalgenome.org/kb/gene-validity/CGGV:assertion_0665772a-ba94-4561-b597-364f7db7e4ca-2023-11-15T170000.000Z | https://search.clinicalgenome.org/kb/gene-validity/CGGV:assertion_561327b9-7c55-40c3-b83c-5a3ed9d75606-2023-11-15T170000.000Z","Hearing Loss | Hearing Loss","","",""
"COL11A2","HGNC:2187","https://search.clinicalgenome.org/kb/genes/HGNC:2187","otospondylomegaepiphyseal dysplasia","MONDO:0008975","https://search.clinicalgenome.org/kb/conditions/MONDO:0008975","Autosomal dominant inheritance | Autosomal recessive inheritance","","","","","definitive evidence (12/20/2018) | definitive evidence (12/20/2018)","https://search.clinicalgenome.org/kb/gene-validity/CGGV:assertion_177bddd8-0566-4f80-a9f1-679ca96a7c60-2018-12-20T170000.000Z | https://search.clinicalgenome.org/kb/gene-validity/CGGV:assertion_27b13a91-0a04-4393-bf1c-4f8418154c9b-2018-12-20T170000.000Z","Hearing Loss | Hearing Loss","","",""
"COL18A1","HGNC:2195","https://search.clinicalgenome.org/kb/genes/HGNC:2195","Knobloch syndrome 1","MONDO:0800167","https://search.clinicalgenome.org/kb/conditions/MONDO:0800167","Autosomal recessive inheritance","","","","","definitive evidence (02/28/2023)","https://search.clinicalgenome.org/kb/gene-validity/CGGV:assertion_ae24ab5e-a4a9-45eb-a52d-18e6dfebae53-2023-02-28T100000.000Z","Brain Malformations","","",""
"COL1A1","HGNC:2197","https://search.clinicalgenome.org/kb/genes/HGNC:2197","Caffey disease","MONDO:0007244","https://search.clinicalgenome.org/kb/conditions/MONDO:0007244","Autosomal dominant inheritance","3 - Sufficient Evidence for Haploinsufficiency (08/23/2012)","0 - No Evidence for Triplosensitivity (08/23/2012)","https://search.clinicalgenome.org/kb/gene-dosage/HGNC:2197","Dosage Working Group","definitive evidence (09/28/2023)","https://search.clinicalgenome.org/kb/gene-validity/CGGV:assertion_21b43a7b-79d4-4adf-b1a4-cd26e21ba8fa-2023-09-28T160000.000Z","Skeletal Disorders","","",""
"COL1A1","HGNC:2197","https://search.clinicalgenome.org/kb/genes/HGNC:2197","osteogenesis imperfecta","MONDO:0019019","https://search.clinicalgenome.org/kb/conditions/MONDO:0019019","Autosomal dominant inheritance","3 - Sufficient Evidence for Haploinsufficiency (08/23/2012)","0 - No Evidence for Triplosensitivity (08/23/2012)","https://search.clinicalgenome.org/kb/gene-dosage/HGNC:2197","Dosage Working Group","definitive evidence (06/06/2022)","https://search.clinicalgenome.org/kb/gene-validity/CGGV:assertion_adc78f61-1e90-4496-ab30-b1fb0d6dcf5b-2022-06-06T160000.000Z","Skeletal Disorders","","",""
"COL1A1","HGNC:2197","https://search.clinicalgenome.org/kb/genes/HGNC:2197","COL1A1-related Ehlers-Danlos syndrome","MONDO:0100599","https://search.clinicalgenome.org/kb/conditions/MONDO:0100599","Autosomal dominant inheritance","3 - Sufficient Evidence for Haploinsufficiency (08/23/2012)","0 - No Evidence for Triplosensitivity (08/23/2012)","https://search.clinicalgenome.org/kb/gene-dosage/HGNC:2197","Dosage Working Group","definitive evidence (10/03/2022)","https://search.clinicalgenome.org/kb/gene-validity/CGGV:assertion_da1aeef0-2dae-4b96-9ac8-946374a09cb6-2022-10-03T160000.000Z","Skeletal Disorders","","",""
"COL1A1","HGNC:2197","https://search.clinicalgenome.org/kb/genes/HGNC:2197","osteogenesis imperfecta type 1","MONDO:0008146","https://search.clinicalgenome.org/kb/conditions/MONDO:0008146","N/A","3 - Sufficient Evidence for Haploinsufficiency (08/23/2012)","0 - No Evidence for Triplosensitivity (08/23/2012)","https://search.clinicalgenome.org/kb/gene-dosage/HGNC:2197","Dosage Working Group","","","","","",""
"COL1A2","HGNC:2198","https://search.clinicalgenome.org/kb/genes/HGNC:2198","congenital heart disease","MONDO:0005453","https://search.clinicalgenome.org/kb/conditions/MONDO:0005453","Mode of inheritance","0 - No Evidence for Haploinsufficiency (10/12/2012)","0 - No Evidence for Triplosensitivity (10/12/2012)","https://search.clinicalgenome.org/kb/gene-dosage/HGNC:2198","Dosage Working Group","disputing (09/09/2024)","https://search.clinicalgenome.org/kb/gene-validity/CGGV:assertion_b4e87080-7e90-4e19-a3dc-e986bfd01e0f-2024-09-09T160000.000Z","Congenital Heart Disease","","",""
"COL1A2","HGNC:2198","https://search.clinicalgenome.org/kb/genes/HGNC:2198","Ehlers-Danlos syndrome, cardiac valvular type","MONDO:0009159","https://search.clinicalgenome.org/kb/conditions/MONDO:0009159","Autosomal recessive inheritance","0 - No Evidence for Haploinsufficiency (10/12/2012)","0 - No Evidence for Triplosensitivity (10/12/2012)","https://search.clinicalgenome.org/kb/gene-dosage/HGNC:2198","Dosage Working Group","definitive evidence (09/28/2023)","https://search.clinicalgenome.org/kb/gene-validity/CGGV:assertion_66dcf444-5302-400f-aa44-1e12629af095-2023-09-28T160000.000Z","Skeletal Disorders","","",""
"COL1A2","HGNC:2198","https://search.clinicalgenome.org/kb/genes/HGNC:2198","COL1A2-related Ehlers-Danlos syndrome","MONDO:0100606","https://search.clinicalgenome.org/kb/conditions/MONDO:0100606","Autosomal dominant inheritance","0 - No Evidence for Haploinsufficiency (10/12/2012)","0 - No Evidence for Triplosensitivity (10/12/2012)","https://search.clinicalgenome.org/kb/gene-dosage/HGNC:2198","Dosage Working Group","definitive evidence (11/02/2022)","https://search.clinicalgenome.org/kb/gene-validity/CGGV:assertion_25e0c6fa-1b72-4346-b182-0708de2d0420-2022-11-02T160000.000Z","Skeletal Disorders","","",""
"COL1A2","HGNC:2198","https://search.clinicalgenome.org/kb/genes/HGNC:2198","COL1A2-related osteogenesis imperfecta","MONDO:0100596","https://search.clinicalgenome.org/kb/conditions/MONDO:0100596","Autosomal dominant inheritance","0 - No Evidence for Haploinsufficiency (10/12/2012)","0 - No Evidence for Triplosensitivity (10/12/2012)","https://search.clinicalgenome.org/kb/gene-dosage/HGNC:2198","Dosage Working Group","definitive evidence (12/05/2022)","https://search.clinicalgenome.org/kb/gene-validity/CGGV:assertion_d67b74d4-3c39-4632-9eba-106b99230f37-2022-12-05T170000.000Z","Skeletal Disorders","","",""
"COL2A1","HGNC:2200","https://search.clinicalgenome.org/kb/genes/HGNC:2200","Stickler syndrome type 1","MONDO:0007160","https://search.clinicalgenome.org/kb/conditions/MONDO:0007160","Autosomal dominant inheritance","3 - Sufficient Evidence for Haploinsufficiency (07/29/2020)","0 - No Evidence for Triplosensitivity (07/29/2020)","https://search.clinicalgenome.org/kb/gene-dosage/HGNC:2200","Dosage Working Group","definitive evidence (09/28/2023)","https://search.clinicalgenome.org/kb/gene-validity/CGGV:assertion_3eb9287e-d731-417e-a814-9630b47301a4-2023-09-28T160000.000Z","Skeletal Disorders","","",""
"COL2A1","HGNC:2200","https://search.clinicalgenome.org/kb/genes/HGNC:2200","achondrogenesis type II","MONDO:0008702","https://search.clinicalgenome.org/kb/conditions/MONDO:0008702","Autosomal dominant inheritance","3 - Sufficient Evidence for Haploinsufficiency (07/29/2020)","0 - No Evidence for Triplosensitivity (07/29/2020)","https://search.clinicalgenome.org/kb/gene-dosage/HGNC:2200","Dosage Working Group","definitive evidence (10/05/2020)","https://search.clinicalgenome.org/kb/gene-validity/CGGV:assertion_14640c06-c66e-4dc7-86ea-9b0850e51474-2020-10-05T170000.000Z","Skeletal Disorders","","",""
"COL2A1","HGNC:2200","https://search.clinicalgenome.org/kb/genes/HGNC:2200","platyspondylic dysplasia, Torrance type","MONDO:0007895","https://search.clinicalgenome.org/kb/conditions/MONDO:0007895","Autosomal dominant inheritance","3 - Sufficient Evidence for Haploinsufficiency (07/29/2020)","0 - No Evidence for Triplosensitivity (07/29/2020)","https://search.clinicalgenome.org/kb/gene-dosage/HGNC:2200","Dosage Working Group","definitive evidence (02/01/2021)","https://search.clinicalgenome.org/kb/gene-validity/CGGV:assertion_a4c42c43-7b6a-4456-aeb1-7a00302a468b-2021-02-01T050000.000Z","Skeletal Disorders","","",""
"COL2A1","HGNC:2200","https://search.clinicalgenome.org/kb/genes/HGNC:2200","Kniest dysplasia","MONDO:0007987","https://search.clinicalgenome.org/kb/conditions/MONDO:0007987","Autosomal dominant inheritance","3 - Sufficient Evidence for Haploinsufficiency (07/29/2020)","0 - No Evidence for Triplosensitivity (07/29/2020)","https://search.clinicalgenome.org/kb/gene-dosage/HGNC:2200","Dosage Working Group","definitive evidence (12/15/2021)","https://search.clinicalgenome.org/kb/gene-validity/CGGV:assertion_25a49ec9-69ab-4e51-a13a-fe1eaa50ae56-2021-12-15T183542.376Z","Skeletal Disorders","","",""
"COL2A1","HGNC:2200","https://search.clinicalgenome.org/kb/genes/HGNC:2200","dysplasia of the proximal femoral epiphyses","MONDO:1030002","https://search.clinicalgenome.org/kb/conditions/MONDO:1030002","Autosomal dominant inheritance","3 - Sufficient Evidence for Haploinsufficiency (07/29/2020)","0 - No Evidence for Triplosensitivity (07/29/2020)","https://search.clinicalgenome.org/kb/gene-dosage/HGNC:2200","Dosage Working Group","definitive evidence (08/06/2024)","https://search.clinicalgenome.org/kb/gene-validity/CGGV:assertion_4dd39f77-cafb-405c-871e-ce34eb55b5e0-2024-08-06T040000.000Z","Skeletal Disorders","","",""
"COL2A1","HGNC:2200","https://search.clinicalgenome.org/kb/genes/HGNC:2200","spondyloperipheral dysplasia","MONDO:0010078","https://search.clinicalgenome.org/kb/conditions/MONDO:0010078","Autosomal dominant inheritance","3 - Sufficient Evidence for Haploinsufficiency (07/29/2020)","0 - No Evidence for Triplosensitivity (07/29/2020)","https://search.clinicalgenome.org/kb/gene-dosage/HGNC:2200","Dosage Working Group","definitive evidence (09/28/2023)","https://search.clinicalgenome.org/kb/gene-validity/CGGV:assertion_d4da6e1f-5aad-4541-a3ae-76ed4782a023-2023-09-28T160000.000Z","Skeletal Disorders","","",""
"COL2A1","HGNC:2200","https://search.clinicalgenome.org/kb/genes/HGNC:2200","COL2A1-related spondyloepiphyseal dysplasia","MONDO:0100602","https://search.clinicalgenome.org/kb/conditions/MONDO:0100602","Autosomal dominant inheritance","3 - Sufficient Evidence for Haploinsufficiency (07/29/2020)","0 - No Evidence for Triplosensitivity (07/29/2020)","https://search.clinicalgenome.org/kb/gene-dosage/HGNC:2200","Dosage Working Group","definitive evidence (12/06/2021)","https://search.clinicalgenome.org/kb/gene-validity/CGGV:assertion_b98d6207-3f9b-4e66-a478-85c31a9fdab8-2021-12-06T170000.000Z","Skeletal Disorders","","",""
"COL2A1","HGNC:2200","https://search.clinicalgenome.org/kb/genes/HGNC:2200","spondyloepiphyseal dysplasia, Stanescu type","MONDO:0014701","https://search.clinicalgenome.org/kb/conditions/MONDO:0014701","Autosomal dominant inheritance","3 - Sufficient Evidence for Haploinsufficiency (07/29/2020)","0 - No Evidence for Triplosensitivity (07/29/2020)","https://search.clinicalgenome.org/kb/gene-dosage/HGNC:2200","Dosage Working Group","moderate evidence (12/01/2016)","https://search.clinicalgenome.org/kb/gene-validity/CGGCIEX:assertion_4843","General Gene Curation","","",""
"COL3A1","HGNC:2201","https://search.clinicalgenome.org/kb/genes/HGNC:2201","Ehlers-Danlos syndrome, vascular type","MONDO:0017314","https://search.clinicalgenome.org/kb/conditions/MONDO:0017314","Autosomal dominant inheritance","3 - Sufficient Evidence for Haploinsufficiency (01/12/2017)","0 - No Evidence for Triplosensitivity (01/12/2017)","https://search.clinicalgenome.org/kb/gene-dosage/HGNC:2201","Dosage Working Group","definitive evidence (02/27/2019)","https://search.clinicalgenome.org/kb/gene-validity/CGGV:assertion_ce795591-1c7c-4a52-886a-a294293c67c3-2019-02-27T170000.000Z","General Gene Curation","Moderate Actionability (09/02/2020) | Moderate Actionability (09/02/2020)","https://actionability.clinicalgenome.org/ac/Adult/ui/stg2SummaryRpt?doc=AC132 | https://actionability.clinicalgenome.org/ac/Pediatric/ui/stg2SummaryRpt?doc=AC132","Adult Actionability Working Group | Pediatric Actionability Working Group"
"COL3A1","HGNC:2201","https://search.clinicalgenome.org/kb/genes/HGNC:2201","autosomal dominant Ehlers-Danlos syndrome, vascular type","MONDO:0007524","https://search.clinicalgenome.org/kb/conditions/MONDO:0007524","N/A","3 - Sufficient Evidence for Haploinsufficiency (01/12/2017)","0 - No Evidence for Triplosensitivity (01/12/2017)","https://search.clinicalgenome.org/kb/gene-dosage/HGNC:2201","Dosage Working Group","","","","Moderate Actionability (09/02/2020) | Moderate Actionability (09/02/2020)","https://actionability.clinicalgenome.org/ac/Adult/ui/stg2SummaryRpt?doc=AC132 | https://actionability.clinicalgenome.org/ac/Pediatric/ui/stg2SummaryRpt?doc=AC132","Adult Actionability Working Group | Pediatric Actionability Working Group"
"COL4A3","HGNC:2204","https://search.clinicalgenome.org/kb/genes/HGNC:2204","Alport syndrome","MONDO:0018965","https://search.clinicalgenome.org/kb/conditions/MONDO:0018965","Semidominant inheritance","30 - Gene Associated with Autosomal Recessive Phenotype (05/22/2013)","0 - No Evidence for Triplosensitivity (05/22/2013)","https://search.clinicalgenome.org/kb/gene-dosage/HGNC:2204","Dosage Working Group","definitive evidence (07/26/2021)","https://search.clinicalgenome.org/kb/gene-validity/CGGV:assertion_e1ed7d3b-4366-4f4a-98f2-80e431e2d8da-2021-07-26T023000.000Z","Glomerulopathy","Strong Actionability (11/04/2021) | Strong Actionability (11/04/2021)","https://actionability.clinicalgenome.org/ac/Adult/ui/stg2SummaryRpt?doc=AC1044 | https://actionability.clinicalgenome.org/ac/Pediatric/ui/stg2SummaryRpt?doc=AC1044","Adult Actionability Working Group | Pediatric Actionability Working Group"
"COL4A3","HGNC:2204","https://search.clinicalgenome.org/kb/genes/HGNC:2204","autosomal recessive Alport syndrome","MONDO:0008762","https://search.clinicalgenome.org/kb/conditions/MONDO:0008762","N/A","30 - Gene Associated with Autosomal Recessive Phenotype (05/22/2013)","0 - No Evidence for Triplosensitivity (05/22/2013)","https://search.clinicalgenome.org/kb/gene-dosage/HGNC:2204","Dosage Working Group","","","","","",""
"COL4A4","HGNC:2206","https://search.clinicalgenome.org/kb/genes/HGNC:2206","Alport syndrome","MONDO:0018965","https://search.clinicalgenome.org/kb/conditions/MONDO:0018965","Semidominant inheritance","","","","","definitive evidence (08/24/2021)","https://search.clinicalgenome.org/kb/gene-validity/CGGV:assertion_c235830a-a6f5-4cf6-b015-902da62f1b2e-2021-08-24T023000.000Z","Glomerulopathy","Strong Actionability (11/04/2021) | Strong Actionability (11/04/2021)","https://actionability.clinicalgenome.org/ac/Adult/ui/stg2SummaryRpt?doc=AC1044 | https://actionability.clinicalgenome.org/ac/Pediatric/ui/stg2SummaryRpt?doc=AC1044","Adult Actionability Working Group | Pediatric Actionability Working Group"
"COL4A5","HGNC:2207","https://search.clinicalgenome.org/kb/genes/HGNC:2207","Alport syndrome","MONDO:0018965","https://search.clinicalgenome.org/kb/conditions/MONDO:0018965","X-linked inheritance","3 - Sufficient Evidence for Haploinsufficiency (09/08/2020)","0 - No Evidence for Triplosensitivity (09/08/2020)","https://search.clinicalgenome.org/kb/gene-dosage/HGNC:2207","Dosage Working Group","definitive evidence (03/19/2019)","https://search.clinicalgenome.org/kb/gene-validity/CGGV:assertion_0407dc2e-1cab-4043-889d-4695b043d7b3-2019-03-19T160000.000Z","Hearing Loss","Strong Actionability (11/04/2021) | Strong Actionability (11/04/2021)","https://actionability.clinicalgenome.org/ac/Adult/ui/stg2SummaryRpt?doc=AC1044 | https://actionability.clinicalgenome.org/ac/Pediatric/ui/stg2SummaryRpt?doc=AC1044","Adult Actionability Working Group | Pediatric Actionability Working Group"
"COL4A5","HGNC:2207","https://search.clinicalgenome.org/kb/genes/HGNC:2207","X-linked Alport syndrome","MONDO:0010520","https://search.clinicalgenome.org/kb/conditions/MONDO:0010520","N/A","3 - Sufficient Evidence for Haploinsufficiency (09/08/2020)","0 - No Evidence for Triplosensitivity (09/08/2020)","https://search.clinicalgenome.org/kb/gene-dosage/HGNC:2207","Dosage Working Group","","","","","",""
"COL4A6","HGNC:2208","https://search.clinicalgenome.org/kb/genes/HGNC:2208","hearing loss, X-linked 6","MONDO:0010484","https://search.clinicalgenome.org/kb/conditions/MONDO:0010484","X-linked inheritance","","","","","limited evidence (02/16/2022)","https://search.clinicalgenome.org/kb/gene-validity/CGGV:assertion_d026ef00-c6f3-4aa8-a61a-b354b68fe043-2022-02-16T170000.000Z","Hearing Loss","","",""
"COL5A1","HGNC:2209","https://search.clinicalgenome.org/kb/genes/HGNC:2209","Ehlers-Danlos syndrome, classic type","MONDO:0007522","https://search.clinicalgenome.org/kb/conditions/MONDO:0007522","Autosomal dominant inheritance","3 - Sufficient Evidence for Haploinsufficiency (12/14/2017)","0 - No Evidence for Triplosensitivity (12/14/2017)","https://search.clinicalgenome.org/kb/gene-dosage/HGNC:2209","Dosage Working Group","definitive evidence (03/24/2021)","https://search.clinicalgenome.org/kb/gene-validity/CGGV:assertion_3133eacb-2ef9-4463-8031-11d10f0e91b9-2021-03-24T151331.225Z","General Gene Curation","Moderate Actionability (02/17/2025) | Moderate Actionability (02/17/2025)","https://actionability.clinicalgenome.org/ac/Adult/ui/stg2SummaryRpt?doc=AC089 | https://actionability.clinicalgenome.org/ac/Pediatric/ui/stg2SummaryRpt?doc=AC089","Adult Actionability Working Group | Pediatric Actionability Working Group"
"COL5A1","HGNC:2209","https://search.clinicalgenome.org/kb/genes/HGNC:2209","Ehlers-Danlos syndrome, classic type, 1","MONDO:0019567","https://search.clinicalgenome.org/kb/conditions/MONDO:0019567","N/A","3 - Sufficient Evidence for Haploinsufficiency (12/14/2017)","0 - No Evidence for Triplosensitivity (12/14/2017)","https://search.clinicalgenome.org/kb/gene-dosage/HGNC:2209","Dosage Working Group","","","","Moderate Actionability (02/17/2025) | Moderate Actionability (02/17/2025)","https://actionability.clinicalgenome.org/ac/Adult/ui/stg2SummaryRpt?doc=AC089 | https://actionability.clinicalgenome.org/ac/Pediatric/ui/stg2SummaryRpt?doc=AC089","Adult Actionability Working Group | Pediatric Actionability Working Group"
"COL5A2","HGNC:2210","https://search.clinicalgenome.org/kb/genes/HGNC:2210","Ehlers-Danlos syndrome, classic type","MONDO:0007522","https://search.clinicalgenome.org/kb/conditions/MONDO:0007522","Autosomal dominant inheritance","","","","","definitive evidence (03/24/2021)","https://search.clinicalgenome.org/kb/gene-validity/CGGV:assertion_1901d495-d33f-4741-88fd-4b66ac43bbad-2021-03-24T184245.711Z","General Gene Curation","Moderate Actionability (02/17/2025) | Moderate Actionability (02/17/2025)","https://actionability.clinicalgenome.org/ac/Adult/ui/stg2SummaryRpt?doc=AC089 | https://actionability.clinicalgenome.org/ac/Pediatric/ui/stg2SummaryRpt?doc=AC089","Adult Actionability Working Group | Pediatric Actionability Working Group"
"COL5A2","HGNC:2210","https://search.clinicalgenome.org/kb/genes/HGNC:2210","Ehlers-Danlos syndrome, classic type, 2","MONDO:0019568","https://search.clinicalgenome.org/kb/conditions/MONDO:0019568","N/A","","","","","","","","Moderate Actionability (02/17/2025) | Moderate Actionability (02/17/2025)","https://actionability.clinicalgenome.org/ac/Adult/ui/stg2SummaryRpt?doc=AC089 | https://actionability.clinicalgenome.org/ac/Pediatric/ui/stg2SummaryRpt?doc=AC089","Adult Actionability Working Group | Pediatric Actionability Working Group"
"COL6A1","HGNC:2211","https://search.clinicalgenome.org/kb/genes/HGNC:2211","collagen 6-related myopathy","MONDO:0100225","https://search.clinicalgenome.org/kb/conditions/MONDO:0100225","Autosomal dominant inheritance | Autosomal recessive inheritance","","","","","definitive evidence (09/26/2022) | definitive evidence (09/26/2022)","https://search.clinicalgenome.org/kb/gene-validity/CGGV:assertion_95ee3b63-8083-49e2-9e20-a1006ac168dd-2022-09-26T160000.000Z | https://search.clinicalgenome.org/kb/gene-validity/CGGV:assertion_9de84294-8404-4bd0-a7c6-89a9a70eb408-2022-09-26T160000.000Z","Congenital Myopathies | Congenital Myopathies","","",""
"COL6A2","HGNC:2212","https://search.clinicalgenome.org/kb/genes/HGNC:2212","collagen 6-related myopathy","MONDO:0100225","https://search.clinicalgenome.org/kb/conditions/MONDO:0100225","Autosomal dominant inheritance | Autosomal recessive inheritance","","","","","definitive evidence (06/27/2022) | definitive evidence (06/27/2022)","https://search.clinicalgenome.org/kb/gene-validity/CGGV:assertion_a7a4dad5-f179-44ac-adcb-c5e15c11a1ec-2022-06-27T160000.000Z | https://search.clinicalgenome.org/kb/gene-validity/CGGV:assertion_c523dbfa-e08e-4bdc-82d4-6bf43480697c-2022-06-27T160000.000Z","Congenital Myopathies | Congenital Myopathies","","",""
"COL6A3","HGNC:2213","https://search.clinicalgenome.org/kb/genes/HGNC:2213","dystonia 27","MONDO:0014627","https://search.clinicalgenome.org/kb/conditions/MONDO:0014627","Autosomal recessive inheritance","","","","","limited evidence (08/25/2025)","https://search.clinicalgenome.org/kb/gene-validity/CGGV:assertion_8a109763-6fff-4da9-b826-7c2544d3f878-2025-08-25T160000.000Z","Congenital Myopathies","","",""
"COL6A3","HGNC:2213","https://search.clinicalgenome.org/kb/genes/HGNC:2213","collagen 6-related myopathy","MONDO:0100225","https://search.clinicalgenome.org/kb/conditions/MONDO:0100225","Autosomal dominant inheritance | Autosomal recessive inheritance","","","","","definitive evidence (06/27/2022) | definitive evidence (06/27/2022)","https://search.clinicalgenome.org/kb/gene-validity/CGGV:assertion_37d30e5c-61f5-4e4a-9ee7-573a2ed704b3-2022-06-27T160000.000Z | https://search.clinicalgenome.org/kb/gene-validity/CGGV:assertion_516ffd6c-c9ea-4d8a-8364-8ec4892ad464-2022-06-27T160000.000Z","Congenital Myopathies | Congenital Myopathies","","",""
"COL7A1","HGNC:2214","https://search.clinicalgenome.org/kb/genes/HGNC:2214","recessive dystrophic epidermolysis bullosa","MONDO:0009179","https://search.clinicalgenome.org/kb/conditions/MONDO:0009179","Autosomal recessive inheritance","30 - Gene Associated with Autosomal Recessive Phenotype (02/08/2023)","","https://search.clinicalgenome.org/kb/gene-dosage/HGNC:2214","Dosage Working Group","definitive evidence (06/20/2022)","https://search.clinicalgenome.org/kb/gene-validity/CGGV:assertion_940fac3e-2586-4d49-a6f3-db12e865cc65-2022-06-20T170000.000Z","Hereditary Cancer","","",""
"COL9A1","HGNC:2217","https://search.clinicalgenome.org/kb/genes/HGNC:2217","Stickler syndrome","MONDO:0019354","https://search.clinicalgenome.org/kb/conditions/MONDO:0019354","Autosomal recessive inheritance","0 - No Evidence for Haploinsufficiency (11/06/2013)","0 - No Evidence for Triplosensitivity (11/06/2013)","https://search.clinicalgenome.org/kb/gene-dosage/HGNC:2217","Dosage Working Group","limited evidence (03/26/2018)","https://search.clinicalgenome.org/kb/gene-validity/CGGCIEX:assertion_9807","Heritable Thoracic Aortic Aneurysm and Dissection","","",""
"COL9A1","HGNC:2217","https://search.clinicalgenome.org/kb/genes/HGNC:2217","epiphyseal dysplasia, multiple, 6","MONDO:0013591","https://search.clinicalgenome.org/kb/conditions/MONDO:0013591","N/A","0 - No Evidence for Haploinsufficiency (11/06/2013)","0 - No Evidence for Triplosensitivity (11/06/2013)","https://search.clinicalgenome.org/kb/gene-dosage/HGNC:2217","Dosage Working Group","","","","","",""
"COL9A2","HGNC:2218","https://search.clinicalgenome.org/kb/genes/HGNC:2218","Stickler syndrome","MONDO:0019354","https://search.clinicalgenome.org/kb/conditions/MONDO:0019354","Autosomal recessive inheritance","0 - No Evidence for Haploinsufficiency (10/09/2013)","0 - No Evidence for Triplosensitivity (10/09/2013)","https://search.clinicalgenome.org/kb/gene-dosage/HGNC:2218","Dosage Working Group","limited evidence (02/19/2019)","https://search.clinicalgenome.org/kb/gene-validity/CGGV:assertion_697ae26e-2b07-4f87-b42c-121684c89bc0-2019-02-19T170000.000Z","Hearing Loss","","",""
"COL9A3","HGNC:2219","https://search.clinicalgenome.org/kb/genes/HGNC:2219","Stickler syndrome","MONDO:0019354","https://search.clinicalgenome.org/kb/conditions/MONDO:0019354","Autosomal recessive inheritance","","","","","definitive evidence (12/21/2022)","https://search.clinicalgenome.org/kb/gene-validity/CGGV:assertion_a436c41e-0873-4e4c-b2f2-d56f75ca737a-2022-12-21T050000.000Z","Hearing Loss","","",""
"COLEC11","HGNC:17213","https://search.clinicalgenome.org/kb/genes/HGNC:17213","3MC syndrome 2","MONDO:0009927","https://search.clinicalgenome.org/kb/conditions/MONDO:0009927","N/A","30 - Gene Associated with Autosomal Recessive Phenotype (08/22/2016)","0 - No Evidence for Triplosensitivity (08/22/2016)","https://search.clinicalgenome.org/kb/gene-dosage/HGNC:17213","Dosage Working Group","","","","","",""
"COLGALT1","HGNC:26182","https://search.clinicalgenome.org/kb/genes/HGNC:26182","brain small vessel disease 3","MONDO:0100105","https://search.clinicalgenome.org/kb/conditions/MONDO:0100105","Autosomal recessive inheritance","","","","","moderate evidence (03/31/2025)","https://search.clinicalgenome.org/kb/gene-validity/CGGV:assertion_8cc18e7d-fac7-435b-9207-9a3e6891e7ca-2025-03-31T160000.000Z","Congenital Disorders of Glycosylation","","",""
"COLQ","HGNC:2226","https://search.clinicalgenome.org/kb/genes/HGNC:2226","congenital myasthenic syndrome 5","MONDO:0011281","https://search.clinicalgenome.org/kb/conditions/MONDO:0011281","N/A","30 - Gene Associated with Autosomal Recessive Phenotype (08/22/2016)","0 - No Evidence for Triplosensitivity (08/22/2016)","https://search.clinicalgenome.org/kb/gene-dosage/HGNC:2226","Dosage Working Group","","","","","",""
"COMP","HGNC:2227","https://search.clinicalgenome.org/kb/genes/HGNC:2227","COMP-related skeletal dysplasia","MONDO:0100593","https://search.clinicalgenome.org/kb/conditions/MONDO:0100593","Autosomal dominant inheritance","","","","","definitive evidence (02/28/2025)","https://search.clinicalgenome.org/kb/gene-validity/CGGV:assertion_9905abef-52f7-4beb-9232-7651967d9f27-2025-02-28T170000.000Z","Skeletal Disorders","","",""
"COPG1","HGNC:2236","https://search.clinicalgenome.org/kb/genes/HGNC:2236","non-severe combined immunodeficiency due to COPG1 deficiency","MONDO:0800136","https://search.clinicalgenome.org/kb/conditions/MONDO:0800136","Autosomal recessive inheritance","","","","","limited evidence (01/18/2024)","https://search.clinicalgenome.org/kb/gene-validity/CGGV:assertion_7d3aaced-2415-425a-b2c7-b59c7a687a2c-2024-01-18T180000.000Z","SCID-CID","","",""
"COQ2","HGNC:25223","https://search.clinicalgenome.org/kb/genes/HGNC:25223","mitochondrial disease","MONDO:0044970","https://search.clinicalgenome.org/kb/conditions/MONDO:0044970","Autosomal recessive inheritance","30 - Gene Associated with Autosomal Recessive Phenotype (08/22/2016)","0 - No Evidence for Triplosensitivity (08/22/2016)","https://search.clinicalgenome.org/kb/gene-dosage/HGNC:25223","Dosage Working Group","definitive evidence (01/30/2023)","https://search.clinicalgenome.org/kb/gene-validity/CGGV:assertion_0b91e278-c030-40b2-b135-c558fcc49531-2023-01-30T170000.000Z","Mitochondrial Diseases","","",""
"COQ2","HGNC:25223","https://search.clinicalgenome.org/kb/genes/HGNC:25223","coenzyme Q10 deficiency, primary, 1","MONDO:0011829","https://search.clinicalgenome.org/kb/conditions/MONDO:0011829","N/A","30 - Gene Associated with Autosomal Recessive Phenotype (08/22/2016)","0 - No Evidence for Triplosensitivity (08/22/2016)","https://search.clinicalgenome.org/kb/gene-dosage/HGNC:25223","Dosage Working Group","","","","","",""
"COQ4","HGNC:19693","https://search.clinicalgenome.org/kb/genes/HGNC:19693","mitochondrial disease","MONDO:0044970","https://search.clinicalgenome.org/kb/conditions/MONDO:0044970","Autosomal recessive inheritance","","","","","definitive evidence (01/30/2023)","https://search.clinicalgenome.org/kb/gene-validity/CGGV:assertion_7d59cb98-0dd9-4707-8464-876eee053467-2023-01-30T170000.000Z","Mitochondrial Diseases","","",""
"COQ5","HGNC:28722","https://search.clinicalgenome.org/kb/genes/HGNC:28722","mitochondrial disease","MONDO:0044970","https://search.clinicalgenome.org/kb/conditions/MONDO:0044970","Autosomal recessive inheritance","","","","","moderate evidence (07/10/2024)","https://search.clinicalgenome.org/kb/gene-validity/CGGV:assertion_9b9c2846-d034-46f4-87ba-525bed7efe9c-2024-07-10T160000.000Z","Cerebellar Ataxia","","",""
"COQ6","HGNC:20233","https://search.clinicalgenome.org/kb/genes/HGNC:20233","primary coenzyme Q10 deficiency 8","MONDO:0014754","https://search.clinicalgenome.org/kb/conditions/MONDO:0014754","Autosomal recessive inheritance","","","","","definitive evidence (04/14/2025)","https://search.clinicalgenome.org/kb/gene-validity/CGGV:assertion_5d5d261a-0978-4940-880e-a7a6eb4fa4bf-2025-04-14T180000.000Z","Glomerulopathy","","",""
"COQ8B","HGNC:19041","https://search.clinicalgenome.org/kb/genes/HGNC:19041","mitochondrial disease","MONDO:0044970","https://search.clinicalgenome.org/kb/conditions/MONDO:0044970","Autosomal recessive inheritance","","","","","definitive evidence (02/06/2023)","https://search.clinicalgenome.org/kb/gene-validity/CGGV:assertion_43b1c614-38c9-4729-8661-eecc0d24a364-2023-02-06T050000.000Z","Mitochondrial Diseases","","",""
"COQ9","HGNC:25302","https://search.clinicalgenome.org/kb/genes/HGNC:25302","Leigh syndrome","MONDO:0009723","https://search.clinicalgenome.org/kb/conditions/MONDO:0009723","Autosomal recessive inheritance","","","","","limited evidence (04/09/2021)","https://search.clinicalgenome.org/kb/gene-validity/CGGV:assertion_cebc5501-5d36-4767-98bc-edc4ddab3527-2021-04-09T140634.407Z","Mitochondrial Diseases","","",""
"COQ9","HGNC:25302","https://search.clinicalgenome.org/kb/genes/HGNC:25302","mitochondrial disease","MONDO:0044970","https://search.clinicalgenome.org/kb/conditions/MONDO:0044970","Autosomal recessive inheritance","","","","","definitive evidence (01/29/2024)","https://search.clinicalgenome.org/kb/gene-validity/CGGV:assertion_5bd50af5-d882-49e1-afd5-d68f253055d7-2024-01-29T170000.000Z","Mitochondrial Diseases","","",""
"CORO1A","HGNC:2252","https://search.clinicalgenome.org/kb/genes/HGNC:2252","severe combined immunodeficiency due to CORO1A deficiency","MONDO:0014168","https://search.clinicalgenome.org/kb/conditions/MONDO:0014168","Autosomal recessive inheritance","30 - Gene Associated with Autosomal Recessive Phenotype (08/22/2016)","0 - No Evidence for Triplosensitivity (08/22/2016)","https://search.clinicalgenome.org/kb/gene-dosage/HGNC:2252","Dosage Working Group","definitive evidence (06/03/2022)","https://search.clinicalgenome.org/kb/gene-validity/CGGV:assertion_f55fde93-1b6e-4d03-b737-ecad8aa89ecf-2022-06-03T160000.000Z","SCID-CID","","",""
"COX10","HGNC:2260","https://search.clinicalgenome.org/kb/genes/HGNC:2260","Leigh syndrome","MONDO:0009723","https://search.clinicalgenome.org/kb/conditions/MONDO:0009723","Autosomal recessive inheritance","30 - Gene Associated with Autosomal Recessive Phenotype (08/22/2016)","","https://search.clinicalgenome.org/kb/gene-dosage/HGNC:2260","Dosage Working Group","moderate evidence (05/20/2019)","https://search.clinicalgenome.org/kb/gene-validity/CGGV:assertion_48794019-db9d-47c2-9977-4dc76a7d07b3-2019-05-20T182801.393Z","Mitochondrial Diseases","","",""
"COX10","HGNC:2260","https://search.clinicalgenome.org/kb/genes/HGNC:2260","mitochondrial disease","MONDO:0044970","https://search.clinicalgenome.org/kb/conditions/MONDO:0044970","Autosomal recessive inheritance","30 - Gene Associated with Autosomal Recessive Phenotype (08/22/2016)","","https://search.clinicalgenome.org/kb/gene-dosage/HGNC:2260","Dosage Working Group","definitive evidence (12/04/2023)","https://search.clinicalgenome.org/kb/gene-validity/CGGV:assertion_1cb195fd-1191-45ba-83ef-cc2b18a081a7-2023-12-04T050000.000Z","Mitochondrial Diseases","","",""
"COX14","HGNC:28216","https://search.clinicalgenome.org/kb/genes/HGNC:28216","mitochondrial disease","MONDO:0044970","https://search.clinicalgenome.org/kb/conditions/MONDO:0044970","Autosomal recessive inheritance","30 - Gene Associated with Autosomal Recessive Phenotype (08/22/2016)","0 - No Evidence for Triplosensitivity (08/22/2016)","https://search.clinicalgenome.org/kb/gene-dosage/HGNC:28216","Dosage Working Group","limited evidence (03/21/2022)","https://search.clinicalgenome.org/kb/gene-validity/CGGV:assertion_8899dbb6-9769-4d93-83fb-e95b6775962c-2022-03-21T040000.000Z","Mitochondrial Diseases","","",""
"COX14","HGNC:28216","https://search.clinicalgenome.org/kb/genes/HGNC:28216","obsolete cytochrome-c oxidase deficiency disease","MONDO:0009068","https://search.clinicalgenome.org/kb/conditions/MONDO:0009068","N/A","30 - Gene Associated with Autosomal Recessive Phenotype (08/22/2016)","0 - No Evidence for Triplosensitivity (08/22/2016)","https://search.clinicalgenome.org/kb/gene-dosage/HGNC:28216","Dosage Working Group","","","","","",""
"COX15","HGNC:2263","https://search.clinicalgenome.org/kb/genes/HGNC:2263","Leigh syndrome","MONDO:0009723","https://search.clinicalgenome.org/kb/conditions/MONDO:0009723","Autosomal recessive inheritance","30 - Gene Associated with Autosomal Recessive Phenotype (08/22/2016)","0 - No Evidence for Triplosensitivity (08/22/2016)","https://search.clinicalgenome.org/kb/gene-dosage/HGNC:2263","Dosage Working Group","limited evidence (05/20/2019)","https://search.clinicalgenome.org/kb/gene-validity/CGGV:assertion_b5c8d1e1-24d0-4b88-8c04-023197db14f3-2019-05-20T183321.284Z","Mitochondrial Diseases","","",""
"COX15","HGNC:2263","https://search.clinicalgenome.org/kb/genes/HGNC:2263","mitochondrial disease","MONDO:0044970","https://search.clinicalgenome.org/kb/conditions/MONDO:0044970","Autosomal recessive inheritance","30 - Gene Associated with Autosomal Recessive Phenotype (08/22/2016)","0 - No Evidence for Triplosensitivity (08/22/2016)","https://search.clinicalgenome.org/kb/gene-dosage/HGNC:2263","Dosage Working Group","definitive evidence (12/04/2023)","https://search.clinicalgenome.org/kb/gene-validity/CGGV:assertion_2f825de2-a93c-4f96-b1e5-7b2843c668ee-2023-12-04T050000.000Z","Mitochondrial Diseases","","",""
"COX15","HGNC:2263","https://search.clinicalgenome.org/kb/genes/HGNC:2263","cardioencephalomyopathy, fatal infantile, due to cytochrome c oxidase deficiency 2","MONDO:0014051","https://search.clinicalgenome.org/kb/conditions/MONDO:0014051","N/A","30 - Gene Associated with Autosomal Recessive Phenotype (08/22/2016)","0 - No Evidence for Triplosensitivity (08/22/2016)","https://search.clinicalgenome.org/kb/gene-dosage/HGNC:2263","Dosage Working Group","","","","","",""
"COX20","HGNC:26970","https://search.clinicalgenome.org/kb/genes/HGNC:26970","mitochondrial disease","MONDO:0044970","https://search.clinicalgenome.org/kb/conditions/MONDO:0044970","Autosomal recessive inheritance","30 - Gene Associated with Autosomal Recessive Phenotype (08/22/2016)","","https://search.clinicalgenome.org/kb/gene-dosage/HGNC:26970","Dosage Working Group","definitive evidence (02/17/2022)","https://search.clinicalgenome.org/kb/gene-validity/CGGV:assertion_2391b81d-cfd2-4862-b71b-0418794539c3-2022-02-17T170000.000Z","Mitochondrial Diseases","","",""
"COX4I1","HGNC:2265","https://search.clinicalgenome.org/kb/genes/HGNC:2265","Leigh syndrome","MONDO:0009723","https://search.clinicalgenome.org/kb/conditions/MONDO:0009723","Autosomal recessive inheritance","","","","","limited evidence (04/09/2021)","https://search.clinicalgenome.org/kb/gene-validity/CGGV:assertion_d56c1fe4-7711-45f4-992c-7e9586b9efc6-2021-04-09T135824.042Z","Mitochondrial Diseases","","",""
"COX4I1","HGNC:2265","https://search.clinicalgenome.org/kb/genes/HGNC:2265","mitochondrial disease","MONDO:0044970","https://search.clinicalgenome.org/kb/conditions/MONDO:0044970","Autosomal recessive inheritance","","","","","limited evidence (03/18/2024)","https://search.clinicalgenome.org/kb/gene-validity/CGGV:assertion_18fa1fc5-ce1b-4fec-9cc0-c94dd5c040c7-2024-03-18T040000.000Z","Mitochondrial Diseases","","",""
"COX4I2","HGNC:16232","https://search.clinicalgenome.org/kb/genes/HGNC:16232","mitochondrial disease","MONDO:0044970","https://search.clinicalgenome.org/kb/conditions/MONDO:0044970","Autosomal recessive inheritance","","","","","limited evidence (03/18/2024)","https://search.clinicalgenome.org/kb/gene-validity/CGGV:assertion_a77de2a3-bc6f-47fc-a56c-edee31e11dcb-2024-03-18T040000.000Z","Mitochondrial Diseases","","",""
"COX6A1","HGNC:2277","https://search.clinicalgenome.org/kb/genes/HGNC:2277","mitochondrial disease","MONDO:0044970","https://search.clinicalgenome.org/kb/conditions/MONDO:0044970","Autosomal recessive inheritance","","","","","strong evidence (03/18/2024)","https://search.clinicalgenome.org/kb/gene-validity/CGGV:assertion_7a94f65e-5295-4757-bb1e-72f2004725fa-2024-03-18T040000.000Z","Mitochondrial Diseases","","",""
"COX6A2","HGNC:2279","https://search.clinicalgenome.org/kb/genes/HGNC:2279","mitochondrial disease","MONDO:0044970","https://search.clinicalgenome.org/kb/conditions/MONDO:0044970","Autosomal recessive inheritance","","","","","moderate evidence (03/18/2024)","https://search.clinicalgenome.org/kb/gene-validity/CGGV:assertion_c09fbc40-dc5e-4cbd-80d1-1f918fffdceb-2024-03-18T040000.000Z","Mitochondrial Diseases","","",""
"COX6B1","HGNC:2280","https://search.clinicalgenome.org/kb/genes/HGNC:2280","mitochondrial disease","MONDO:0044970","https://search.clinicalgenome.org/kb/conditions/MONDO:0044970","Autosomal recessive inheritance","30 - Gene Associated with Autosomal Recessive Phenotype (08/22/2016)","0 - No Evidence for Triplosensitivity (08/22/2016)","https://search.clinicalgenome.org/kb/gene-dosage/HGNC:2280","Dosage Working Group","definitive evidence (03/21/2022)","https://search.clinicalgenome.org/kb/gene-validity/CGGV:assertion_bc374fc3-050b-4985-9f2f-a2972bb795fe-2022-03-21T040000.000Z","Mitochondrial Diseases","","",""
"COX8A","HGNC:2294","https://search.clinicalgenome.org/kb/genes/HGNC:2294","Leigh syndrome","MONDO:0009723","https://search.clinicalgenome.org/kb/conditions/MONDO:0009723","Autosomal recessive inheritance","","","","","limited evidence (04/09/2021)","https://search.clinicalgenome.org/kb/gene-validity/CGGV:assertion_70763eb9-40f7-4f71-a64b-ab0c6ad536b0-2021-04-09T135510.592Z","Mitochondrial Diseases","","",""
"COX8A","HGNC:2294","https://search.clinicalgenome.org/kb/genes/HGNC:2294","mitochondrial disease","MONDO:0044970","https://search.clinicalgenome.org/kb/conditions/MONDO:0044970","Autosomal recessive inheritance","","","","","limited evidence (03/18/2024)","https://search.clinicalgenome.org/kb/gene-validity/CGGV:assertion_a1671723-9b23-4f70-b64d-dd1829b926bc-2024-03-18T040000.000Z","Mitochondrial Diseases","","",""
"CP","HGNC:2295","https://search.clinicalgenome.org/kb/genes/HGNC:2295","aceruloplasminemia","MONDO:0011426","https://search.clinicalgenome.org/kb/conditions/MONDO:0011426","N/A","30 - Gene Associated with Autosomal Recessive Phenotype (08/22/2016)","","https://search.clinicalgenome.org/kb/gene-dosage/HGNC:2295","Dosage Working Group","","","","Moderate Actionability (12/10/2018) | Strong Actionability (09/17/2018)","https://actionability.clinicalgenome.org/ac/Adult/ui/stg2SummaryRpt?doc=AC157 | https://actionability.clinicalgenome.org/ac/Pediatric/ui/stg2SummaryRpt?doc=AC157","Adult Actionability Working Group | Pediatric Actionability Working Group"
"CPA6","HGNC:17245","https://search.clinicalgenome.org/kb/genes/HGNC:17245","epilepsy","MONDO:0005027","https://search.clinicalgenome.org/kb/conditions/MONDO:0005027","Autosomal dominant inheritance | Autosomal recessive inheritance","0 - No Evidence for Haploinsufficiency (09/04/2019)","0 - No Evidence for Triplosensitivity (09/04/2019)","https://search.clinicalgenome.org/kb/gene-dosage/HGNC:17245","Dosage Working Group","refuting evidence (07/29/2021) | disputing (07/29/2021)","https://search.clinicalgenome.org/kb/gene-validity/CGGV:assertion_1cb32379-82a8-425d-ac80-3d740e1cc10b-2021-07-29T132527.108Z | https://search.clinicalgenome.org/kb/gene-validity/CGGV:assertion_7b3ebd58-dccb-4c73-b5e4-1ec55171f2fe-2021-07-29T135909.720Z","Epilepsy | Epilepsy","","",""
"CPAMD8","HGNC:23228","https://search.clinicalgenome.org/kb/genes/HGNC:23228","anterior segment dysgenesis 8","MONDO:0015017","https://search.clinicalgenome.org/kb/conditions/MONDO:0015017","Autosomal recessive inheritance","","","","","definitive evidence (11/18/2022)","https://search.clinicalgenome.org/kb/gene-validity/CGGV:assertion_bc4d2b2a-08d6-4869-a56e-55721fd4c9dc-2022-11-18T170000.000Z","Glaucoma and Neuro-Ophthalmology","","",""
"CPLANE1","HGNC:25801","https://search.clinicalgenome.org/kb/genes/HGNC:25801","Joubert syndrome 17","MONDO:0013824","https://search.clinicalgenome.org/kb/conditions/MONDO:0013824","Autosomal recessive inheritance","30 - Gene Associated with Autosomal Recessive Phenotype (08/22/2016)","0 - No Evidence for Triplosensitivity (08/22/2016)","https://search.clinicalgenome.org/kb/gene-dosage/HGNC:25801","Dosage Working Group","definitive evidence (05/20/2022)","https://search.clinicalgenome.org/kb/gene-validity/CGGV:assertion_954cdc22-7834-4876-a64e-27d56615c1ff-2022-05-20T114241.088Z","Syndromic Disorders","","",""
"CPN1","HGNC:2312","https://search.clinicalgenome.org/kb/genes/HGNC:2312","carboxypeptidase N deficiency","MONDO:0008910","https://search.clinicalgenome.org/kb/conditions/MONDO:0008910","N/A","30 - Gene Associated with Autosomal Recessive Phenotype (08/22/2016)","0 - No Evidence for Triplosensitivity (08/22/2016)","https://search.clinicalgenome.org/kb/gene-dosage/HGNC:2312","Dosage Working Group","","","","","",""
"CPOX","HGNC:2321","https://search.clinicalgenome.org/kb/genes/HGNC:2321","CPOX-related hereditary coproporphyria","MONDO:0800180","https://search.clinicalgenome.org/kb/conditions/MONDO:0800180","Semidominant inheritance","","","","","definitive evidence (01/27/2023)","https://search.clinicalgenome.org/kb/gene-validity/CGGV:assertion_f7cfd579-9ded-4e8a-b8be-c1a6e573e28b-2023-01-27T170000.000Z","General Inborn Errors of Metabolism","","",""
"CPS1","HGNC:2323","https://search.clinicalgenome.org/kb/genes/HGNC:2323","carbamoyl phosphate synthetase I deficiency disease","MONDO:0009376","https://search.clinicalgenome.org/kb/conditions/MONDO:0009376","Autosomal recessive inheritance","30 - Gene Associated with Autosomal Recessive Phenotype (08/22/2016)","","https://search.clinicalgenome.org/kb/gene-dosage/HGNC:2323","Dosage Working Group","definitive evidence (10/12/2018)","https://search.clinicalgenome.org/kb/gene-validity/CGGV:assertion_dbc4dbbe-8827-4d68-a396-8368f3801e78-2018-10-12T160000.000Z","Aminoacidopathy","Strong Actionability (03/16/2022) | Moderate Actionability (03/16/2022)","https://actionability.clinicalgenome.org/ac/Pediatric/ui/stg2SummaryRpt?doc=AC1046 | https://actionability.clinicalgenome.org/ac/Adult/ui/stg2SummaryRpt?doc=AC1046","Pediatric Actionability Working Group | Adult Actionability Working Group"
"CPT1A","HGNC:2328","https://search.clinicalgenome.org/kb/genes/HGNC:2328","carnitine palmitoyl transferase 1A deficiency","MONDO:0009705","https://search.clinicalgenome.org/kb/conditions/MONDO:0009705","Autosomal recessive inheritance","30 - Gene Associated with Autosomal Recessive Phenotype (08/22/2016)","0 - No Evidence for Triplosensitivity (08/22/2016)","https://search.clinicalgenome.org/kb/gene-dosage/HGNC:2328","Dosage Working Group","definitive evidence (01/23/2018)","https://search.clinicalgenome.org/kb/gene-validity/CGGV:assertion_dcea255c-11e4-46fd-b0f7-2de68311a75c-2018-01-23T170000.000Z","Fatty Acid Oxidation Disorders","","",""
"CPT1B","HGNC:2329","https://search.clinicalgenome.org/kb/genes/HGNC:2329","inherited fatty acid metabolism disorder","MONDO:0037858","https://search.clinicalgenome.org/kb/conditions/MONDO:0037858","Mode of inheritance","","","","","no known disease relationship (01/25/2021)","https://search.clinicalgenome.org/kb/gene-validity/CGGV:assertion_cfcd80c7-d806-41cf-8c3a-7ba955919537-2021-01-25T194946.827Z","Fatty Acid Oxidation Disorders","","",""
"CPT1C","HGNC:18540","https://search.clinicalgenome.org/kb/genes/HGNC:18540","hereditary spastic paraplegia","MONDO:0019064","https://search.clinicalgenome.org/kb/conditions/MONDO:0019064","Autosomal dominant inheritance","","","","","limited evidence (03/20/2023)","https://search.clinicalgenome.org/kb/gene-validity/CGGV:assertion_8d171b54-3af1-442a-9c54-b959061a7b5a-2023-03-20T180000.000Z","Cerebral Palsy","","",""
"CPT2","HGNC:2330","https://search.clinicalgenome.org/kb/genes/HGNC:2330","carnitine palmitoyltransferase II deficiency","MONDO:0015515","https://search.clinicalgenome.org/kb/conditions/MONDO:0015515","Autosomal recessive inheritance","","","","","definitive evidence (03/27/2018)","https://search.clinicalgenome.org/kb/gene-validity/CGGV:assertion_1a57ea10-6ca0-4311-94f1-0ad036a38ca6-2018-03-27T160000.000Z","Fatty Acid Oxidation Disorders","Moderate Actionability (12/26/2020) | Moderate Actionability (12/26/2020)","https://actionability.clinicalgenome.org/ac/Adult/ui/stg2SummaryRpt?doc=AC1022 | https://actionability.clinicalgenome.org/ac/Pediatric/ui/stg2SummaryRpt?doc=AC1022","Adult Actionability Working Group | Pediatric Actionability Working Group"
"CPT2","HGNC:2330","https://search.clinicalgenome.org/kb/genes/HGNC:2330","carnitine palmitoyl transferase II deficiency, myopathic form","MONDO:0009704","https://search.clinicalgenome.org/kb/conditions/MONDO:0009704","N/A","","","","","","","","Moderate Actionability (12/26/2020) | Moderate Actionability (12/26/2020)","https://actionability.clinicalgenome.org/ac/Adult/ui/stg2SummaryRpt?doc=AC1022 | https://actionability.clinicalgenome.org/ac/Pediatric/ui/stg2SummaryRpt?doc=AC1022","Adult Actionability Working Group | Pediatric Actionability Working Group"
"CPT2","HGNC:2330","https://search.clinicalgenome.org/kb/genes/HGNC:2330","carnitine palmitoyl transferase II deficiency, neonatal form","MONDO:0012136","https://search.clinicalgenome.org/kb/conditions/MONDO:0012136","N/A","","","","","","","","Moderate Actionability (12/26/2020) | Moderate Actionability (12/26/2020)","https://actionability.clinicalgenome.org/ac/Adult/ui/stg2SummaryRpt?doc=AC1022 | https://actionability.clinicalgenome.org/ac/Pediatric/ui/stg2SummaryRpt?doc=AC1022","Adult Actionability Working Group | Pediatric Actionability Working Group"
"CPT2","HGNC:2330","https://search.clinicalgenome.org/kb/genes/HGNC:2330","carnitine palmitoyl transferase II deficiency, severe infantile form","MONDO:0010914","https://search.clinicalgenome.org/kb/conditions/MONDO:0010914","N/A","","","","","","","","Moderate Actionability (12/26/2020) | Moderate Actionability (12/26/2020)","https://actionability.clinicalgenome.org/ac/Adult/ui/stg2SummaryRpt?doc=AC1022 | https://actionability.clinicalgenome.org/ac/Pediatric/ui/stg2SummaryRpt?doc=AC1022","Adult Actionability Working Group | Pediatric Actionability Working Group"
"CR2","HGNC:2336","https://search.clinicalgenome.org/kb/genes/HGNC:2336","immunodeficiency, common variable, 7","MONDO:0013862","https://search.clinicalgenome.org/kb/conditions/MONDO:0013862","Autosomal recessive inheritance","","","","","definitive evidence (08/03/2021)","https://search.clinicalgenome.org/kb/gene-validity/CGGV:assertion_9153b41e-f2ef-453d-883b-187565cf4593-2021-08-03T130056.511Z","Antibody Deficiencies GCEP","","",""
"CRACR2A","HGNC:28657","https://search.clinicalgenome.org/kb/genes/HGNC:28657","combined immunodeficiency","MONDO:0015131","https://search.clinicalgenome.org/kb/conditions/MONDO:0015131","Autosomal recessive inheritance","","","","","limited evidence (09/19/2024)","https://search.clinicalgenome.org/kb/gene-validity/CGGV:assertion_404d2603-e070-4798-81b0-ebf683a76efe-2024-09-19T160000.000Z","SCID-CID","","",""
"CRADD","HGNC:2340","https://search.clinicalgenome.org/kb/genes/HGNC:2340","syndromic intellectual disability","MONDO:0000508","https://search.clinicalgenome.org/kb/conditions/MONDO:0000508","Autosomal recessive inheritance","30 - Gene Associated with Autosomal Recessive Phenotype (08/22/2016)","0 - No Evidence for Triplosensitivity (08/22/2016)","https://search.clinicalgenome.org/kb/gene-dosage/HGNC:2340","Dosage Working Group","definitive evidence (06/16/2021)","https://search.clinicalgenome.org/kb/gene-validity/CGGV:assertion_7f64ee7f-13a7-4a2d-b1a2-ad6c9e63cab3-2021-06-16T180000.000Z","Intellectual Disability and Autism","","",""
"CRADD","HGNC:2340","https://search.clinicalgenome.org/kb/genes/HGNC:2340","intellectual disability, autosomal recessive 34","MONDO:0013785","https://search.clinicalgenome.org/kb/conditions/MONDO:0013785","N/A","30 - Gene Associated with Autosomal Recessive Phenotype (08/22/2016)","0 - No Evidence for Triplosensitivity (08/22/2016)","https://search.clinicalgenome.org/kb/gene-dosage/HGNC:2340","Dosage Working Group","","","","","",""
"CRB2","HGNC:18688","https://search.clinicalgenome.org/kb/genes/HGNC:18688","focal segmental glomerulosclerosis 9","MONDO:0014539","https://search.clinicalgenome.org/kb/conditions/MONDO:0014539","Autosomal recessive inheritance","","","","","definitive evidence (10/26/2021)","https://search.clinicalgenome.org/kb/gene-validity/CGGV:assertion_98f54e8c-a81c-4b3b-8dbb-05dd24c5dbcc-2021-10-26T013000.000Z","Glomerulopathy","","",""
"CRBN","HGNC:30185","https://search.clinicalgenome.org/kb/genes/HGNC:30185","intellectual disability","MONDO:0001071","https://search.clinicalgenome.org/kb/conditions/MONDO:0001071","Autosomal recessive inheritance","","","","","moderate evidence (05/21/2021)","https://search.clinicalgenome.org/kb/gene-validity/CGGV:assertion_158c9b6b-2ac8-4ee3-bd89-a57d567e675f-2021-05-21T135046.004Z","Intellectual Disability and Autism","","",""
"CREBBP","HGNC:2348","https://search.clinicalgenome.org/kb/genes/HGNC:2348","Rubinstein-Taybi syndrome","MONDO:0019188","https://search.clinicalgenome.org/kb/conditions/MONDO:0019188","Autosomal dominant inheritance","3 - Sufficient Evidence for Haploinsufficiency (10/23/2019)","0 - No Evidence for Triplosensitivity (10/23/2019)","https://search.clinicalgenome.org/kb/gene-dosage/HGNC:2348","Dosage Working Group","definitive evidence (04/27/2018)","https://search.clinicalgenome.org/kb/gene-validity/CGGV:assertion_d16df64b-26ed-4f1c-b8dc-f27be773b102-2018-04-27T160000.000Z","Intellectual Disability and Autism","","",""
"CREBBP","HGNC:2348","https://search.clinicalgenome.org/kb/genes/HGNC:2348","Rubinstein-Taybi syndrome due to CREBBP mutations","MONDO:0008393","https://search.clinicalgenome.org/kb/conditions/MONDO:0008393","N/A","3 - Sufficient Evidence for Haploinsufficiency (10/23/2019)","0 - No Evidence for Triplosensitivity (10/23/2019)","https://search.clinicalgenome.org/kb/gene-dosage/HGNC:2348","Dosage Working Group","","","","","",""
"CRELD1","HGNC:14630","https://search.clinicalgenome.org/kb/genes/HGNC:14630","congenital heart disease","MONDO:0005453","https://search.clinicalgenome.org/kb/conditions/MONDO:0005453","Autosomal dominant inheritance","","","","","limited evidence (09/05/2023)","https://search.clinicalgenome.org/kb/gene-validity/CGGV:assertion_1aa67af6-c8df-4151-98ab-049b69fefd08-2023-09-05T160000.000Z","Congenital Heart Disease","","",""
"CRH","HGNC:2355","https://search.clinicalgenome.org/kb/genes/HGNC:2355","epilepsy","MONDO:0005027","https://search.clinicalgenome.org/kb/conditions/MONDO:0005027","Autosomal dominant inheritance","","","","","refuting evidence (09/21/2021)","https://search.clinicalgenome.org/kb/gene-validity/CGGV:assertion_e1719f97-0d6c-4ed3-93bc-13cc8e1f1d6e-2021-09-21T160000.000Z","Epilepsy","","",""
"CRIPT","HGNC:14312","https://search.clinicalgenome.org/kb/genes/HGNC:14312","Rothmund-Thomson syndrome, type 3","MONDO:0014347","https://search.clinicalgenome.org/kb/conditions/MONDO:0014347","N/A","30 - Gene Associated with Autosomal Recessive Phenotype (08/22/2016)","0 - No Evidence for Triplosensitivity (08/22/2016)","https://search.clinicalgenome.org/kb/gene-dosage/HGNC:14312","Dosage Working Group","","","","","",""
"CRIPTO","HGNC:11701","https://search.clinicalgenome.org/kb/genes/HGNC:11701","congenital heart disease","MONDO:0005453","https://search.clinicalgenome.org/kb/conditions/MONDO:0005453","Autosomal dominant inheritance","1 - Little Evidence for Haploinsufficiency (12/27/2011)","0 - No Evidence for Triplosensitivity (12/27/2011)","https://search.clinicalgenome.org/kb/gene-dosage/HGNC:11701","Dosage Working Group","limited evidence (06/10/2024)","https://search.clinicalgenome.org/kb/gene-validity/CGGV:assertion_15231240-2c6d-44c5-9623-05127bb30b6e-2024-06-10T160000.000Z","Congenital Heart Disease","","",""
"CRKL","HGNC:2363","https://search.clinicalgenome.org/kb/genes/HGNC:2363","congenital heart disease","MONDO:0005453","https://search.clinicalgenome.org/kb/conditions/MONDO:0005453","Mode of inheritance","1 - Little Evidence for Haploinsufficiency (04/13/2020)","0 - No Evidence for Triplosensitivity (04/13/2020)","https://search.clinicalgenome.org/kb/gene-dosage/HGNC:2363","Dosage Working Group","no known disease relationship (10/17/2023)","https://search.clinicalgenome.org/kb/gene-validity/CGGV:assertion_453641ec-805e-4712-841d-a228b48f5cc4-2023-10-17T040000.000Z","Congenital Heart Disease","","",""
"CRPPA","HGNC:37276","https://search.clinicalgenome.org/kb/genes/HGNC:37276","myopathy caused by variation in CRPPA","MONDO:0100530","https://search.clinicalgenome.org/kb/conditions/MONDO:0100530","Autosomal recessive inheritance","30 - Gene Associated with Autosomal Recessive Phenotype (08/22/2016)","","https://search.clinicalgenome.org/kb/gene-dosage/HGNC:37276","Dosage Working Group","definitive evidence (12/12/2023)","https://search.clinicalgenome.org/kb/gene-validity/CGGV:assertion_6d774637-2d63-48fc-b670-da4d9e57377c-2023-12-12T170000.000Z","Muscular Dystrophies and Myopathies","","",""
"CRPPA","HGNC:37276","https://search.clinicalgenome.org/kb/genes/HGNC:37276","muscular dystrophy-dystroglycanopathy","MONDO:0018276","https://search.clinicalgenome.org/kb/conditions/MONDO:0018276","N/A","30 - Gene Associated with Autosomal Recessive Phenotype (08/22/2016)","","https://search.clinicalgenome.org/kb/gene-dosage/HGNC:37276","Dosage Working Group","","","","","",""
"CRTAP","HGNC:2379","https://search.clinicalgenome.org/kb/genes/HGNC:2379","osteogenesis imperfecta type 7","MONDO:0012536","https://search.clinicalgenome.org/kb/conditions/MONDO:0012536","N/A","30 - Gene Associated with Autosomal Recessive Phenotype (08/22/2016)","0 - No Evidence for Triplosensitivity (08/22/2016)","https://search.clinicalgenome.org/kb/gene-dosage/HGNC:2379","Dosage Working Group","","","","","",""
"CRX","HGNC:2383","https://search.clinicalgenome.org/kb/genes/HGNC:2383","cone-rod dystrophy 2","MONDO:0007362","https://search.clinicalgenome.org/kb/conditions/MONDO:0007362","Autosomal dominant inheritance","","","","","definitive evidence (12/06/2024)","https://search.clinicalgenome.org/kb/gene-validity/CGGV:assertion_26f9f606-f3f3-45f0-b212-998bcea09765-2024-12-06T170000.000Z","Retina","","",""
"CRYM","HGNC:2418","https://search.clinicalgenome.org/kb/genes/HGNC:2418","nonsyndromic genetic hearing loss","MONDO:0019497","https://search.clinicalgenome.org/kb/conditions/MONDO:0019497","Autosomal dominant inheritance","","","","","limited evidence (09/21/2021)","https://search.clinicalgenome.org/kb/gene-validity/CGGV:assertion_d15cf48a-3696-467a-b3c8-a45ef5a577bf-2021-09-21T160000.000Z","Hearing Loss","","",""
"CSDE1","HGNC:29905","https://search.clinicalgenome.org/kb/genes/HGNC:29905","complex neurodevelopmental disorder","MONDO:0100038","https://search.clinicalgenome.org/kb/conditions/MONDO:0100038","Autosomal dominant inheritance","","","","","definitive evidence (11/21/2023)","https://search.clinicalgenome.org/kb/gene-validity/CGGV:assertion_7061e9de-d429-4d92-a8fa-e386016ab9db-2023-11-21T070000.000Z","Intellectual Disability and Autism","","",""
"CSF2RA","HGNC:2435","https://search.clinicalgenome.org/kb/genes/HGNC:2435","surfactant metabolism dysfunction, pulmonary, 4","MONDO:0010424","https://search.clinicalgenome.org/kb/conditions/MONDO:0010424","Autosomal recessive inheritance","30 - Gene Associated with Autosomal Recessive Phenotype (08/23/2021)","0 - No Evidence for Triplosensitivity (08/23/2021)","https://search.clinicalgenome.org/kb/gene-dosage/HGNC:2435","Dosage Working Group","definitive evidence (09/16/2025)","https://search.clinicalgenome.org/kb/gene-validity/CGGV:assertion_6037e055-90a1-4727-be41-fa3295982b12-2025-09-16T160000.000Z","Interstitial Lung Disease","","",""
"CSF2RA","HGNC:2435","https://search.clinicalgenome.org/kb/genes/HGNC:2435","hereditary pulmonary alveolar proteinosis","MONDO:0012580","https://search.clinicalgenome.org/kb/conditions/MONDO:0012580","N/A","30 - Gene Associated with Autosomal Recessive Phenotype (08/23/2021)","0 - No Evidence for Triplosensitivity (08/23/2021)","https://search.clinicalgenome.org/kb/gene-dosage/HGNC:2435","Dosage Working Group","","","","","",""
"CSF2RB","HGNC:2436","https://search.clinicalgenome.org/kb/genes/HGNC:2436","surfactant metabolism dysfunction, pulmonary, 5","MONDO:0013712","https://search.clinicalgenome.org/kb/conditions/MONDO:0013712","Autosomal recessive inheritance","30 - Gene Associated with Autosomal Recessive Phenotype (08/22/2016)","","https://search.clinicalgenome.org/kb/gene-dosage/HGNC:2436","Dosage Working Group","definitive evidence (09/17/2024)","https://search.clinicalgenome.org/kb/gene-validity/CGGV:assertion_820769fa-c7cb-4d98-ae3d-fb2cd0ae93b9-2024-09-17T160000.000Z","Interstitial Lung Disease","","",""
"CSGALNACT1","HGNC:24290","https://search.clinicalgenome.org/kb/genes/HGNC:24290","skeletal dysplasia, mild, with joint laxity and advanced bone age","MONDO:0030029","https://search.clinicalgenome.org/kb/conditions/MONDO:0030029","Autosomal recessive inheritance","","","","","moderate evidence (06/25/2025)","https://search.clinicalgenome.org/kb/gene-validity/CGGV:assertion_1ba7e544-2e7d-4314-b011-74210faae113-2025-06-25T160000.000Z","Congenital Disorders of Glycosylation","","",""
"CSMD1","HGNC:14026","https://search.clinicalgenome.org/kb/genes/HGNC:14026","complex neurodevelopmental disorder","MONDO:0100038","https://search.clinicalgenome.org/kb/conditions/MONDO:0100038","N/A","1 - Little Evidence for Haploinsufficiency (10/08/2024)","0 - No Evidence for Triplosensitivity (10/08/2024)","https://search.clinicalgenome.org/kb/gene-dosage/HGNC:14026","Dosage Working Group","","","","","",""
"CSNK2A1","HGNC:2457","https://search.clinicalgenome.org/kb/genes/HGNC:2457","syndromic intellectual disability","MONDO:0000508","https://search.clinicalgenome.org/kb/conditions/MONDO:0000508","Autosomal dominant inheritance","1 - Little Evidence for Haploinsufficiency (06/26/2024)","0 - No Evidence for Triplosensitivity (06/26/2024)","https://search.clinicalgenome.org/kb/gene-dosage/HGNC:2457","Dosage Working Group","definitive evidence (06/15/2022)","https://search.clinicalgenome.org/kb/gene-validity/CGGV:assertion_007e16ed-7392-4050-88b1-2b2158ca2a28-2022-06-15T060000.000Z","Intellectual Disability and Autism","","",""
"CSNK2B","HGNC:2460","https://search.clinicalgenome.org/kb/genes/HGNC:2460","Poirier-Bienvenu neurodevelopmental syndrome","MONDO:0032889","https://search.clinicalgenome.org/kb/conditions/MONDO:0032889","Autosomal dominant inheritance","","","","","definitive evidence (04/08/2022)","https://search.clinicalgenome.org/kb/gene-validity/CGGV:assertion_64552de0-3f81-4110-90f7-97de14b0387b-2022-04-08T050921.681Z","Syndromic Disorders","","",""
"CSPP1","HGNC:26193","https://search.clinicalgenome.org/kb/genes/HGNC:26193","Joubert syndrome 21","MONDO:0014288","https://search.clinicalgenome.org/kb/conditions/MONDO:0014288","Autosomal recessive inheritance","30 - Gene Associated with Autosomal Recessive Phenotype (08/22/2016)","0 - No Evidence for Triplosensitivity (08/22/2016)","https://search.clinicalgenome.org/kb/gene-dosage/HGNC:26193","Dosage Working Group","definitive evidence (06/23/2021)","https://search.clinicalgenome.org/kb/gene-validity/CGGV:assertion_e24d1591-91b7-4c2f-bd79-d4dc8be0974d-2021-06-23T160000.000Z","Kidney Cystic and Ciliopathy Disorders","","",""
"CSRP1","HGNC:2469","https://search.clinicalgenome.org/kb/genes/HGNC:2469","congenital heart disease","MONDO:0005453","https://search.clinicalgenome.org/kb/conditions/MONDO:0005453","Autosomal dominant inheritance","","","","","disputing (07/02/2024)","https://search.clinicalgenome.org/kb/gene-validity/CGGV:assertion_b92d7b82-72c1-4d19-82fc-078f89bfc2cb-2024-07-02T160000.000Z","Congenital Heart Disease","","",""
"CSRP3","HGNC:2472","https://search.clinicalgenome.org/kb/genes/HGNC:2472","hypertrophic cardiomyopathy","MONDO:0005045","https://search.clinicalgenome.org/kb/conditions/MONDO:0005045","Semidominant inheritance","","","","","definitive evidence (08/09/2023)","https://search.clinicalgenome.org/kb/gene-validity/CGGV:assertion_012b9b15-798a-46e2-8164-61a829ceeda1-2023-08-09T160000.000Z","Hereditary Cardiovascular Disease","Assertion Pending (08/14/2017)","https://actionability.clinicalgenome.org/ac/Adult/ui/stg2SummaryRpt?doc=AC056","Adult Actionability Working Group"
"CSRP3","HGNC:2472","https://search.clinicalgenome.org/kb/genes/HGNC:2472","dilated cardiomyopathy","MONDO:0005021","https://search.clinicalgenome.org/kb/conditions/MONDO:0005021","Autosomal dominant inheritance","","","","","limited evidence (05/30/2025)","https://search.clinicalgenome.org/kb/gene-validity/CGGV:assertion_beaafc90-20ef-4c81-ad8f-cfcf69d269ca-2025-05-30T160000.000Z","Dilated Cardiomyopathy","","",""
"CSRP3","HGNC:2472","https://search.clinicalgenome.org/kb/genes/HGNC:2472","familial hypertrophic cardiomyopathy","MONDO:0024573","https://search.clinicalgenome.org/kb/conditions/MONDO:0024573","N/A","","","","","","","","Assertion Pending (08/14/2017)","https://actionability.clinicalgenome.org/ac/Adult/ui/stg2SummaryRpt?doc=AC056","Adult Actionability Working Group"
"CSRP3","HGNC:2472","https://search.clinicalgenome.org/kb/genes/HGNC:2472","hypertrophic cardiomyopathy 12","MONDO:0012804","https://search.clinicalgenome.org/kb/conditions/MONDO:0012804","N/A","","","","","","","","Assertion Pending (08/14/2017)","https://actionability.clinicalgenome.org/ac/Adult/ui/stg2SummaryRpt?doc=AC056","Adult Actionability Working Group"
"CSTB","HGNC:2482","https://search.clinicalgenome.org/kb/genes/HGNC:2482","Unverricht-Lundborg syndrome","MONDO:0009698","https://search.clinicalgenome.org/kb/conditions/MONDO:0009698","Autosomal recessive inheritance","30 - Gene Associated with Autosomal Recessive Phenotype (08/22/2016)","0 - No Evidence for Triplosensitivity (08/22/2016)","https://search.clinicalgenome.org/kb/gene-dosage/HGNC:2482","Dosage Working Group","definitive evidence (06/16/2020)","https://search.clinicalgenome.org/kb/gene-validity/CGGV:assertion_2926506c-5b75-4340-b821-e3ac846b6621-2020-06-16T160000.000Z","Epilepsy","","",""
"CSTB","HGNC:2482","https://search.clinicalgenome.org/kb/genes/HGNC:2482","genetic developmental and epileptic encephalopathy","MONDO:0100062","https://search.clinicalgenome.org/kb/conditions/MONDO:0100062","Autosomal recessive inheritance","30 - Gene Associated with Autosomal Recessive Phenotype (08/22/2016)","0 - No Evidence for Triplosensitivity (08/22/2016)","https://search.clinicalgenome.org/kb/gene-dosage/HGNC:2482","Dosage Working Group","moderate evidence (12/01/2020)","https://search.clinicalgenome.org/kb/gene-validity/CGGV:assertion_accafcd4-ba3c-4049-9285-1de877d256ec-2020-12-01T060000.000Z","Epilepsy","","",""
"CTC1","HGNC:26169","https://search.clinicalgenome.org/kb/genes/HGNC:26169","cerebroretinal microangiopathy with calcifications and cysts 1","MONDO:0024564","https://search.clinicalgenome.org/kb/conditions/MONDO:0024564","N/A","30 - Gene Associated with Autosomal Recessive Phenotype (10/08/2019)","0 - No Evidence for Triplosensitivity (10/08/2019)","https://search.clinicalgenome.org/kb/gene-dosage/HGNC:26169","Dosage Working Group","","","","","",""
"CTCF","HGNC:13723","https://search.clinicalgenome.org/kb/genes/HGNC:13723","syndromic intellectual disability","MONDO:0000508","https://search.clinicalgenome.org/kb/conditions/MONDO:0000508","Autosomal dominant inheritance","3 - Sufficient Evidence for Haploinsufficiency (09/22/2021)","0 - No Evidence for Triplosensitivity (09/22/2021)","https://search.clinicalgenome.org/kb/gene-dosage/HGNC:13723","Dosage Working Group","definitive evidence (07/21/2021)","https://search.clinicalgenome.org/kb/gene-validity/CGGV:assertion_f1cbcd7b-83e2-47c1-b708-c9052502e639-2021-07-21T160000.000Z","Intellectual Disability and Autism","","",""
"CTDP1","HGNC:2498","https://search.clinicalgenome.org/kb/genes/HGNC:2498","congenital cataracts-facial dysmorphism-neuropathy syndrome","MONDO:0011402","https://search.clinicalgenome.org/kb/conditions/MONDO:0011402","N/A","30 - Gene Associated with Autosomal Recessive Phenotype (08/22/2016)","","https://search.clinicalgenome.org/kb/gene-dosage/HGNC:2498","Dosage Working Group","","","","","",""
